1.000000 IP 10.1.1.1.49153 > 10.1.1.2.8080: Flags [S], seq 0, win 65535, length 0
1.002134 IP 10.1.1.2.8080 > 10.1.1.1.49153: Flags [S.], seq 0, ack 1, win 65535, length 0
1.002134 IP 10.1.1.1.49153 > 10.1.1.2.8080: Flags [.], ack 1, win 65535, length 0
1.002201 IP 10.1.1.1.49153 > 10.1.1.2.8080: Flags [.], seq 1:537, ack 1, win 65535, length 536
1.005193 IP 10.1.1.2.8080 > 10.1.1.1.49153: Flags [.], ack 537, win 65535, length 0
1.005193 IP 10.1.1.1.49153 > 10.1.1.2.8080: Flags [.], seq 537:1073, ack 1, win 65535, length 536
1.006118 IP 10.1.1.1.49153 > 10.1.1.2.8080: Flags [.], seq 1073:1609, ack 1, win 65535, length 536
1.009110 IP 10.1.1.2.8080 > 10.1.1.1.49153: Flags [.], ack 1609, win 65535, length 0
1.009110 IP 10.1.1.1.49153 > 10.1.1.2.8080: Flags [.], seq 1609:2145, ack 1, win 65535, length 536
1.010035 IP 10.1.1.1.49153 > 10.1.1.2.8080: Flags [.], seq 2145:2681, ack 1, win 65535, length 536
1.010960 IP 10.1.1.1.49153 > 10.1.1.2.8080: Flags [.], seq 2681:3217, ack 1, win 65535, length 536
1.013027 IP 10.1.1.2.8080 > 10.1.1.1.49153: Flags [.], ack 2681, win 65535, length 0
1.013027 IP 10.1.1.1.49153 > 10.1.1.2.8080: Flags [.], seq 3217:3753, ack 1, win 65535, length 536
1.013952 IP 10.1.1.1.49153 > 10.1.1.2.8080: Flags [.], seq 3753:4289, ack 1, win 65535, length 536
1.014876 IP 10.1.1.1.49153 > 10.1.1.2.8080: Flags [.], seq 4289:4825, ack 1, win 65535, length 536
1.016019 IP 10.1.1.2.8080 > 10.1.1.1.49153: Flags [.], ack 3753, win 65535, length 0
1.016019 IP 10.1.1.1.49153 > 10.1.1.2.8080: Flags [.], seq 4825:5361, ack 1, win 65535, length 536
1.016944 IP 10.1.1.1.49153 > 10.1.1.2.8080: Flags [.], seq 5361:5897, ack 1, win 65535, length 536
1.017868 IP 10.1.1.2.8080 > 10.1.1.1.49153: Flags [.], ack 4825, win 65535, length 0
1.017868 IP 10.1.1.1.49153 > 10.1.1.2.8080: Flags [.], seq 5897:6433, ack 1, win 65535, length 536
1.018793 IP 10.1.1.1.49153 > 10.1.1.2.8080: Flags [.], seq 6433:6969, ack 1, win 65535, length 536
1.019718 IP 10.1.1.1.49153 > 10.1.1.2.8080: Flags [.], seq 6969:7505, ack 1, win 65535, length 536
1.019936 IP 10.1.1.2.8080 > 10.1.1.1.49153: Flags [.], ack 5897, win 65535, length 0
1.020643 IP 10.1.1.1.49153 > 10.1.1.2.8080: Flags [.], seq 7505:8041, ack 1, win 65535, length 536
1.021568 IP 10.1.1.1.49153 > 10.1.1.2.8080: Flags [.], seq 8041:8577, ack 1, win 65535, length 536
1.021785 IP 10.1.1.2.8080 > 10.1.1.1.49153: Flags [.], ack 6969, win 65535, length 0
1.022492 IP 10.1.1.1.49153 > 10.1.1.2.8080: Flags [.], seq 8577:9113, ack 1, win 65535, length 536
1.023417 IP 10.1.1.1.49153 > 10.1.1.2.8080: Flags [.], seq 9113:9649, ack 1, win 65535, length 536
1.023635 IP 10.1.1.2.8080 > 10.1.1.1.49153: Flags [.], ack 8041, win 65535, length 0
1.024342 IP 10.1.1.1.49153 > 10.1.1.2.8080: Flags [.], seq 9649:10185, ack 1, win 65535, length 536
1.025267 IP 10.1.1.1.49153 > 10.1.1.2.8080: Flags [.], seq 10185:10721, ack 1, win 65535, length 536
1.025484 IP 10.1.1.2.8080 > 10.1.1.1.49153: Flags [.], ack 9113, win 65535, length 0
1.026192 IP 10.1.1.1.49153 > 10.1.1.2.8080: Flags [.], seq 10721:11257, ack 1, win 65535, length 536
1.027116 IP 10.1.1.1.49153 > 10.1.1.2.8080: Flags [.], seq 11257:11793, ack 1, win 65535, length 536
1.027334 IP 10.1.1.2.8080 > 10.1.1.1.49153: Flags [.], ack 10185, win 65535, length 0
1.028041 IP 10.1.1.1.49153 > 10.1.1.2.8080: Flags [.], seq 11793:12329, ack 1, win 65535, length 536
1.028966 IP 10.1.1.1.49153 > 10.1.1.2.8080: Flags [.], seq 12329:12865, ack 1, win 65535, length 536
1.029184 IP 10.1.1.2.8080 > 10.1.1.1.49153: Flags [.], ack 11257, win 65535, length 0
1.029891 IP 10.1.1.1.49153 > 10.1.1.2.8080: Flags [.], seq 12865:13401, ack 1, win 65535, length 536
1.030816 IP 10.1.1.1.49153 > 10.1.1.2.8080: Flags [.], seq 13401:13937, ack 1, win 65535, length 536
1.031033 IP 10.1.1.2.8080 > 10.1.1.1.49153: Flags [.], ack 12329, win 65535, length 0
1.031740 IP 10.1.1.1.49153 > 10.1.1.2.8080: Flags [.], seq 13937:14473, ack 1, win 65535, length 536
1.032665 IP 10.1.1.1.49153 > 10.1.1.2.8080: Flags [.], seq 14473:15009, ack 1, win 65535, length 536
1.032883 IP 10.1.1.2.8080 > 10.1.1.1.49153: Flags [.], ack 13401, win 65535, length 0
1.033590 IP 10.1.1.1.49153 > 10.1.1.2.8080: Flags [.], seq 15009:15545, ack 1, win 65535, length 536
1.034515 IP 10.1.1.1.49153 > 10.1.1.2.8080: Flags [.], seq 15545:16081, ack 1, win 65535, length 536
1.034732 IP 10.1.1.2.8080 > 10.1.1.1.49153: Flags [.], ack 14473, win 65535, length 0
1.035440 IP 10.1.1.1.49153 > 10.1.1.2.8080: Flags [.], seq 16081:16617, ack 1, win 65535, length 536
1.036364 IP 10.1.1.1.49153 > 10.1.1.2.8080: Flags [.], seq 16617:17153, ack 1, win 65535, length 536
1.036582 IP 10.1.1.2.8080 > 10.1.1.1.49153: Flags [.], ack 15545, win 65535, length 0
1.037289 IP 10.1.1.1.49153 > 10.1.1.2.8080: Flags [.], seq 17153:17689, ack 1, win 65535, length 536
1.038214 IP 10.1.1.1.49153 > 10.1.1.2.8080: Flags [.], seq 17689:18225, ack 1, win 65535, length 536
1.038432 IP 10.1.1.2.8080 > 10.1.1.1.49153: Flags [.], ack 16617, win 65535, length 0
1.039139 IP 10.1.1.1.49153 > 10.1.1.2.8080: Flags [.], seq 18225:18761, ack 1, win 65535, length 536
1.040064 IP 10.1.1.1.49153 > 10.1.1.2.8080: Flags [.], seq 18761:19297, ack 1, win 65535, length 536
1.040281 IP 10.1.1.2.8080 > 10.1.1.1.49153: Flags [.], ack 17689, win 65535, length 0
1.040988 IP 10.1.1.1.49153 > 10.1.1.2.8080: Flags [.], seq 19297:19833, ack 1, win 65535, length 536
1.041913 IP 10.1.1.1.49153 > 10.1.1.2.8080: Flags [.], seq 19833:20369, ack 1, win 65535, length 536
1.042131 IP 10.1.1.2.8080 > 10.1.1.1.49153: Flags [.], ack 18761, win 65535, length 0
1.042838 IP 10.1.1.1.49153 > 10.1.1.2.8080: Flags [.], seq 20905:21441, ack 1, win 65535, length 536
1.043763 IP 10.1.1.1.49153 > 10.1.1.2.8080: Flags [.], seq 21441:21977, ack 1, win 65535, length 536
1.043980 IP 10.1.1.2.8080 > 10.1.1.1.49153: Flags [.], ack 19833, win 65535, length 0
1.044688 IP 10.1.1.1.49153 > 10.1.1.2.8080: Flags [.], seq 22513:23049, ack 1, win 65535, length 536
1.045612 IP 10.1.1.1.49153 > 10.1.1.2.8080: Flags [.], seq 23049:23585, ack 1, win 65535, length 536
1.045830 IP 10.1.1.2.8080 > 10.1.1.1.49153: Flags [.], ack 20369, win 65535, length 0
1.046537 IP 10.1.1.1.49153 > 10.1.1.2.8080: Flags [.], seq 24121:24657, ack 1, win 65535, length 536
1.046755 IP 10.1.1.2.8080 > 10.1.1.1.49153: Flags [.], ack 20369, win 65535, length 0
1.047462 IP 10.1.1.1.49153 > 10.1.1.2.8080: Flags [.], seq 24657:25193, ack 1, win 65535, length 536
1.047680 IP 10.1.1.2.8080 > 10.1.1.1.49153: Flags [.], ack 20369, win 65535, length 0
1.048387 IP 10.1.1.1.49153 > 10.1.1.2.8080: Flags [.], seq 25729:26265, ack 1, win 65535, length 536
1.048604 IP 10.1.1.2.8080 > 10.1.1.1.49153: Flags [.], ack 20369, win 65535, length 0
1.049312 IP 10.1.1.1.49153 > 10.1.1.2.8080: Flags [.], seq 26265:26801, ack 1, win 65535, length 536
1.049529 IP 10.1.1.2.8080 > 10.1.1.1.49153: Flags [.], ack 20369, win 65535, length 0
1.050236 IP 10.1.1.1.49153 > 10.1.1.2.8080: Flags [.], seq 27337:27873, ack 1, win 65535, length 536
1.050454 IP 10.1.1.2.8080 > 10.1.1.1.49153: Flags [.], ack 20369, win 65535, length 0
1.051161 IP 10.1.1.1.49153 > 10.1.1.2.8080: Flags [.], seq 27873:28409, ack 1, win 65535, length 536
1.051379 IP 10.1.1.2.8080 > 10.1.1.1.49153: Flags [.], ack 20369, win 65535, length 0
1.052086 IP 10.1.1.1.49153 > 10.1.1.2.8080: Flags [.], seq 28945:29481, ack 1, win 65535, length 536
1.052304 IP 10.1.1.2.8080 > 10.1.1.1.49153: Flags [.], ack 20369, win 65535, length 0
1.053011 IP 10.1.1.1.49153 > 10.1.1.2.8080: Flags [.], seq 29481:30017, ack 1, win 65535, length 536
1.053228 IP 10.1.1.2.8080 > 10.1.1.1.49153: Flags [.], ack 20369, win 65535, length 0
1.053936 IP 10.1.1.1.49153 > 10.1.1.2.8080: Flags [.], seq 30553:31089, ack 1, win 65535, length 536
1.054153 IP 10.1.1.2.8080 > 10.1.1.1.49153: Flags [.], ack 20369, win 65535, length 0
1.054860 IP 10.1.1.1.49153 > 10.1.1.2.8080: Flags [.], seq 31089:31625, ack 1, win 65535, length 536
1.055078 IP 10.1.1.2.8080 > 10.1.1.1.49153: Flags [.], ack 20369, win 65535, length 0
1.055785 IP 10.1.1.1.49153 > 10.1.1.2.8080: Flags [.], seq 20369:20905, ack 1, win 65535, length 536
1.056003 IP 10.1.1.2.8080 > 10.1.1.1.49153: Flags [.], ack 20369, win 65535, length 0
1.056928 IP 10.1.1.2.8080 > 10.1.1.1.49153: Flags [.], ack 20369, win 65535, length 0
1.056928 IP 10.1.1.1.49153 > 10.1.1.2.8080: Flags [.], seq 31625:32161, ack 1, win 65535, length 536
1.057852 IP 10.1.1.2.8080 > 10.1.1.1.49153: Flags [.], ack 20369, win 65535, length 0
1.057852 IP 10.1.1.1.49153 > 10.1.1.2.8080: Flags [.], seq 32161:32697, ack 1, win 65535, length 536
1.058777 IP 10.1.1.2.8080 > 10.1.1.1.49153: Flags [.], ack 21977, win 65535, length 0
1.058777 IP 10.1.1.1.49153 > 10.1.1.2.8080: Flags [.], seq 21977:22513, ack 1, win 65535, length 536
1.059702 IP 10.1.1.1.49153 > 10.1.1.2.8080: Flags [.], seq 32697:33233, ack 1, win 65535, length 536
1.059920 IP 10.1.1.2.8080 > 10.1.1.1.49153: Flags [.], ack 21977, win 65535, length 0
1.060627 IP 10.1.1.1.49153 > 10.1.1.2.8080: Flags [.], seq 33233:33769, ack 1, win 65535, length 536
1.060844 IP 10.1.1.2.8080 > 10.1.1.1.49153: Flags [.], ack 21977, win 65535, length 0
1.061552 IP 10.1.1.1.49153 > 10.1.1.2.8080: Flags [.], seq 33769:34305, ack 1, win 65535, length 536
1.061769 IP 10.1.1.2.8080 > 10.1.1.1.49153: Flags [.], ack 23585, win 65535, length 0
1.062476 IP 10.1.1.1.49153 > 10.1.1.2.8080: Flags [.], seq 23585:24121, ack 1, win 65535, length 536
1.062694 IP 10.1.1.2.8080 > 10.1.1.1.49153: Flags [.], ack 23585, win 65535, length 0
1.063401 IP 10.1.1.1.49153 > 10.1.1.2.8080: Flags [.], seq 34305:34841, ack 1, win 65535, length 536
1.063619 IP 10.1.1.2.8080 > 10.1.1.1.49153: Flags [.], ack 23585, win 65535, length 0
1.064326 IP 10.1.1.1.49153 > 10.1.1.2.8080: Flags [.], seq 34841:35377, ack 1, win 65535, length 536
1.064544 IP 10.1.1.2.8080 > 10.1.1.1.49153: Flags [.], ack 23585, win 65535, length 0
1.065251 IP 10.1.1.1.49153 > 10.1.1.2.8080: Flags [.], seq 35377:35913, ack 1, win 65535, length 536
1.065468 IP 10.1.1.2.8080 > 10.1.1.1.49153: Flags [.], ack 25193, win 65535, length 0
1.066176 IP 10.1.1.1.49153 > 10.1.1.2.8080: Flags [.], seq 35913:36449, ack 1, win 65535, length 536
1.066393 IP 10.1.1.2.8080 > 10.1.1.1.49153: Flags [.], ack 25193, win 65535, length 0
1.067100 IP 10.1.1.1.49153 > 10.1.1.2.8080: Flags [.], seq 25193:25729, ack 1, win 65535, length 536
1.067318 IP 10.1.1.2.8080 > 10.1.1.1.49153: Flags [.], ack 25193, win 65535, length 0
1.068025 IP 10.1.1.1.49153 > 10.1.1.2.8080: Flags [.], seq 36449:36985, ack 1, win 65535, length 536
1.068243 IP 10.1.1.2.8080 > 10.1.1.1.49153: Flags [.], ack 25193, win 65535, length 0
1.068950 IP 10.1.1.1.49153 > 10.1.1.2.8080: Flags [.], seq 36985:37521, ack 1, win 65535, length 536
1.069168 IP 10.1.1.2.8080 > 10.1.1.1.49153: Flags [.], ack 25193, win 65535, length 0
1.069875 IP 10.1.1.1.49153 > 10.1.1.2.8080: Flags [.], seq 37521:38057, ack 1, win 65535, length 536
1.070092 IP 10.1.1.2.8080 > 10.1.1.1.49153: Flags [.], ack 26801, win 65535, length 0
1.070800 IP 10.1.1.1.49153 > 10.1.1.2.8080: Flags [.], seq 38057:38593, ack 1, win 65535, length 536
1.071017 IP 10.1.1.2.8080 > 10.1.1.1.49153: Flags [.], ack 26801, win 65535, length 0
1.071724 IP 10.1.1.1.49153 > 10.1.1.2.8080: Flags [.], seq 38593:39129, ack 1, win 65535, length 536
1.071942 IP 10.1.1.2.8080 > 10.1.1.1.49153: Flags [.], ack 26801, win 65535, length 0
1.072649 IP 10.1.1.1.49153 > 10.1.1.2.8080: Flags [.], seq 26801:27337, ack 1, win 65535, length 536
1.072867 IP 10.1.1.2.8080 > 10.1.1.1.49153: Flags [.], ack 26801, win 65535, length 0
1.073574 IP 10.1.1.1.49153 > 10.1.1.2.8080: Flags [.], seq 39129:39665, ack 1, win 65535, length 536
1.073792 IP 10.1.1.2.8080 > 10.1.1.1.49153: Flags [.], ack 26801, win 65535, length 0
1.074499 IP 10.1.1.1.49153 > 10.1.1.2.8080: Flags [.], seq 39665:40201, ack 1, win 65535, length 536
1.074716 IP 10.1.1.2.8080 > 10.1.1.1.49153: Flags [.], ack 26801, win 65535, length 0
1.075424 IP 10.1.1.1.49153 > 10.1.1.2.8080: Flags [.], seq 40201:40737, ack 1, win 65535, length 536
1.075641 IP 10.1.1.2.8080 > 10.1.1.1.49153: Flags [.], ack 28409, win 65535, length 0
1.076348 IP 10.1.1.1.49153 > 10.1.1.2.8080: Flags [.], seq 40737:41273, ack 1, win 65535, length 536
1.076566 IP 10.1.1.2.8080 > 10.1.1.1.49153: Flags [.], ack 28409, win 65535, length 0
1.077273 IP 10.1.1.1.49153 > 10.1.1.2.8080: Flags [.], seq 41273:41809, ack 1, win 65535, length 536
1.077491 IP 10.1.1.2.8080 > 10.1.1.1.49153: Flags [.], ack 28409, win 65535, length 0
1.078198 IP 10.1.1.1.49153 > 10.1.1.2.8080: Flags [.], seq 41809:42345, ack 1, win 65535, length 536
1.078416 IP 10.1.1.2.8080 > 10.1.1.1.49153: Flags [.], ack 28409, win 65535, length 0
1.079123 IP 10.1.1.1.49153 > 10.1.1.2.8080: Flags [.], seq 28409:28945, ack 1, win 65535, length 536
1.079340 IP 10.1.1.2.8080 > 10.1.1.1.49153: Flags [.], ack 28409, win 65535, length 0
1.080048 IP 10.1.1.1.49153 > 10.1.1.2.8080: Flags [.], seq 42345:42881, ack 1, win 65535, length 536
1.080265 IP 10.1.1.2.8080 > 10.1.1.1.49153: Flags [.], ack 28409, win 65535, length 0
1.080972 IP 10.1.1.1.49153 > 10.1.1.2.8080: Flags [.], seq 42881:43417, ack 1, win 65535, length 536
1.081190 IP 10.1.1.2.8080 > 10.1.1.1.49153: Flags [.], ack 28409, win 65535, length 0
1.081897 IP 10.1.1.1.49153 > 10.1.1.2.8080: Flags [.], seq 43417:43953, ack 1, win 65535, length 536
1.082115 IP 10.1.1.2.8080 > 10.1.1.1.49153: Flags [.], ack 30017, win 65535, length 0
1.082822 IP 10.1.1.1.49153 > 10.1.1.2.8080: Flags [.], seq 43953:44489, ack 1, win 65535, length 536
1.083040 IP 10.1.1.2.8080 > 10.1.1.1.49153: Flags [.], ack 30017, win 65535, length 0
1.083747 IP 10.1.1.1.49153 > 10.1.1.2.8080: Flags [.], seq 44489:45025, ack 1, win 65535, length 536
1.083964 IP 10.1.1.2.8080 > 10.1.1.1.49153: Flags [.], ack 30017, win 65535, length 0
1.084672 IP 10.1.1.1.49153 > 10.1.1.2.8080: Flags [.], seq 45025:45561, ack 1, win 65535, length 536
1.084889 IP 10.1.1.2.8080 > 10.1.1.1.49153: Flags [.], ack 30017, win 65535, length 0
1.085596 IP 10.1.1.1.49153 > 10.1.1.2.8080: Flags [.], seq 45561:46097, ack 1, win 65535, length 536
1.085814 IP 10.1.1.2.8080 > 10.1.1.1.49153: Flags [.], ack 30017, win 65535, length 0
1.086521 IP 10.1.1.1.49153 > 10.1.1.2.8080: Flags [.], seq 30017:30553, ack 1, win 65535, length 536
1.086739 IP 10.1.1.2.8080 > 10.1.1.1.49153: Flags [.], ack 30017, win 65535, length 0
1.087446 IP 10.1.1.1.49153 > 10.1.1.2.8080: Flags [.], seq 46097:46633, ack 1, win 65535, length 536
1.087664 IP 10.1.1.2.8080 > 10.1.1.1.49153: Flags [.], ack 30017, win 65535, length 0
1.088371 IP 10.1.1.1.49153 > 10.1.1.2.8080: Flags [.], seq 46633:47169, ack 1, win 65535, length 536
1.088588 IP 10.1.1.2.8080 > 10.1.1.1.49153: Flags [.], ack 30017, win 65535, length 0
1.089296 IP 10.1.1.1.49153 > 10.1.1.2.8080: Flags [.], seq 47169:47705, ack 1, win 65535, length 536
1.089513 IP 10.1.1.2.8080 > 10.1.1.1.49153: Flags [.], ack 46097, win 65535, length 0
1.090220 IP 10.1.1.1.49153 > 10.1.1.2.8080: Flags [.], seq 47705:48241, ack 1, win 65535, length 536
1.091145 IP 10.1.1.1.49153 > 10.1.1.2.8080: Flags [.], seq 48241:48777, ack 1, win 65535, length 536
1.091363 IP 10.1.1.2.8080 > 10.1.1.1.49153: Flags [.], ack 47169, win 65535, length 0
1.092070 IP 10.1.1.1.49153 > 10.1.1.2.8080: Flags [.], seq 48777:49313, ack 1, win 65535, length 536
1.092995 IP 10.1.1.1.49153 > 10.1.1.2.8080: Flags [.], seq 49313:49849, ack 1, win 65535, length 536
1.093212 IP 10.1.1.2.8080 > 10.1.1.1.49153: Flags [.], ack 48241, win 65535, length 0
1.093920 IP 10.1.1.1.49153 > 10.1.1.2.8080: Flags [.], seq 49849:50385, ack 1, win 65535, length 536
1.094844 IP 10.1.1.1.49153 > 10.1.1.2.8080: Flags [.], seq 50385:50921, ack 1, win 65535, length 536
1.095062 IP 10.1.1.2.8080 > 10.1.1.1.49153: Flags [.], ack 49313, win 65535, length 0
1.095769 IP 10.1.1.1.49153 > 10.1.1.2.8080: Flags [.], seq 50921:51457, ack 1, win 65535, length 536
1.096694 IP 10.1.1.1.49153 > 10.1.1.2.8080: Flags [.], seq 51457:51993, ack 1, win 65535, length 536
1.096912 IP 10.1.1.2.8080 > 10.1.1.1.49153: Flags [.], ack 50385, win 65535, length 0
1.097619 IP 10.1.1.1.49153 > 10.1.1.2.8080: Flags [.], seq 51993:52529, ack 1, win 65535, length 536
1.098544 IP 10.1.1.1.49153 > 10.1.1.2.8080: Flags [.], seq 52529:53065, ack 1, win 65535, length 536
1.098761 IP 10.1.1.2.8080 > 10.1.1.1.49153: Flags [.], ack 51457, win 65535, length 0
1.099468 IP 10.1.1.1.49153 > 10.1.1.2.8080: Flags [.], seq 53065:53601, ack 1, win 65535, length 536
1.100393 IP 10.1.1.1.49153 > 10.1.1.2.8080: Flags [.], seq 53601:54137, ack 1, win 65535, length 536
1.100611 IP 10.1.1.2.8080 > 10.1.1.1.49153: Flags [.], ack 52529, win 65535, length 0
1.101318 IP 10.1.1.1.49153 > 10.1.1.2.8080: Flags [.], seq 54137:54673, ack 1, win 65535, length 536
1.102243 IP 10.1.1.1.49153 > 10.1.1.2.8080: Flags [.], seq 54673:55209, ack 1, win 65535, length 536
1.102460 IP 10.1.1.2.8080 > 10.1.1.1.49153: Flags [.], ack 53601, win 65535, length 0
1.103168 IP 10.1.1.1.49153 > 10.1.1.2.8080: Flags [.], seq 55209:55745, ack 1, win 65535, length 536
1.104092 IP 10.1.1.1.49153 > 10.1.1.2.8080: Flags [.], seq 55745:56281, ack 1, win 65535, length 536
1.104310 IP 10.1.1.2.8080 > 10.1.1.1.49153: Flags [.], ack 54673, win 65535, length 0
1.105017 IP 10.1.1.1.49153 > 10.1.1.2.8080: Flags [.], seq 56281:56817, ack 1, win 65535, length 536
1.105942 IP 10.1.1.1.49153 > 10.1.1.2.8080: Flags [.], seq 56817:57353, ack 1, win 65535, length 536
1.106160 IP 10.1.1.2.8080 > 10.1.1.1.49153: Flags [.], ack 55745, win 65535, length 0
1.106867 IP 10.1.1.1.49153 > 10.1.1.2.8080: Flags [.], seq 57353:57889, ack 1, win 65535, length 536
1.107792 IP 10.1.1.1.49153 > 10.1.1.2.8080: Flags [.], seq 57889:58425, ack 1, win 65535, length 536
1.108009 IP 10.1.1.2.8080 > 10.1.1.1.49153: Flags [.], ack 56817, win 65535, length 0
1.108716 IP 10.1.1.1.49153 > 10.1.1.2.8080: Flags [.], seq 58425:58961, ack 1, win 65535, length 536
1.109641 IP 10.1.1.1.49153 > 10.1.1.2.8080: Flags [.], seq 58961:59497, ack 1, win 65535, length 536
1.109859 IP 10.1.1.2.8080 > 10.1.1.1.49153: Flags [.], ack 57889, win 65535, length 0
1.110566 IP 10.1.1.1.49153 > 10.1.1.2.8080: Flags [.], seq 59497:60033, ack 1, win 65535, length 536
1.111491 IP 10.1.1.1.49153 > 10.1.1.2.8080: Flags [.], seq 60033:60569, ack 1, win 65535, length 536
1.111708 IP 10.1.1.2.8080 > 10.1.1.1.49153: Flags [.], ack 58961, win 65535, length 0
1.112416 IP 10.1.1.1.49153 > 10.1.1.2.8080: Flags [.], seq 60569:61105, ack 1, win 65535, length 536
1.113340 IP 10.1.1.1.49153 > 10.1.1.2.8080: Flags [.], seq 61105:61641, ack 1, win 65535, length 536
1.113558 IP 10.1.1.2.8080 > 10.1.1.1.49153: Flags [.], ack 60033, win 65535, length 0
1.114265 IP 10.1.1.1.49153 > 10.1.1.2.8080: Flags [.], seq 61641:62177, ack 1, win 65535, length 536
1.115190 IP 10.1.1.1.49153 > 10.1.1.2.8080: Flags [.], seq 62177:62713, ack 1, win 65535, length 536
1.115408 IP 10.1.1.2.8080 > 10.1.1.1.49153: Flags [.], ack 61105, win 65535, length 0
1.116115 IP 10.1.1.1.49153 > 10.1.1.2.8080: Flags [.], seq 62713:63249, ack 1, win 65535, length 536
1.117040 IP 10.1.1.1.49153 > 10.1.1.2.8080: Flags [.], seq 63249:63785, ack 1, win 65535, length 536
1.117257 IP 10.1.1.2.8080 > 10.1.1.1.49153: Flags [.], ack 62177, win 65535, length 0
1.117964 IP 10.1.1.1.49153 > 10.1.1.2.8080: Flags [.], seq 63785:64321, ack 1, win 65535, length 536
1.118889 IP 10.1.1.1.49153 > 10.1.1.2.8080: Flags [.], seq 64321:64857, ack 1, win 65535, length 536
1.119107 IP 10.1.1.2.8080 > 10.1.1.1.49153: Flags [.], ack 63249, win 65535, length 0
1.119814 IP 10.1.1.1.49153 > 10.1.1.2.8080: Flags [.], seq 64857:65393, ack 1, win 65535, length 536
1.120739 IP 10.1.1.1.49153 > 10.1.1.2.8080: Flags [.], seq 65393:65929, ack 1, win 65535, length 536
1.120956 IP 10.1.1.2.8080 > 10.1.1.1.49153: Flags [.], ack 64321, win 65535, length 0
1.121664 IP 10.1.1.1.49153 > 10.1.1.2.8080: Flags [.], seq 65929:66465, ack 1, win 65535, length 536
1.122588 IP 10.1.1.1.49153 > 10.1.1.2.8080: Flags [.], seq 66465:67001, ack 1, win 65535, length 536
1.122806 IP 10.1.1.2.8080 > 10.1.1.1.49153: Flags [.], ack 65393, win 65535, length 0
1.123513 IP 10.1.1.1.49153 > 10.1.1.2.8080: Flags [.], seq 67001:67537, ack 1, win 65535, length 536
1.124438 IP 10.1.1.1.49153 > 10.1.1.2.8080: Flags [.], seq 67537:68073, ack 1, win 65535, length 536
1.124656 IP 10.1.1.2.8080 > 10.1.1.1.49153: Flags [.], ack 66465, win 65535, length 0
1.125363 IP 10.1.1.1.49153 > 10.1.1.2.8080: Flags [.], seq 68073:68609, ack 1, win 65535, length 536
1.126288 IP 10.1.1.1.49153 > 10.1.1.2.8080: Flags [.], seq 68609:69145, ack 1, win 65535, length 536
1.126505 IP 10.1.1.2.8080 > 10.1.1.1.49153: Flags [.], ack 67537, win 65535, length 0
1.127212 IP 10.1.1.1.49153 > 10.1.1.2.8080: Flags [.], seq 69145:69681, ack 1, win 65535, length 536
1.128137 IP 10.1.1.1.49153 > 10.1.1.2.8080: Flags [.], seq 69681:70217, ack 1, win 65535, length 536
1.128355 IP 10.1.1.2.8080 > 10.1.1.1.49153: Flags [.], ack 68609, win 65535, length 0
1.129062 IP 10.1.1.1.49153 > 10.1.1.2.8080: Flags [.], seq 70217:70753, ack 1, win 65535, length 536
1.129987 IP 10.1.1.1.49153 > 10.1.1.2.8080: Flags [.], seq 70753:71289, ack 1, win 65535, length 536
1.130204 IP 10.1.1.2.8080 > 10.1.1.1.49153: Flags [.], ack 69681, win 65535, length 0
1.130912 IP 10.1.1.1.49153 > 10.1.1.2.8080: Flags [.], seq 71289:71825, ack 1, win 65535, length 536
1.131836 IP 10.1.1.1.49153 > 10.1.1.2.8080: Flags [.], seq 71825:72361, ack 1, win 65535, length 536
1.132054 IP 10.1.1.2.8080 > 10.1.1.1.49153: Flags [.], ack 70753, win 65535, length 0
1.132761 IP 10.1.1.1.49153 > 10.1.1.2.8080: Flags [.], seq 72361:72897, ack 1, win 65535, length 536
1.133686 IP 10.1.1.1.49153 > 10.1.1.2.8080: Flags [.], seq 72897:73433, ack 1, win 65535, length 536
1.133904 IP 10.1.1.2.8080 > 10.1.1.1.49153: Flags [.], ack 71825, win 65535, length 0
1.134611 IP 10.1.1.1.49153 > 10.1.1.2.8080: Flags [.], seq 73433:73969, ack 1, win 65535, length 536
1.135536 IP 10.1.1.1.49153 > 10.1.1.2.8080: Flags [.], seq 73969:74505, ack 1, win 65535, length 536
1.135753 IP 10.1.1.2.8080 > 10.1.1.1.49153: Flags [.], ack 72897, win 65535, length 0
1.136460 IP 10.1.1.1.49153 > 10.1.1.2.8080: Flags [.], seq 74505:75041, ack 1, win 65535, length 536
1.137385 IP 10.1.1.1.49153 > 10.1.1.2.8080: Flags [.], seq 75041:75577, ack 1, win 65535, length 536
1.137603 IP 10.1.1.2.8080 > 10.1.1.1.49153: Flags [.], ack 73969, win 65535, length 0
1.138310 IP 10.1.1.1.49153 > 10.1.1.2.8080: Flags [.], seq 75577:76113, ack 1, win 65535, length 536
1.139235 IP 10.1.1.1.49153 > 10.1.1.2.8080: Flags [.], seq 76113:76649, ack 1, win 65535, length 536
1.139452 IP 10.1.1.2.8080 > 10.1.1.1.49153: Flags [.], ack 75041, win 65535, length 0
1.140160 IP 10.1.1.1.49153 > 10.1.1.2.8080: Flags [.], seq 76649:77185, ack 1, win 65535, length 536
1.141084 IP 10.1.1.1.49153 > 10.1.1.2.8080: Flags [.], seq 77185:77721, ack 1, win 65535, length 536
1.141302 IP 10.1.1.2.8080 > 10.1.1.1.49153: Flags [.], ack 76113, win 65535, length 0
1.142009 IP 10.1.1.1.49153 > 10.1.1.2.8080: Flags [.], seq 77721:78257, ack 1, win 65535, length 536
1.142934 IP 10.1.1.1.49153 > 10.1.1.2.8080: Flags [.], seq 78257:78793, ack 1, win 65535, length 536
1.143152 IP 10.1.1.2.8080 > 10.1.1.1.49153: Flags [.], ack 77185, win 65535, length 0
1.143859 IP 10.1.1.1.49153 > 10.1.1.2.8080: Flags [.], seq 78793:79329, ack 1, win 65535, length 536
1.144784 IP 10.1.1.1.49153 > 10.1.1.2.8080: Flags [.], seq 79329:79865, ack 1, win 65535, length 536
1.145001 IP 10.1.1.2.8080 > 10.1.1.1.49153: Flags [.], ack 78257, win 65535, length 0
1.145708 IP 10.1.1.1.49153 > 10.1.1.2.8080: Flags [.], seq 79865:80401, ack 1, win 65535, length 536
1.146633 IP 10.1.1.1.49153 > 10.1.1.2.8080: Flags [.], seq 80401:80937, ack 1, win 65535, length 536
1.146851 IP 10.1.1.2.8080 > 10.1.1.1.49153: Flags [.], ack 79329, win 65535, length 0
1.147558 IP 10.1.1.1.49153 > 10.1.1.2.8080: Flags [.], seq 80937:81473, ack 1, win 65535, length 536
1.148483 IP 10.1.1.1.49153 > 10.1.1.2.8080: Flags [.], seq 81473:82009, ack 1, win 65535, length 536
1.148700 IP 10.1.1.2.8080 > 10.1.1.1.49153: Flags [.], ack 80401, win 65535, length 0
1.149408 IP 10.1.1.1.49153 > 10.1.1.2.8080: Flags [.], seq 82009:82545, ack 1, win 65535, length 536
1.150332 IP 10.1.1.1.49153 > 10.1.1.2.8080: Flags [.], seq 82545:83081, ack 1, win 65535, length 536
1.150550 IP 10.1.1.2.8080 > 10.1.1.1.49153: Flags [.], ack 81473, win 65535, length 0
1.151257 IP 10.1.1.1.49153 > 10.1.1.2.8080: Flags [.], seq 83081:83617, ack 1, win 65535, length 536
1.152182 IP 10.1.1.1.49153 > 10.1.1.2.8080: Flags [.], seq 83617:84153, ack 1, win 65535, length 536
1.152400 IP 10.1.1.2.8080 > 10.1.1.1.49153: Flags [.], ack 82545, win 65535, length 0
1.153107 IP 10.1.1.1.49153 > 10.1.1.2.8080: Flags [.], seq 84153:84689, ack 1, win 65535, length 536
1.154032 IP 10.1.1.1.49153 > 10.1.1.2.8080: Flags [.], seq 84689:85225, ack 1, win 65535, length 536
1.154249 IP 10.1.1.2.8080 > 10.1.1.1.49153: Flags [.], ack 83617, win 65535, length 0
1.154956 IP 10.1.1.1.49153 > 10.1.1.2.8080: Flags [.], seq 85225:85761, ack 1, win 65535, length 536
1.155881 IP 10.1.1.1.49153 > 10.1.1.2.8080: Flags [.], seq 85761:86297, ack 1, win 65535, length 536
1.156099 IP 10.1.1.2.8080 > 10.1.1.1.49153: Flags [.], ack 84689, win 65535, length 0
1.156806 IP 10.1.1.1.49153 > 10.1.1.2.8080: Flags [.], seq 86297:86833, ack 1, win 65535, length 536
1.157731 IP 10.1.1.1.49153 > 10.1.1.2.8080: Flags [.], seq 86833:87369, ack 1, win 65535, length 536
1.157948 IP 10.1.1.2.8080 > 10.1.1.1.49153: Flags [.], ack 85761, win 65535, length 0
1.158656 IP 10.1.1.1.49153 > 10.1.1.2.8080: Flags [.], seq 87369:87905, ack 1, win 65535, length 536
1.159580 IP 10.1.1.1.49153 > 10.1.1.2.8080: Flags [.], seq 87905:88441, ack 1, win 65535, length 536
1.159798 IP 10.1.1.2.8080 > 10.1.1.1.49153: Flags [.], ack 86833, win 65535, length 0
1.160505 IP 10.1.1.1.49153 > 10.1.1.2.8080: Flags [.], seq 88441:88977, ack 1, win 65535, length 536
1.161430 IP 10.1.1.1.49153 > 10.1.1.2.8080: Flags [.], seq 88977:89513, ack 1, win 65535, length 536
1.161648 IP 10.1.1.2.8080 > 10.1.1.1.49153: Flags [.], ack 87905, win 65535, length 0
1.162355 IP 10.1.1.1.49153 > 10.1.1.2.8080: Flags [.], seq 89513:90049, ack 1, win 65535, length 536
1.163280 IP 10.1.1.1.49153 > 10.1.1.2.8080: Flags [.], seq 90049:90585, ack 1, win 65535, length 536
1.163497 IP 10.1.1.2.8080 > 10.1.1.1.49153: Flags [.], ack 88977, win 65535, length 0
1.164204 IP 10.1.1.1.49153 > 10.1.1.2.8080: Flags [.], seq 90585:91121, ack 1, win 65535, length 536
1.165129 IP 10.1.1.1.49153 > 10.1.1.2.8080: Flags [.], seq 91121:91657, ack 1, win 65535, length 536
1.165347 IP 10.1.1.2.8080 > 10.1.1.1.49153: Flags [.], ack 90049, win 65535, length 0
1.166054 IP 10.1.1.1.49153 > 10.1.1.2.8080: Flags [.], seq 91657:92193, ack 1, win 65535, length 536
1.166979 IP 10.1.1.1.49153 > 10.1.1.2.8080: Flags [.], seq 92193:92729, ack 1, win 65535, length 536
1.167196 IP 10.1.1.2.8080 > 10.1.1.1.49153: Flags [.], ack 91121, win 65535, length 0
1.167904 IP 10.1.1.1.49153 > 10.1.1.2.8080: Flags [.], seq 92729:93265, ack 1, win 65535, length 536
1.168828 IP 10.1.1.1.49153 > 10.1.1.2.8080: Flags [.], seq 93265:93801, ack 1, win 65535, length 536
1.169046 IP 10.1.1.2.8080 > 10.1.1.1.49153: Flags [.], ack 92193, win 65535, length 0
1.169753 IP 10.1.1.1.49153 > 10.1.1.2.8080: Flags [.], seq 93801:94337, ack 1, win 65535, length 536
1.170678 IP 10.1.1.1.49153 > 10.1.1.2.8080: Flags [.], seq 94337:94873, ack 1, win 65535, length 536
1.170896 IP 10.1.1.2.8080 > 10.1.1.1.49153: Flags [.], ack 93265, win 65535, length 0
1.171603 IP 10.1.1.1.49153 > 10.1.1.2.8080: Flags [.], seq 94873:95409, ack 1, win 65535, length 536
1.172528 IP 10.1.1.1.49153 > 10.1.1.2.8080: Flags [.], seq 95409:95945, ack 1, win 65535, length 536
1.172745 IP 10.1.1.2.8080 > 10.1.1.1.49153: Flags [.], ack 94337, win 65535, length 0
1.173452 IP 10.1.1.1.49153 > 10.1.1.2.8080: Flags [.], seq 95945:96481, ack 1, win 65535, length 536
1.174377 IP 10.1.1.1.49153 > 10.1.1.2.8080: Flags [.], seq 96481:97017, ack 1, win 65535, length 536
1.174595 IP 10.1.1.2.8080 > 10.1.1.1.49153: Flags [.], ack 95409, win 65535, length 0
1.175302 IP 10.1.1.1.49153 > 10.1.1.2.8080: Flags [.], seq 97017:97553, ack 1, win 65535, length 536
1.176227 IP 10.1.1.1.49153 > 10.1.1.2.8080: Flags [.], seq 97553:98089, ack 1, win 65535, length 536
1.176444 IP 10.1.1.2.8080 > 10.1.1.1.49153: Flags [.], ack 96481, win 65535, length 0
1.177152 IP 10.1.1.1.49153 > 10.1.1.2.8080: Flags [.], seq 98089:98625, ack 1, win 65535, length 536
1.178076 IP 10.1.1.1.49153 > 10.1.1.2.8080: Flags [.], seq 98625:99161, ack 1, win 65535, length 536
1.178294 IP 10.1.1.2.8080 > 10.1.1.1.49153: Flags [.], ack 97553, win 65535, length 0
1.179001 IP 10.1.1.1.49153 > 10.1.1.2.8080: Flags [.], seq 99697:100233, ack 1, win 65535, length 536
1.179926 IP 10.1.1.1.49153 > 10.1.1.2.8080: Flags [.], seq 100233:100769, ack 1, win 65535, length 536
1.180144 IP 10.1.1.2.8080 > 10.1.1.1.49153: Flags [.], ack 98625, win 65535, length 0
1.180851 IP 10.1.1.1.49153 > 10.1.1.2.8080: Flags [.], seq 100769:101305, ack 1, win 65535, length 536
1.181776 IP 10.1.1.1.49153 > 10.1.1.2.8080: Flags [.], seq 101305:101841, ack 1, win 65535, length 536
1.181993 IP 10.1.1.2.8080 > 10.1.1.1.49153: Flags [.], ack 99161, win 65535, length 0
1.182700 IP 10.1.1.1.49153 > 10.1.1.2.8080: Flags [.], seq 101841:102377, ack 1, win 65535, length 536
1.182918 IP 10.1.1.2.8080 > 10.1.1.1.49153: Flags [.], ack 99161, win 65535, length 0
1.183625 IP 10.1.1.1.49153 > 10.1.1.2.8080: Flags [.], seq 102377:102913, ack 1, win 65535, length 536
1.183843 IP 10.1.1.2.8080 > 10.1.1.1.49153: Flags [.], ack 99161, win 65535, length 0
1.184550 IP 10.1.1.1.49153 > 10.1.1.2.8080: Flags [.], seq 102913:103449, ack 1, win 65535, length 536
1.184768 IP 10.1.1.2.8080 > 10.1.1.1.49153: Flags [.], ack 99161, win 65535, length 0
1.185475 IP 10.1.1.1.49153 > 10.1.1.2.8080: Flags [.], seq 103449:103985, ack 1, win 65535, length 536
1.185692 IP 10.1.1.2.8080 > 10.1.1.1.49153: Flags [.], ack 99161, win 65535, length 0
1.186400 IP 10.1.1.1.49153 > 10.1.1.2.8080: Flags [.], seq 103985:104521, ack 1, win 65535, length 536
1.186617 IP 10.1.1.2.8080 > 10.1.1.1.49153: Flags [.], ack 99161, win 65535, length 0
1.187324 IP 10.1.1.1.49153 > 10.1.1.2.8080: Flags [.], seq 104521:105057, ack 1, win 65535, length 536
1.187542 IP 10.1.1.2.8080 > 10.1.1.1.49153: Flags [.], ack 99161, win 65535, length 0
1.188249 IP 10.1.1.1.49153 > 10.1.1.2.8080: Flags [.], seq 105057:105593, ack 1, win 65535, length 536
1.188467 IP 10.1.1.2.8080 > 10.1.1.1.49153: Flags [.], ack 99161, win 65535, length 0
1.189174 IP 10.1.1.1.49153 > 10.1.1.2.8080: Flags [.], seq 105593:106129, ack 1, win 65535, length 536
1.189392 IP 10.1.1.2.8080 > 10.1.1.1.49153: Flags [.], ack 99161, win 65535, length 0
1.190099 IP 10.1.1.1.49153 > 10.1.1.2.8080: Flags [.], seq 106129:106665, ack 1, win 65535, length 536
1.190316 IP 10.1.1.2.8080 > 10.1.1.1.49153: Flags [.], ack 99161, win 65535, length 0
1.191024 IP 10.1.1.1.49153 > 10.1.1.2.8080: Flags [.], seq 99161:99697, ack 1, win 65535, length 536
1.191241 IP 10.1.1.2.8080 > 10.1.1.1.49153: Flags [.], ack 99161, win 65535, length 0
1.191948 IP 10.1.1.1.49153 > 10.1.1.2.8080: Flags [.], seq 106665:107201, ack 1, win 65535, length 536
1.192166 IP 10.1.1.2.8080 > 10.1.1.1.49153: Flags [.], ack 99161, win 65535, length 0
1.192873 IP 10.1.1.1.49153 > 10.1.1.2.8080: Flags [.], seq 107201:107737, ack 1, win 65535, length 536
1.193091 IP 10.1.1.2.8080 > 10.1.1.1.49153: Flags [.], ack 99161, win 65535, length 0
1.193798 IP 10.1.1.1.49153 > 10.1.1.2.8080: Flags [.], seq 107737:108273, ack 1, win 65535, length 536
1.194016 IP 10.1.1.2.8080 > 10.1.1.1.49153: Flags [.], ack 106665, win 65535, length 0
1.194723 IP 10.1.1.1.49153 > 10.1.1.2.8080: Flags [.], seq 108273:108809, ack 1, win 65535, length 536
1.195648 IP 10.1.1.1.49153 > 10.1.1.2.8080: Flags [.], seq 108809:109345, ack 1, win 65535, length 536
1.195865 IP 10.1.1.2.8080 > 10.1.1.1.49153: Flags [.], ack 107737, win 65535, length 0
1.196572 IP 10.1.1.1.49153 > 10.1.1.2.8080: Flags [.], seq 109345:109881, ack 1, win 65535, length 536
1.197497 IP 10.1.1.1.49153 > 10.1.1.2.8080: Flags [.], seq 109881:110417, ack 1, win 65535, length 536
1.197715 IP 10.1.1.2.8080 > 10.1.1.1.49153: Flags [.], ack 108809, win 65535, length 0
1.198422 IP 10.1.1.1.49153 > 10.1.1.2.8080: Flags [.], seq 110417:110953, ack 1, win 65535, length 536
1.199347 IP 10.1.1.1.49153 > 10.1.1.2.8080: Flags [.], seq 110953:111489, ack 1, win 65535, length 536
1.199564 IP 10.1.1.2.8080 > 10.1.1.1.49153: Flags [.], ack 109881, win 65535, length 0
1.200272 IP 10.1.1.1.49153 > 10.1.1.2.8080: Flags [.], seq 111489:112025, ack 1, win 65535, length 536
1.201196 IP 10.1.1.1.49153 > 10.1.1.2.8080: Flags [.], seq 112025:112561, ack 1, win 65535, length 536
1.201414 IP 10.1.1.2.8080 > 10.1.1.1.49153: Flags [.], ack 110953, win 65535, length 0
1.202121 IP 10.1.1.1.49153 > 10.1.1.2.8080: Flags [.], seq 112561:113097, ack 1, win 65535, length 536
1.203046 IP 10.1.1.1.49153 > 10.1.1.2.8080: Flags [.], seq 113097:113633, ack 1, win 65535, length 536
1.203264 IP 10.1.1.2.8080 > 10.1.1.1.49153: Flags [.], ack 112025, win 65535, length 0
1.203971 IP 10.1.1.1.49153 > 10.1.1.2.8080: Flags [.], seq 113633:114169, ack 1, win 65535, length 536
1.204896 IP 10.1.1.1.49153 > 10.1.1.2.8080: Flags [.], seq 114169:114705, ack 1, win 65535, length 536
1.205113 IP 10.1.1.2.8080 > 10.1.1.1.49153: Flags [.], ack 113097, win 65535, length 0
1.205820 IP 10.1.1.1.49153 > 10.1.1.2.8080: Flags [.], seq 114705:115241, ack 1, win 65535, length 536
1.206745 IP 10.1.1.1.49153 > 10.1.1.2.8080: Flags [.], seq 115241:115777, ack 1, win 65535, length 536
1.206963 IP 10.1.1.2.8080 > 10.1.1.1.49153: Flags [.], ack 114169, win 65535, length 0
1.207670 IP 10.1.1.1.49153 > 10.1.1.2.8080: Flags [.], seq 115777:116313, ack 1, win 65535, length 536
1.208595 IP 10.1.1.1.49153 > 10.1.1.2.8080: Flags [.], seq 116313:116849, ack 1, win 65535, length 536
1.208812 IP 10.1.1.2.8080 > 10.1.1.1.49153: Flags [.], ack 115241, win 65535, length 0
1.209520 IP 10.1.1.1.49153 > 10.1.1.2.8080: Flags [.], seq 116849:117385, ack 1, win 65535, length 536
1.210444 IP 10.1.1.1.49153 > 10.1.1.2.8080: Flags [.], seq 117385:117921, ack 1, win 65535, length 536
1.210662 IP 10.1.1.2.8080 > 10.1.1.1.49153: Flags [.], ack 116313, win 65535, length 0
1.211369 IP 10.1.1.1.49153 > 10.1.1.2.8080: Flags [.], seq 117921:118457, ack 1, win 65535, length 536
1.212294 IP 10.1.1.1.49153 > 10.1.1.2.8080: Flags [.], seq 118457:118993, ack 1, win 65535, length 536
1.212512 IP 10.1.1.2.8080 > 10.1.1.1.49153: Flags [.], ack 117385, win 65535, length 0
1.213219 IP 10.1.1.1.49153 > 10.1.1.2.8080: Flags [.], seq 118993:119529, ack 1, win 65535, length 536
1.214144 IP 10.1.1.1.49153 > 10.1.1.2.8080: Flags [.], seq 119529:120065, ack 1, win 65535, length 536
1.214361 IP 10.1.1.2.8080 > 10.1.1.1.49153: Flags [.], ack 118457, win 65535, length 0
1.215068 IP 10.1.1.1.49153 > 10.1.1.2.8080: Flags [.], seq 120065:120601, ack 1, win 65535, length 536
1.215993 IP 10.1.1.1.49153 > 10.1.1.2.8080: Flags [.], seq 120601:121137, ack 1, win 65535, length 536
1.216211 IP 10.1.1.2.8080 > 10.1.1.1.49153: Flags [.], ack 119529, win 65535, length 0
1.216918 IP 10.1.1.1.49153 > 10.1.1.2.8080: Flags [.], seq 121137:121673, ack 1, win 65535, length 536
1.217843 IP 10.1.1.1.49153 > 10.1.1.2.8080: Flags [.], seq 121673:122209, ack 1, win 65535, length 536
1.218060 IP 10.1.1.2.8080 > 10.1.1.1.49153: Flags [.], ack 120601, win 65535, length 0
1.218768 IP 10.1.1.1.49153 > 10.1.1.2.8080: Flags [.], seq 122209:122745, ack 1, win 65535, length 536
1.219692 IP 10.1.1.1.49153 > 10.1.1.2.8080: Flags [.], seq 122745:123281, ack 1, win 65535, length 536
1.219910 IP 10.1.1.2.8080 > 10.1.1.1.49153: Flags [.], ack 121673, win 65535, length 0
1.220617 IP 10.1.1.1.49153 > 10.1.1.2.8080: Flags [.], seq 123281:123817, ack 1, win 65535, length 536
1.221542 IP 10.1.1.1.49153 > 10.1.1.2.8080: Flags [.], seq 123817:124353, ack 1, win 65535, length 536
1.221760 IP 10.1.1.2.8080 > 10.1.1.1.49153: Flags [.], ack 122745, win 65535, length 0
1.222467 IP 10.1.1.1.49153 > 10.1.1.2.8080: Flags [.], seq 124353:124889, ack 1, win 65535, length 536
1.223392 IP 10.1.1.1.49153 > 10.1.1.2.8080: Flags [.], seq 124889:125425, ack 1, win 65535, length 536
1.223609 IP 10.1.1.2.8080 > 10.1.1.1.49153: Flags [.], ack 123817, win 65535, length 0
1.224316 IP 10.1.1.1.49153 > 10.1.1.2.8080: Flags [.], seq 125425:125961, ack 1, win 65535, length 536
1.225241 IP 10.1.1.1.49153 > 10.1.1.2.8080: Flags [.], seq 125961:126497, ack 1, win 65535, length 536
1.225459 IP 10.1.1.2.8080 > 10.1.1.1.49153: Flags [.], ack 124889, win 65535, length 0
1.226166 IP 10.1.1.1.49153 > 10.1.1.2.8080: Flags [.], seq 126497:127033, ack 1, win 65535, length 536
1.227091 IP 10.1.1.1.49153 > 10.1.1.2.8080: Flags [.], seq 127033:127569, ack 1, win 65535, length 536
1.227308 IP 10.1.1.2.8080 > 10.1.1.1.49153: Flags [.], ack 125961, win 65535, length 0
1.228016 IP 10.1.1.1.49153 > 10.1.1.2.8080: Flags [.], seq 127569:128105, ack 1, win 65535, length 536
1.228940 IP 10.1.1.1.49153 > 10.1.1.2.8080: Flags [.], seq 128105:128641, ack 1, win 65535, length 536
1.229158 IP 10.1.1.2.8080 > 10.1.1.1.49153: Flags [.], ack 127033, win 65535, length 0
1.229865 IP 10.1.1.1.49153 > 10.1.1.2.8080: Flags [.], seq 128641:129177, ack 1, win 65535, length 536
1.230790 IP 10.1.1.1.49153 > 10.1.1.2.8080: Flags [.], seq 129177:129713, ack 1, win 65535, length 536
1.231008 IP 10.1.1.2.8080 > 10.1.1.1.49153: Flags [.], ack 128105, win 65535, length 0
1.231715 IP 10.1.1.1.49153 > 10.1.1.2.8080: Flags [.], seq 129713:130249, ack 1, win 65535, length 536
1.232640 IP 10.1.1.1.49153 > 10.1.1.2.8080: Flags [.], seq 130249:130785, ack 1, win 65535, length 536
1.232857 IP 10.1.1.2.8080 > 10.1.1.1.49153: Flags [.], ack 129177, win 65535, length 0
1.233564 IP 10.1.1.1.49153 > 10.1.1.2.8080: Flags [.], seq 130785:131321, ack 1, win 65535, length 536
1.234489 IP 10.1.1.1.49153 > 10.1.1.2.8080: Flags [.], seq 131321:131857, ack 1, win 65535, length 536
1.234707 IP 10.1.1.2.8080 > 10.1.1.1.49153: Flags [.], ack 130249, win 65535, length 0
1.235414 IP 10.1.1.1.49153 > 10.1.1.2.8080: Flags [.], seq 131857:132393, ack 1, win 65535, length 536
1.236339 IP 10.1.1.1.49153 > 10.1.1.2.8080: Flags [.], seq 132393:132929, ack 1, win 65535, length 536
1.236556 IP 10.1.1.2.8080 > 10.1.1.1.49153: Flags [.], ack 131321, win 65535, length 0
1.237264 IP 10.1.1.1.49153 > 10.1.1.2.8080: Flags [.], seq 132929:133465, ack 1, win 65535, length 536
1.238188 IP 10.1.1.1.49153 > 10.1.1.2.8080: Flags [.], seq 133465:134001, ack 1, win 65535, length 536
1.238406 IP 10.1.1.2.8080 > 10.1.1.1.49153: Flags [.], ack 132393, win 65535, length 0
1.239113 IP 10.1.1.1.49153 > 10.1.1.2.8080: Flags [.], seq 134001:134537, ack 1, win 65535, length 536
1.240038 IP 10.1.1.1.49153 > 10.1.1.2.8080: Flags [.], seq 134537:135073, ack 1, win 65535, length 536
1.240256 IP 10.1.1.2.8080 > 10.1.1.1.49153: Flags [.], ack 133465, win 65535, length 0
1.240963 IP 10.1.1.1.49153 > 10.1.1.2.8080: Flags [.], seq 135073:135609, ack 1, win 65535, length 536
1.241888 IP 10.1.1.1.49153 > 10.1.1.2.8080: Flags [.], seq 135609:136145, ack 1, win 65535, length 536
1.242105 IP 10.1.1.2.8080 > 10.1.1.1.49153: Flags [.], ack 134537, win 65535, length 0
1.242812 IP 10.1.1.1.49153 > 10.1.1.2.8080: Flags [.], seq 136145:136681, ack 1, win 65535, length 536
1.243737 IP 10.1.1.1.49153 > 10.1.1.2.8080: Flags [.], seq 136681:137217, ack 1, win 65535, length 536
1.243955 IP 10.1.1.2.8080 > 10.1.1.1.49153: Flags [.], ack 135609, win 65535, length 0
1.244662 IP 10.1.1.1.49153 > 10.1.1.2.8080: Flags [.], seq 137217:137753, ack 1, win 65535, length 536
1.245587 IP 10.1.1.1.49153 > 10.1.1.2.8080: Flags [.], seq 137753:138289, ack 1, win 65535, length 536
