1.000000 IP 10.1.1.1.49153 > 10.1.1.2.8080: Flags [S], seq 0, win 65535, length 0
1.010134 IP 10.1.1.2.8080 > 10.1.1.1.49153: Flags [S.], seq 0, ack 1, win 65535, length 0
1.010134 IP 10.1.1.1.49153 > 10.1.1.2.8080: Flags [.], ack 1, win 65535, length 0
1.010201 IP 10.1.1.1.49153 > 10.1.1.2.8080: Flags [.], seq 1:537, ack 1, win 65535, length 536
1.021193 IP 10.1.1.2.8080 > 10.1.1.1.49153: Flags [.], ack 537, win 65535, length 0
1.021193 IP 10.1.1.1.49153 > 10.1.1.2.8080: Flags [.], seq 537:1073, ack 1, win 65535, length 536
1.022118 IP 10.1.1.1.49153 > 10.1.1.2.8080: Flags [.], seq 1073:1609, ack 1, win 65535, length 536
1.033110 IP 10.1.1.2.8080 > 10.1.1.1.49153: Flags [.], ack 1609, win 65535, length 0
1.033110 IP 10.1.1.1.49153 > 10.1.1.2.8080: Flags [.], seq 1609:2145, ack 1, win 65535, length 536
1.034035 IP 10.1.1.1.49153 > 10.1.1.2.8080: Flags [.], seq 2145:2681, ack 1, win 65535, length 536
1.034960 IP 10.1.1.1.49153 > 10.1.1.2.8080: Flags [.], seq 2681:3217, ack 1, win 65535, length 536
1.045027 IP 10.1.1.2.8080 > 10.1.1.1.49153: Flags [.], ack 2681, win 65535, length 0
1.045027 IP 10.1.1.1.49153 > 10.1.1.2.8080: Flags [.], seq 3217:3753, ack 1, win 65535, length 536
1.045952 IP 10.1.1.1.49153 > 10.1.1.2.8080: Flags [.], seq 3753:4289, ack 1, win 65535, length 536
1.046876 IP 10.1.1.1.49153 > 10.1.1.2.8080: Flags [.], seq 4289:4825, ack 1, win 65535, length 536
1.056019 IP 10.1.1.2.8080 > 10.1.1.1.49153: Flags [.], ack 3753, win 65535, length 0
1.056019 IP 10.1.1.1.49153 > 10.1.1.2.8080: Flags [.], seq 4825:5361, ack 1, win 65535, length 536
1.056944 IP 10.1.1.1.49153 > 10.1.1.2.8080: Flags [.], seq 5361:5897, ack 1, win 65535, length 536
1.057868 IP 10.1.1.2.8080 > 10.1.1.1.49153: Flags [.], ack 4825, win 65535, length 0
1.057868 IP 10.1.1.1.49153 > 10.1.1.2.8080: Flags [.], seq 5897:6433, ack 1, win 65535, length 536
1.058793 IP 10.1.1.1.49153 > 10.1.1.2.8080: Flags [.], seq 6433:6969, ack 1, win 65535, length 536
1.059718 IP 10.1.1.1.49153 > 10.1.1.2.8080: Flags [.], seq 6969:7505, ack 1, win 65535, length 536
1.067936 IP 10.1.1.2.8080 > 10.1.1.1.49153: Flags [.], ack 5897, win 65535, length 0
1.067936 IP 10.1.1.1.49153 > 10.1.1.2.8080: Flags [.], seq 8041:8577, ack 1, win 65535, length 536
1.068860 IP 10.1.1.1.49153 > 10.1.1.2.8080: Flags [.], seq 8577:9113, ack 1, win 65535, length 536
1.069785 IP 10.1.1.2.8080 > 10.1.1.1.49153: Flags [.], ack 6969, win 65535, length 0
1.069785 IP 10.1.1.1.49153 > 10.1.1.2.8080: Flags [.], seq 9113:9649, ack 1, win 65535, length 536
1.070710 IP 10.1.1.1.49153 > 10.1.1.2.8080: Flags [.], seq 9649:10185, ack 1, win 65535, length 536
1.071635 IP 10.1.1.1.49153 > 10.1.1.2.8080: Flags [.], seq 10185:10721, ack 1, win 65535, length 536
1.078928 IP 10.1.1.2.8080 > 10.1.1.1.49153: Flags [.], ack 7505, win 65535, length 0
1.078928 IP 10.1.1.1.49153 > 10.1.1.2.8080: Flags [.], seq 11257:11793, ack 1, win 65535, length 536
1.079852 IP 10.1.1.2.8080 > 10.1.1.1.49153: Flags [.], ack 7505, win 65535, length 0
1.079852 IP 10.1.1.1.49153 > 10.1.1.2.8080: Flags [.], seq 11793:12329, ack 1, win 65535, length 536
1.080777 IP 10.1.1.2.8080 > 10.1.1.1.49153: Flags [.], ack 7505, win 65535, length 0
1.081702 IP 10.1.1.2.8080 > 10.1.1.1.49153: Flags [.], ack 7505, win 65535, length 0
1.081702 IP 10.1.1.1.49153 > 10.1.1.2.8080: Flags [.], seq 7505:8041, ack 1, win 65535, length 536
1.082627 IP 10.1.1.2.8080 > 10.1.1.1.49153: Flags [.], ack 7505, win 65535, length 0
1.089920 IP 10.1.1.2.8080 > 10.1.1.1.49153: Flags [.], ack 7505, win 65535, length 0
1.090844 IP 10.1.1.2.8080 > 10.1.1.1.49153: Flags [.], ack 7505, win 65535, length 0
1.090844 IP 10.1.1.1.49153 > 10.1.1.2.8080: Flags [.], seq 12329:12865, ack 1, win 65535, length 536
1.092694 IP 10.1.1.2.8080 > 10.1.1.1.49153: Flags [.], ack 10721, win 65535, length 0
1.092694 IP 10.1.1.1.49153 > 10.1.1.2.8080: Flags [.], seq 10721:11257, ack 1, win 65535, length 536
1.093619 IP 10.1.1.1.49153 > 10.1.1.2.8080: Flags [.], seq 12865:13401, ack 1, win 65535, length 536
1.101836 IP 10.1.1.2.8080 > 10.1.1.1.49153: Flags [.], ack 10721, win 65535, length 0
1.101836 IP 10.1.1.1.49153 > 10.1.1.2.8080: Flags [.], seq 13401:13937, ack 1, win 65535, length 536
1.103686 IP 10.1.1.2.8080 > 10.1.1.1.49153: Flags [.], ack 12865, win 65535, length 0
1.103686 IP 10.1.1.1.49153 > 10.1.1.2.8080: Flags [.], seq 13937:14473, ack 1, win 65535, length 536
1.104611 IP 10.1.1.1.49153 > 10.1.1.2.8080: Flags [.], seq 14473:15009, ack 1, win 65535, length 536
1.112828 IP 10.1.1.2.8080 > 10.1.1.1.49153: Flags [.], ack 13937, win 65535, length 0
1.112828 IP 10.1.1.1.49153 > 10.1.1.2.8080: Flags [.], seq 15009:15545, ack 1, win 65535, length 536
1.113753 IP 10.1.1.1.49153 > 10.1.1.2.8080: Flags [.], seq 15545:16081, ack 1, win 65535, length 536
1.115603 IP 10.1.1.2.8080 > 10.1.1.1.49153: Flags [.], ack 15009, win 65535, length 0
1.115603 IP 10.1.1.1.49153 > 10.1.1.2.8080: Flags [.], seq 16081:16617, ack 1, win 65535, length 536
1.116528 IP 10.1.1.1.49153 > 10.1.1.2.8080: Flags [.], seq 16617:17153, ack 1, win 65535, length 536
1.117452 IP 10.1.1.1.49153 > 10.1.1.2.8080: Flags [.], seq 17153:17689, ack 1, win 65535, length 536
1.124745 IP 10.1.1.2.8080 > 10.1.1.1.49153: Flags [.], ack 16081, win 65535, length 0
1.124745 IP 10.1.1.1.49153 > 10.1.1.2.8080: Flags [.], seq 17689:18225, ack 1, win 65535, length 536
1.125670 IP 10.1.1.1.49153 > 10.1.1.2.8080: Flags [.], seq 18225:18761, ack 1, win 65535, length 536
1.127520 IP 10.1.1.2.8080 > 10.1.1.1.49153: Flags [.], ack 17153, win 65535, length 0
1.127520 IP 10.1.1.1.49153 > 10.1.1.2.8080: Flags [.], seq 18761:19297, ack 1, win 65535, length 536
1.128444 IP 10.1.1.1.49153 > 10.1.1.2.8080: Flags [.], seq 19297:19833, ack 1, win 65535, length 536
1.135737 IP 10.1.1.2.8080 > 10.1.1.1.49153: Flags [.], ack 18225, win 65535, length 0
1.135737 IP 10.1.1.1.49153 > 10.1.1.2.8080: Flags [.], seq 19833:20369, ack 1, win 65535, length 536
1.136662 IP 10.1.1.1.49153 > 10.1.1.2.8080: Flags [.], seq 20369:20905, ack 1, win 65535, length 536
1.138512 IP 10.1.1.2.8080 > 10.1.1.1.49153: Flags [.], ack 19297, win 65535, length 0
1.138512 IP 10.1.1.1.49153 > 10.1.1.2.8080: Flags [.], seq 20905:21441, ack 1, win 65535, length 536
1.139436 IP 10.1.1.1.49153 > 10.1.1.2.8080: Flags [.], seq 21441:21977, ack 1, win 65535, length 536
1.146729 IP 10.1.1.2.8080 > 10.1.1.1.49153: Flags [.], ack 20369, win 65535, length 0
1.146729 IP 10.1.1.1.49153 > 10.1.1.2.8080: Flags [.], seq 21977:22513, ack 1, win 65535, length 536
1.147654 IP 10.1.1.1.49153 > 10.1.1.2.8080: Flags [.], seq 22513:23049, ack 1, win 65535, length 536
1.148579 IP 10.1.1.1.49153 > 10.1.1.2.8080: Flags [.], seq 23049:23585, ack 1, win 65535, length 536
1.149504 IP 10.1.1.2.8080 > 10.1.1.1.49153: Flags [.], ack 21441, win 65535, length 0
1.149504 IP 10.1.1.1.49153 > 10.1.1.2.8080: Flags [.], seq 23585:24121, ack 1, win 65535, length 536
1.150428 IP 10.1.1.1.49153 > 10.1.1.2.8080: Flags [.], seq 24121:24657, ack 1, win 65535, length 536
1.157721 IP 10.1.1.2.8080 > 10.1.1.1.49153: Flags [.], ack 22513, win 65535, length 0
1.157721 IP 10.1.1.1.49153 > 10.1.1.2.8080: Flags [.], seq 24657:25193, ack 1, win 65535, length 536
1.158646 IP 10.1.1.1.49153 > 10.1.1.2.8080: Flags [.], seq 25193:25729, ack 1, win 65535, length 536
1.159571 IP 10.1.1.2.8080 > 10.1.1.1.49153: Flags [.], ack 23585, win 65535, length 0
1.159571 IP 10.1.1.1.49153 > 10.1.1.2.8080: Flags [.], seq 25729:26265, ack 1, win 65535, length 536
1.160496 IP 10.1.1.1.49153 > 10.1.1.2.8080: Flags [.], seq 26265:26801, ack 1, win 65535, length 536
1.161420 IP 10.1.1.2.8080 > 10.1.1.1.49153: Flags [.], ack 24657, win 65535, length 0
1.161420 IP 10.1.1.1.49153 > 10.1.1.2.8080: Flags [.], seq 26801:27337, ack 1, win 65535, length 536
1.162345 IP 10.1.1.1.49153 > 10.1.1.2.8080: Flags [.], seq 27337:27873, ack 1, win 65535, length 536
1.169638 IP 10.1.1.2.8080 > 10.1.1.1.49153: Flags [.], ack 25729, win 65535, length 0
1.169638 IP 10.1.1.1.49153 > 10.1.1.2.8080: Flags [.], seq 27873:28409, ack 1, win 65535, length 536
1.170563 IP 10.1.1.1.49153 > 10.1.1.2.8080: Flags [.], seq 28409:28945, ack 1, win 65535, length 536
1.171488 IP 10.1.1.2.8080 > 10.1.1.1.49153: Flags [.], ack 26801, win 65535, length 0
1.171488 IP 10.1.1.1.49153 > 10.1.1.2.8080: Flags [.], seq 28945:29481, ack 1, win 65535, length 536
1.172412 IP 10.1.1.1.49153 > 10.1.1.2.8080: Flags [.], seq 29481:30017, ack 1, win 65535, length 536
1.173337 IP 10.1.1.2.8080 > 10.1.1.1.49153: Flags [.], ack 27873, win 65535, length 0
1.173337 IP 10.1.1.1.49153 > 10.1.1.2.8080: Flags [.], seq 30017:30553, ack 1, win 65535, length 536
1.174262 IP 10.1.1.1.49153 > 10.1.1.2.8080: Flags [.], seq 30553:31089, ack 1, win 65535, length 536
1.175187 IP 10.1.1.1.49153 > 10.1.1.2.8080: Flags [.], seq 31089:31625, ack 1, win 65535, length 536
1.181555 IP 10.1.1.2.8080 > 10.1.1.1.49153: Flags [.], ack 28945, win 65535, length 0
1.181555 IP 10.1.1.1.49153 > 10.1.1.2.8080: Flags [.], seq 31625:32161, ack 1, win 65535, length 536
1.182480 IP 10.1.1.1.49153 > 10.1.1.2.8080: Flags [.], seq 32161:32697, ack 1, win 65535, length 536
1.183404 IP 10.1.1.2.8080 > 10.1.1.1.49153: Flags [.], ack 30017, win 65535, length 0
1.183404 IP 10.1.1.1.49153 > 10.1.1.2.8080: Flags [.], seq 32697:33233, ack 1, win 65535, length 536
1.184329 IP 10.1.1.1.49153 > 10.1.1.2.8080: Flags [.], seq 33233:33769, ack 1, win 65535, length 536
1.185254 IP 10.1.1.2.8080 > 10.1.1.1.49153: Flags [.], ack 31089, win 65535, length 0
1.185254 IP 10.1.1.1.49153 > 10.1.1.2.8080: Flags [.], seq 33769:34305, ack 1, win 65535, length 536
1.186179 IP 10.1.1.1.49153 > 10.1.1.2.8080: Flags [.], seq 34305:34841, ack 1, win 65535, length 536
1.192547 IP 10.1.1.2.8080 > 10.1.1.1.49153: Flags [.], ack 32161, win 65535, length 0
1.192547 IP 10.1.1.1.49153 > 10.1.1.2.8080: Flags [.], seq 34841:35377, ack 1, win 65535, length 536
1.193472 IP 10.1.1.1.49153 > 10.1.1.2.8080: Flags [.], seq 35377:35913, ack 1, win 65535, length 536
1.194396 IP 10.1.1.2.8080 > 10.1.1.1.49153: Flags [.], ack 33233, win 65535, length 0
1.194396 IP 10.1.1.1.49153 > 10.1.1.2.8080: Flags [.], seq 35913:36449, ack 1, win 65535, length 536
1.195321 IP 10.1.1.1.49153 > 10.1.1.2.8080: Flags [.], seq 36449:36985, ack 1, win 65535, length 536
1.196246 IP 10.1.1.2.8080 > 10.1.1.1.49153: Flags [.], ack 34305, win 65535, length 0
1.196246 IP 10.1.1.1.49153 > 10.1.1.2.8080: Flags [.], seq 36985:37521, ack 1, win 65535, length 536
1.197171 IP 10.1.1.1.49153 > 10.1.1.2.8080: Flags [.], seq 37521:38057, ack 1, win 65535, length 536
1.203539 IP 10.1.1.2.8080 > 10.1.1.1.49153: Flags [.], ack 35377, win 65535, length 0
1.203539 IP 10.1.1.1.49153 > 10.1.1.2.8080: Flags [.], seq 38057:38593, ack 1, win 65535, length 536
1.204464 IP 10.1.1.1.49153 > 10.1.1.2.8080: Flags [.], seq 38593:39129, ack 1, win 65535, length 536
1.205388 IP 10.1.1.2.8080 > 10.1.1.1.49153: Flags [.], ack 36449, win 65535, length 0
1.205388 IP 10.1.1.1.49153 > 10.1.1.2.8080: Flags [.], seq 39129:39665, ack 1, win 65535, length 536
1.206313 IP 10.1.1.1.49153 > 10.1.1.2.8080: Flags [.], seq 39665:40201, ack 1, win 65535, length 536
1.207238 IP 10.1.1.2.8080 > 10.1.1.1.49153: Flags [.], ack 37521, win 65535, length 0
1.207238 IP 10.1.1.1.49153 > 10.1.1.2.8080: Flags [.], seq 40201:40737, ack 1, win 65535, length 536
1.208163 IP 10.1.1.1.49153 > 10.1.1.2.8080: Flags [.], seq 40737:41273, ack 1, win 65535, length 536
1.209088 IP 10.1.1.1.49153 > 10.1.1.2.8080: Flags [.], seq 41273:41809, ack 1, win 65535, length 536
1.214531 IP 10.1.1.2.8080 > 10.1.1.1.49153: Flags [.], ack 38593, win 65535, length 0
1.214531 IP 10.1.1.1.49153 > 10.1.1.2.8080: Flags [.], seq 41809:42345, ack 1, win 65535, length 536
1.215456 IP 10.1.1.1.49153 > 10.1.1.2.8080: Flags [.], seq 42345:42881, ack 1, win 65535, length 536
1.216380 IP 10.1.1.2.8080 > 10.1.1.1.49153: Flags [.], ack 39665, win 65535, length 0
1.216380 IP 10.1.1.1.49153 > 10.1.1.2.8080: Flags [.], seq 42881:43417, ack 1, win 65535, length 536
1.217305 IP 10.1.1.1.49153 > 10.1.1.2.8080: Flags [.], seq 43417:43953, ack 1, win 65535, length 536
1.218230 IP 10.1.1.2.8080 > 10.1.1.1.49153: Flags [.], ack 40737, win 65535, length 0
1.218230 IP 10.1.1.1.49153 > 10.1.1.2.8080: Flags [.], seq 43953:44489, ack 1, win 65535, length 536
1.219155 IP 10.1.1.1.49153 > 10.1.1.2.8080: Flags [.], seq 44489:45025, ack 1, win 65535, length 536
1.220080 IP 10.1.1.2.8080 > 10.1.1.1.49153: Flags [.], ack 41809, win 65535, length 0
1.220080 IP 10.1.1.1.49153 > 10.1.1.2.8080: Flags [.], seq 45025:45561, ack 1, win 65535, length 536
1.221004 IP 10.1.1.1.49153 > 10.1.1.2.8080: Flags [.], seq 45561:46097, ack 1, win 65535, length 536
1.226448 IP 10.1.1.2.8080 > 10.1.1.1.49153: Flags [.], ack 42881, win 65535, length 0
1.226448 IP 10.1.1.1.49153 > 10.1.1.2.8080: Flags [.], seq 46097:46633, ack 1, win 65535, length 536
1.227372 IP 10.1.1.1.49153 > 10.1.1.2.8080: Flags [.], seq 46633:47169, ack 1, win 65535, length 536
1.228297 IP 10.1.1.2.8080 > 10.1.1.1.49153: Flags [.], ack 43953, win 65535, length 0
1.228297 IP 10.1.1.1.49153 > 10.1.1.2.8080: Flags [.], seq 47169:47705, ack 1, win 65535, length 536
1.229222 IP 10.1.1.1.49153 > 10.1.1.2.8080: Flags [.], seq 47705:48241, ack 1, win 65535, length 536
1.230147 IP 10.1.1.2.8080 > 10.1.1.1.49153: Flags [.], ack 45025, win 65535, length 0
1.230147 IP 10.1.1.1.49153 > 10.1.1.2.8080: Flags [.], seq 48241:48777, ack 1, win 65535, length 536
1.231072 IP 10.1.1.1.49153 > 10.1.1.2.8080: Flags [.], seq 48777:49313, ack 1, win 65535, length 536
1.231996 IP 10.1.1.2.8080 > 10.1.1.1.49153: Flags [.], ack 46097, win 65535, length 0
1.231996 IP 10.1.1.1.49153 > 10.1.1.2.8080: Flags [.], seq 49313:49849, ack 1, win 65535, length 536
1.232921 IP 10.1.1.1.49153 > 10.1.1.2.8080: Flags [.], seq 49849:50385, ack 1, win 65535, length 536
1.233846 IP 10.1.1.1.49153 > 10.1.1.2.8080: Flags [.], seq 50385:50921, ack 1, win 65535, length 536
1.238364 IP 10.1.1.2.8080 > 10.1.1.1.49153: Flags [.], ack 47169, win 65535, length 0
1.238364 IP 10.1.1.1.49153 > 10.1.1.2.8080: Flags [.], seq 50921:51457, ack 1, win 65535, length 536
1.239289 IP 10.1.1.1.49153 > 10.1.1.2.8080: Flags [.], seq 51457:51993, ack 1, win 65535, length 536
1.240214 IP 10.1.1.2.8080 > 10.1.1.1.49153: Flags [.], ack 48241, win 65535, length 0
1.240214 IP 10.1.1.1.49153 > 10.1.1.2.8080: Flags [.], seq 51993:52529, ack 1, win 65535, length 536
1.241139 IP 10.1.1.1.49153 > 10.1.1.2.8080: Flags [.], seq 52529:53065, ack 1, win 65535, length 536
1.242064 IP 10.1.1.2.8080 > 10.1.1.1.49153: Flags [.], ack 49313, win 65535, length 0
1.242064 IP 10.1.1.1.49153 > 10.1.1.2.8080: Flags [.], seq 53065:53601, ack 1, win 65535, length 536
1.242988 IP 10.1.1.1.49153 > 10.1.1.2.8080: Flags [.], seq 53601:54137, ack 1, win 65535, length 536
1.243913 IP 10.1.1.2.8080 > 10.1.1.1.49153: Flags [.], ack 50385, win 65535, length 0
1.243913 IP 10.1.1.1.49153 > 10.1.1.2.8080: Flags [.], seq 54137:54673, ack 1, win 65535, length 536
1.244838 IP 10.1.1.1.49153 > 10.1.1.2.8080: Flags [.], seq 54673:55209, ack 1, win 65535, length 536
1.249356 IP 10.1.1.2.8080 > 10.1.1.1.49153: Flags [.], ack 51457, win 65535, length 0
1.249356 IP 10.1.1.1.49153 > 10.1.1.2.8080: Flags [.], seq 55209:55745, ack 1, win 65535, length 536
1.250281 IP 10.1.1.1.49153 > 10.1.1.2.8080: Flags [.], seq 55745:56281, ack 1, win 65535, length 536
1.251206 IP 10.1.1.2.8080 > 10.1.1.1.49153: Flags [.], ack 52529, win 65535, length 0
1.251206 IP 10.1.1.1.49153 > 10.1.1.2.8080: Flags [.], seq 56281:56817, ack 1, win 65535, length 536
1.252131 IP 10.1.1.1.49153 > 10.1.1.2.8080: Flags [.], seq 56817:57353, ack 1, win 65535, length 536
1.253056 IP 10.1.1.2.8080 > 10.1.1.1.49153: Flags [.], ack 53601, win 65535, length 0
1.253056 IP 10.1.1.1.49153 > 10.1.1.2.8080: Flags [.], seq 57353:57889, ack 1, win 65535, length 536
1.253980 IP 10.1.1.1.49153 > 10.1.1.2.8080: Flags [.], seq 57889:58425, ack 1, win 65535, length 536
1.254905 IP 10.1.1.2.8080 > 10.1.1.1.49153: Flags [.], ack 54673, win 65535, length 0
1.254905 IP 10.1.1.1.49153 > 10.1.1.2.8080: Flags [.], seq 58425:58961, ack 1, win 65535, length 536
1.255830 IP 10.1.1.1.49153 > 10.1.1.2.8080: Flags [.], seq 58961:59497, ack 1, win 65535, length 536
1.256755 IP 10.1.1.1.49153 > 10.1.1.2.8080: Flags [.], seq 59497:60033, ack 1, win 65535, length 536
1.260348 IP 10.1.1.2.8080 > 10.1.1.1.49153: Flags [.], ack 55745, win 65535, length 0
1.260348 IP 10.1.1.1.49153 > 10.1.1.2.8080: Flags [.], seq 60033:60569, ack 1, win 65535, length 536
1.261273 IP 10.1.1.1.49153 > 10.1.1.2.8080: Flags [.], seq 60569:61105, ack 1, win 65535, length 536
1.262198 IP 10.1.1.2.8080 > 10.1.1.1.49153: Flags [.], ack 56817, win 65535, length 0
1.262198 IP 10.1.1.1.49153 > 10.1.1.2.8080: Flags [.], seq 61105:61641, ack 1, win 65535, length 536
1.263123 IP 10.1.1.1.49153 > 10.1.1.2.8080: Flags [.], seq 61641:62177, ack 1, win 65535, length 536
1.264048 IP 10.1.1.2.8080 > 10.1.1.1.49153: Flags [.], ack 57889, win 65535, length 0
1.264048 IP 10.1.1.1.49153 > 10.1.1.2.8080: Flags [.], seq 62177:62713, ack 1, win 65535, length 536
1.264972 IP 10.1.1.1.49153 > 10.1.1.2.8080: Flags [.], seq 62713:63249, ack 1, win 65535, length 536
1.265897 IP 10.1.1.2.8080 > 10.1.1.1.49153: Flags [.], ack 58961, win 65535, length 0
1.265897 IP 10.1.1.1.49153 > 10.1.1.2.8080: Flags [.], seq 63249:63785, ack 1, win 65535, length 536
1.266822 IP 10.1.1.1.49153 > 10.1.1.2.8080: Flags [.], seq 63785:64321, ack 1, win 65535, length 536
1.267747 IP 10.1.1.2.8080 > 10.1.1.1.49153: Flags [.], ack 60033, win 65535, length 0
1.267747 IP 10.1.1.1.49153 > 10.1.1.2.8080: Flags [.], seq 64321:64857, ack 1, win 65535, length 536
1.268672 IP 10.1.1.1.49153 > 10.1.1.2.8080: Flags [.], seq 64857:65393, ack 1, win 65535, length 536
1.272265 IP 10.1.1.2.8080 > 10.1.1.1.49153: Flags [.], ack 61105, win 65535, length 0
1.272265 IP 10.1.1.1.49153 > 10.1.1.2.8080: Flags [.], seq 65393:65929, ack 1, win 65535, length 536
1.273190 IP 10.1.1.1.49153 > 10.1.1.2.8080: Flags [.], seq 65929:66465, ack 1, win 65535, length 536
1.274115 IP 10.1.1.2.8080 > 10.1.1.1.49153: Flags [.], ack 62177, win 65535, length 0
1.274115 IP 10.1.1.1.49153 > 10.1.1.2.8080: Flags [.], seq 66465:67001, ack 1, win 65535, length 536
1.275040 IP 10.1.1.1.49153 > 10.1.1.2.8080: Flags [.], seq 67001:67537, ack 1, win 65535, length 536
1.275964 IP 10.1.1.2.8080 > 10.1.1.1.49153: Flags [.], ack 63249, win 65535, length 0
1.275964 IP 10.1.1.1.49153 > 10.1.1.2.8080: Flags [.], seq 67537:68073, ack 1, win 65535, length 536
1.276889 IP 10.1.1.1.49153 > 10.1.1.2.8080: Flags [.], seq 68073:68609, ack 1, win 65535, length 536
1.277814 IP 10.1.1.2.8080 > 10.1.1.1.49153: Flags [.], ack 64321, win 65535, length 0
1.277814 IP 10.1.1.1.49153 > 10.1.1.2.8080: Flags [.], seq 68609:69145, ack 1, win 65535, length 536
1.278739 IP 10.1.1.1.49153 > 10.1.1.2.8080: Flags [.], seq 69145:69681, ack 1, win 65535, length 536
1.279664 IP 10.1.1.2.8080 > 10.1.1.1.49153: Flags [.], ack 65393, win 65535, length 0
1.279664 IP 10.1.1.1.49153 > 10.1.1.2.8080: Flags [.], seq 69681:70217, ack 1, win 65535, length 536
1.280588 IP 10.1.1.1.49153 > 10.1.1.2.8080: Flags [.], seq 70217:70753, ack 1, win 65535, length 536
1.284182 IP 10.1.1.2.8080 > 10.1.1.1.49153: Flags [.], ack 66465, win 65535, length 0
1.284182 IP 10.1.1.1.49153 > 10.1.1.2.8080: Flags [.], seq 70753:71289, ack 1, win 65535, length 536
1.285107 IP 10.1.1.1.49153 > 10.1.1.2.8080: Flags [.], seq 71289:71825, ack 1, win 65535, length 536
1.286032 IP 10.1.1.2.8080 > 10.1.1.1.49153: Flags [.], ack 67537, win 65535, length 0
1.286032 IP 10.1.1.1.49153 > 10.1.1.2.8080: Flags [.], seq 71825:72361, ack 1, win 65535, length 536
1.286956 IP 10.1.1.1.49153 > 10.1.1.2.8080: Flags [.], seq 72361:72897, ack 1, win 65535, length 536
1.287881 IP 10.1.1.2.8080 > 10.1.1.1.49153: Flags [.], ack 68609, win 65535, length 0
1.287881 IP 10.1.1.1.49153 > 10.1.1.2.8080: Flags [.], seq 72897:73433, ack 1, win 65535, length 536
1.288806 IP 10.1.1.1.49153 > 10.1.1.2.8080: Flags [.], seq 73433:73969, ack 1, win 65535, length 536
1.289731 IP 10.1.1.2.8080 > 10.1.1.1.49153: Flags [.], ack 69681, win 65535, length 0
1.289731 IP 10.1.1.1.49153 > 10.1.1.2.8080: Flags [.], seq 73969:74505, ack 1, win 65535, length 536
1.290656 IP 10.1.1.1.49153 > 10.1.1.2.8080: Flags [.], seq 74505:75041, ack 1, win 65535, length 536
1.291580 IP 10.1.1.2.8080 > 10.1.1.1.49153: Flags [.], ack 70753, win 65535, length 0
1.291580 IP 10.1.1.1.49153 > 10.1.1.2.8080: Flags [.], seq 75041:75577, ack 1, win 65535, length 536
1.292505 IP 10.1.1.1.49153 > 10.1.1.2.8080: Flags [.], seq 75577:76113, ack 1, win 65535, length 536
1.293430 IP 10.1.1.1.49153 > 10.1.1.2.8080: Flags [.], seq 76113:76649, ack 1, win 65535, length 536
1.296099 IP 10.1.1.2.8080 > 10.1.1.1.49153: Flags [.], ack 71825, win 65535, length 0
1.296099 IP 10.1.1.1.49153 > 10.1.1.2.8080: Flags [.], seq 76649:77185, ack 1, win 65535, length 536
1.297024 IP 10.1.1.1.49153 > 10.1.1.2.8080: Flags [.], seq 77185:77721, ack 1, win 65535, length 536
1.297948 IP 10.1.1.2.8080 > 10.1.1.1.49153: Flags [.], ack 72897, win 65535, length 0
1.297948 IP 10.1.1.1.49153 > 10.1.1.2.8080: Flags [.], seq 77721:78257, ack 1, win 65535, length 536
1.298873 IP 10.1.1.1.49153 > 10.1.1.2.8080: Flags [.], seq 78257:78793, ack 1, win 65535, length 536
1.299798 IP 10.1.1.2.8080 > 10.1.1.1.49153: Flags [.], ack 73969, win 65535, length 0
1.299798 IP 10.1.1.1.49153 > 10.1.1.2.8080: Flags [.], seq 78793:79329, ack 1, win 65535, length 536
1.300723 IP 10.1.1.1.49153 > 10.1.1.2.8080: Flags [.], seq 79329:79865, ack 1, win 65535, length 536
1.301648 IP 10.1.1.2.8080 > 10.1.1.1.49153: Flags [.], ack 75041, win 65535, length 0
1.301648 IP 10.1.1.1.49153 > 10.1.1.2.8080: Flags [.], seq 79865:80401, ack 1, win 65535, length 536
1.302572 IP 10.1.1.1.49153 > 10.1.1.2.8080: Flags [.], seq 80401:80937, ack 1, win 65535, length 536
1.303497 IP 10.1.1.2.8080 > 10.1.1.1.49153: Flags [.], ack 76113, win 65535, length 0
1.303497 IP 10.1.1.1.49153 > 10.1.1.2.8080: Flags [.], seq 80937:81473, ack 1, win 65535, length 536
1.304422 IP 10.1.1.1.49153 > 10.1.1.2.8080: Flags [.], seq 81473:82009, ack 1, win 65535, length 536
1.307091 IP 10.1.1.2.8080 > 10.1.1.1.49153: Flags [.], ack 77185, win 65535, length 0
1.307091 IP 10.1.1.1.49153 > 10.1.1.2.8080: Flags [.], seq 82009:82545, ack 1, win 65535, length 536
1.308016 IP 10.1.1.1.49153 > 10.1.1.2.8080: Flags [.], seq 82545:83081, ack 1, win 65535, length 536
1.308940 IP 10.1.1.2.8080 > 10.1.1.1.49153: Flags [.], ack 78257, win 65535, length 0
1.308940 IP 10.1.1.1.49153 > 10.1.1.2.8080: Flags [.], seq 83081:83617, ack 1, win 65535, length 536
1.309865 IP 10.1.1.1.49153 > 10.1.1.2.8080: Flags [.], seq 83617:84153, ack 1, win 65535, length 536
1.310790 IP 10.1.1.2.8080 > 10.1.1.1.49153: Flags [.], ack 79329, win 65535, length 0
1.310790 IP 10.1.1.1.49153 > 10.1.1.2.8080: Flags [.], seq 84153:84689, ack 1, win 65535, length 536
1.311715 IP 10.1.1.1.49153 > 10.1.1.2.8080: Flags [.], seq 84689:85225, ack 1, win 65535, length 536
1.312640 IP 10.1.1.2.8080 > 10.1.1.1.49153: Flags [.], ack 80401, win 65535, length 0
1.312640 IP 10.1.1.1.49153 > 10.1.1.2.8080: Flags [.], seq 85225:85761, ack 1, win 65535, length 536
1.313564 IP 10.1.1.1.49153 > 10.1.1.2.8080: Flags [.], seq 85761:86297, ack 1, win 65535, length 536
1.314489 IP 10.1.1.2.8080 > 10.1.1.1.49153: Flags [.], ack 81473, win 65535, length 0
1.314489 IP 10.1.1.1.49153 > 10.1.1.2.8080: Flags [.], seq 86297:86833, ack 1, win 65535, length 536
1.315414 IP 10.1.1.1.49153 > 10.1.1.2.8080: Flags [.], seq 86833:87369, ack 1, win 65535, length 536
1.316339 IP 10.1.1.1.49153 > 10.1.1.2.8080: Flags [.], seq 87369:87905, ack 1, win 65535, length 536
1.318083 IP 10.1.1.2.8080 > 10.1.1.1.49153: Flags [.], ack 82545, win 65535, length 0
1.318083 IP 10.1.1.1.49153 > 10.1.1.2.8080: Flags [.], seq 87905:88441, ack 1, win 65535, length 536
1.319008 IP 10.1.1.1.49153 > 10.1.1.2.8080: Flags [.], seq 88441:88977, ack 1, win 65535, length 536
1.319932 IP 10.1.1.2.8080 > 10.1.1.1.49153: Flags [.], ack 83617, win 65535, length 0
1.319932 IP 10.1.1.1.49153 > 10.1.1.2.8080: Flags [.], seq 88977:89513, ack 1, win 65535, length 536
1.320857 IP 10.1.1.1.49153 > 10.1.1.2.8080: Flags [.], seq 89513:90049, ack 1, win 65535, length 536
1.321782 IP 10.1.1.2.8080 > 10.1.1.1.49153: Flags [.], ack 84689, win 65535, length 0
1.321782 IP 10.1.1.1.49153 > 10.1.1.2.8080: Flags [.], seq 90049:90585, ack 1, win 65535, length 536
1.322707 IP 10.1.1.1.49153 > 10.1.1.2.8080: Flags [.], seq 90585:91121, ack 1, win 65535, length 536
1.323632 IP 10.1.1.2.8080 > 10.1.1.1.49153: Flags [.], ack 85761, win 65535, length 0
1.323632 IP 10.1.1.1.49153 > 10.1.1.2.8080: Flags [.], seq 91121:91657, ack 1, win 65535, length 536
1.324556 IP 10.1.1.1.49153 > 10.1.1.2.8080: Flags [.], seq 91657:92193, ack 1, win 65535, length 536
1.325481 IP 10.1.1.2.8080 > 10.1.1.1.49153: Flags [.], ack 86833, win 65535, length 0
1.325481 IP 10.1.1.1.49153 > 10.1.1.2.8080: Flags [.], seq 92193:92729, ack 1, win 65535, length 536
1.326406 IP 10.1.1.1.49153 > 10.1.1.2.8080: Flags [.], seq 92729:93265, ack 1, win 65535, length 536
1.327331 IP 10.1.1.2.8080 > 10.1.1.1.49153: Flags [.], ack 87905, win 65535, length 0
1.327331 IP 10.1.1.1.49153 > 10.1.1.2.8080: Flags [.], seq 93265:93801, ack 1, win 65535, length 536
1.328256 IP 10.1.1.1.49153 > 10.1.1.2.8080: Flags [.], seq 93801:94337, ack 1, win 65535, length 536
1.330000 IP 10.1.1.2.8080 > 10.1.1.1.49153: Flags [.], ack 88977, win 65535, length 0
1.330000 IP 10.1.1.1.49153 > 10.1.1.2.8080: Flags [.], seq 94337:94873, ack 1, win 65535, length 536
1.330924 IP 10.1.1.1.49153 > 10.1.1.2.8080: Flags [.], seq 94873:95409, ack 1, win 65535, length 536
1.331849 IP 10.1.1.2.8080 > 10.1.1.1.49153: Flags [.], ack 90049, win 65535, length 0
1.331849 IP 10.1.1.1.49153 > 10.1.1.2.8080: Flags [.], seq 95409:95945, ack 1, win 65535, length 536
1.332774 IP 10.1.1.1.49153 > 10.1.1.2.8080: Flags [.], seq 95945:96481, ack 1, win 65535, length 536
1.333699 IP 10.1.1.2.8080 > 10.1.1.1.49153: Flags [.], ack 91121, win 65535, length 0
1.333699 IP 10.1.1.1.49153 > 10.1.1.2.8080: Flags [.], seq 96481:97017, ack 1, win 65535, length 536
1.334624 IP 10.1.1.1.49153 > 10.1.1.2.8080: Flags [.], seq 97017:97553, ack 1, win 65535, length 536
1.335548 IP 10.1.1.2.8080 > 10.1.1.1.49153: Flags [.], ack 92193, win 65535, length 0
1.335548 IP 10.1.1.1.49153 > 10.1.1.2.8080: Flags [.], seq 97553:98089, ack 1, win 65535, length 536
1.336473 IP 10.1.1.1.49153 > 10.1.1.2.8080: Flags [.], seq 98089:98625, ack 1, win 65535, length 536
1.337398 IP 10.1.1.2.8080 > 10.1.1.1.49153: Flags [.], ack 93265, win 65535, length 0
1.337398 IP 10.1.1.1.49153 > 10.1.1.2.8080: Flags [.], seq 98625:99161, ack 1, win 65535, length 536
1.338323 IP 10.1.1.1.49153 > 10.1.1.2.8080: Flags [.], seq 99161:99697, ack 1, win 65535, length 536
1.339248 IP 10.1.1.2.8080 > 10.1.1.1.49153: Flags [.], ack 94337, win 65535, length 0
1.339248 IP 10.1.1.1.49153 > 10.1.1.2.8080: Flags [.], seq 99697:100233, ack 1, win 65535, length 536
1.340172 IP 10.1.1.1.49153 > 10.1.1.2.8080: Flags [.], seq 100233:100769, ack 1, win 65535, length 536
1.341097 IP 10.1.1.1.49153 > 10.1.1.2.8080: Flags [.], seq 100769:101305, ack 1, win 65535, length 536
1.341916 IP 10.1.1.2.8080 > 10.1.1.1.49153: Flags [.], ack 95409, win 65535, length 0
1.342022 IP 10.1.1.1.49153 > 10.1.1.2.8080: Flags [.], seq 101305:101841, ack 1, win 65535, length 536
1.342947 IP 10.1.1.1.49153 > 10.1.1.2.8080: Flags [.], seq 101841:102377, ack 1, win 65535, length 536
1.343766 IP 10.1.1.2.8080 > 10.1.1.1.49153: Flags [.], ack 96481, win 65535, length 0
1.343872 IP 10.1.1.1.49153 > 10.1.1.2.8080: Flags [.], seq 102377:102913, ack 1, win 65535, length 536
1.344796 IP 10.1.1.1.49153 > 10.1.1.2.8080: Flags [.], seq 102913:103449, ack 1, win 65535, length 536
1.345616 IP 10.1.1.2.8080 > 10.1.1.1.49153: Flags [.], ack 97553, win 65535, length 0
1.345721 IP 10.1.1.1.49153 > 10.1.1.2.8080: Flags [.], seq 103449:103985, ack 1, win 65535, length 536
1.346646 IP 10.1.1.1.49153 > 10.1.1.2.8080: Flags [.], seq 103985:104521, ack 1, win 65535, length 536
1.347465 IP 10.1.1.2.8080 > 10.1.1.1.49153: Flags [.], ack 98625, win 65535, length 0
1.347571 IP 10.1.1.1.49153 > 10.1.1.2.8080: Flags [.], seq 104521:105057, ack 1, win 65535, length 536
1.348496 IP 10.1.1.1.49153 > 10.1.1.2.8080: Flags [.], seq 105057:105593, ack 1, win 65535, length 536
1.349315 IP 10.1.1.2.8080 > 10.1.1.1.49153: Flags [.], ack 99697, win 65535, length 0
1.349420 IP 10.1.1.1.49153 > 10.1.1.2.8080: Flags [.], seq 105593:106129, ack 1, win 65535, length 536
1.350345 IP 10.1.1.1.49153 > 10.1.1.2.8080: Flags [.], seq 106129:106665, ack 1, win 65535, length 536
1.351164 IP 10.1.1.2.8080 > 10.1.1.1.49153: Flags [.], ack 100769, win 65535, length 0
1.351270 IP 10.1.1.1.49153 > 10.1.1.2.8080: Flags [.], seq 106665:107201, ack 1, win 65535, length 536
1.352195 IP 10.1.1.1.49153 > 10.1.1.2.8080: Flags [.], seq 107201:107737, ack 1, win 65535, length 536
1.353014 IP 10.1.1.2.8080 > 10.1.1.1.49153: Flags [.], ack 101841, win 65535, length 0
1.353120 IP 10.1.1.1.49153 > 10.1.1.2.8080: Flags [.], seq 107737:108273, ack 1, win 65535, length 536
1.354044 IP 10.1.1.1.49153 > 10.1.1.2.8080: Flags [.], seq 108273:108809, ack 1, win 65535, length 536
1.354864 IP 10.1.1.2.8080 > 10.1.1.1.49153: Flags [.], ack 102913, win 65535, length 0
1.354969 IP 10.1.1.1.49153 > 10.1.1.2.8080: Flags [.], seq 108809:109345, ack 1, win 65535, length 536
1.355894 IP 10.1.1.1.49153 > 10.1.1.2.8080: Flags [.], seq 109345:109881, ack 1, win 65535, length 536
1.356713 IP 10.1.1.2.8080 > 10.1.1.1.49153: Flags [.], ack 103985, win 65535, length 0
1.356819 IP 10.1.1.1.49153 > 10.1.1.2.8080: Flags [.], seq 109881:110417, ack 1, win 65535, length 536
1.357744 IP 10.1.1.1.49153 > 10.1.1.2.8080: Flags [.], seq 110417:110953, ack 1, win 65535, length 536
1.358563 IP 10.1.1.2.8080 > 10.1.1.1.49153: Flags [.], ack 105057, win 65535, length 0
1.358668 IP 10.1.1.1.49153 > 10.1.1.2.8080: Flags [.], seq 110953:111489, ack 1, win 65535, length 536
1.359593 IP 10.1.1.1.49153 > 10.1.1.2.8080: Flags [.], seq 111489:112025, ack 1, win 65535, length 536
1.360412 IP 10.1.1.2.8080 > 10.1.1.1.49153: Flags [.], ack 106129, win 65535, length 0
1.360518 IP 10.1.1.1.49153 > 10.1.1.2.8080: Flags [.], seq 112025:112561, ack 1, win 65535, length 536
1.361443 IP 10.1.1.1.49153 > 10.1.1.2.8080: Flags [.], seq 112561:113097, ack 1, win 65535, length 536
1.362262 IP 10.1.1.2.8080 > 10.1.1.1.49153: Flags [.], ack 107201, win 65535, length 0
1.362368 IP 10.1.1.1.49153 > 10.1.1.2.8080: Flags [.], seq 113097:113633, ack 1, win 65535, length 536
1.363292 IP 10.1.1.1.49153 > 10.1.1.2.8080: Flags [.], seq 113633:114169, ack 1, win 65535, length 536
1.364112 IP 10.1.1.2.8080 > 10.1.1.1.49153: Flags [.], ack 108273, win 65535, length 0
1.364217 IP 10.1.1.1.49153 > 10.1.1.2.8080: Flags [.], seq 114705:115241, ack 1, win 65535, length 536
1.365142 IP 10.1.1.1.49153 > 10.1.1.2.8080: Flags [.], seq 115241:115777, ack 1, win 65535, length 536
1.365961 IP 10.1.1.2.8080 > 10.1.1.1.49153: Flags [.], ack 109345, win 65535, length 0
1.366067 IP 10.1.1.1.49153 > 10.1.1.2.8080: Flags [.], seq 115777:116313, ack 1, win 65535, length 536
1.366992 IP 10.1.1.1.49153 > 10.1.1.2.8080: Flags [.], seq 116313:116849, ack 1, win 65535, length 536
1.367811 IP 10.1.1.2.8080 > 10.1.1.1.49153: Flags [.], ack 110417, win 65535, length 0
1.367916 IP 10.1.1.1.49153 > 10.1.1.2.8080: Flags [.], seq 116849:117385, ack 1, win 65535, length 536
1.368841 IP 10.1.1.1.49153 > 10.1.1.2.8080: Flags [.], seq 117385:117921, ack 1, win 65535, length 536
1.369660 IP 10.1.1.2.8080 > 10.1.1.1.49153: Flags [.], ack 111489, win 65535, length 0
1.369766 IP 10.1.1.1.49153 > 10.1.1.2.8080: Flags [.], seq 117921:118457, ack 1, win 65535, length 536
1.370691 IP 10.1.1.1.49153 > 10.1.1.2.8080: Flags [.], seq 118457:118993, ack 1, win 65535, length 536
1.371510 IP 10.1.1.2.8080 > 10.1.1.1.49153: Flags [.], ack 112561, win 65535, length 0
1.371616 IP 10.1.1.1.49153 > 10.1.1.2.8080: Flags [.], seq 118993:119529, ack 1, win 65535, length 536
1.372540 IP 10.1.1.1.49153 > 10.1.1.2.8080: Flags [.], seq 119529:120065, ack 1, win 65535, length 536
1.373360 IP 10.1.1.2.8080 > 10.1.1.1.49153: Flags [.], ack 113633, win 65535, length 0
1.373465 IP 10.1.1.1.49153 > 10.1.1.2.8080: Flags [.], seq 120065:120601, ack 1, win 65535, length 536
1.374390 IP 10.1.1.1.49153 > 10.1.1.2.8080: Flags [.], seq 120601:121137, ack 1, win 65535, length 536
1.375209 IP 10.1.1.2.8080 > 10.1.1.1.49153: Flags [.], ack 114169, win 65535, length 0
1.375315 IP 10.1.1.1.49153 > 10.1.1.2.8080: Flags [.], seq 121137:121673, ack 1, win 65535, length 536
1.376134 IP 10.1.1.2.8080 > 10.1.1.1.49153: Flags [.], ack 114169, win 65535, length 0
1.377059 IP 10.1.1.2.8080 > 10.1.1.1.49153: Flags [.], ack 114169, win 65535, length 0
1.377984 IP 10.1.1.2.8080 > 10.1.1.1.49153: Flags [.], ack 114169, win 65535, length 0
1.377984 IP 10.1.1.1.49153 > 10.1.1.2.8080: Flags [.], seq 114169:114705, ack 1, win 65535, length 536
1.378908 IP 10.1.1.2.8080 > 10.1.1.1.49153: Flags [.], ack 114169, win 65535, length 0
1.379833 IP 10.1.1.2.8080 > 10.1.1.1.49153: Flags [.], ack 114169, win 65535, length 0
1.380758 IP 10.1.1.2.8080 > 10.1.1.1.49153: Flags [.], ack 114169, win 65535, length 0
1.381683 IP 10.1.1.2.8080 > 10.1.1.1.49153: Flags [.], ack 114169, win 65535, length 0
1.382608 IP 10.1.1.2.8080 > 10.1.1.1.49153: Flags [.], ack 114169, win 65535, length 0
1.382608 IP 10.1.1.1.49153 > 10.1.1.2.8080: Flags [.], seq 121673:122209, ack 1, win 65535, length 536
1.383532 IP 10.1.1.2.8080 > 10.1.1.1.49153: Flags [.], ack 114169, win 65535, length 0
1.383532 IP 10.1.1.1.49153 > 10.1.1.2.8080: Flags [.], seq 122209:122745, ack 1, win 65535, length 536
1.384457 IP 10.1.1.2.8080 > 10.1.1.1.49153: Flags [.], ack 114169, win 65535, length 0
1.384457 IP 10.1.1.1.49153 > 10.1.1.2.8080: Flags [.], seq 122745:123281, ack 1, win 65535, length 536
1.385382 IP 10.1.1.2.8080 > 10.1.1.1.49153: Flags [.], ack 114169, win 65535, length 0
1.385382 IP 10.1.1.1.49153 > 10.1.1.2.8080: Flags [.], seq 123281:123817, ack 1, win 65535, length 536
1.386307 IP 10.1.1.2.8080 > 10.1.1.1.49153: Flags [.], ack 114169, win 65535, length 0
1.386307 IP 10.1.1.1.49153 > 10.1.1.2.8080: Flags [.], seq 123817:124353, ack 1, win 65535, length 536
1.388976 IP 10.1.1.2.8080 > 10.1.1.1.49153: Flags [.], ack 121673, win 65535, length 0
1.388976 IP 10.1.1.1.49153 > 10.1.1.2.8080: Flags [.], seq 124353:124889, ack 1, win 65535, length 536
1.389900 IP 10.1.1.1.49153 > 10.1.1.2.8080: Flags [.], seq 124889:125425, ack 1, win 65535, length 536
1.394524 IP 10.1.1.2.8080 > 10.1.1.1.49153: Flags [.], ack 122745, win 65535, length 0
1.394524 IP 10.1.1.1.49153 > 10.1.1.2.8080: Flags [.], seq 125425:125961, ack 1, win 65535, length 536
1.395449 IP 10.1.1.1.49153 > 10.1.1.2.8080: Flags [.], seq 125961:126497, ack 1, win 65535, length 536
1.396374 IP 10.1.1.2.8080 > 10.1.1.1.49153: Flags [.], ack 123817, win 65535, length 0
1.396374 IP 10.1.1.1.49153 > 10.1.1.2.8080: Flags [.], seq 126497:127033, ack 1, win 65535, length 536
1.397299 IP 10.1.1.1.49153 > 10.1.1.2.8080: Flags [.], seq 127033:127569, ack 1, win 65535, length 536
1.399968 IP 10.1.1.2.8080 > 10.1.1.1.49153: Flags [.], ack 124889, win 65535, length 0
1.399968 IP 10.1.1.1.49153 > 10.1.1.2.8080: Flags [.], seq 127569:128105, ack 1, win 65535, length 536
1.400892 IP 10.1.1.1.49153 > 10.1.1.2.8080: Flags [.], seq 128105:128641, ack 1, win 65535, length 536
1.405516 IP 10.1.1.2.8080 > 10.1.1.1.49153: Flags [.], ack 125961, win 65535, length 0
1.405516 IP 10.1.1.1.49153 > 10.1.1.2.8080: Flags [.], seq 128641:129177, ack 1, win 65535, length 536
1.406441 IP 10.1.1.1.49153 > 10.1.1.2.8080: Flags [.], seq 129177:129713, ack 1, win 65535, length 536
1.407366 IP 10.1.1.2.8080 > 10.1.1.1.49153: Flags [.], ack 127033, win 65535, length 0
1.407366 IP 10.1.1.1.49153 > 10.1.1.2.8080: Flags [.], seq 129713:130249, ack 1, win 65535, length 536
1.408291 IP 10.1.1.1.49153 > 10.1.1.2.8080: Flags [.], seq 130249:130785, ack 1, win 65535, length 536
1.410960 IP 10.1.1.2.8080 > 10.1.1.1.49153: Flags [.], ack 128105, win 65535, length 0
1.410960 IP 10.1.1.1.49153 > 10.1.1.2.8080: Flags [.], seq 130785:131321, ack 1, win 65535, length 536
1.411884 IP 10.1.1.1.49153 > 10.1.1.2.8080: Flags [.], seq 131321:131857, ack 1, win 65535, length 536
1.416508 IP 10.1.1.2.8080 > 10.1.1.1.49153: Flags [.], ack 129177, win 65535, length 0
1.416508 IP 10.1.1.1.49153 > 10.1.1.2.8080: Flags [.], seq 131857:132393, ack 1, win 65535, length 536
1.417433 IP 10.1.1.1.49153 > 10.1.1.2.8080: Flags [.], seq 132393:132929, ack 1, win 65535, length 536
1.418358 IP 10.1.1.2.8080 > 10.1.1.1.49153: Flags [.], ack 130249, win 65535, length 0
1.418358 IP 10.1.1.1.49153 > 10.1.1.2.8080: Flags [.], seq 132929:133465, ack 1, win 65535, length 536
1.419283 IP 10.1.1.1.49153 > 10.1.1.2.8080: Flags [.], seq 133465:134001, ack 1, win 65535, length 536
1.420208 IP 10.1.1.1.49153 > 10.1.1.2.8080: Flags [.], seq 134001:134537, ack 1, win 65535, length 536
1.421952 IP 10.1.1.2.8080 > 10.1.1.1.49153: Flags [.], ack 131321, win 65535, length 0
1.421952 IP 10.1.1.1.49153 > 10.1.1.2.8080: Flags [.], seq 134537:135073, ack 1, win 65535, length 536
1.422876 IP 10.1.1.1.49153 > 10.1.1.2.8080: Flags [.], seq 135073:135609, ack 1, win 65535, length 536
1.427500 IP 10.1.1.2.8080 > 10.1.1.1.49153: Flags [.], ack 132393, win 65535, length 0
1.427500 IP 10.1.1.1.49153 > 10.1.1.2.8080: Flags [.], seq 135609:136145, ack 1, win 65535, length 536
1.428425 IP 10.1.1.1.49153 > 10.1.1.2.8080: Flags [.], seq 136145:136681, ack 1, win 65535, length 536
1.429350 IP 10.1.1.2.8080 > 10.1.1.1.49153: Flags [.], ack 133465, win 65535, length 0
1.429350 IP 10.1.1.1.49153 > 10.1.1.2.8080: Flags [.], seq 136681:137217, ack 1, win 65535, length 536
1.430275 IP 10.1.1.1.49153 > 10.1.1.2.8080: Flags [.], seq 137217:137753, ack 1, win 65535, length 536
1.431200 IP 10.1.1.2.8080 > 10.1.1.1.49153: Flags [.], ack 134537, win 65535, length 0
1.431200 IP 10.1.1.1.49153 > 10.1.1.2.8080: Flags [.], seq 137753:138289, ack 1, win 65535, length 536
1.432124 IP 10.1.1.1.49153 > 10.1.1.2.8080: Flags [.], seq 138289:138825, ack 1, win 65535, length 536
1.433868 IP 10.1.1.2.8080 > 10.1.1.1.49153: Flags [.], ack 135609, win 65535, length 0
1.433868 IP 10.1.1.1.49153 > 10.1.1.2.8080: Flags [.], seq 138825:139361, ack 1, win 65535, length 536
1.434793 IP 10.1.1.1.49153 > 10.1.1.2.8080: Flags [.], seq 139361:139897, ack 1, win 65535, length 536
1.439417 IP 10.1.1.2.8080 > 10.1.1.1.49153: Flags [.], ack 136681, win 65535, length 0
1.439417 IP 10.1.1.1.49153 > 10.1.1.2.8080: Flags [.], seq 139897:140433, ack 1, win 65535, length 536
1.440342 IP 10.1.1.1.49153 > 10.1.1.2.8080: Flags [.], seq 140433:140969, ack 1, win 65535, length 536
1.441267 IP 10.1.1.2.8080 > 10.1.1.1.49153: Flags [.], ack 137753, win 65535, length 0
1.441267 IP 10.1.1.1.49153 > 10.1.1.2.8080: Flags [.], seq 140969:141505, ack 1, win 65535, length 536
1.442192 IP 10.1.1.1.49153 > 10.1.1.2.8080: Flags [.], seq 141505:142041, ack 1, win 65535, length 536
1.443116 IP 10.1.1.2.8080 > 10.1.1.1.49153: Flags [.], ack 138825, win 65535, length 0
1.443116 IP 10.1.1.1.49153 > 10.1.1.2.8080: Flags [.], seq 142041:142577, ack 1, win 65535, length 536
1.444041 IP 10.1.1.1.49153 > 10.1.1.2.8080: Flags [.], seq 142577:143113, ack 1, win 65535, length 536
1.444966 IP 10.1.1.1.49153 > 10.1.1.2.8080: Flags [.], seq 143113:143649, ack 1, win 65535, length 536
1.445785 IP 10.1.1.2.8080 > 10.1.1.1.49153: Flags [.], ack 139897, win 65535, length 0
1.445891 IP 10.1.1.1.49153 > 10.1.1.2.8080: Flags [.], seq 143649:144185, ack 1, win 65535, length 536
1.446816 IP 10.1.1.1.49153 > 10.1.1.2.8080: Flags [.], seq 144185:144721, ack 1, win 65535, length 536
1.451334 IP 10.1.1.2.8080 > 10.1.1.1.49153: Flags [.], ack 140969, win 65535, length 0
