1.005067 IP 10.1.1.1.49153 > 10.1.1.2.8080: Flags [S], seq 0, win 65535, length 0
1.005067 IP 10.1.1.2.8080 > 10.1.1.1.49153: Flags [S.], seq 0, ack 1, win 65535, length 0
1.015201 IP 10.1.1.1.49153 > 10.1.1.2.8080: Flags [.], ack 1, win 65535, length 0
1.016126 IP 10.1.1.1.49153 > 10.1.1.2.8080: Flags [.], seq 1:537, ack 1, win 65535, length 536
1.016126 IP 10.1.1.2.8080 > 10.1.1.1.49153: Flags [.], ack 537, win 65535, length 0
1.027118 IP 10.1.1.1.49153 > 10.1.1.2.8080: Flags [.], seq 537:1073, ack 1, win 65535, length 536
1.028043 IP 10.1.1.1.49153 > 10.1.1.2.8080: Flags [.], seq 1073:1609, ack 1, win 65535, length 536
1.028043 IP 10.1.1.2.8080 > 10.1.1.1.49153: Flags [.], ack 1609, win 65535, length 0
1.039035 IP 10.1.1.1.49153 > 10.1.1.2.8080: Flags [.], seq 1609:2145, ack 1, win 65535, length 536
1.039960 IP 10.1.1.1.49153 > 10.1.1.2.8080: Flags [.], seq 2145:2681, ack 1, win 65535, length 536
1.039960 IP 10.1.1.2.8080 > 10.1.1.1.49153: Flags [.], ack 2681, win 65535, length 0
1.050952 IP 10.1.1.1.49153 > 10.1.1.2.8080: Flags [.], seq 3217:3753, ack 1, win 65535, length 536
1.050952 IP 10.1.1.2.8080 > 10.1.1.1.49153: Flags [.], ack 2681, win 65535, length 0
1.051876 IP 10.1.1.1.49153 > 10.1.1.2.8080: Flags [.], seq 3753:4289, ack 1, win 65535, length 536
1.051876 IP 10.1.1.2.8080 > 10.1.1.1.49153: Flags [.], ack 2681, win 65535, length 0
1.250952 IP 10.1.1.1.49153 > 10.1.1.2.8080: Flags [.], seq 2681:3217, ack 1, win 65535, length 536
1.250952 IP 10.1.1.2.8080 > 10.1.1.1.49153: Flags [.], ack 4289, win 65535, length 0
1.261944 IP 10.1.1.1.49153 > 10.1.1.2.8080: Flags [.], seq 4289:4825, ack 1, win 65535, length 536
1.262868 IP 10.1.1.1.49153 > 10.1.1.2.8080: Flags [.], seq 4825:5361, ack 1, win 65535, length 536
1.262868 IP 10.1.1.2.8080 > 10.1.1.1.49153: Flags [.], ack 5361, win 65535, length 0
1.273860 IP 10.1.1.1.49153 > 10.1.1.2.8080: Flags [.], seq 5361:5897, ack 1, win 65535, length 536
1.274785 IP 10.1.1.1.49153 > 10.1.1.2.8080: Flags [.], seq 5897:6433, ack 1, win 65535, length 536
1.274785 IP 10.1.1.2.8080 > 10.1.1.1.49153: Flags [.], ack 6433, win 65535, length 0
1.285777 IP 10.1.1.1.49153 > 10.1.1.2.8080: Flags [.], seq 6433:6969, ack 1, win 65535, length 536
1.286702 IP 10.1.1.1.49153 > 10.1.1.2.8080: Flags [.], seq 6969:7505, ack 1, win 65535, length 536
1.286702 IP 10.1.1.2.8080 > 10.1.1.1.49153: Flags [.], ack 7505, win 65535, length 0
1.297694 IP 10.1.1.1.49153 > 10.1.1.2.8080: Flags [.], seq 7505:8041, ack 1, win 65535, length 536
1.298619 IP 10.1.1.1.49153 > 10.1.1.2.8080: Flags [.], seq 8041:8577, ack 1, win 65535, length 536
1.298619 IP 10.1.1.2.8080 > 10.1.1.1.49153: Flags [.], ack 8577, win 65535, length 0
1.309611 IP 10.1.1.1.49153 > 10.1.1.2.8080: Flags [.], seq 9113:9649, ack 1, win 65535, length 536
1.309611 IP 10.1.1.2.8080 > 10.1.1.1.49153: Flags [.], ack 8577, win 65535, length 0
1.310536 IP 10.1.1.1.49153 > 10.1.1.2.8080: Flags [.], seq 9649:10185, ack 1, win 65535, length 536
1.310536 IP 10.1.1.2.8080 > 10.1.1.1.49153: Flags [.], ack 8577, win 65535, length 0
1.509611 IP 10.1.1.1.49153 > 10.1.1.2.8080: Flags [.], seq 8577:9113, ack 1, win 65535, length 536
1.509611 IP 10.1.1.2.8080 > 10.1.1.1.49153: Flags [.], ack 10185, win 65535, length 0
1.520603 IP 10.1.1.1.49153 > 10.1.1.2.8080: Flags [.], seq 10185:10721, ack 1, win 65535, length 536
1.521528 IP 10.1.1.1.49153 > 10.1.1.2.8080: Flags [.], seq 10721:11257, ack 1, win 65535, length 536
1.521528 IP 10.1.1.2.8080 > 10.1.1.1.49153: Flags [.], ack 11257, win 65535, length 0
1.532520 IP 10.1.1.1.49153 > 10.1.1.2.8080: Flags [.], seq 11257:11793, ack 1, win 65535, length 536
1.533444 IP 10.1.1.1.49153 > 10.1.1.2.8080: Flags [.], seq 11793:12329, ack 1, win 65535, length 536
1.533444 IP 10.1.1.2.8080 > 10.1.1.1.49153: Flags [.], ack 12329, win 65535, length 0
1.544436 IP 10.1.1.1.49153 > 10.1.1.2.8080: Flags [.], seq 12329:12865, ack 1, win 65535, length 536
1.545361 IP 10.1.1.1.49153 > 10.1.1.2.8080: Flags [.], seq 12865:13401, ack 1, win 65535, length 536
1.545361 IP 10.1.1.2.8080 > 10.1.1.1.49153: Flags [.], ack 13401, win 65535, length 0
1.556353 IP 10.1.1.1.49153 > 10.1.1.2.8080: Flags [.], seq 13401:13937, ack 1, win 65535, length 536
1.557278 IP 10.1.1.1.49153 > 10.1.1.2.8080: Flags [.], seq 13937:14473, ack 1, win 65535, length 536
1.557278 IP 10.1.1.2.8080 > 10.1.1.1.49153: Flags [.], ack 14473, win 65535, length 0
1.568270 IP 10.1.1.1.49153 > 10.1.1.2.8080: Flags [.], seq 15009:15545, ack 1, win 65535, length 536
1.568270 IP 10.1.1.2.8080 > 10.1.1.1.49153: Flags [.], ack 14473, win 65535, length 0
1.569195 IP 10.1.1.1.49153 > 10.1.1.2.8080: Flags [.], seq 15545:16081, ack 1, win 65535, length 536
1.569195 IP 10.1.1.2.8080 > 10.1.1.1.49153: Flags [.], ack 14473, win 65535, length 0
1.768270 IP 10.1.1.1.49153 > 10.1.1.2.8080: Flags [.], seq 14473:15009, ack 1, win 65535, length 536
1.768270 IP 10.1.1.2.8080 > 10.1.1.1.49153: Flags [.], ack 16081, win 65535, length 0
1.779262 IP 10.1.1.1.49153 > 10.1.1.2.8080: Flags [.], seq 16081:16617, ack 1, win 65535, length 536
1.780187 IP 10.1.1.1.49153 > 10.1.1.2.8080: Flags [.], seq 16617:17153, ack 1, win 65535, length 536
1.780187 IP 10.1.1.2.8080 > 10.1.1.1.49153: Flags [.], ack 17153, win 65535, length 0
1.791179 IP 10.1.1.1.49153 > 10.1.1.2.8080: Flags [.], seq 17153:17689, ack 1, win 65535, length 536
1.792104 IP 10.1.1.1.49153 > 10.1.1.2.8080: Flags [.], seq 17689:18225, ack 1, win 65535, length 536
1.792104 IP 10.1.1.2.8080 > 10.1.1.1.49153: Flags [.], ack 18225, win 65535, length 0
1.803096 IP 10.1.1.1.49153 > 10.1.1.2.8080: Flags [.], seq 18225:18761, ack 1, win 65535, length 536
1.804020 IP 10.1.1.1.49153 > 10.1.1.2.8080: Flags [.], seq 18761:19297, ack 1, win 65535, length 536
1.804020 IP 10.1.1.2.8080 > 10.1.1.1.49153: Flags [.], ack 19297, win 65535, length 0
1.815012 IP 10.1.1.1.49153 > 10.1.1.2.8080: Flags [.], seq 19297:19833, ack 1, win 65535, length 536
1.815937 IP 10.1.1.1.49153 > 10.1.1.2.8080: Flags [.], seq 19833:20369, ack 1, win 65535, length 536
1.815937 IP 10.1.1.2.8080 > 10.1.1.1.49153: Flags [.], ack 20369, win 65535, length 0
1.826929 IP 10.1.1.1.49153 > 10.1.1.2.8080: Flags [.], seq 20905:21441, ack 1, win 65535, length 536
1.826929 IP 10.1.1.2.8080 > 10.1.1.1.49153: Flags [.], ack 20369, win 65535, length 0
1.827854 IP 10.1.1.1.49153 > 10.1.1.2.8080: Flags [.], seq 21441:21977, ack 1, win 65535, length 536
1.827854 IP 10.1.1.2.8080 > 10.1.1.1.49153: Flags [.], ack 20369, win 65535, length 0
2.026929 IP 10.1.1.1.49153 > 10.1.1.2.8080: Flags [.], seq 20369:20905, ack 1, win 65535, length 536
2.026929 IP 10.1.1.2.8080 > 10.1.1.1.49153: Flags [.], ack 21977, win 65535, length 0
2.037921 IP 10.1.1.1.49153 > 10.1.1.2.8080: Flags [.], seq 21977:22513, ack 1, win 65535, length 536
2.038846 IP 10.1.1.1.49153 > 10.1.1.2.8080: Flags [.], seq 22513:23049, ack 1, win 65535, length 536
2.038846 IP 10.1.1.2.8080 > 10.1.1.1.49153: Flags [.], ack 23049, win 65535, length 0
2.049838 IP 10.1.1.1.49153 > 10.1.1.2.8080: Flags [.], seq 23049:23585, ack 1, win 65535, length 536
2.050763 IP 10.1.1.1.49153 > 10.1.1.2.8080: Flags [.], seq 23585:24121, ack 1, win 65535, length 536
2.050763 IP 10.1.1.2.8080 > 10.1.1.1.49153: Flags [.], ack 24121, win 65535, length 0
2.061755 IP 10.1.1.1.49153 > 10.1.1.2.8080: Flags [.], seq 24121:24657, ack 1, win 65535, length 536
2.062680 IP 10.1.1.1.49153 > 10.1.1.2.8080: Flags [.], seq 24657:25193, ack 1, win 65535, length 536
2.062680 IP 10.1.1.2.8080 > 10.1.1.1.49153: Flags [.], ack 25193, win 65535, length 0
2.073672 IP 10.1.1.1.49153 > 10.1.1.2.8080: Flags [.], seq 25193:25729, ack 1, win 65535, length 536
2.074596 IP 10.1.1.1.49153 > 10.1.1.2.8080: Flags [.], seq 25729:26265, ack 1, win 65535, length 536
2.074596 IP 10.1.1.2.8080 > 10.1.1.1.49153: Flags [.], ack 26265, win 65535, length 0
2.085588 IP 10.1.1.1.49153 > 10.1.1.2.8080: Flags [.], seq 26801:27337, ack 1, win 65535, length 536
2.085588 IP 10.1.1.2.8080 > 10.1.1.1.49153: Flags [.], ack 26265, win 65535, length 0
2.086513 IP 10.1.1.1.49153 > 10.1.1.2.8080: Flags [.], seq 27337:27873, ack 1, win 65535, length 536
2.086513 IP 10.1.1.2.8080 > 10.1.1.1.49153: Flags [.], ack 26265, win 65535, length 0
2.285588 IP 10.1.1.1.49153 > 10.1.1.2.8080: Flags [.], seq 26265:26801, ack 1, win 65535, length 536
2.285588 IP 10.1.1.2.8080 > 10.1.1.1.49153: Flags [.], ack 27873, win 65535, length 0
2.296580 IP 10.1.1.1.49153 > 10.1.1.2.8080: Flags [.], seq 27873:28409, ack 1, win 65535, length 536
2.297505 IP 10.1.1.1.49153 > 10.1.1.2.8080: Flags [.], seq 28409:28945, ack 1, win 65535, length 536
2.297505 IP 10.1.1.2.8080 > 10.1.1.1.49153: Flags [.], ack 28945, win 65535, length 0
2.308497 IP 10.1.1.1.49153 > 10.1.1.2.8080: Flags [.], seq 28945:29481, ack 1, win 65535, length 536
2.309422 IP 10.1.1.1.49153 > 10.1.1.2.8080: Flags [.], seq 29481:30017, ack 1, win 65535, length 536
2.309422 IP 10.1.1.2.8080 > 10.1.1.1.49153: Flags [.], ack 30017, win 65535, length 0
2.320414 IP 10.1.1.1.49153 > 10.1.1.2.8080: Flags [.], seq 30017:30553, ack 1, win 65535, length 536
2.321339 IP 10.1.1.1.49153 > 10.1.1.2.8080: Flags [.], seq 30553:31089, ack 1, win 65535, length 536
2.321339 IP 10.1.1.2.8080 > 10.1.1.1.49153: Flags [.], ack 31089, win 65535, length 0
2.332331 IP 10.1.1.1.49153 > 10.1.1.2.8080: Flags [.], seq 31089:31625, ack 1, win 65535, length 536
2.333256 IP 10.1.1.1.49153 > 10.1.1.2.8080: Flags [.], seq 31625:32161, ack 1, win 65535, length 536
2.333256 IP 10.1.1.2.8080 > 10.1.1.1.49153: Flags [.], ack 32161, win 65535, length 0
2.344248 IP 10.1.1.1.49153 > 10.1.1.2.8080: Flags [.], seq 32697:33233, ack 1, win 65535, length 536
2.344248 IP 10.1.1.2.8080 > 10.1.1.1.49153: Flags [.], ack 32161, win 65535, length 0
2.345172 IP 10.1.1.1.49153 > 10.1.1.2.8080: Flags [.], seq 33233:33769, ack 1, win 65535, length 536
2.345172 IP 10.1.1.2.8080 > 10.1.1.1.49153: Flags [.], ack 32161, win 65535, length 0
2.544248 IP 10.1.1.1.49153 > 10.1.1.2.8080: Flags [.], seq 32161:32697, ack 1, win 65535, length 536
2.544248 IP 10.1.1.2.8080 > 10.1.1.1.49153: Flags [.], ack 33769, win 65535, length 0
2.555240 IP 10.1.1.1.49153 > 10.1.1.2.8080: Flags [.], seq 33769:34305, ack 1, win 65535, length 536
2.556164 IP 10.1.1.1.49153 > 10.1.1.2.8080: Flags [.], seq 34305:34841, ack 1, win 65535, length 536
2.556164 IP 10.1.1.2.8080 > 10.1.1.1.49153: Flags [.], ack 34841, win 65535, length 0
2.567156 IP 10.1.1.1.49153 > 10.1.1.2.8080: Flags [.], seq 34841:35377, ack 1, win 65535, length 536
2.568081 IP 10.1.1.1.49153 > 10.1.1.2.8080: Flags [.], seq 35377:35913, ack 1, win 65535, length 536
2.568081 IP 10.1.1.2.8080 > 10.1.1.1.49153: Flags [.], ack 35913, win 65535, length 0
2.579073 IP 10.1.1.1.49153 > 10.1.1.2.8080: Flags [.], seq 35913:36449, ack 1, win 65535, length 536
2.579998 IP 10.1.1.1.49153 > 10.1.1.2.8080: Flags [.], seq 36449:36985, ack 1, win 65535, length 536
2.579998 IP 10.1.1.2.8080 > 10.1.1.1.49153: Flags [.], ack 36985, win 65535, length 0
2.590990 IP 10.1.1.1.49153 > 10.1.1.2.8080: Flags [.], seq 36985:37521, ack 1, win 65535, length 536
2.591915 IP 10.1.1.1.49153 > 10.1.1.2.8080: Flags [.], seq 37521:38057, ack 1, win 65535, length 536
2.591915 IP 10.1.1.2.8080 > 10.1.1.1.49153: Flags [.], ack 38057, win 65535, length 0
2.602907 IP 10.1.1.1.49153 > 10.1.1.2.8080: Flags [.], seq 38593:39129, ack 1, win 65535, length 536
2.602907 IP 10.1.1.2.8080 > 10.1.1.1.49153: Flags [.], ack 38057, win 65535, length 0
2.603832 IP 10.1.1.1.49153 > 10.1.1.2.8080: Flags [.], seq 39129:39665, ack 1, win 65535, length 536
2.603832 IP 10.1.1.2.8080 > 10.1.1.1.49153: Flags [.], ack 38057, win 65535, length 0
2.802907 IP 10.1.1.1.49153 > 10.1.1.2.8080: Flags [.], seq 38057:38593, ack 1, win 65535, length 536
2.802907 IP 10.1.1.2.8080 > 10.1.1.1.49153: Flags [.], ack 39665, win 65535, length 0
2.813899 IP 10.1.1.1.49153 > 10.1.1.2.8080: Flags [.], seq 39665:40201, ack 1, win 65535, length 536
2.814824 IP 10.1.1.1.49153 > 10.1.1.2.8080: Flags [.], seq 40201:40737, ack 1, win 65535, length 536
2.814824 IP 10.1.1.2.8080 > 10.1.1.1.49153: Flags [.], ack 40737, win 65535, length 0
2.825816 IP 10.1.1.1.49153 > 10.1.1.2.8080: Flags [.], seq 40737:41273, ack 1, win 65535, length 536
2.826740 IP 10.1.1.1.49153 > 10.1.1.2.8080: Flags [.], seq 41273:41809, ack 1, win 65535, length 536
2.826740 IP 10.1.1.2.8080 > 10.1.1.1.49153: Flags [.], ack 41809, win 65535, length 0
2.837732 IP 10.1.1.1.49153 > 10.1.1.2.8080: Flags [.], seq 41809:42345, ack 1, win 65535, length 536
2.838657 IP 10.1.1.1.49153 > 10.1.1.2.8080: Flags [.], seq 42345:42881, ack 1, win 65535, length 536
2.838657 IP 10.1.1.2.8080 > 10.1.1.1.49153: Flags [.], ack 42881, win 65535, length 0
2.849649 IP 10.1.1.1.49153 > 10.1.1.2.8080: Flags [.], seq 42881:43417, ack 1, win 65535, length 536
2.850574 IP 10.1.1.1.49153 > 10.1.1.2.8080: Flags [.], seq 43417:43953, ack 1, win 65535, length 536
2.850574 IP 10.1.1.2.8080 > 10.1.1.1.49153: Flags [.], ack 43953, win 65535, length 0
2.861566 IP 10.1.1.1.49153 > 10.1.1.2.8080: Flags [.], seq 44489:45025, ack 1, win 65535, length 536
2.861566 IP 10.1.1.2.8080 > 10.1.1.1.49153: Flags [.], ack 43953, win 65535, length 0
2.862491 IP 10.1.1.1.49153 > 10.1.1.2.8080: Flags [.], seq 45025:45561, ack 1, win 65535, length 536
2.862491 IP 10.1.1.2.8080 > 10.1.1.1.49153: Flags [.], ack 43953, win 65535, length 0
3.061566 IP 10.1.1.1.49153 > 10.1.1.2.8080: Flags [.], seq 43953:44489, ack 1, win 65535, length 536
3.061566 IP 10.1.1.2.8080 > 10.1.1.1.49153: Flags [.], ack 45561, win 65535, length 0
3.072558 IP 10.1.1.1.49153 > 10.1.1.2.8080: Flags [.], seq 45561:46097, ack 1, win 65535, length 536
3.073483 IP 10.1.1.1.49153 > 10.1.1.2.8080: Flags [.], seq 46097:46633, ack 1, win 65535, length 536
3.073483 IP 10.1.1.2.8080 > 10.1.1.1.49153: Flags [.], ack 46633, win 65535, length 0
3.084475 IP 10.1.1.1.49153 > 10.1.1.2.8080: Flags [.], seq 46633:47169, ack 1, win 65535, length 536
3.085400 IP 10.1.1.1.49153 > 10.1.1.2.8080: Flags [.], seq 47169:47705, ack 1, win 65535, length 536
3.085400 IP 10.1.1.2.8080 > 10.1.1.1.49153: Flags [.], ack 47705, win 65535, length 0
3.096392 IP 10.1.1.1.49153 > 10.1.1.2.8080: Flags [.], seq 47705:48241, ack 1, win 65535, length 536
3.097316 IP 10.1.1.1.49153 > 10.1.1.2.8080: Flags [.], seq 48241:48777, ack 1, win 65535, length 536
3.097316 IP 10.1.1.2.8080 > 10.1.1.1.49153: Flags [.], ack 48777, win 65535, length 0
3.108308 IP 10.1.1.1.49153 > 10.1.1.2.8080: Flags [.], seq 48777:49313, ack 1, win 65535, length 536
3.109233 IP 10.1.1.1.49153 > 10.1.1.2.8080: Flags [.], seq 49313:49849, ack 1, win 65535, length 536
3.109233 IP 10.1.1.2.8080 > 10.1.1.1.49153: Flags [.], ack 49849, win 65535, length 0
3.120225 IP 10.1.1.1.49153 > 10.1.1.2.8080: Flags [.], seq 50385:50921, ack 1, win 65535, length 536
3.120225 IP 10.1.1.2.8080 > 10.1.1.1.49153: Flags [.], ack 49849, win 65535, length 0
3.121150 IP 10.1.1.1.49153 > 10.1.1.2.8080: Flags [.], seq 50921:51457, ack 1, win 65535, length 536
3.121150 IP 10.1.1.2.8080 > 10.1.1.1.49153: Flags [.], ack 49849, win 65535, length 0
3.320225 IP 10.1.1.1.49153 > 10.1.1.2.8080: Flags [.], seq 49849:50385, ack 1, win 65535, length 536
3.320225 IP 10.1.1.2.8080 > 10.1.1.1.49153: Flags [.], ack 51457, win 65535, length 0
3.331217 IP 10.1.1.1.49153 > 10.1.1.2.8080: Flags [.], seq 51457:51993, ack 1, win 65535, length 536
3.332142 IP 10.1.1.1.49153 > 10.1.1.2.8080: Flags [.], seq 51993:52529, ack 1, win 65535, length 536
3.332142 IP 10.1.1.2.8080 > 10.1.1.1.49153: Flags [.], ack 52529, win 65535, length 0
3.343134 IP 10.1.1.1.49153 > 10.1.1.2.8080: Flags [.], seq 52529:53065, ack 1, win 65535, length 536
3.344059 IP 10.1.1.1.49153 > 10.1.1.2.8080: Flags [.], seq 53065:53601, ack 1, win 65535, length 536
3.344059 IP 10.1.1.2.8080 > 10.1.1.1.49153: Flags [.], ack 53601, win 65535, length 0
3.355051 IP 10.1.1.1.49153 > 10.1.1.2.8080: Flags [.], seq 53601:54137, ack 1, win 65535, length 536
3.355976 IP 10.1.1.1.49153 > 10.1.1.2.8080: Flags [.], seq 54137:54673, ack 1, win 65535, length 536
3.355976 IP 10.1.1.2.8080 > 10.1.1.1.49153: Flags [.], ack 54673, win 65535, length 0
3.366968 IP 10.1.1.1.49153 > 10.1.1.2.8080: Flags [.], seq 54673:55209, ack 1, win 65535, length 536
3.367892 IP 10.1.1.1.49153 > 10.1.1.2.8080: Flags [.], seq 55209:55745, ack 1, win 65535, length 536
3.367892 IP 10.1.1.2.8080 > 10.1.1.1.49153: Flags [.], ack 55745, win 65535, length 0
3.378884 IP 10.1.1.1.49153 > 10.1.1.2.8080: Flags [.], seq 56281:56817, ack 1, win 65535, length 536
3.378884 IP 10.1.1.2.8080 > 10.1.1.1.49153: Flags [.], ack 55745, win 65535, length 0
3.379809 IP 10.1.1.1.49153 > 10.1.1.2.8080: Flags [.], seq 56817:57353, ack 1, win 65535, length 536
3.379809 IP 10.1.1.2.8080 > 10.1.1.1.49153: Flags [.], ack 55745, win 65535, length 0
3.578884 IP 10.1.1.1.49153 > 10.1.1.2.8080: Flags [.], seq 55745:56281, ack 1, win 65535, length 536
3.578884 IP 10.1.1.2.8080 > 10.1.1.1.49153: Flags [.], ack 57353, win 65535, length 0
3.589876 IP 10.1.1.1.49153 > 10.1.1.2.8080: Flags [.], seq 57353:57889, ack 1, win 65535, length 536
3.590801 IP 10.1.1.1.49153 > 10.1.1.2.8080: Flags [.], seq 57889:58425, ack 1, win 65535, length 536
3.590801 IP 10.1.1.2.8080 > 10.1.1.1.49153: Flags [.], ack 58425, win 65535, length 0
3.601793 IP 10.1.1.1.49153 > 10.1.1.2.8080: Flags [.], seq 58425:58961, ack 1, win 65535, length 536
3.602718 IP 10.1.1.1.49153 > 10.1.1.2.8080: Flags [.], seq 58961:59497, ack 1, win 65535, length 536
3.602718 IP 10.1.1.2.8080 > 10.1.1.1.49153: Flags [.], ack 59497, win 65535, length 0
3.613710 IP 10.1.1.1.49153 > 10.1.1.2.8080: Flags [.], seq 59497:60033, ack 1, win 65535, length 536
3.614635 IP 10.1.1.1.49153 > 10.1.1.2.8080: Flags [.], seq 60033:60569, ack 1, win 65535, length 536
3.614635 IP 10.1.1.2.8080 > 10.1.1.1.49153: Flags [.], ack 60569, win 65535, length 0
3.625627 IP 10.1.1.1.49153 > 10.1.1.2.8080: Flags [.], seq 60569:61105, ack 1, win 65535, length 536
3.626552 IP 10.1.1.1.49153 > 10.1.1.2.8080: Flags [.], seq 61105:61641, ack 1, win 65535, length 536
3.626552 IP 10.1.1.2.8080 > 10.1.1.1.49153: Flags [.], ack 61641, win 65535, length 0
3.637544 IP 10.1.1.1.49153 > 10.1.1.2.8080: Flags [.], seq 62177:62713, ack 1, win 65535, length 536
3.637544 IP 10.1.1.2.8080 > 10.1.1.1.49153: Flags [.], ack 61641, win 65535, length 0
3.638468 IP 10.1.1.1.49153 > 10.1.1.2.8080: Flags [.], seq 62713:63249, ack 1, win 65535, length 536
3.638468 IP 10.1.1.2.8080 > 10.1.1.1.49153: Flags [.], ack 61641, win 65535, length 0
3.837544 IP 10.1.1.1.49153 > 10.1.1.2.8080: Flags [.], seq 61641:62177, ack 1, win 65535, length 536
3.837544 IP 10.1.1.2.8080 > 10.1.1.1.49153: Flags [.], ack 63249, win 65535, length 0
3.848536 IP 10.1.1.1.49153 > 10.1.1.2.8080: Flags [.], seq 63249:63785, ack 1, win 65535, length 536
3.849460 IP 10.1.1.1.49153 > 10.1.1.2.8080: Flags [.], seq 63785:64321, ack 1, win 65535, length 536
3.849460 IP 10.1.1.2.8080 > 10.1.1.1.49153: Flags [.], ack 64321, win 65535, length 0
3.860452 IP 10.1.1.1.49153 > 10.1.1.2.8080: Flags [.], seq 64321:64857, ack 1, win 65535, length 536
3.861377 IP 10.1.1.1.49153 > 10.1.1.2.8080: Flags [.], seq 64857:65393, ack 1, win 65535, length 536
3.861377 IP 10.1.1.2.8080 > 10.1.1.1.49153: Flags [.], ack 65393, win 65535, length 0
3.872369 IP 10.1.1.1.49153 > 10.1.1.2.8080: Flags [.], seq 65393:65929, ack 1, win 65535, length 536
3.873294 IP 10.1.1.1.49153 > 10.1.1.2.8080: Flags [.], seq 65929:66465, ack 1, win 65535, length 536
3.873294 IP 10.1.1.2.8080 > 10.1.1.1.49153: Flags [.], ack 66465, win 65535, length 0
3.884286 IP 10.1.1.1.49153 > 10.1.1.2.8080: Flags [.], seq 66465:67001, ack 1, win 65535, length 536
3.885211 IP 10.1.1.1.49153 > 10.1.1.2.8080: Flags [.], seq 67001:67537, ack 1, win 65535, length 536
3.885211 IP 10.1.1.2.8080 > 10.1.1.1.49153: Flags [.], ack 67537, win 65535, length 0
3.896203 IP 10.1.1.1.49153 > 10.1.1.2.8080: Flags [.], seq 68073:68609, ack 1, win 65535, length 536
3.896203 IP 10.1.1.2.8080 > 10.1.1.1.49153: Flags [.], ack 67537, win 65535, length 0
3.897128 IP 10.1.1.1.49153 > 10.1.1.2.8080: Flags [.], seq 68609:69145, ack 1, win 65535, length 536
3.897128 IP 10.1.1.2.8080 > 10.1.1.1.49153: Flags [.], ack 67537, win 65535, length 0
4.096203 IP 10.1.1.1.49153 > 10.1.1.2.8080: Flags [.], seq 67537:68073, ack 1, win 65535, length 536
4.096203 IP 10.1.1.2.8080 > 10.1.1.1.49153: Flags [.], ack 69145, win 65535, length 0
4.107195 IP 10.1.1.1.49153 > 10.1.1.2.8080: Flags [.], seq 69145:69681, ack 1, win 65535, length 536
4.108120 IP 10.1.1.1.49153 > 10.1.1.2.8080: Flags [.], seq 69681:70217, ack 1, win 65535, length 536
4.108120 IP 10.1.1.2.8080 > 10.1.1.1.49153: Flags [.], ack 70217, win 65535, length 0
4.119112 IP 10.1.1.1.49153 > 10.1.1.2.8080: Flags [.], seq 70217:70753, ack 1, win 65535, length 536
4.120036 IP 10.1.1.1.49153 > 10.1.1.2.8080: Flags [.], seq 70753:71289, ack 1, win 65535, length 536
4.120036 IP 10.1.1.2.8080 > 10.1.1.1.49153: Flags [.], ack 71289, win 65535, length 0
4.131028 IP 10.1.1.1.49153 > 10.1.1.2.8080: Flags [.], seq 71289:71825, ack 1, win 65535, length 536
4.131953 IP 10.1.1.1.49153 > 10.1.1.2.8080: Flags [.], seq 71825:72361, ack 1, win 65535, length 536
4.131953 IP 10.1.1.2.8080 > 10.1.1.1.49153: Flags [.], ack 72361, win 65535, length 0
4.142945 IP 10.1.1.1.49153 > 10.1.1.2.8080: Flags [.], seq 72361:72897, ack 1, win 65535, length 536
4.143870 IP 10.1.1.1.49153 > 10.1.1.2.8080: Flags [.], seq 72897:73433, ack 1, win 65535, length 536
4.143870 IP 10.1.1.2.8080 > 10.1.1.1.49153: Flags [.], ack 73433, win 65535, length 0
4.154862 IP 10.1.1.1.49153 > 10.1.1.2.8080: Flags [.], seq 73969:74505, ack 1, win 65535, length 536
4.154862 IP 10.1.1.2.8080 > 10.1.1.1.49153: Flags [.], ack 73433, win 65535, length 0
4.155787 IP 10.1.1.1.49153 > 10.1.1.2.8080: Flags [.], seq 74505:75041, ack 1, win 65535, length 536
4.155787 IP 10.1.1.2.8080 > 10.1.1.1.49153: Flags [.], ack 73433, win 65535, length 0
4.354862 IP 10.1.1.1.49153 > 10.1.1.2.8080: Flags [.], seq 73433:73969, ack 1, win 65535, length 536
4.354862 IP 10.1.1.2.8080 > 10.1.1.1.49153: Flags [.], ack 75041, win 65535, length 0
4.365854 IP 10.1.1.1.49153 > 10.1.1.2.8080: Flags [.], seq 75041:75577, ack 1, win 65535, length 536
4.366779 IP 10.1.1.1.49153 > 10.1.1.2.8080: Flags [.], seq 75577:76113, ack 1, win 65535, length 536
4.366779 IP 10.1.1.2.8080 > 10.1.1.1.49153: Flags [.], ack 76113, win 65535, length 0
4.377771 IP 10.1.1.1.49153 > 10.1.1.2.8080: Flags [.], seq 76113:76649, ack 1, win 65535, length 536
4.378696 IP 10.1.1.1.49153 > 10.1.1.2.8080: Flags [.], seq 76649:77185, ack 1, win 65535, length 536
4.378696 IP 10.1.1.2.8080 > 10.1.1.1.49153: Flags [.], ack 77185, win 65535, length 0
4.389688 IP 10.1.1.1.49153 > 10.1.1.2.8080: Flags [.], seq 77185:77721, ack 1, win 65535, length 536
4.390612 IP 10.1.1.1.49153 > 10.1.1.2.8080: Flags [.], seq 77721:78257, ack 1, win 65535, length 536
4.390612 IP 10.1.1.2.8080 > 10.1.1.1.49153: Flags [.], ack 78257, win 65535, length 0
4.401604 IP 10.1.1.1.49153 > 10.1.1.2.8080: Flags [.], seq 78257:78793, ack 1, win 65535, length 536
4.402529 IP 10.1.1.1.49153 > 10.1.1.2.8080: Flags [.], seq 78793:79329, ack 1, win 65535, length 536
4.402529 IP 10.1.1.2.8080 > 10.1.1.1.49153: Flags [.], ack 79329, win 65535, length 0
4.413521 IP 10.1.1.1.49153 > 10.1.1.2.8080: Flags [.], seq 79865:80401, ack 1, win 65535, length 536
4.413521 IP 10.1.1.2.8080 > 10.1.1.1.49153: Flags [.], ack 79329, win 65535, length 0
4.414446 IP 10.1.1.1.49153 > 10.1.1.2.8080: Flags [.], seq 80401:80937, ack 1, win 65535, length 536
4.414446 IP 10.1.1.2.8080 > 10.1.1.1.49153: Flags [.], ack 79329, win 65535, length 0
4.613521 IP 10.1.1.1.49153 > 10.1.1.2.8080: Flags [.], seq 79329:79865, ack 1, win 65535, length 536
4.613521 IP 10.1.1.2.8080 > 10.1.1.1.49153: Flags [.], ack 80937, win 65535, length 0
4.624513 IP 10.1.1.1.49153 > 10.1.1.2.8080: Flags [.], seq 80937:81473, ack 1, win 65535, length 536
4.625438 IP 10.1.1.1.49153 > 10.1.1.2.8080: Flags [.], seq 81473:82009, ack 1, win 65535, length 536
4.625438 IP 10.1.1.2.8080 > 10.1.1.1.49153: Flags [.], ack 82009, win 65535, length 0
4.636430 IP 10.1.1.1.49153 > 10.1.1.2.8080: Flags [.], seq 82009:82545, ack 1, win 65535, length 536
4.637355 IP 10.1.1.1.49153 > 10.1.1.2.8080: Flags [.], seq 82545:83081, ack 1, win 65535, length 536
4.637355 IP 10.1.1.2.8080 > 10.1.1.1.49153: Flags [.], ack 83081, win 65535, length 0
4.648347 IP 10.1.1.1.49153 > 10.1.1.2.8080: Flags [.], seq 83081:83617, ack 1, win 65535, length 536
4.649272 IP 10.1.1.1.49153 > 10.1.1.2.8080: Flags [.], seq 83617:84153, ack 1, win 65535, length 536
4.649272 IP 10.1.1.2.8080 > 10.1.1.1.49153: Flags [.], ack 84153, win 65535, length 0
4.660264 IP 10.1.1.1.49153 > 10.1.1.2.8080: Flags [.], seq 84153:84689, ack 1, win 65535, length 536
4.661188 IP 10.1.1.1.49153 > 10.1.1.2.8080: Flags [.], seq 84689:85225, ack 1, win 65535, length 536
4.661188 IP 10.1.1.2.8080 > 10.1.1.1.49153: Flags [.], ack 85225, win 65535, length 0
4.672180 IP 10.1.1.1.49153 > 10.1.1.2.8080: Flags [.], seq 85761:86297, ack 1, win 65535, length 536
4.672180 IP 10.1.1.2.8080 > 10.1.1.1.49153: Flags [.], ack 85225, win 65535, length 0
4.673105 IP 10.1.1.1.49153 > 10.1.1.2.8080: Flags [.], seq 86297:86833, ack 1, win 65535, length 536
4.673105 IP 10.1.1.2.8080 > 10.1.1.1.49153: Flags [.], ack 85225, win 65535, length 0
4.872180 IP 10.1.1.1.49153 > 10.1.1.2.8080: Flags [.], seq 85225:85761, ack 1, win 65535, length 536
4.872180 IP 10.1.1.2.8080 > 10.1.1.1.49153: Flags [.], ack 86833, win 65535, length 0
4.883172 IP 10.1.1.1.49153 > 10.1.1.2.8080: Flags [.], seq 86833:87369, ack 1, win 65535, length 536
4.884097 IP 10.1.1.1.49153 > 10.1.1.2.8080: Flags [.], seq 87369:87905, ack 1, win 65535, length 536
4.884097 IP 10.1.1.2.8080 > 10.1.1.1.49153: Flags [.], ack 87905, win 65535, length 0
4.895089 IP 10.1.1.1.49153 > 10.1.1.2.8080: Flags [.], seq 87905:88441, ack 1, win 65535, length 536
4.896014 IP 10.1.1.1.49153 > 10.1.1.2.8080: Flags [.], seq 88441:88977, ack 1, win 65535, length 536
4.896014 IP 10.1.1.2.8080 > 10.1.1.1.49153: Flags [.], ack 88977, win 65535, length 0
4.907006 IP 10.1.1.1.49153 > 10.1.1.2.8080: Flags [.], seq 88977:89513, ack 1, win 65535, length 536
4.907931 IP 10.1.1.1.49153 > 10.1.1.2.8080: Flags [.], seq 89513:90049, ack 1, win 65535, length 536
4.907931 IP 10.1.1.2.8080 > 10.1.1.1.49153: Flags [.], ack 90049, win 65535, length 0
4.918923 IP 10.1.1.1.49153 > 10.1.1.2.8080: Flags [.], seq 90049:90585, ack 1, win 65535, length 536
4.919848 IP 10.1.1.1.49153 > 10.1.1.2.8080: Flags [.], seq 90585:91121, ack 1, win 65535, length 536
4.919848 IP 10.1.1.2.8080 > 10.1.1.1.49153: Flags [.], ack 91121, win 65535, length 0
4.930840 IP 10.1.1.1.49153 > 10.1.1.2.8080: Flags [.], seq 91657:92193, ack 1, win 65535, length 536
4.930840 IP 10.1.1.2.8080 > 10.1.1.1.49153: Flags [.], ack 91121, win 65535, length 0
4.931764 IP 10.1.1.1.49153 > 10.1.1.2.8080: Flags [.], seq 92193:92729, ack 1, win 65535, length 536
4.931764 IP 10.1.1.2.8080 > 10.1.1.1.49153: Flags [.], ack 91121, win 65535, length 0
5.130840 IP 10.1.1.1.49153 > 10.1.1.2.8080: Flags [.], seq 91121:91657, ack 1, win 65535, length 536
5.130840 IP 10.1.1.2.8080 > 10.1.1.1.49153: Flags [.], ack 92729, win 65535, length 0
5.141832 IP 10.1.1.1.49153 > 10.1.1.2.8080: Flags [.], seq 92729:93265, ack 1, win 65535, length 536
5.142756 IP 10.1.1.1.49153 > 10.1.1.2.8080: Flags [.], seq 93265:93801, ack 1, win 65535, length 536
5.142756 IP 10.1.1.2.8080 > 10.1.1.1.49153: Flags [.], ack 93801, win 65535, length 0
5.153748 IP 10.1.1.1.49153 > 10.1.1.2.8080: Flags [.], seq 93801:94337, ack 1, win 65535, length 536
5.154673 IP 10.1.1.1.49153 > 10.1.1.2.8080: Flags [.], seq 94337:94873, ack 1, win 65535, length 536
5.154673 IP 10.1.1.2.8080 > 10.1.1.1.49153: Flags [.], ack 94873, win 65535, length 0
5.165665 IP 10.1.1.1.49153 > 10.1.1.2.8080: Flags [.], seq 94873:95409, ack 1, win 65535, length 536
5.166590 IP 10.1.1.1.49153 > 10.1.1.2.8080: Flags [.], seq 95409:95945, ack 1, win 65535, length 536
5.166590 IP 10.1.1.2.8080 > 10.1.1.1.49153: Flags [.], ack 95945, win 65535, length 0
5.177582 IP 10.1.1.1.49153 > 10.1.1.2.8080: Flags [.], seq 95945:96481, ack 1, win 65535, length 536
5.178507 IP 10.1.1.1.49153 > 10.1.1.2.8080: Flags [.], seq 96481:97017, ack 1, win 65535, length 536
5.178507 IP 10.1.1.2.8080 > 10.1.1.1.49153: Flags [.], ack 97017, win 65535, length 0
5.189499 IP 10.1.1.1.49153 > 10.1.1.2.8080: Flags [.], seq 97553:98089, ack 1, win 65535, length 536
5.189499 IP 10.1.1.2.8080 > 10.1.1.1.49153: Flags [.], ack 97017, win 65535, length 0
5.190424 IP 10.1.1.1.49153 > 10.1.1.2.8080: Flags [.], seq 98089:98625, ack 1, win 65535, length 536
5.190424 IP 10.1.1.2.8080 > 10.1.1.1.49153: Flags [.], ack 97017, win 65535, length 0
5.389499 IP 10.1.1.1.49153 > 10.1.1.2.8080: Flags [.], seq 97017:97553, ack 1, win 65535, length 536
5.389499 IP 10.1.1.2.8080 > 10.1.1.1.49153: Flags [.], ack 98625, win 65535, length 0
5.400491 IP 10.1.1.1.49153 > 10.1.1.2.8080: Flags [.], seq 98625:99161, ack 1, win 65535, length 536
5.401416 IP 10.1.1.1.49153 > 10.1.1.2.8080: Flags [.], seq 99161:99697, ack 1, win 65535, length 536
5.401416 IP 10.1.1.2.8080 > 10.1.1.1.49153: Flags [.], ack 99697, win 65535, length 0
5.412408 IP 10.1.1.1.49153 > 10.1.1.2.8080: Flags [.], seq 99697:100233, ack 1, win 65535, length 536
5.413332 IP 10.1.1.1.49153 > 10.1.1.2.8080: Flags [.], seq 100233:100769, ack 1, win 65535, length 536
5.413332 IP 10.1.1.2.8080 > 10.1.1.1.49153: Flags [.], ack 100769, win 65535, length 0
5.424324 IP 10.1.1.1.49153 > 10.1.1.2.8080: Flags [.], seq 100769:101305, ack 1, win 65535, length 536
5.425249 IP 10.1.1.1.49153 > 10.1.1.2.8080: Flags [.], seq 101305:101841, ack 1, win 65535, length 536
5.425249 IP 10.1.1.2.8080 > 10.1.1.1.49153: Flags [.], ack 101841, win 65535, length 0
5.436241 IP 10.1.1.1.49153 > 10.1.1.2.8080: Flags [.], seq 101841:102377, ack 1, win 65535, length 536
5.437166 IP 10.1.1.1.49153 > 10.1.1.2.8080: Flags [.], seq 102377:102913, ack 1, win 65535, length 536
5.437166 IP 10.1.1.2.8080 > 10.1.1.1.49153: Flags [.], ack 102913, win 65535, length 0
5.448158 IP 10.1.1.1.49153 > 10.1.1.2.8080: Flags [.], seq 103449:103985, ack 1, win 65535, length 536
5.448158 IP 10.1.1.2.8080 > 10.1.1.1.49153: Flags [.], ack 102913, win 65535, length 0
5.449083 IP 10.1.1.1.49153 > 10.1.1.2.8080: Flags [.], seq 103985:104521, ack 1, win 65535, length 536
5.449083 IP 10.1.1.2.8080 > 10.1.1.1.49153: Flags [.], ack 102913, win 65535, length 0
5.648158 IP 10.1.1.1.49153 > 10.1.1.2.8080: Flags [.], seq 102913:103449, ack 1, win 65535, length 536
5.648158 IP 10.1.1.2.8080 > 10.1.1.1.49153: Flags [.], ack 104521, win 65535, length 0
5.659150 IP 10.1.1.1.49153 > 10.1.1.2.8080: Flags [.], seq 104521:105057, ack 1, win 65535, length 536
5.660075 IP 10.1.1.1.49153 > 10.1.1.2.8080: Flags [.], seq 105057:105593, ack 1, win 65535, length 536
5.660075 IP 10.1.1.2.8080 > 10.1.1.1.49153: Flags [.], ack 105593, win 65535, length 0
5.671067 IP 10.1.1.1.49153 > 10.1.1.2.8080: Flags [.], seq 105593:106129, ack 1, win 65535, length 536
5.671992 IP 10.1.1.1.49153 > 10.1.1.2.8080: Flags [.], seq 106129:106665, ack 1, win 65535, length 536
5.671992 IP 10.1.1.2.8080 > 10.1.1.1.49153: Flags [.], ack 106665, win 65535, length 0
5.682984 IP 10.1.1.1.49153 > 10.1.1.2.8080: Flags [.], seq 106665:107201, ack 1, win 65535, length 536
5.683908 IP 10.1.1.1.49153 > 10.1.1.2.8080: Flags [.], seq 107201:107737, ack 1, win 65535, length 536
5.683908 IP 10.1.1.2.8080 > 10.1.1.1.49153: Flags [.], ack 107737, win 65535, length 0
5.694900 IP 10.1.1.1.49153 > 10.1.1.2.8080: Flags [.], seq 107737:108273, ack 1, win 65535, length 536
5.695825 IP 10.1.1.1.49153 > 10.1.1.2.8080: Flags [.], seq 108273:108809, ack 1, win 65535, length 536
5.695825 IP 10.1.1.2.8080 > 10.1.1.1.49153: Flags [.], ack 108809, win 65535, length 0
5.706817 IP 10.1.1.1.49153 > 10.1.1.2.8080: Flags [.], seq 109345:109881, ack 1, win 65535, length 536
5.706817 IP 10.1.1.2.8080 > 10.1.1.1.49153: Flags [.], ack 108809, win 65535, length 0
5.707742 IP 10.1.1.1.49153 > 10.1.1.2.8080: Flags [.], seq 109881:110417, ack 1, win 65535, length 536
5.707742 IP 10.1.1.2.8080 > 10.1.1.1.49153: Flags [.], ack 108809, win 65535, length 0
5.906817 IP 10.1.1.1.49153 > 10.1.1.2.8080: Flags [.], seq 108809:109345, ack 1, win 65535, length 536
5.906817 IP 10.1.1.2.8080 > 10.1.1.1.49153: Flags [.], ack 110417, win 65535, length 0
5.917809 IP 10.1.1.1.49153 > 10.1.1.2.8080: Flags [.], seq 110417:110953, ack 1, win 65535, length 536
5.918734 IP 10.1.1.1.49153 > 10.1.1.2.8080: Flags [.], seq 110953:111489, ack 1, win 65535, length 536
5.918734 IP 10.1.1.2.8080 > 10.1.1.1.49153: Flags [.], ack 111489, win 65535, length 0
5.929726 IP 10.1.1.1.49153 > 10.1.1.2.8080: Flags [.], seq 111489:112025, ack 1, win 65535, length 536
5.930651 IP 10.1.1.1.49153 > 10.1.1.2.8080: Flags [.], seq 112025:112561, ack 1, win 65535, length 536
5.930651 IP 10.1.1.2.8080 > 10.1.1.1.49153: Flags [.], ack 112561, win 65535, length 0
5.941643 IP 10.1.1.1.49153 > 10.1.1.2.8080: Flags [.], seq 112561:113097, ack 1, win 65535, length 536
5.942568 IP 10.1.1.1.49153 > 10.1.1.2.8080: Flags [.], seq 113097:113633, ack 1, win 65535, length 536
5.942568 IP 10.1.1.2.8080 > 10.1.1.1.49153: Flags [.], ack 113633, win 65535, length 0
5.953560 IP 10.1.1.1.49153 > 10.1.1.2.8080: Flags [.], seq 113633:114169, ack 1, win 65535, length 536
5.954484 IP 10.1.1.1.49153 > 10.1.1.2.8080: Flags [.], seq 114169:114705, ack 1, win 65535, length 536
5.954484 IP 10.1.1.2.8080 > 10.1.1.1.49153: Flags [.], ack 114705, win 65535, length 0
5.965476 IP 10.1.1.1.49153 > 10.1.1.2.8080: Flags [.], seq 115241:115777, ack 1, win 65535, length 536
5.965476 IP 10.1.1.2.8080 > 10.1.1.1.49153: Flags [.], ack 114705, win 65535, length 0
5.966401 IP 10.1.1.1.49153 > 10.1.1.2.8080: Flags [.], seq 115777:116313, ack 1, win 65535, length 536
5.966401 IP 10.1.1.2.8080 > 10.1.1.1.49153: Flags [.], ack 114705, win 65535, length 0
6.165476 IP 10.1.1.1.49153 > 10.1.1.2.8080: Flags [.], seq 114705:115241, ack 1, win 65535, length 536
6.165476 IP 10.1.1.2.8080 > 10.1.1.1.49153: Flags [.], ack 116313, win 65535, length 0
6.176468 IP 10.1.1.1.49153 > 10.1.1.2.8080: Flags [.], seq 116313:116849, ack 1, win 65535, length 536
6.177393 IP 10.1.1.1.49153 > 10.1.1.2.8080: Flags [.], seq 116849:117385, ack 1, win 65535, length 536
6.177393 IP 10.1.1.2.8080 > 10.1.1.1.49153: Flags [.], ack 117385, win 65535, length 0
6.188385 IP 10.1.1.1.49153 > 10.1.1.2.8080: Flags [.], seq 117385:117921, ack 1, win 65535, length 536
6.189310 IP 10.1.1.1.49153 > 10.1.1.2.8080: Flags [.], seq 117921:118457, ack 1, win 65535, length 536
6.189310 IP 10.1.1.2.8080 > 10.1.1.1.49153: Flags [.], ack 118457, win 65535, length 0
6.200302 IP 10.1.1.1.49153 > 10.1.1.2.8080: Flags [.], seq 118457:118993, ack 1, win 65535, length 536
6.201227 IP 10.1.1.1.49153 > 10.1.1.2.8080: Flags [.], seq 118993:119529, ack 1, win 65535, length 536
6.201227 IP 10.1.1.2.8080 > 10.1.1.1.49153: Flags [.], ack 119529, win 65535, length 0
6.212219 IP 10.1.1.1.49153 > 10.1.1.2.8080: Flags [.], seq 119529:120065, ack 1, win 65535, length 536
6.213144 IP 10.1.1.1.49153 > 10.1.1.2.8080: Flags [.], seq 120065:120601, ack 1, win 65535, length 536
6.213144 IP 10.1.1.2.8080 > 10.1.1.1.49153: Flags [.], ack 120601, win 65535, length 0
6.224136 IP 10.1.1.1.49153 > 10.1.1.2.8080: Flags [.], seq 121137:121673, ack 1, win 65535, length 536
6.224136 IP 10.1.1.2.8080 > 10.1.1.1.49153: Flags [.], ack 120601, win 65535, length 0
6.225060 IP 10.1.1.1.49153 > 10.1.1.2.8080: Flags [.], seq 121673:122209, ack 1, win 65535, length 536
6.225060 IP 10.1.1.2.8080 > 10.1.1.1.49153: Flags [.], ack 120601, win 65535, length 0
6.424136 IP 10.1.1.1.49153 > 10.1.1.2.8080: Flags [.], seq 120601:121137, ack 1, win 65535, length 536
6.424136 IP 10.1.1.2.8080 > 10.1.1.1.49153: Flags [.], ack 122209, win 65535, length 0
6.435128 IP 10.1.1.1.49153 > 10.1.1.2.8080: Flags [.], seq 122209:122745, ack 1, win 65535, length 536
6.436052 IP 10.1.1.1.49153 > 10.1.1.2.8080: Flags [.], seq 122745:123281, ack 1, win 65535, length 536
6.436052 IP 10.1.1.2.8080 > 10.1.1.1.49153: Flags [.], ack 123281, win 65535, length 0
6.447044 IP 10.1.1.1.49153 > 10.1.1.2.8080: Flags [.], seq 123281:123817, ack 1, win 65535, length 536
6.447969 IP 10.1.1.1.49153 > 10.1.1.2.8080: Flags [.], seq 123817:124353, ack 1, win 65535, length 536
6.447969 IP 10.1.1.2.8080 > 10.1.1.1.49153: Flags [.], ack 124353, win 65535, length 0
6.458961 IP 10.1.1.1.49153 > 10.1.1.2.8080: Flags [.], seq 124353:124889, ack 1, win 65535, length 536
6.459886 IP 10.1.1.1.49153 > 10.1.1.2.8080: Flags [.], seq 124889:125425, ack 1, win 65535, length 536
6.459886 IP 10.1.1.2.8080 > 10.1.1.1.49153: Flags [.], ack 125425, win 65535, length 0
6.470878 IP 10.1.1.1.49153 > 10.1.1.2.8080: Flags [.], seq 125425:125961, ack 1, win 65535, length 536
6.471803 IP 10.1.1.1.49153 > 10.1.1.2.8080: Flags [.], seq 125961:126497, ack 1, win 65535, length 536
6.471803 IP 10.1.1.2.8080 > 10.1.1.1.49153: Flags [.], ack 126497, win 65535, length 0
6.482795 IP 10.1.1.1.49153 > 10.1.1.2.8080: Flags [.], seq 127033:127569, ack 1, win 65535, length 536
6.482795 IP 10.1.1.2.8080 > 10.1.1.1.49153: Flags [.], ack 126497, win 65535, length 0
6.483720 IP 10.1.1.1.49153 > 10.1.1.2.8080: Flags [.], seq 127569:128105, ack 1, win 65535, length 536
6.483720 IP 10.1.1.2.8080 > 10.1.1.1.49153: Flags [.], ack 126497, win 65535, length 0
6.682795 IP 10.1.1.1.49153 > 10.1.1.2.8080: Flags [.], seq 126497:127033, ack 1, win 65535, length 536
6.682795 IP 10.1.1.2.8080 > 10.1.1.1.49153: Flags [.], ack 128105, win 65535, length 0
6.693787 IP 10.1.1.1.49153 > 10.1.1.2.8080: Flags [.], seq 128105:128641, ack 1, win 65535, length 536
6.694712 IP 10.1.1.1.49153 > 10.1.1.2.8080: Flags [.], seq 128641:129177, ack 1, win 65535, length 536
6.694712 IP 10.1.1.2.8080 > 10.1.1.1.49153: Flags [.], ack 129177, win 65535, length 0
6.705704 IP 10.1.1.1.49153 > 10.1.1.2.8080: Flags [.], seq 129177:129713, ack 1, win 65535, length 536
6.706628 IP 10.1.1.1.49153 > 10.1.1.2.8080: Flags [.], seq 129713:130249, ack 1, win 65535, length 536
6.706628 IP 10.1.1.2.8080 > 10.1.1.1.49153: Flags [.], ack 130249, win 65535, length 0
6.717620 IP 10.1.1.1.49153 > 10.1.1.2.8080: Flags [.], seq 130249:130785, ack 1, win 65535, length 536
6.718545 IP 10.1.1.1.49153 > 10.1.1.2.8080: Flags [.], seq 130785:131321, ack 1, win 65535, length 536
6.718545 IP 10.1.1.2.8080 > 10.1.1.1.49153: Flags [.], ack 131321, win 65535, length 0
6.729537 IP 10.1.1.1.49153 > 10.1.1.2.8080: Flags [.], seq 131321:131857, ack 1, win 65535, length 536
6.730462 IP 10.1.1.1.49153 > 10.1.1.2.8080: Flags [.], seq 131857:132393, ack 1, win 65535, length 536
6.730462 IP 10.1.1.2.8080 > 10.1.1.1.49153: Flags [.], ack 132393, win 65535, length 0
6.741454 IP 10.1.1.1.49153 > 10.1.1.2.8080: Flags [.], seq 132929:133465, ack 1, win 65535, length 536
6.741454 IP 10.1.1.2.8080 > 10.1.1.1.49153: Flags [.], ack 132393, win 65535, length 0
6.742379 IP 10.1.1.1.49153 > 10.1.1.2.8080: Flags [.], seq 133465:134001, ack 1, win 65535, length 536
6.742379 IP 10.1.1.2.8080 > 10.1.1.1.49153: Flags [.], ack 132393, win 65535, length 0
6.941454 IP 10.1.1.1.49153 > 10.1.1.2.8080: Flags [.], seq 132393:132929, ack 1, win 65535, length 536
6.941454 IP 10.1.1.2.8080 > 10.1.1.1.49153: Flags [.], ack 134001, win 65535, length 0
6.952446 IP 10.1.1.1.49153 > 10.1.1.2.8080: Flags [.], seq 134001:134537, ack 1, win 65535, length 536
6.953371 IP 10.1.1.1.49153 > 10.1.1.2.8080: Flags [.], seq 134537:135073, ack 1, win 65535, length 536
6.953371 IP 10.1.1.2.8080 > 10.1.1.1.49153: Flags [.], ack 135073, win 65535, length 0
6.964363 IP 10.1.1.1.49153 > 10.1.1.2.8080: Flags [.], seq 135073:135609, ack 1, win 65535, length 536
6.965288 IP 10.1.1.1.49153 > 10.1.1.2.8080: Flags [.], seq 135609:136145, ack 1, win 65535, length 536
6.965288 IP 10.1.1.2.8080 > 10.1.1.1.49153: Flags [.], ack 136145, win 65535, length 0
6.976280 IP 10.1.1.1.49153 > 10.1.1.2.8080: Flags [.], seq 136145:136681, ack 1, win 65535, length 536
6.977204 IP 10.1.1.1.49153 > 10.1.1.2.8080: Flags [.], seq 136681:137217, ack 1, win 65535, length 536
6.977204 IP 10.1.1.2.8080 > 10.1.1.1.49153: Flags [.], ack 137217, win 65535, length 0
6.988196 IP 10.1.1.1.49153 > 10.1.1.2.8080: Flags [.], seq 137217:137753, ack 1, win 65535, length 536
6.989121 IP 10.1.1.1.49153 > 10.1.1.2.8080: Flags [.], seq 137753:138289, ack 1, win 65535, length 536
6.989121 IP 10.1.1.2.8080 > 10.1.1.1.49153: Flags [.], ack 138289, win 65535, length 0
7.000113 IP 10.1.1.1.49153 > 10.1.1.2.8080: Flags [.], seq 138825:139361, ack 1, win 65535, length 536
7.000113 IP 10.1.1.2.8080 > 10.1.1.1.49153: Flags [.], ack 138289, win 65535, length 0
7.001038 IP 10.1.1.1.49153 > 10.1.1.2.8080: Flags [.], seq 139361:139897, ack 1, win 65535, length 536
7.001038 IP 10.1.1.2.8080 > 10.1.1.1.49153: Flags [.], ack 138289, win 65535, length 0
7.200113 IP 10.1.1.1.49153 > 10.1.1.2.8080: Flags [.], seq 138289:138825, ack 1, win 65535, length 536
7.200113 IP 10.1.1.2.8080 > 10.1.1.1.49153: Flags [.], ack 139897, win 65535, length 0
7.211105 IP 10.1.1.1.49153 > 10.1.1.2.8080: Flags [.], seq 139897:140433, ack 1, win 65535, length 536
7.212030 IP 10.1.1.1.49153 > 10.1.1.2.8080: Flags [.], seq 140433:140969, ack 1, win 65535, length 536
7.212030 IP 10.1.1.2.8080 > 10.1.1.1.49153: Flags [.], ack 140969, win 65535, length 0
7.223022 IP 10.1.1.1.49153 > 10.1.1.2.8080: Flags [.], seq 140969:141505, ack 1, win 65535, length 536
7.223947 IP 10.1.1.1.49153 > 10.1.1.2.8080: Flags [.], seq 141505:142041, ack 1, win 65535, length 536
7.223947 IP 10.1.1.2.8080 > 10.1.1.1.49153: Flags [.], ack 142041, win 65535, length 0
7.234939 IP 10.1.1.1.49153 > 10.1.1.2.8080: Flags [.], seq 142041:142577, ack 1, win 65535, length 536
7.235864 IP 10.1.1.1.49153 > 10.1.1.2.8080: Flags [.], seq 142577:143113, ack 1, win 65535, length 536
7.235864 IP 10.1.1.2.8080 > 10.1.1.1.49153: Flags [.], ack 143113, win 65535, length 0
7.246856 IP 10.1.1.1.49153 > 10.1.1.2.8080: Flags [.], seq 143113:143649, ack 1, win 65535, length 536
7.247780 IP 10.1.1.1.49153 > 10.1.1.2.8080: Flags [.], seq 143649:144185, ack 1, win 65535, length 536
7.247780 IP 10.1.1.2.8080 > 10.1.1.1.49153: Flags [.], ack 144185, win 65535, length 0
7.258772 IP 10.1.1.1.49153 > 10.1.1.2.8080: Flags [.], seq 144721:145257, ack 1, win 65535, length 536
7.258772 IP 10.1.1.2.8080 > 10.1.1.1.49153: Flags [.], ack 144185, win 65535, length 0
7.259697 IP 10.1.1.1.49153 > 10.1.1.2.8080: Flags [.], seq 145257:145793, ack 1, win 65535, length 536
7.259697 IP 10.1.1.2.8080 > 10.1.1.1.49153: Flags [.], ack 144185, win 65535, length 0
7.458772 IP 10.1.1.1.49153 > 10.1.1.2.8080: Flags [.], seq 144185:144721, ack 1, win 65535, length 536
7.458772 IP 10.1.1.2.8080 > 10.1.1.1.49153: Flags [.], ack 145793, win 65535, length 0
7.469764 IP 10.1.1.1.49153 > 10.1.1.2.8080: Flags [.], seq 145793:146329, ack 1, win 65535, length 536
7.470689 IP 10.1.1.1.49153 > 10.1.1.2.8080: Flags [.], seq 146329:146865, ack 1, win 65535, length 536
7.470689 IP 10.1.1.2.8080 > 10.1.1.1.49153: Flags [.], ack 146865, win 65535, length 0
7.481681 IP 10.1.1.1.49153 > 10.1.1.2.8080: Flags [.], seq 146865:147401, ack 1, win 65535, length 536
7.482606 IP 10.1.1.1.49153 > 10.1.1.2.8080: Flags [.], seq 147401:147937, ack 1, win 65535, length 536
7.482606 IP 10.1.1.2.8080 > 10.1.1.1.49153: Flags [.], ack 147937, win 65535, length 0
7.493598 IP 10.1.1.1.49153 > 10.1.1.2.8080: Flags [.], seq 147937:148473, ack 1, win 65535, length 536
7.494523 IP 10.1.1.1.49153 > 10.1.1.2.8080: Flags [.], seq 148473:149009, ack 1, win 65535, length 536
7.494523 IP 10.1.1.2.8080 > 10.1.1.1.49153: Flags [.], ack 149009, win 65535, length 0
7.505515 IP 10.1.1.1.49153 > 10.1.1.2.8080: Flags [.], seq 149009:149545, ack 1, win 65535, length 536
7.506440 IP 10.1.1.1.49153 > 10.1.1.2.8080: Flags [.], seq 149545:150081, ack 1, win 65535, length 536
7.506440 IP 10.1.1.2.8080 > 10.1.1.1.49153: Flags [.], ack 150081, win 65535, length 0
7.517432 IP 10.1.1.1.49153 > 10.1.1.2.8080: Flags [.], seq 150617:151153, ack 1, win 65535, length 536
7.517432 IP 10.1.1.2.8080 > 10.1.1.1.49153: Flags [.], ack 150081, win 65535, length 0
7.518356 IP 10.1.1.1.49153 > 10.1.1.2.8080: Flags [.], seq 151153:151689, ack 1, win 65535, length 536
7.518356 IP 10.1.1.2.8080 > 10.1.1.1.49153: Flags [.], ack 150081, win 65535, length 0
7.717432 IP 10.1.1.1.49153 > 10.1.1.2.8080: Flags [.], seq 150081:150617, ack 1, win 65535, length 536
7.717432 IP 10.1.1.2.8080 > 10.1.1.1.49153: Flags [.], ack 151689, win 65535, length 0
7.728424 IP 10.1.1.1.49153 > 10.1.1.2.8080: Flags [.], seq 151689:152225, ack 1, win 65535, length 536
7.729348 IP 10.1.1.1.49153 > 10.1.1.2.8080: Flags [.], seq 152225:152761, ack 1, win 65535, length 536
7.729348 IP 10.1.1.2.8080 > 10.1.1.1.49153: Flags [.], ack 152761, win 65535, length 0
7.740340 IP 10.1.1.1.49153 > 10.1.1.2.8080: Flags [.], seq 152761:153297, ack 1, win 65535, length 536
7.741265 IP 10.1.1.1.49153 > 10.1.1.2.8080: Flags [.], seq 153297:153833, ack 1, win 65535, length 536
7.741265 IP 10.1.1.2.8080 > 10.1.1.1.49153: Flags [.], ack 153833, win 65535, length 0
7.752257 IP 10.1.1.1.49153 > 10.1.1.2.8080: Flags [.], seq 153833:154369, ack 1, win 65535, length 536
7.753182 IP 10.1.1.1.49153 > 10.1.1.2.8080: Flags [.], seq 154369:154905, ack 1, win 65535, length 536
7.753182 IP 10.1.1.2.8080 > 10.1.1.1.49153: Flags [.], ack 154905, win 65535, length 0
7.764174 IP 10.1.1.1.49153 > 10.1.1.2.8080: Flags [.], seq 154905:155441, ack 1, win 65535, length 536
7.765099 IP 10.1.1.1.49153 > 10.1.1.2.8080: Flags [.], seq 155441:155977, ack 1, win 65535, length 536
7.765099 IP 10.1.1.2.8080 > 10.1.1.1.49153: Flags [.], ack 155977, win 65535, length 0
7.776091 IP 10.1.1.1.49153 > 10.1.1.2.8080: Flags [.], seq 156513:157049, ack 1, win 65535, length 536
7.776091 IP 10.1.1.2.8080 > 10.1.1.1.49153: Flags [.], ack 155977, win 65535, length 0
7.777016 IP 10.1.1.1.49153 > 10.1.1.2.8080: Flags [.], seq 157049:157585, ack 1, win 65535, length 536
7.777016 IP 10.1.1.2.8080 > 10.1.1.1.49153: Flags [.], ack 155977, win 65535, length 0
7.976091 IP 10.1.1.1.49153 > 10.1.1.2.8080: Flags [.], seq 155977:156513, ack 1, win 65535, length 536
7.976091 IP 10.1.1.2.8080 > 10.1.1.1.49153: Flags [.], ack 157585, win 65535, length 0
7.987083 IP 10.1.1.1.49153 > 10.1.1.2.8080: Flags [.], seq 157585:158121, ack 1, win 65535, length 536
7.988008 IP 10.1.1.1.49153 > 10.1.1.2.8080: Flags [.], seq 158121:158657, ack 1, win 65535, length 536
7.988008 IP 10.1.1.2.8080 > 10.1.1.1.49153: Flags [.], ack 158657, win 65535, length 0
7.999000 IP 10.1.1.1.49153 > 10.1.1.2.8080: Flags [.], seq 158657:159193, ack 1, win 65535, length 536
7.999924 IP 10.1.1.1.49153 > 10.1.1.2.8080: Flags [.], seq 159193:159729, ack 1, win 65535, length 536
7.999924 IP 10.1.1.2.8080 > 10.1.1.1.49153: Flags [.], ack 159729, win 65535, length 0
8.010916 IP 10.1.1.1.49153 > 10.1.1.2.8080: Flags [.], seq 159729:160265, ack 1, win 65535, length 536
8.011841 IP 10.1.1.1.49153 > 10.1.1.2.8080: Flags [.], seq 160265:160801, ack 1, win 65535, length 536
8.011841 IP 10.1.1.2.8080 > 10.1.1.1.49153: Flags [.], ack 160801, win 65535, length 0
8.022833 IP 10.1.1.1.49153 > 10.1.1.2.8080: Flags [.], seq 160801:161337, ack 1, win 65535, length 536
8.023758 IP 10.1.1.1.49153 > 10.1.1.2.8080: Flags [.], seq 161337:161873, ack 1, win 65535, length 536
8.023758 IP 10.1.1.2.8080 > 10.1.1.1.49153: Flags [.], ack 161873, win 65535, length 0
8.034750 IP 10.1.1.1.49153 > 10.1.1.2.8080: Flags [.], seq 162409:162945, ack 1, win 65535, length 536
8.034750 IP 10.1.1.2.8080 > 10.1.1.1.49153: Flags [.], ack 161873, win 65535, length 0
8.035675 IP 10.1.1.1.49153 > 10.1.1.2.8080: Flags [.], seq 162945:163481, ack 1, win 65535, length 536
8.035675 IP 10.1.1.2.8080 > 10.1.1.1.49153: Flags [.], ack 161873, win 65535, length 0
8.234750 IP 10.1.1.1.49153 > 10.1.1.2.8080: Flags [.], seq 161873:162409, ack 1, win 65535, length 536
8.234750 IP 10.1.1.2.8080 > 10.1.1.1.49153: Flags [.], ack 163481, win 65535, length 0
8.245742 IP 10.1.1.1.49153 > 10.1.1.2.8080: Flags [.], seq 163481:164017, ack 1, win 65535, length 536
8.246667 IP 10.1.1.1.49153 > 10.1.1.2.8080: Flags [.], seq 164017:164553, ack 1, win 65535, length 536
8.246667 IP 10.1.1.2.8080 > 10.1.1.1.49153: Flags [.], ack 164553, win 65535, length 0
8.257659 IP 10.1.1.1.49153 > 10.1.1.2.8080: Flags [.], seq 164553:165089, ack 1, win 65535, length 536
8.258584 IP 10.1.1.1.49153 > 10.1.1.2.8080: Flags [.], seq 165089:165625, ack 1, win 65535, length 536
8.258584 IP 10.1.1.2.8080 > 10.1.1.1.49153: Flags [.], ack 165625, win 65535, length 0
8.269576 IP 10.1.1.1.49153 > 10.1.1.2.8080: Flags [.], seq 165625:166161, ack 1, win 65535, length 536
8.270500 IP 10.1.1.1.49153 > 10.1.1.2.8080: Flags [.], seq 166161:166697, ack 1, win 65535, length 536
8.270500 IP 10.1.1.2.8080 > 10.1.1.1.49153: Flags [.], ack 166697, win 65535, length 0
8.281492 IP 10.1.1.1.49153 > 10.1.1.2.8080: Flags [.], seq 166697:167233, ack 1, win 65535, length 536
8.282417 IP 10.1.1.1.49153 > 10.1.1.2.8080: Flags [.], seq 167233:167769, ack 1, win 65535, length 536
8.282417 IP 10.1.1.2.8080 > 10.1.1.1.49153: Flags [.], ack 167769, win 65535, length 0
8.293409 IP 10.1.1.1.49153 > 10.1.1.2.8080: Flags [.], seq 168305:168841, ack 1, win 65535, length 536
8.293409 IP 10.1.1.2.8080 > 10.1.1.1.49153: Flags [.], ack 167769, win 65535, length 0
8.294334 IP 10.1.1.1.49153 > 10.1.1.2.8080: Flags [.], seq 168841:169377, ack 1, win 65535, length 536
8.294334 IP 10.1.1.2.8080 > 10.1.1.1.49153: Flags [.], ack 167769, win 65535, length 0
8.493409 IP 10.1.1.1.49153 > 10.1.1.2.8080: Flags [.], seq 167769:168305, ack 1, win 65535, length 536
8.493409 IP 10.1.1.2.8080 > 10.1.1.1.49153: Flags [.], ack 169377, win 65535, length 0
8.504401 IP 10.1.1.1.49153 > 10.1.1.2.8080: Flags [.], seq 169377:169913, ack 1, win 65535, length 536
8.505326 IP 10.1.1.1.49153 > 10.1.1.2.8080: Flags [.], seq 169913:170449, ack 1, win 65535, length 536
8.505326 IP 10.1.1.2.8080 > 10.1.1.1.49153: Flags [.], ack 170449, win 65535, length 0
8.516318 IP 10.1.1.1.49153 > 10.1.1.2.8080: Flags [.], seq 170449:170985, ack 1, win 65535, length 536
8.517243 IP 10.1.1.1.49153 > 10.1.1.2.8080: Flags [.], seq 170985:171521, ack 1, win 65535, length 536
8.517243 IP 10.1.1.2.8080 > 10.1.1.1.49153: Flags [.], ack 171521, win 65535, length 0
8.528235 IP 10.1.1.1.49153 > 10.1.1.2.8080: Flags [.], seq 171521:172057, ack 1, win 65535, length 536
8.529160 IP 10.1.1.1.49153 > 10.1.1.2.8080: Flags [.], seq 172057:172593, ack 1, win 65535, length 536
8.529160 IP 10.1.1.2.8080 > 10.1.1.1.49153: Flags [.], ack 172593, win 65535, length 0
8.540152 IP 10.1.1.1.49153 > 10.1.1.2.8080: Flags [.], seq 172593:173129, ack 1, win 65535, length 536
8.541076 IP 10.1.1.1.49153 > 10.1.1.2.8080: Flags [.], seq 173129:173665, ack 1, win 65535, length 536
8.541076 IP 10.1.1.2.8080 > 10.1.1.1.49153: Flags [.], ack 173665, win 65535, length 0
8.552068 IP 10.1.1.1.49153 > 10.1.1.2.8080: Flags [.], seq 174201:174737, ack 1, win 65535, length 536
8.552068 IP 10.1.1.2.8080 > 10.1.1.1.49153: Flags [.], ack 173665, win 65535, length 0
8.552993 IP 10.1.1.1.49153 > 10.1.1.2.8080: Flags [.], seq 174737:175273, ack 1, win 65535, length 536
8.552993 IP 10.1.1.2.8080 > 10.1.1.1.49153: Flags [.], ack 173665, win 65535, length 0
8.752068 IP 10.1.1.1.49153 > 10.1.1.2.8080: Flags [.], seq 173665:174201, ack 1, win 65535, length 536
8.752068 IP 10.1.1.2.8080 > 10.1.1.1.49153: Flags [.], ack 175273, win 65535, length 0
8.763060 IP 10.1.1.1.49153 > 10.1.1.2.8080: Flags [.], seq 175273:175809, ack 1, win 65535, length 536
8.763985 IP 10.1.1.1.49153 > 10.1.1.2.8080: Flags [.], seq 175809:176345, ack 1, win 65535, length 536
8.763985 IP 10.1.1.2.8080 > 10.1.1.1.49153: Flags [.], ack 176345, win 65535, length 0
8.774977 IP 10.1.1.1.49153 > 10.1.1.2.8080: Flags [.], seq 176345:176881, ack 1, win 65535, length 536
8.775902 IP 10.1.1.1.49153 > 10.1.1.2.8080: Flags [.], seq 176881:177417, ack 1, win 65535, length 536
8.775902 IP 10.1.1.2.8080 > 10.1.1.1.49153: Flags [.], ack 177417, win 65535, length 0
8.786894 IP 10.1.1.1.49153 > 10.1.1.2.8080: Flags [.], seq 177417:177953, ack 1, win 65535, length 536
8.787819 IP 10.1.1.1.49153 > 10.1.1.2.8080: Flags [.], seq 177953:178489, ack 1, win 65535, length 536
8.787819 IP 10.1.1.2.8080 > 10.1.1.1.49153: Flags [.], ack 178489, win 65535, length 0
8.798811 IP 10.1.1.1.49153 > 10.1.1.2.8080: Flags [.], seq 178489:179025, ack 1, win 65535, length 536
8.799736 IP 10.1.1.1.49153 > 10.1.1.2.8080: Flags [.], seq 179025:179561, ack 1, win 65535, length 536
8.799736 IP 10.1.1.2.8080 > 10.1.1.1.49153: Flags [.], ack 179561, win 65535, length 0
8.810728 IP 10.1.1.1.49153 > 10.1.1.2.8080: Flags [.], seq 180097:180633, ack 1, win 65535, length 536
8.810728 IP 10.1.1.2.8080 > 10.1.1.1.49153: Flags [.], ack 179561, win 65535, length 0
8.811652 IP 10.1.1.1.49153 > 10.1.1.2.8080: Flags [.], seq 180633:181169, ack 1, win 65535, length 536
8.811652 IP 10.1.1.2.8080 > 10.1.1.1.49153: Flags [.], ack 179561, win 65535, length 0
9.010728 IP 10.1.1.1.49153 > 10.1.1.2.8080: Flags [.], seq 179561:180097, ack 1, win 65535, length 536
9.010728 IP 10.1.1.2.8080 > 10.1.1.1.49153: Flags [.], ack 181169, win 65535, length 0
9.021720 IP 10.1.1.1.49153 > 10.1.1.2.8080: Flags [.], seq 181169:181705, ack 1, win 65535, length 536
9.022644 IP 10.1.1.1.49153 > 10.1.1.2.8080: Flags [.], seq 181705:182241, ack 1, win 65535, length 536
9.022644 IP 10.1.1.2.8080 > 10.1.1.1.49153: Flags [.], ack 182241, win 65535, length 0
9.033636 IP 10.1.1.1.49153 > 10.1.1.2.8080: Flags [.], seq 182241:182777, ack 1, win 65535, length 536
9.034561 IP 10.1.1.1.49153 > 10.1.1.2.8080: Flags [.], seq 182777:183313, ack 1, win 65535, length 536
9.034561 IP 10.1.1.2.8080 > 10.1.1.1.49153: Flags [.], ack 183313, win 65535, length 0
9.045553 IP 10.1.1.1.49153 > 10.1.1.2.8080: Flags [.], seq 183313:183849, ack 1, win 65535, length 536
9.046478 IP 10.1.1.1.49153 > 10.1.1.2.8080: Flags [.], seq 183849:184385, ack 1, win 65535, length 536
9.046478 IP 10.1.1.2.8080 > 10.1.1.1.49153: Flags [.], ack 184385, win 65535, length 0
9.057470 IP 10.1.1.1.49153 > 10.1.1.2.8080: Flags [.], seq 184385:184921, ack 1, win 65535, length 536
9.058395 IP 10.1.1.1.49153 > 10.1.1.2.8080: Flags [.], seq 184921:185457, ack 1, win 65535, length 536
9.058395 IP 10.1.1.2.8080 > 10.1.1.1.49153: Flags [.], ack 185457, win 65535, length 0
9.069387 IP 10.1.1.1.49153 > 10.1.1.2.8080: Flags [.], seq 185993:186529, ack 1, win 65535, length 536
9.069387 IP 10.1.1.2.8080 > 10.1.1.1.49153: Flags [.], ack 185457, win 65535, length 0
9.070312 IP 10.1.1.1.49153 > 10.1.1.2.8080: Flags [.], seq 186529:187065, ack 1, win 65535, length 536
9.070312 IP 10.1.1.2.8080 > 10.1.1.1.49153: Flags [.], ack 185457, win 65535, length 0
9.269387 IP 10.1.1.1.49153 > 10.1.1.2.8080: Flags [.], seq 185457:185993, ack 1, win 65535, length 536
9.269387 IP 10.1.1.2.8080 > 10.1.1.1.49153: Flags [.], ack 187065, win 65535, length 0
9.280379 IP 10.1.1.1.49153 > 10.1.1.2.8080: Flags [.], seq 187065:187601, ack 1, win 65535, length 536
9.281304 IP 10.1.1.1.49153 > 10.1.1.2.8080: Flags [.], seq 187601:188137, ack 1, win 65535, length 536
9.281304 IP 10.1.1.2.8080 > 10.1.1.1.49153: Flags [.], ack 188137, win 65535, length 0
9.292296 IP 10.1.1.1.49153 > 10.1.1.2.8080: Flags [.], seq 188137:188673, ack 1, win 65535, length 536
9.293220 IP 10.1.1.1.49153 > 10.1.1.2.8080: Flags [.], seq 188673:189209, ack 1, win 65535, length 536
9.293220 IP 10.1.1.2.8080 > 10.1.1.1.49153: Flags [.], ack 189209, win 65535, length 0
9.304212 IP 10.1.1.1.49153 > 10.1.1.2.8080: Flags [.], seq 189209:189745, ack 1, win 65535, length 536
9.305137 IP 10.1.1.1.49153 > 10.1.1.2.8080: Flags [.], seq 189745:190281, ack 1, win 65535, length 536
9.305137 IP 10.1.1.2.8080 > 10.1.1.1.49153: Flags [.], ack 190281, win 65535, length 0
9.316129 IP 10.1.1.1.49153 > 10.1.1.2.8080: Flags [.], seq 190281:190817, ack 1, win 65535, length 536
9.317054 IP 10.1.1.1.49153 > 10.1.1.2.8080: Flags [.], seq 190817:191353, ack 1, win 65535, length 536
9.317054 IP 10.1.1.2.8080 > 10.1.1.1.49153: Flags [.], ack 191353, win 65535, length 0
9.328046 IP 10.1.1.1.49153 > 10.1.1.2.8080: Flags [.], seq 191889:192425, ack 1, win 65535, length 536
9.328046 IP 10.1.1.2.8080 > 10.1.1.1.49153: Flags [.], ack 191353, win 65535, length 0
9.328971 IP 10.1.1.1.49153 > 10.1.1.2.8080: Flags [.], seq 192425:192961, ack 1, win 65535, length 536
9.328971 IP 10.1.1.2.8080 > 10.1.1.1.49153: Flags [.], ack 191353, win 65535, length 0
9.528046 IP 10.1.1.1.49153 > 10.1.1.2.8080: Flags [.], seq 191353:191889, ack 1, win 65535, length 536
9.528046 IP 10.1.1.2.8080 > 10.1.1.1.49153: Flags [.], ack 192961, win 65535, length 0
9.539038 IP 10.1.1.1.49153 > 10.1.1.2.8080: Flags [.], seq 192961:193497, ack 1, win 65535, length 536
9.539963 IP 10.1.1.1.49153 > 10.1.1.2.8080: Flags [.], seq 193497:194033, ack 1, win 65535, length 536
9.539963 IP 10.1.1.2.8080 > 10.1.1.1.49153: Flags [.], ack 194033, win 65535, length 0
9.550955 IP 10.1.1.1.49153 > 10.1.1.2.8080: Flags [.], seq 194033:194569, ack 1, win 65535, length 536
9.551880 IP 10.1.1.1.49153 > 10.1.1.2.8080: Flags [.], seq 194569:195105, ack 1, win 65535, length 536
9.551880 IP 10.1.1.2.8080 > 10.1.1.1.49153: Flags [.], ack 195105, win 65535, length 0
9.562872 IP 10.1.1.1.49153 > 10.1.1.2.8080: Flags [.], seq 195105:195641, ack 1, win 65535, length 536
9.563796 IP 10.1.1.1.49153 > 10.1.1.2.8080: Flags [.], seq 195641:196177, ack 1, win 65535, length 536
9.563796 IP 10.1.1.2.8080 > 10.1.1.1.49153: Flags [.], ack 196177, win 65535, length 0
9.574788 IP 10.1.1.1.49153 > 10.1.1.2.8080: Flags [.], seq 196177:196713, ack 1, win 65535, length 536
9.575713 IP 10.1.1.1.49153 > 10.1.1.2.8080: Flags [.], seq 196713:197249, ack 1, win 65535, length 536
9.575713 IP 10.1.1.2.8080 > 10.1.1.1.49153: Flags [.], ack 197249, win 65535, length 0
9.586705 IP 10.1.1.1.49153 > 10.1.1.2.8080: Flags [.], seq 197785:198321, ack 1, win 65535, length 536
9.586705 IP 10.1.1.2.8080 > 10.1.1.1.49153: Flags [.], ack 197249, win 65535, length 0
9.587630 IP 10.1.1.1.49153 > 10.1.1.2.8080: Flags [.], seq 198321:198857, ack 1, win 65535, length 536
9.587630 IP 10.1.1.2.8080 > 10.1.1.1.49153: Flags [.], ack 197249, win 65535, length 0
9.786705 IP 10.1.1.1.49153 > 10.1.1.2.8080: Flags [.], seq 197249:197785, ack 1, win 65535, length 536
9.786705 IP 10.1.1.2.8080 > 10.1.1.1.49153: Flags [.], ack 198857, win 65535, length 0
9.797697 IP 10.1.1.1.49153 > 10.1.1.2.8080: Flags [.], seq 198857:199393, ack 1, win 65535, length 536
9.798622 IP 10.1.1.1.49153 > 10.1.1.2.8080: Flags [.], seq 199393:199929, ack 1, win 65535, length 536
9.798622 IP 10.1.1.2.8080 > 10.1.1.1.49153: Flags [.], ack 199929, win 65535, length 0
9.809614 IP 10.1.1.1.49153 > 10.1.1.2.8080: Flags [.], seq 199929:200465, ack 1, win 65535, length 536
9.810539 IP 10.1.1.1.49153 > 10.1.1.2.8080: Flags [.], seq 200465:201001, ack 1, win 65535, length 536
9.810539 IP 10.1.1.2.8080 > 10.1.1.1.49153: Flags [.], ack 201001, win 65535, length 0
9.821531 IP 10.1.1.1.49153 > 10.1.1.2.8080: Flags [.], seq 201001:201537, ack 1, win 65535, length 536
9.822456 IP 10.1.1.1.49153 > 10.1.1.2.8080: Flags [.], seq 201537:202073, ack 1, win 65535, length 536
9.822456 IP 10.1.1.2.8080 > 10.1.1.1.49153: Flags [.], ack 202073, win 65535, length 0
9.833448 IP 10.1.1.1.49153 > 10.1.1.2.8080: Flags [.], seq 202073:202609, ack 1, win 65535, length 536
9.834372 IP 10.1.1.1.49153 > 10.1.1.2.8080: Flags [.], seq 202609:203145, ack 1, win 65535, length 536
9.834372 IP 10.1.1.2.8080 > 10.1.1.1.49153: Flags [.], ack 203145, win 65535, length 0
9.845364 IP 10.1.1.1.49153 > 10.1.1.2.8080: Flags [.], seq 203681:204217, ack 1, win 65535, length 536
9.845364 IP 10.1.1.2.8080 > 10.1.1.1.49153: Flags [.], ack 203145, win 65535, length 0
9.846289 IP 10.1.1.1.49153 > 10.1.1.2.8080: Flags [.], seq 204217:204753, ack 1, win 65535, length 536
9.846289 IP 10.1.1.2.8080 > 10.1.1.1.49153: Flags [.], ack 203145, win 65535, length 0
