1.000000 IP 10.1.1.1.49153 > 10.1.1.2.8080: Flags [S], seq 0, win 65535, length 0
1.010134 IP 10.1.1.2.8080 > 10.1.1.1.49153: Flags [S.], seq 0, ack 1, win 65535, length 0
1.010134 IP 10.1.1.1.49153 > 10.1.1.2.8080: Flags [.], ack 1, win 65535, length 0
1.010201 IP 10.1.1.1.49153 > 10.1.1.2.8080: Flags [.], seq 1:537, ack 1, win 65535, length 536
1.021193 IP 10.1.1.2.8080 > 10.1.1.1.49153: Flags [.], ack 537, win 65535, length 0
1.021193 IP 10.1.1.1.49153 > 10.1.1.2.8080: Flags [.], seq 537:1073, ack 1, win 65535, length 536
1.022118 IP 10.1.1.1.49153 > 10.1.1.2.8080: Flags [.], seq 1073:1609, ack 1, win 65535, length 536
1.033110 IP 10.1.1.2.8080 > 10.1.1.1.49153: Flags [.], ack 1609, win 65535, length 0
1.033110 IP 10.1.1.1.49153 > 10.1.1.2.8080: Flags [.], seq 1609:2145, ack 1, win 65535, length 536
1.034035 IP 10.1.1.1.49153 > 10.1.1.2.8080: Flags [.], seq 2145:2681, ack 1, win 65535, length 536
1.045027 IP 10.1.1.2.8080 > 10.1.1.1.49153: Flags [.], ack 2681, win 65535, length 0
1.045027 IP 10.1.1.1.49153 > 10.1.1.2.8080: Flags [.], seq 3217:3753, ack 1, win 65535, length 536
1.045952 IP 10.1.1.1.49153 > 10.1.1.2.8080: Flags [.], seq 3753:4289, ack 1, win 65535, length 536
1.056019 IP 10.1.1.2.8080 > 10.1.1.1.49153: Flags [.], ack 2681, win 65535, length 0
1.056944 IP 10.1.1.2.8080 > 10.1.1.1.49153: Flags [.], ack 2681, win 65535, length 0
1.245027 IP 10.1.1.1.49153 > 10.1.1.2.8080: Flags [.], seq 2681:3217, ack 1, win 65535, length 536
1.256019 IP 10.1.1.2.8080 > 10.1.1.1.49153: Flags [.], ack 4289, win 65535, length 0
1.256019 IP 10.1.1.1.49153 > 10.1.1.2.8080: Flags [.], seq 4289:4825, ack 1, win 65535, length 536
1.256944 IP 10.1.1.1.49153 > 10.1.1.2.8080: Flags [.], seq 4825:5361, ack 1, win 65535, length 536
1.267936 IP 10.1.1.2.8080 > 10.1.1.1.49153: Flags [.], ack 5361, win 65535, length 0
1.267936 IP 10.1.1.1.49153 > 10.1.1.2.8080: Flags [.], seq 5361:5897, ack 1, win 65535, length 536
1.268860 IP 10.1.1.1.49153 > 10.1.1.2.8080: Flags [.], seq 5897:6433, ack 1, win 65535, length 536
1.279852 IP 10.1.1.2.8080 > 10.1.1.1.49153: Flags [.], ack 6433, win 65535, length 0
1.279852 IP 10.1.1.1.49153 > 10.1.1.2.8080: Flags [.], seq 6433:6969, ack 1, win 65535, length 536
1.280777 IP 10.1.1.1.49153 > 10.1.1.2.8080: Flags [.], seq 6969:7505, ack 1, win 65535, length 536
1.291769 IP 10.1.1.2.8080 > 10.1.1.1.49153: Flags [.], ack 7505, win 65535, length 0
1.291769 IP 10.1.1.1.49153 > 10.1.1.2.8080: Flags [.], seq 7505:8041, ack 1, win 65535, length 536
1.292694 IP 10.1.1.1.49153 > 10.1.1.2.8080: Flags [.], seq 8041:8577, ack 1, win 65535, length 536
1.303686 IP 10.1.1.2.8080 > 10.1.1.1.49153: Flags [.], ack 8577, win 65535, length 0
1.303686 IP 10.1.1.1.49153 > 10.1.1.2.8080: Flags [.], seq 9113:9649, ack 1, win 65535, length 536
1.304611 IP 10.1.1.1.49153 > 10.1.1.2.8080: Flags [.], seq 9649:10185, ack 1, win 65535, length 536
1.314678 IP 10.1.1.2.8080 > 10.1.1.1.49153: Flags [.], ack 8577, win 65535, length 0
1.315603 IP 10.1.1.2.8080 > 10.1.1.1.49153: Flags [.], ack 8577, win 65535, length 0
1.503686 IP 10.1.1.1.49153 > 10.1.1.2.8080: Flags [.], seq 8577:9113, ack 1, win 65535, length 536
1.514678 IP 10.1.1.2.8080 > 10.1.1.1.49153: Flags [.], ack 10185, win 65535, length 0
1.514678 IP 10.1.1.1.49153 > 10.1.1.2.8080: Flags [.], seq 10185:10721, ack 1, win 65535, length 536
1.515603 IP 10.1.1.1.49153 > 10.1.1.2.8080: Flags [.], seq 10721:11257, ack 1, win 65535, length 536
1.526595 IP 10.1.1.2.8080 > 10.1.1.1.49153: Flags [.], ack 11257, win 65535, length 0
1.526595 IP 10.1.1.1.49153 > 10.1.1.2.8080: Flags [.], seq 11257:11793, ack 1, win 65535, length 536
1.527520 IP 10.1.1.1.49153 > 10.1.1.2.8080: Flags [.], seq 11793:12329, ack 1, win 65535, length 536
1.538512 IP 10.1.1.2.8080 > 10.1.1.1.49153: Flags [.], ack 12329, win 65535, length 0
1.538512 IP 10.1.1.1.49153 > 10.1.1.2.8080: Flags [.], seq 12329:12865, ack 1, win 65535, length 536
1.539436 IP 10.1.1.1.49153 > 10.1.1.2.8080: Flags [.], seq 12865:13401, ack 1, win 65535, length 536
1.550428 IP 10.1.1.2.8080 > 10.1.1.1.49153: Flags [.], ack 13401, win 65535, length 0
1.550428 IP 10.1.1.1.49153 > 10.1.1.2.8080: Flags [.], seq 13401:13937, ack 1, win 65535, length 536
1.551353 IP 10.1.1.1.49153 > 10.1.1.2.8080: Flags [.], seq 13937:14473, ack 1, win 65535, length 536
1.562345 IP 10.1.1.2.8080 > 10.1.1.1.49153: Flags [.], ack 14473, win 65535, length 0
1.562345 IP 10.1.1.1.49153 > 10.1.1.2.8080: Flags [.], seq 15009:15545, ack 1, win 65535, length 536
1.563270 IP 10.1.1.1.49153 > 10.1.1.2.8080: Flags [.], seq 15545:16081, ack 1, win 65535, length 536
1.573337 IP 10.1.1.2.8080 > 10.1.1.1.49153: Flags [.], ack 14473, win 65535, length 0
1.574262 IP 10.1.1.2.8080 > 10.1.1.1.49153: Flags [.], ack 14473, win 65535, length 0
1.762345 IP 10.1.1.1.49153 > 10.1.1.2.8080: Flags [.], seq 14473:15009, ack 1, win 65535, length 536
1.773337 IP 10.1.1.2.8080 > 10.1.1.1.49153: Flags [.], ack 16081, win 65535, length 0
1.773337 IP 10.1.1.1.49153 > 10.1.1.2.8080: Flags [.], seq 16081:16617, ack 1, win 65535, length 536
1.774262 IP 10.1.1.1.49153 > 10.1.1.2.8080: Flags [.], seq 16617:17153, ack 1, win 65535, length 536
1.785254 IP 10.1.1.2.8080 > 10.1.1.1.49153: Flags [.], ack 17153, win 65535, length 0
1.785254 IP 10.1.1.1.49153 > 10.1.1.2.8080: Flags [.], seq 17153:17689, ack 1, win 65535, length 536
1.786179 IP 10.1.1.1.49153 > 10.1.1.2.8080: Flags [.], seq 17689:18225, ack 1, win 65535, length 536
1.797171 IP 10.1.1.2.8080 > 10.1.1.1.49153: Flags [.], ack 18225, win 65535, length 0
1.797171 IP 10.1.1.1.49153 > 10.1.1.2.8080: Flags [.], seq 18225:18761, ack 1, win 65535, length 536
1.798096 IP 10.1.1.1.49153 > 10.1.1.2.8080: Flags [.], seq 18761:19297, ack 1, win 65535, length 536
1.809088 IP 10.1.1.2.8080 > 10.1.1.1.49153: Flags [.], ack 19297, win 65535, length 0
1.809088 IP 10.1.1.1.49153 > 10.1.1.2.8080: Flags [.], seq 19297:19833, ack 1, win 65535, length 536
1.810012 IP 10.1.1.1.49153 > 10.1.1.2.8080: Flags [.], seq 19833:20369, ack 1, win 65535, length 536
1.821004 IP 10.1.1.2.8080 > 10.1.1.1.49153: Flags [.], ack 20369, win 65535, length 0
1.821004 IP 10.1.1.1.49153 > 10.1.1.2.8080: Flags [.], seq 20905:21441, ack 1, win 65535, length 536
1.821929 IP 10.1.1.1.49153 > 10.1.1.2.8080: Flags [.], seq 21441:21977, ack 1, win 65535, length 536
1.831996 IP 10.1.1.2.8080 > 10.1.1.1.49153: Flags [.], ack 20369, win 65535, length 0
1.832921 IP 10.1.1.2.8080 > 10.1.1.1.49153: Flags [.], ack 20369, win 65535, length 0
2.021004 IP 10.1.1.1.49153 > 10.1.1.2.8080: Flags [.], seq 20369:20905, ack 1, win 65535, length 536
2.031996 IP 10.1.1.2.8080 > 10.1.1.1.49153: Flags [.], ack 21977, win 65535, length 0
2.031996 IP 10.1.1.1.49153 > 10.1.1.2.8080: Flags [.], seq 21977:22513, ack 1, win 65535, length 536
2.032921 IP 10.1.1.1.49153 > 10.1.1.2.8080: Flags [.], seq 22513:23049, ack 1, win 65535, length 536
2.043913 IP 10.1.1.2.8080 > 10.1.1.1.49153: Flags [.], ack 23049, win 65535, length 0
2.043913 IP 10.1.1.1.49153 > 10.1.1.2.8080: Flags [.], seq 23049:23585, ack 1, win 65535, length 536
2.044838 IP 10.1.1.1.49153 > 10.1.1.2.8080: Flags [.], seq 23585:24121, ack 1, win 65535, length 536
2.055830 IP 10.1.1.2.8080 > 10.1.1.1.49153: Flags [.], ack 24121, win 65535, length 0
2.055830 IP 10.1.1.1.49153 > 10.1.1.2.8080: Flags [.], seq 24121:24657, ack 1, win 65535, length 536
2.056755 IP 10.1.1.1.49153 > 10.1.1.2.8080: Flags [.], seq 24657:25193, ack 1, win 65535, length 536
2.067747 IP 10.1.1.2.8080 > 10.1.1.1.49153: Flags [.], ack 25193, win 65535, length 0
2.067747 IP 10.1.1.1.49153 > 10.1.1.2.8080: Flags [.], seq 25193:25729, ack 1, win 65535, length 536
2.068672 IP 10.1.1.1.49153 > 10.1.1.2.8080: Flags [.], seq 25729:26265, ack 1, win 65535, length 536
2.079664 IP 10.1.1.2.8080 > 10.1.1.1.49153: Flags [.], ack 26265, win 65535, length 0
2.079664 IP 10.1.1.1.49153 > 10.1.1.2.8080: Flags [.], seq 26801:27337, ack 1, win 65535, length 536
2.080588 IP 10.1.1.1.49153 > 10.1.1.2.8080: Flags [.], seq 27337:27873, ack 1, win 65535, length 536
2.090656 IP 10.1.1.2.8080 > 10.1.1.1.49153: Flags [.], ack 26265, win 65535, length 0
2.091580 IP 10.1.1.2.8080 > 10.1.1.1.49153: Flags [.], ack 26265, win 65535, length 0
2.279664 IP 10.1.1.1.49153 > 10.1.1.2.8080: Flags [.], seq 26265:26801, ack 1, win 65535, length 536
2.290656 IP 10.1.1.2.8080 > 10.1.1.1.49153: Flags [.], ack 27873, win 65535, length 0
2.290656 IP 10.1.1.1.49153 > 10.1.1.2.8080: Flags [.], seq 27873:28409, ack 1, win 65535, length 536
2.291580 IP 10.1.1.1.49153 > 10.1.1.2.8080: Flags [.], seq 28409:28945, ack 1, win 65535, length 536
2.302572 IP 10.1.1.2.8080 > 10.1.1.1.49153: Flags [.], ack 28945, win 65535, length 0
2.302572 IP 10.1.1.1.49153 > 10.1.1.2.8080: Flags [.], seq 28945:29481, ack 1, win 65535, length 536
2.303497 IP 10.1.1.1.49153 > 10.1.1.2.8080: Flags [.], seq 29481:30017, ack 1, win 65535, length 536
2.314489 IP 10.1.1.2.8080 > 10.1.1.1.49153: Flags [.], ack 30017, win 65535, length 0
2.314489 IP 10.1.1.1.49153 > 10.1.1.2.8080: Flags [.], seq 30017:30553, ack 1, win 65535, length 536
2.315414 IP 10.1.1.1.49153 > 10.1.1.2.8080: Flags [.], seq 30553:31089, ack 1, win 65535, length 536
2.326406 IP 10.1.1.2.8080 > 10.1.1.1.49153: Flags [.], ack 31089, win 65535, length 0
2.326406 IP 10.1.1.1.49153 > 10.1.1.2.8080: Flags [.], seq 31089:31625, ack 1, win 65535, length 536
2.327331 IP 10.1.1.1.49153 > 10.1.1.2.8080: Flags [.], seq 31625:32161, ack 1, win 65535, length 536
2.338323 IP 10.1.1.2.8080 > 10.1.1.1.49153: Flags [.], ack 32161, win 65535, length 0
2.338323 IP 10.1.1.1.49153 > 10.1.1.2.8080: Flags [.], seq 32697:33233, ack 1, win 65535, length 536
2.339248 IP 10.1.1.1.49153 > 10.1.1.2.8080: Flags [.], seq 33233:33769, ack 1, win 65535, length 536
2.349315 IP 10.1.1.2.8080 > 10.1.1.1.49153: Flags [.], ack 32161, win 65535, length 0
2.350240 IP 10.1.1.2.8080 > 10.1.1.1.49153: Flags [.], ack 32161, win 65535, length 0
2.538323 IP 10.1.1.1.49153 > 10.1.1.2.8080: Flags [.], seq 32161:32697, ack 1, win 65535, length 536
2.549315 IP 10.1.1.2.8080 > 10.1.1.1.49153: Flags [.], ack 33769, win 65535, length 0
2.549315 IP 10.1.1.1.49153 > 10.1.1.2.8080: Flags [.], seq 33769:34305, ack 1, win 65535, length 536
2.550240 IP 10.1.1.1.49153 > 10.1.1.2.8080: Flags [.], seq 34305:34841, ack 1, win 65535, length 536
2.561232 IP 10.1.1.2.8080 > 10.1.1.1.49153: Flags [.], ack 34841, win 65535, length 0
2.561232 IP 10.1.1.1.49153 > 10.1.1.2.8080: Flags [.], seq 34841:35377, ack 1, win 65535, length 536
2.562156 IP 10.1.1.1.49153 > 10.1.1.2.8080: Flags [.], seq 35377:35913, ack 1, win 65535, length 536
2.573148 IP 10.1.1.2.8080 > 10.1.1.1.49153: Flags [.], ack 35913, win 65535, length 0
2.573148 IP 10.1.1.1.49153 > 10.1.1.2.8080: Flags [.], seq 35913:36449, ack 1, win 65535, length 536
2.574073 IP 10.1.1.1.49153 > 10.1.1.2.8080: Flags [.], seq 36449:36985, ack 1, win 65535, length 536
2.585065 IP 10.1.1.2.8080 > 10.1.1.1.49153: Flags [.], ack 36985, win 65535, length 0
2.585065 IP 10.1.1.1.49153 > 10.1.1.2.8080: Flags [.], seq 36985:37521, ack 1, win 65535, length 536
2.585990 IP 10.1.1.1.49153 > 10.1.1.2.8080: Flags [.], seq 37521:38057, ack 1, win 65535, length 536
2.596982 IP 10.1.1.2.8080 > 10.1.1.1.49153: Flags [.], ack 38057, win 65535, length 0
2.596982 IP 10.1.1.1.49153 > 10.1.1.2.8080: Flags [.], seq 38593:39129, ack 1, win 65535, length 536
2.597907 IP 10.1.1.1.49153 > 10.1.1.2.8080: Flags [.], seq 39129:39665, ack 1, win 65535, length 536
2.607974 IP 10.1.1.2.8080 > 10.1.1.1.49153: Flags [.], ack 38057, win 65535, length 0
2.608899 IP 10.1.1.2.8080 > 10.1.1.1.49153: Flags [.], ack 38057, win 65535, length 0
2.796982 IP 10.1.1.1.49153 > 10.1.1.2.8080: Flags [.], seq 38057:38593, ack 1, win 65535, length 536
2.807974 IP 10.1.1.2.8080 > 10.1.1.1.49153: Flags [.], ack 39665, win 65535, length 0
2.807974 IP 10.1.1.1.49153 > 10.1.1.2.8080: Flags [.], seq 39665:40201, ack 1, win 65535, length 536
2.808899 IP 10.1.1.1.49153 > 10.1.1.2.8080: Flags [.], seq 40201:40737, ack 1, win 65535, length 536
2.819891 IP 10.1.1.2.8080 > 10.1.1.1.49153: Flags [.], ack 40737, win 65535, length 0
2.819891 IP 10.1.1.1.49153 > 10.1.1.2.8080: Flags [.], seq 40737:41273, ack 1, win 65535, length 536
2.820816 IP 10.1.1.1.49153 > 10.1.1.2.8080: Flags [.], seq 41273:41809, ack 1, win 65535, length 536
2.831808 IP 10.1.1.2.8080 > 10.1.1.1.49153: Flags [.], ack 41809, win 65535, length 0
2.831808 IP 10.1.1.1.49153 > 10.1.1.2.8080: Flags [.], seq 41809:42345, ack 1, win 65535, length 536
2.832732 IP 10.1.1.1.49153 > 10.1.1.2.8080: Flags [.], seq 42345:42881, ack 1, win 65535, length 536
2.843724 IP 10.1.1.2.8080 > 10.1.1.1.49153: Flags [.], ack 42881, win 65535, length 0
2.843724 IP 10.1.1.1.49153 > 10.1.1.2.8080: Flags [.], seq 42881:43417, ack 1, win 65535, length 536
2.844649 IP 10.1.1.1.49153 > 10.1.1.2.8080: Flags [.], seq 43417:43953, ack 1, win 65535, length 536
2.855641 IP 10.1.1.2.8080 > 10.1.1.1.49153: Flags [.], ack 43953, win 65535, length 0
2.855641 IP 10.1.1.1.49153 > 10.1.1.2.8080: Flags [.], seq 44489:45025, ack 1, win 65535, length 536
2.856566 IP 10.1.1.1.49153 > 10.1.1.2.8080: Flags [.], seq 45025:45561, ack 1, win 65535, length 536
2.866633 IP 10.1.1.2.8080 > 10.1.1.1.49153: Flags [.], ack 43953, win 65535, length 0
2.867558 IP 10.1.1.2.8080 > 10.1.1.1.49153: Flags [.], ack 43953, win 65535, length 0
3.055641 IP 10.1.1.1.49153 > 10.1.1.2.8080: Flags [.], seq 43953:44489, ack 1, win 65535, length 536
3.066633 IP 10.1.1.2.8080 > 10.1.1.1.49153: Flags [.], ack 45561, win 65535, length 0
3.066633 IP 10.1.1.1.49153 > 10.1.1.2.8080: Flags [.], seq 45561:46097, ack 1, win 65535, length 536
3.067558 IP 10.1.1.1.49153 > 10.1.1.2.8080: Flags [.], seq 46097:46633, ack 1, win 65535, length 536
3.078550 IP 10.1.1.2.8080 > 10.1.1.1.49153: Flags [.], ack 46633, win 65535, length 0
3.078550 IP 10.1.1.1.49153 > 10.1.1.2.8080: Flags [.], seq 46633:47169, ack 1, win 65535, length 536
3.079475 IP 10.1.1.1.49153 > 10.1.1.2.8080: Flags [.], seq 47169:47705, ack 1, win 65535, length 536
3.090467 IP 10.1.1.2.8080 > 10.1.1.1.49153: Flags [.], ack 47705, win 65535, length 0
3.090467 IP 10.1.1.1.49153 > 10.1.1.2.8080: Flags [.], seq 47705:48241, ack 1, win 65535, length 536
3.091392 IP 10.1.1.1.49153 > 10.1.1.2.8080: Flags [.], seq 48241:48777, ack 1, win 65535, length 536
3.102384 IP 10.1.1.2.8080 > 10.1.1.1.49153: Flags [.], ack 48777, win 65535, length 0
3.102384 IP 10.1.1.1.49153 > 10.1.1.2.8080: Flags [.], seq 48777:49313, ack 1, win 65535, length 536
3.103308 IP 10.1.1.1.49153 > 10.1.1.2.8080: Flags [.], seq 49313:49849, ack 1, win 65535, length 536
3.114300 IP 10.1.1.2.8080 > 10.1.1.1.49153: Flags [.], ack 49849, win 65535, length 0
3.114300 IP 10.1.1.1.49153 > 10.1.1.2.8080: Flags [.], seq 50385:50921, ack 1, win 65535, length 536
3.115225 IP 10.1.1.1.49153 > 10.1.1.2.8080: Flags [.], seq 50921:51457, ack 1, win 65535, length 536
3.125292 IP 10.1.1.2.8080 > 10.1.1.1.49153: Flags [.], ack 49849, win 65535, length 0
3.126217 IP 10.1.1.2.8080 > 10.1.1.1.49153: Flags [.], ack 49849, win 65535, length 0
3.314300 IP 10.1.1.1.49153 > 10.1.1.2.8080: Flags [.], seq 49849:50385, ack 1, win 65535, length 536
3.325292 IP 10.1.1.2.8080 > 10.1.1.1.49153: Flags [.], ack 51457, win 65535, length 0
3.325292 IP 10.1.1.1.49153 > 10.1.1.2.8080: Flags [.], seq 51457:51993, ack 1, win 65535, length 536
3.326217 IP 10.1.1.1.49153 > 10.1.1.2.8080: Flags [.], seq 51993:52529, ack 1, win 65535, length 536
3.337209 IP 10.1.1.2.8080 > 10.1.1.1.49153: Flags [.], ack 52529, win 65535, length 0
3.337209 IP 10.1.1.1.49153 > 10.1.1.2.8080: Flags [.], seq 52529:53065, ack 1, win 65535, length 536
3.338134 IP 10.1.1.1.49153 > 10.1.1.2.8080: Flags [.], seq 53065:53601, ack 1, win 65535, length 536
3.349126 IP 10.1.1.2.8080 > 10.1.1.1.49153: Flags [.], ack 53601, win 65535, length 0
3.349126 IP 10.1.1.1.49153 > 10.1.1.2.8080: Flags [.], seq 53601:54137, ack 1, win 65535, length 536
3.350051 IP 10.1.1.1.49153 > 10.1.1.2.8080: Flags [.], seq 54137:54673, ack 1, win 65535, length 536
3.361043 IP 10.1.1.2.8080 > 10.1.1.1.49153: Flags [.], ack 54673, win 65535, length 0
3.361043 IP 10.1.1.1.49153 > 10.1.1.2.8080: Flags [.], seq 54673:55209, ack 1, win 65535, length 536
3.361968 IP 10.1.1.1.49153 > 10.1.1.2.8080: Flags [.], seq 55209:55745, ack 1, win 65535, length 536
3.372960 IP 10.1.1.2.8080 > 10.1.1.1.49153: Flags [.], ack 55745, win 65535, length 0
3.372960 IP 10.1.1.1.49153 > 10.1.1.2.8080: Flags [.], seq 56281:56817, ack 1, win 65535, length 536
3.373884 IP 10.1.1.1.49153 > 10.1.1.2.8080: Flags [.], seq 56817:57353, ack 1, win 65535, length 536
3.383952 IP 10.1.1.2.8080 > 10.1.1.1.49153: Flags [.], ack 55745, win 65535, length 0
3.384876 IP 10.1.1.2.8080 > 10.1.1.1.49153: Flags [.], ack 55745, win 65535, length 0
3.572960 IP 10.1.1.1.49153 > 10.1.1.2.8080: Flags [.], seq 55745:56281, ack 1, win 65535, length 536
3.583952 IP 10.1.1.2.8080 > 10.1.1.1.49153: Flags [.], ack 57353, win 65535, length 0
3.583952 IP 10.1.1.1.49153 > 10.1.1.2.8080: Flags [.], seq 57353:57889, ack 1, win 65535, length 536
3.584876 IP 10.1.1.1.49153 > 10.1.1.2.8080: Flags [.], seq 57889:58425, ack 1, win 65535, length 536
3.595868 IP 10.1.1.2.8080 > 10.1.1.1.49153: Flags [.], ack 58425, win 65535, length 0
3.595868 IP 10.1.1.1.49153 > 10.1.1.2.8080: Flags [.], seq 58425:58961, ack 1, win 65535, length 536
3.596793 IP 10.1.1.1.49153 > 10.1.1.2.8080: Flags [.], seq 58961:59497, ack 1, win 65535, length 536
3.607785 IP 10.1.1.2.8080 > 10.1.1.1.49153: Flags [.], ack 59497, win 65535, length 0
3.607785 IP 10.1.1.1.49153 > 10.1.1.2.8080: Flags [.], seq 59497:60033, ack 1, win 65535, length 536
3.608710 IP 10.1.1.1.49153 > 10.1.1.2.8080: Flags [.], seq 60033:60569, ack 1, win 65535, length 536
3.619702 IP 10.1.1.2.8080 > 10.1.1.1.49153: Flags [.], ack 60569, win 65535, length 0
3.619702 IP 10.1.1.1.49153 > 10.1.1.2.8080: Flags [.], seq 60569:61105, ack 1, win 65535, length 536
3.620627 IP 10.1.1.1.49153 > 10.1.1.2.8080: Flags [.], seq 61105:61641, ack 1, win 65535, length 536
3.631619 IP 10.1.1.2.8080 > 10.1.1.1.49153: Flags [.], ack 61641, win 65535, length 0
3.631619 IP 10.1.1.1.49153 > 10.1.1.2.8080: Flags [.], seq 62177:62713, ack 1, win 65535, length 536
3.632544 IP 10.1.1.1.49153 > 10.1.1.2.8080: Flags [.], seq 62713:63249, ack 1, win 65535, length 536
3.642611 IP 10.1.1.2.8080 > 10.1.1.1.49153: Flags [.], ack 61641, win 65535, length 0
3.643536 IP 10.1.1.2.8080 > 10.1.1.1.49153: Flags [.], ack 61641, win 65535, length 0
3.831619 IP 10.1.1.1.49153 > 10.1.1.2.8080: Flags [.], seq 61641:62177, ack 1, win 65535, length 536
3.842611 IP 10.1.1.2.8080 > 10.1.1.1.49153: Flags [.], ack 63249, win 65535, length 0
3.842611 IP 10.1.1.1.49153 > 10.1.1.2.8080: Flags [.], seq 63249:63785, ack 1, win 65535, length 536
3.843536 IP 10.1.1.1.49153 > 10.1.1.2.8080: Flags [.], seq 63785:64321, ack 1, win 65535, length 536
3.854528 IP 10.1.1.2.8080 > 10.1.1.1.49153: Flags [.], ack 64321, win 65535, length 0
3.854528 IP 10.1.1.1.49153 > 10.1.1.2.8080: Flags [.], seq 64321:64857, ack 1, win 65535, length 536
3.855452 IP 10.1.1.1.49153 > 10.1.1.2.8080: Flags [.], seq 64857:65393, ack 1, win 65535, length 536
3.866444 IP 10.1.1.2.8080 > 10.1.1.1.49153: Flags [.], ack 65393, win 65535, length 0
3.866444 IP 10.1.1.1.49153 > 10.1.1.2.8080: Flags [.], seq 65393:65929, ack 1, win 65535, length 536
3.867369 IP 10.1.1.1.49153 > 10.1.1.2.8080: Flags [.], seq 65929:66465, ack 1, win 65535, length 536
3.878361 IP 10.1.1.2.8080 > 10.1.1.1.49153: Flags [.], ack 66465, win 65535, length 0
3.878361 IP 10.1.1.1.49153 > 10.1.1.2.8080: Flags [.], seq 66465:67001, ack 1, win 65535, length 536
3.879286 IP 10.1.1.1.49153 > 10.1.1.2.8080: Flags [.], seq 67001:67537, ack 1, win 65535, length 536
3.890278 IP 10.1.1.2.8080 > 10.1.1.1.49153: Flags [.], ack 67537, win 65535, length 0
3.890278 IP 10.1.1.1.49153 > 10.1.1.2.8080: Flags [.], seq 68073:68609, ack 1, win 65535, length 536
3.891203 IP 10.1.1.1.49153 > 10.1.1.2.8080: Flags [.], seq 68609:69145, ack 1, win 65535, length 536
3.901270 IP 10.1.1.2.8080 > 10.1.1.1.49153: Flags [.], ack 67537, win 65535, length 0
3.902195 IP 10.1.1.2.8080 > 10.1.1.1.49153: Flags [.], ack 67537, win 65535, length 0
4.090278 IP 10.1.1.1.49153 > 10.1.1.2.8080: Flags [.], seq 67537:68073, ack 1, win 65535, length 536
4.101270 IP 10.1.1.2.8080 > 10.1.1.1.49153: Flags [.], ack 69145, win 65535, length 0
4.101270 IP 10.1.1.1.49153 > 10.1.1.2.8080: Flags [.], seq 69145:69681, ack 1, win 65535, length 536
4.102195 IP 10.1.1.1.49153 > 10.1.1.2.8080: Flags [.], seq 69681:70217, ack 1, win 65535, length 536
4.113187 IP 10.1.1.2.8080 > 10.1.1.1.49153: Flags [.], ack 70217, win 65535, length 0
4.113187 IP 10.1.1.1.49153 > 10.1.1.2.8080: Flags [.], seq 70217:70753, ack 1, win 65535, length 536
4.114112 IP 10.1.1.1.49153 > 10.1.1.2.8080: Flags [.], seq 70753:71289, ack 1, win 65535, length 536
4.125104 IP 10.1.1.2.8080 > 10.1.1.1.49153: Flags [.], ack 71289, win 65535, length 0
4.125104 IP 10.1.1.1.49153 > 10.1.1.2.8080: Flags [.], seq 71289:71825, ack 1, win 65535, length 536
4.126028 IP 10.1.1.1.49153 > 10.1.1.2.8080: Flags [.], seq 71825:72361, ack 1, win 65535, length 536
4.137020 IP 10.1.1.2.8080 > 10.1.1.1.49153: Flags [.], ack 72361, win 65535, length 0
4.137020 IP 10.1.1.1.49153 > 10.1.1.2.8080: Flags [.], seq 72361:72897, ack 1, win 65535, length 536
4.137945 IP 10.1.1.1.49153 > 10.1.1.2.8080: Flags [.], seq 72897:73433, ack 1, win 65535, length 536
4.148937 IP 10.1.1.2.8080 > 10.1.1.1.49153: Flags [.], ack 73433, win 65535, length 0
4.148937 IP 10.1.1.1.49153 > 10.1.1.2.8080: Flags [.], seq 73969:74505, ack 1, win 65535, length 536
4.149862 IP 10.1.1.1.49153 > 10.1.1.2.8080: Flags [.], seq 74505:75041, ack 1, win 65535, length 536
4.159929 IP 10.1.1.2.8080 > 10.1.1.1.49153: Flags [.], ack 73433, win 65535, length 0
4.160854 IP 10.1.1.2.8080 > 10.1.1.1.49153: Flags [.], ack 73433, win 65535, length 0
4.348937 IP 10.1.1.1.49153 > 10.1.1.2.8080: Flags [.], seq 73433:73969, ack 1, win 65535, length 536
4.359929 IP 10.1.1.2.8080 > 10.1.1.1.49153: Flags [.], ack 75041, win 65535, length 0
4.359929 IP 10.1.1.1.49153 > 10.1.1.2.8080: Flags [.], seq 75041:75577, ack 1, win 65535, length 536
4.360854 IP 10.1.1.1.49153 > 10.1.1.2.8080: Flags [.], seq 75577:76113, ack 1, win 65535, length 536
4.371846 IP 10.1.1.2.8080 > 10.1.1.1.49153: Flags [.], ack 76113, win 65535, length 0
4.371846 IP 10.1.1.1.49153 > 10.1.1.2.8080: Flags [.], seq 76113:76649, ack 1, win 65535, length 536
4.372771 IP 10.1.1.1.49153 > 10.1.1.2.8080: Flags [.], seq 76649:77185, ack 1, win 65535, length 536
4.383763 IP 10.1.1.2.8080 > 10.1.1.1.49153: Flags [.], ack 77185, win 65535, length 0
4.383763 IP 10.1.1.1.49153 > 10.1.1.2.8080: Flags [.], seq 77185:77721, ack 1, win 65535, length 536
4.384688 IP 10.1.1.1.49153 > 10.1.1.2.8080: Flags [.], seq 77721:78257, ack 1, win 65535, length 536
4.395680 IP 10.1.1.2.8080 > 10.1.1.1.49153: Flags [.], ack 78257, win 65535, length 0
4.395680 IP 10.1.1.1.49153 > 10.1.1.2.8080: Flags [.], seq 78257:78793, ack 1, win 65535, length 536
4.396604 IP 10.1.1.1.49153 > 10.1.1.2.8080: Flags [.], seq 78793:79329, ack 1, win 65535, length 536
4.407596 IP 10.1.1.2.8080 > 10.1.1.1.49153: Flags [.], ack 79329, win 65535, length 0
4.407596 IP 10.1.1.1.49153 > 10.1.1.2.8080: Flags [.], seq 79865:80401, ack 1, win 65535, length 536
4.408521 IP 10.1.1.1.49153 > 10.1.1.2.8080: Flags [.], seq 80401:80937, ack 1, win 65535, length 536
4.418588 IP 10.1.1.2.8080 > 10.1.1.1.49153: Flags [.], ack 79329, win 65535, length 0
4.419513 IP 10.1.1.2.8080 > 10.1.1.1.49153: Flags [.], ack 79329, win 65535, length 0
4.607596 IP 10.1.1.1.49153 > 10.1.1.2.8080: Flags [.], seq 79329:79865, ack 1, win 65535, length 536
4.618588 IP 10.1.1.2.8080 > 10.1.1.1.49153: Flags [.], ack 80937, win 65535, length 0
4.618588 IP 10.1.1.1.49153 > 10.1.1.2.8080: Flags [.], seq 80937:81473, ack 1, win 65535, length 536
4.619513 IP 10.1.1.1.49153 > 10.1.1.2.8080: Flags [.], seq 81473:82009, ack 1, win 65535, length 536
4.630505 IP 10.1.1.2.8080 > 10.1.1.1.49153: Flags [.], ack 82009, win 65535, length 0
4.630505 IP 10.1.1.1.49153 > 10.1.1.2.8080: Flags [.], seq 82009:82545, ack 1, win 65535, length 536
4.631430 IP 10.1.1.1.49153 > 10.1.1.2.8080: Flags [.], seq 82545:83081, ack 1, win 65535, length 536
4.642422 IP 10.1.1.2.8080 > 10.1.1.1.49153: Flags [.], ack 83081, win 65535, length 0
4.642422 IP 10.1.1.1.49153 > 10.1.1.2.8080: Flags [.], seq 83081:83617, ack 1, win 65535, length 536
4.643347 IP 10.1.1.1.49153 > 10.1.1.2.8080: Flags [.], seq 83617:84153, ack 1, win 65535, length 536
4.654339 IP 10.1.1.2.8080 > 10.1.1.1.49153: Flags [.], ack 84153, win 65535, length 0
4.654339 IP 10.1.1.1.49153 > 10.1.1.2.8080: Flags [.], seq 84153:84689, ack 1, win 65535, length 536
4.655264 IP 10.1.1.1.49153 > 10.1.1.2.8080: Flags [.], seq 84689:85225, ack 1, win 65535, length 536
4.666256 IP 10.1.1.2.8080 > 10.1.1.1.49153: Flags [.], ack 85225, win 65535, length 0
4.666256 IP 10.1.1.1.49153 > 10.1.1.2.8080: Flags [.], seq 85761:86297, ack 1, win 65535, length 536
4.667180 IP 10.1.1.1.49153 > 10.1.1.2.8080: Flags [.], seq 86297:86833, ack 1, win 65535, length 536
4.677248 IP 10.1.1.2.8080 > 10.1.1.1.49153: Flags [.], ack 85225, win 65535, length 0
4.678172 IP 10.1.1.2.8080 > 10.1.1.1.49153: Flags [.], ack 85225, win 65535, length 0
4.866256 IP 10.1.1.1.49153 > 10.1.1.2.8080: Flags [.], seq 85225:85761, ack 1, win 65535, length 536
4.877248 IP 10.1.1.2.8080 > 10.1.1.1.49153: Flags [.], ack 86833, win 65535, length 0
4.877248 IP 10.1.1.1.49153 > 10.1.1.2.8080: Flags [.], seq 86833:87369, ack 1, win 65535, length 536
4.878172 IP 10.1.1.1.49153 > 10.1.1.2.8080: Flags [.], seq 87369:87905, ack 1, win 65535, length 536
4.889164 IP 10.1.1.2.8080 > 10.1.1.1.49153: Flags [.], ack 87905, win 65535, length 0
4.889164 IP 10.1.1.1.49153 > 10.1.1.2.8080: Flags [.], seq 87905:88441, ack 1, win 65535, length 536
4.890089 IP 10.1.1.1.49153 > 10.1.1.2.8080: Flags [.], seq 88441:88977, ack 1, win 65535, length 536
4.901081 IP 10.1.1.2.8080 > 10.1.1.1.49153: Flags [.], ack 88977, win 65535, length 0
4.901081 IP 10.1.1.1.49153 > 10.1.1.2.8080: Flags [.], seq 88977:89513, ack 1, win 65535, length 536
4.902006 IP 10.1.1.1.49153 > 10.1.1.2.8080: Flags [.], seq 89513:90049, ack 1, win 65535, length 536
4.912998 IP 10.1.1.2.8080 > 10.1.1.1.49153: Flags [.], ack 90049, win 65535, length 0
4.912998 IP 10.1.1.1.49153 > 10.1.1.2.8080: Flags [.], seq 90049:90585, ack 1, win 65535, length 536
4.913923 IP 10.1.1.1.49153 > 10.1.1.2.8080: Flags [.], seq 90585:91121, ack 1, win 65535, length 536
4.924915 IP 10.1.1.2.8080 > 10.1.1.1.49153: Flags [.], ack 91121, win 65535, length 0
4.924915 IP 10.1.1.1.49153 > 10.1.1.2.8080: Flags [.], seq 91657:92193, ack 1, win 65535, length 536
4.925840 IP 10.1.1.1.49153 > 10.1.1.2.8080: Flags [.], seq 92193:92729, ack 1, win 65535, length 536
4.935907 IP 10.1.1.2.8080 > 10.1.1.1.49153: Flags [.], ack 91121, win 65535, length 0
4.936832 IP 10.1.1.2.8080 > 10.1.1.1.49153: Flags [.], ack 91121, win 65535, length 0
5.124915 IP 10.1.1.1.49153 > 10.1.1.2.8080: Flags [.], seq 91121:91657, ack 1, win 65535, length 536
5.135907 IP 10.1.1.2.8080 > 10.1.1.1.49153: Flags [.], ack 92729, win 65535, length 0
5.135907 IP 10.1.1.1.49153 > 10.1.1.2.8080: Flags [.], seq 92729:93265, ack 1, win 65535, length 536
5.136832 IP 10.1.1.1.49153 > 10.1.1.2.8080: Flags [.], seq 93265:93801, ack 1, win 65535, length 536
5.147824 IP 10.1.1.2.8080 > 10.1.1.1.49153: Flags [.], ack 93801, win 65535, length 0
5.147824 IP 10.1.1.1.49153 > 10.1.1.2.8080: Flags [.], seq 93801:94337, ack 1, win 65535, length 536
5.148748 IP 10.1.1.1.49153 > 10.1.1.2.8080: Flags [.], seq 94337:94873, ack 1, win 65535, length 536
5.159740 IP 10.1.1.2.8080 > 10.1.1.1.49153: Flags [.], ack 94873, win 65535, length 0
5.159740 IP 10.1.1.1.49153 > 10.1.1.2.8080: Flags [.], seq 94873:95409, ack 1, win 65535, length 536
5.160665 IP 10.1.1.1.49153 > 10.1.1.2.8080: Flags [.], seq 95409:95945, ack 1, win 65535, length 536
5.171657 IP 10.1.1.2.8080 > 10.1.1.1.49153: Flags [.], ack 95945, win 65535, length 0
5.171657 IP 10.1.1.1.49153 > 10.1.1.2.8080: Flags [.], seq 95945:96481, ack 1, win 65535, length 536
5.172582 IP 10.1.1.1.49153 > 10.1.1.2.8080: Flags [.], seq 96481:97017, ack 1, win 65535, length 536
5.183574 IP 10.1.1.2.8080 > 10.1.1.1.49153: Flags [.], ack 97017, win 65535, length 0
5.183574 IP 10.1.1.1.49153 > 10.1.1.2.8080: Flags [.], seq 97553:98089, ack 1, win 65535, length 536
5.184499 IP 10.1.1.1.49153 > 10.1.1.2.8080: Flags [.], seq 98089:98625, ack 1, win 65535, length 536
5.194566 IP 10.1.1.2.8080 > 10.1.1.1.49153: Flags [.], ack 97017, win 65535, length 0
5.195491 IP 10.1.1.2.8080 > 10.1.1.1.49153: Flags [.], ack 97017, win 65535, length 0
5.383574 IP 10.1.1.1.49153 > 10.1.1.2.8080: Flags [.], seq 97017:97553, ack 1, win 65535, length 536
5.394566 IP 10.1.1.2.8080 > 10.1.1.1.49153: Flags [.], ack 98625, win 65535, length 0
5.394566 IP 10.1.1.1.49153 > 10.1.1.2.8080: Flags [.], seq 98625:99161, ack 1, win 65535, length 536
5.395491 IP 10.1.1.1.49153 > 10.1.1.2.8080: Flags [.], seq 99161:99697, ack 1, win 65535, length 536
5.406483 IP 10.1.1.2.8080 > 10.1.1.1.49153: Flags [.], ack 99697, win 65535, length 0
5.406483 IP 10.1.1.1.49153 > 10.1.1.2.8080: Flags [.], seq 99697:100233, ack 1, win 65535, length 536
5.407408 IP 10.1.1.1.49153 > 10.1.1.2.8080: Flags [.], seq 100233:100769, ack 1, win 65535, length 536
5.418400 IP 10.1.1.2.8080 > 10.1.1.1.49153: Flags [.], ack 100769, win 65535, length 0
5.418400 IP 10.1.1.1.49153 > 10.1.1.2.8080: Flags [.], seq 100769:101305, ack 1, win 65535, length 536
5.419324 IP 10.1.1.1.49153 > 10.1.1.2.8080: Flags [.], seq 101305:101841, ack 1, win 65535, length 536
5.430316 IP 10.1.1.2.8080 > 10.1.1.1.49153: Flags [.], ack 101841, win 65535, length 0
5.430316 IP 10.1.1.1.49153 > 10.1.1.2.8080: Flags [.], seq 101841:102377, ack 1, win 65535, length 536
5.431241 IP 10.1.1.1.49153 > 10.1.1.2.8080: Flags [.], seq 102377:102913, ack 1, win 65535, length 536
5.442233 IP 10.1.1.2.8080 > 10.1.1.1.49153: Flags [.], ack 102913, win 65535, length 0
5.442233 IP 10.1.1.1.49153 > 10.1.1.2.8080: Flags [.], seq 103449:103985, ack 1, win 65535, length 536
5.443158 IP 10.1.1.1.49153 > 10.1.1.2.8080: Flags [.], seq 103985:104521, ack 1, win 65535, length 536
5.453225 IP 10.1.1.2.8080 > 10.1.1.1.49153: Flags [.], ack 102913, win 65535, length 0
5.454150 IP 10.1.1.2.8080 > 10.1.1.1.49153: Flags [.], ack 102913, win 65535, length 0
5.642233 IP 10.1.1.1.49153 > 10.1.1.2.8080: Flags [.], seq 102913:103449, ack 1, win 65535, length 536
5.653225 IP 10.1.1.2.8080 > 10.1.1.1.49153: Flags [.], ack 104521, win 65535, length 0
5.653225 IP 10.1.1.1.49153 > 10.1.1.2.8080: Flags [.], seq 104521:105057, ack 1, win 65535, length 536
5.654150 IP 10.1.1.1.49153 > 10.1.1.2.8080: Flags [.], seq 105057:105593, ack 1, win 65535, length 536
5.665142 IP 10.1.1.2.8080 > 10.1.1.1.49153: Flags [.], ack 105593, win 65535, length 0
5.665142 IP 10.1.1.1.49153 > 10.1.1.2.8080: Flags [.], seq 105593:106129, ack 1, win 65535, length 536
5.666067 IP 10.1.1.1.49153 > 10.1.1.2.8080: Flags [.], seq 106129:106665, ack 1, win 65535, length 536
5.677059 IP 10.1.1.2.8080 > 10.1.1.1.49153: Flags [.], ack 106665, win 65535, length 0
5.677059 IP 10.1.1.1.49153 > 10.1.1.2.8080: Flags [.], seq 106665:107201, ack 1, win 65535, length 536
5.677984 IP 10.1.1.1.49153 > 10.1.1.2.8080: Flags [.], seq 107201:107737, ack 1, win 65535, length 536
5.688976 IP 10.1.1.2.8080 > 10.1.1.1.49153: Flags [.], ack 107737, win 65535, length 0
5.688976 IP 10.1.1.1.49153 > 10.1.1.2.8080: Flags [.], seq 107737:108273, ack 1, win 65535, length 536
5.689900 IP 10.1.1.1.49153 > 10.1.1.2.8080: Flags [.], seq 108273:108809, ack 1, win 65535, length 536
5.700892 IP 10.1.1.2.8080 > 10.1.1.1.49153: Flags [.], ack 108809, win 65535, length 0
5.700892 IP 10.1.1.1.49153 > 10.1.1.2.8080: Flags [.], seq 109345:109881, ack 1, win 65535, length 536
5.701817 IP 10.1.1.1.49153 > 10.1.1.2.8080: Flags [.], seq 109881:110417, ack 1, win 65535, length 536
5.711884 IP 10.1.1.2.8080 > 10.1.1.1.49153: Flags [.], ack 108809, win 65535, length 0
5.712809 IP 10.1.1.2.8080 > 10.1.1.1.49153: Flags [.], ack 108809, win 65535, length 0
5.900892 IP 10.1.1.1.49153 > 10.1.1.2.8080: Flags [.], seq 108809:109345, ack 1, win 65535, length 536
5.911884 IP 10.1.1.2.8080 > 10.1.1.1.49153: Flags [.], ack 110417, win 65535, length 0
5.911884 IP 10.1.1.1.49153 > 10.1.1.2.8080: Flags [.], seq 110417:110953, ack 1, win 65535, length 536
5.912809 IP 10.1.1.1.49153 > 10.1.1.2.8080: Flags [.], seq 110953:111489, ack 1, win 65535, length 536
5.923801 IP 10.1.1.2.8080 > 10.1.1.1.49153: Flags [.], ack 111489, win 65535, length 0
5.923801 IP 10.1.1.1.49153 > 10.1.1.2.8080: Flags [.], seq 111489:112025, ack 1, win 65535, length 536
5.924726 IP 10.1.1.1.49153 > 10.1.1.2.8080: Flags [.], seq 112025:112561, ack 1, win 65535, length 536
5.935718 IP 10.1.1.2.8080 > 10.1.1.1.49153: Flags [.], ack 112561, win 65535, length 0
5.935718 IP 10.1.1.1.49153 > 10.1.1.2.8080: Flags [.], seq 112561:113097, ack 1, win 65535, length 536
5.936643 IP 10.1.1.1.49153 > 10.1.1.2.8080: Flags [.], seq 113097:113633, ack 1, win 65535, length 536
5.947635 IP 10.1.1.2.8080 > 10.1.1.1.49153: Flags [.], ack 113633, win 65535, length 0
5.947635 IP 10.1.1.1.49153 > 10.1.1.2.8080: Flags [.], seq 113633:114169, ack 1, win 65535, length 536
5.948560 IP 10.1.1.1.49153 > 10.1.1.2.8080: Flags [.], seq 114169:114705, ack 1, win 65535, length 536
5.959552 IP 10.1.1.2.8080 > 10.1.1.1.49153: Flags [.], ack 114705, win 65535, length 0
5.959552 IP 10.1.1.1.49153 > 10.1.1.2.8080: Flags [.], seq 115241:115777, ack 1, win 65535, length 536
5.960476 IP 10.1.1.1.49153 > 10.1.1.2.8080: Flags [.], seq 115777:116313, ack 1, win 65535, length 536
5.970544 IP 10.1.1.2.8080 > 10.1.1.1.49153: Flags [.], ack 114705, win 65535, length 0
5.971468 IP 10.1.1.2.8080 > 10.1.1.1.49153: Flags [.], ack 114705, win 65535, length 0
6.159552 IP 10.1.1.1.49153 > 10.1.1.2.8080: Flags [.], seq 114705:115241, ack 1, win 65535, length 536
6.170544 IP 10.1.1.2.8080 > 10.1.1.1.49153: Flags [.], ack 116313, win 65535, length 0
6.170544 IP 10.1.1.1.49153 > 10.1.1.2.8080: Flags [.], seq 116313:116849, ack 1, win 65535, length 536
6.171468 IP 10.1.1.1.49153 > 10.1.1.2.8080: Flags [.], seq 116849:117385, ack 1, win 65535, length 536
6.182460 IP 10.1.1.2.8080 > 10.1.1.1.49153: Flags [.], ack 117385, win 65535, length 0
6.182460 IP 10.1.1.1.49153 > 10.1.1.2.8080: Flags [.], seq 117385:117921, ack 1, win 65535, length 536
6.183385 IP 10.1.1.1.49153 > 10.1.1.2.8080: Flags [.], seq 117921:118457, ack 1, win 65535, length 536
6.194377 IP 10.1.1.2.8080 > 10.1.1.1.49153: Flags [.], ack 118457, win 65535, length 0
6.194377 IP 10.1.1.1.49153 > 10.1.1.2.8080: Flags [.], seq 118457:118993, ack 1, win 65535, length 536
6.195302 IP 10.1.1.1.49153 > 10.1.1.2.8080: Flags [.], seq 118993:119529, ack 1, win 65535, length 536
6.206294 IP 10.1.1.2.8080 > 10.1.1.1.49153: Flags [.], ack 119529, win 65535, length 0
6.206294 IP 10.1.1.1.49153 > 10.1.1.2.8080: Flags [.], seq 119529:120065, ack 1, win 65535, length 536
6.207219 IP 10.1.1.1.49153 > 10.1.1.2.8080: Flags [.], seq 120065:120601, ack 1, win 65535, length 536
6.218211 IP 10.1.1.2.8080 > 10.1.1.1.49153: Flags [.], ack 120601, win 65535, length 0
6.218211 IP 10.1.1.1.49153 > 10.1.1.2.8080: Flags [.], seq 121137:121673, ack 1, win 65535, length 536
6.219136 IP 10.1.1.1.49153 > 10.1.1.2.8080: Flags [.], seq 121673:122209, ack 1, win 65535, length 536
6.229203 IP 10.1.1.2.8080 > 10.1.1.1.49153: Flags [.], ack 120601, win 65535, length 0
6.230128 IP 10.1.1.2.8080 > 10.1.1.1.49153: Flags [.], ack 120601, win 65535, length 0
6.418211 IP 10.1.1.1.49153 > 10.1.1.2.8080: Flags [.], seq 120601:121137, ack 1, win 65535, length 536
6.429203 IP 10.1.1.2.8080 > 10.1.1.1.49153: Flags [.], ack 122209, win 65535, length 0
6.429203 IP 10.1.1.1.49153 > 10.1.1.2.8080: Flags [.], seq 122209:122745, ack 1, win 65535, length 536
6.430128 IP 10.1.1.1.49153 > 10.1.1.2.8080: Flags [.], seq 122745:123281, ack 1, win 65535, length 536
6.441120 IP 10.1.1.2.8080 > 10.1.1.1.49153: Flags [.], ack 123281, win 65535, length 0
6.441120 IP 10.1.1.1.49153 > 10.1.1.2.8080: Flags [.], seq 123281:123817, ack 1, win 65535, length 536
6.442044 IP 10.1.1.1.49153 > 10.1.1.2.8080: Flags [.], seq 123817:124353, ack 1, win 65535, length 536
6.453036 IP 10.1.1.2.8080 > 10.1.1.1.49153: Flags [.], ack 124353, win 65535, length 0
6.453036 IP 10.1.1.1.49153 > 10.1.1.2.8080: Flags [.], seq 124353:124889, ack 1, win 65535, length 536
6.453961 IP 10.1.1.1.49153 > 10.1.1.2.8080: Flags [.], seq 124889:125425, ack 1, win 65535, length 536
6.464953 IP 10.1.1.2.8080 > 10.1.1.1.49153: Flags [.], ack 125425, win 65535, length 0
6.464953 IP 10.1.1.1.49153 > 10.1.1.2.8080: Flags [.], seq 125425:125961, ack 1, win 65535, length 536
6.465878 IP 10.1.1.1.49153 > 10.1.1.2.8080: Flags [.], seq 125961:126497, ack 1, win 65535, length 536
6.476870 IP 10.1.1.2.8080 > 10.1.1.1.49153: Flags [.], ack 126497, win 65535, length 0
6.476870 IP 10.1.1.1.49153 > 10.1.1.2.8080: Flags [.], seq 127033:127569, ack 1, win 65535, length 536
6.477795 IP 10.1.1.1.49153 > 10.1.1.2.8080: Flags [.], seq 127569:128105, ack 1, win 65535, length 536
6.487862 IP 10.1.1.2.8080 > 10.1.1.1.49153: Flags [.], ack 126497, win 65535, length 0
6.488787 IP 10.1.1.2.8080 > 10.1.1.1.49153: Flags [.], ack 126497, win 65535, length 0
6.676870 IP 10.1.1.1.49153 > 10.1.1.2.8080: Flags [.], seq 126497:127033, ack 1, win 65535, length 536
6.687862 IP 10.1.1.2.8080 > 10.1.1.1.49153: Flags [.], ack 128105, win 65535, length 0
6.687862 IP 10.1.1.1.49153 > 10.1.1.2.8080: Flags [.], seq 128105:128641, ack 1, win 65535, length 536
6.688787 IP 10.1.1.1.49153 > 10.1.1.2.8080: Flags [.], seq 128641:129177, ack 1, win 65535, length 536
6.699779 IP 10.1.1.2.8080 > 10.1.1.1.49153: Flags [.], ack 129177, win 65535, length 0
6.699779 IP 10.1.1.1.49153 > 10.1.1.2.8080: Flags [.], seq 129177:129713, ack 1, win 65535, length 536
6.700704 IP 10.1.1.1.49153 > 10.1.1.2.8080: Flags [.], seq 129713:130249, ack 1, win 65535, length 536
6.711696 IP 10.1.1.2.8080 > 10.1.1.1.49153: Flags [.], ack 130249, win 65535, length 0
6.711696 IP 10.1.1.1.49153 > 10.1.1.2.8080: Flags [.], seq 130249:130785, ack 1, win 65535, length 536
6.712620 IP 10.1.1.1.49153 > 10.1.1.2.8080: Flags [.], seq 130785:131321, ack 1, win 65535, length 536
6.723612 IP 10.1.1.2.8080 > 10.1.1.1.49153: Flags [.], ack 131321, win 65535, length 0
6.723612 IP 10.1.1.1.49153 > 10.1.1.2.8080: Flags [.], seq 131321:131857, ack 1, win 65535, length 536
6.724537 IP 10.1.1.1.49153 > 10.1.1.2.8080: Flags [.], seq 131857:132393, ack 1, win 65535, length 536
6.735529 IP 10.1.1.2.8080 > 10.1.1.1.49153: Flags [.], ack 132393, win 65535, length 0
6.735529 IP 10.1.1.1.49153 > 10.1.1.2.8080: Flags [.], seq 132929:133465, ack 1, win 65535, length 536
6.736454 IP 10.1.1.1.49153 > 10.1.1.2.8080: Flags [.], seq 133465:134001, ack 1, win 65535, length 536
6.746521 IP 10.1.1.2.8080 > 10.1.1.1.49153: Flags [.], ack 132393, win 65535, length 0
6.747446 IP 10.1.1.2.8080 > 10.1.1.1.49153: Flags [.], ack 132393, win 65535, length 0
6.935529 IP 10.1.1.1.49153 > 10.1.1.2.8080: Flags [.], seq 132393:132929, ack 1, win 65535, length 536
6.946521 IP 10.1.1.2.8080 > 10.1.1.1.49153: Flags [.], ack 134001, win 65535, length 0
6.946521 IP 10.1.1.1.49153 > 10.1.1.2.8080: Flags [.], seq 134001:134537, ack 1, win 65535, length 536
6.947446 IP 10.1.1.1.49153 > 10.1.1.2.8080: Flags [.], seq 134537:135073, ack 1, win 65535, length 536
6.958438 IP 10.1.1.2.8080 > 10.1.1.1.49153: Flags [.], ack 135073, win 65535, length 0
6.958438 IP 10.1.1.1.49153 > 10.1.1.2.8080: Flags [.], seq 135073:135609, ack 1, win 65535, length 536
6.959363 IP 10.1.1.1.49153 > 10.1.1.2.8080: Flags [.], seq 135609:136145, ack 1, win 65535, length 536
6.970355 IP 10.1.1.2.8080 > 10.1.1.1.49153: Flags [.], ack 136145, win 65535, length 0
6.970355 IP 10.1.1.1.49153 > 10.1.1.2.8080: Flags [.], seq 136145:136681, ack 1, win 65535, length 536
6.971280 IP 10.1.1.1.49153 > 10.1.1.2.8080: Flags [.], seq 136681:137217, ack 1, win 65535, length 536
6.982272 IP 10.1.1.2.8080 > 10.1.1.1.49153: Flags [.], ack 137217, win 65535, length 0
6.982272 IP 10.1.1.1.49153 > 10.1.1.2.8080: Flags [.], seq 137217:137753, ack 1, win 65535, length 536
6.983196 IP 10.1.1.1.49153 > 10.1.1.2.8080: Flags [.], seq 137753:138289, ack 1, win 65535, length 536
6.994188 IP 10.1.1.2.8080 > 10.1.1.1.49153: Flags [.], ack 138289, win 65535, length 0
6.994188 IP 10.1.1.1.49153 > 10.1.1.2.8080: Flags [.], seq 138825:139361, ack 1, win 65535, length 536
6.995113 IP 10.1.1.1.49153 > 10.1.1.2.8080: Flags [.], seq 139361:139897, ack 1, win 65535, length 536
7.005180 IP 10.1.1.2.8080 > 10.1.1.1.49153: Flags [.], ack 138289, win 65535, length 0
7.006105 IP 10.1.1.2.8080 > 10.1.1.1.49153: Flags [.], ack 138289, win 65535, length 0
7.194188 IP 10.1.1.1.49153 > 10.1.1.2.8080: Flags [.], seq 138289:138825, ack 1, win 65535, length 536
7.205180 IP 10.1.1.2.8080 > 10.1.1.1.49153: Flags [.], ack 139897, win 65535, length 0
7.205180 IP 10.1.1.1.49153 > 10.1.1.2.8080: Flags [.], seq 139897:140433, ack 1, win 65535, length 536
7.206105 IP 10.1.1.1.49153 > 10.1.1.2.8080: Flags [.], seq 140433:140969, ack 1, win 65535, length 536
7.217097 IP 10.1.1.2.8080 > 10.1.1.1.49153: Flags [.], ack 140969, win 65535, length 0
7.217097 IP 10.1.1.1.49153 > 10.1.1.2.8080: Flags [.], seq 140969:141505, ack 1, win 65535, length 536
7.218022 IP 10.1.1.1.49153 > 10.1.1.2.8080: Flags [.], seq 141505:142041, ack 1, win 65535, length 536
7.229014 IP 10.1.1.2.8080 > 10.1.1.1.49153: Flags [.], ack 142041, win 65535, length 0
7.229014 IP 10.1.1.1.49153 > 10.1.1.2.8080: Flags [.], seq 142041:142577, ack 1, win 65535, length 536
7.229939 IP 10.1.1.1.49153 > 10.1.1.2.8080: Flags [.], seq 142577:143113, ack 1, win 65535, length 536
7.240931 IP 10.1.1.2.8080 > 10.1.1.1.49153: Flags [.], ack 143113, win 65535, length 0
7.240931 IP 10.1.1.1.49153 > 10.1.1.2.8080: Flags [.], seq 143113:143649, ack 1, win 65535, length 536
7.241856 IP 10.1.1.1.49153 > 10.1.1.2.8080: Flags [.], seq 143649:144185, ack 1, win 65535, length 536
7.252848 IP 10.1.1.2.8080 > 10.1.1.1.49153: Flags [.], ack 144185, win 65535, length 0
7.252848 IP 10.1.1.1.49153 > 10.1.1.2.8080: Flags [.], seq 144721:145257, ack 1, win 65535, length 536
7.253772 IP 10.1.1.1.49153 > 10.1.1.2.8080: Flags [.], seq 145257:145793, ack 1, win 65535, length 536
7.263840 IP 10.1.1.2.8080 > 10.1.1.1.49153: Flags [.], ack 144185, win 65535, length 0
7.264764 IP 10.1.1.2.8080 > 10.1.1.1.49153: Flags [.], ack 144185, win 65535, length 0
7.452848 IP 10.1.1.1.49153 > 10.1.1.2.8080: Flags [.], seq 144185:144721, ack 1, win 65535, length 536
7.463840 IP 10.1.1.2.8080 > 10.1.1.1.49153: Flags [.], ack 145793, win 65535, length 0
7.463840 IP 10.1.1.1.49153 > 10.1.1.2.8080: Flags [.], seq 145793:146329, ack 1, win 65535, length 536
7.464764 IP 10.1.1.1.49153 > 10.1.1.2.8080: Flags [.], seq 146329:146865, ack 1, win 65535, length 536
7.475756 IP 10.1.1.2.8080 > 10.1.1.1.49153: Flags [.], ack 146865, win 65535, length 0
7.475756 IP 10.1.1.1.49153 > 10.1.1.2.8080: Flags [.], seq 146865:147401, ack 1, win 65535, length 536
7.476681 IP 10.1.1.1.49153 > 10.1.1.2.8080: Flags [.], seq 147401:147937, ack 1, win 65535, length 536
7.487673 IP 10.1.1.2.8080 > 10.1.1.1.49153: Flags [.], ack 147937, win 65535, length 0
7.487673 IP 10.1.1.1.49153 > 10.1.1.2.8080: Flags [.], seq 147937:148473, ack 1, win 65535, length 536
7.488598 IP 10.1.1.1.49153 > 10.1.1.2.8080: Flags [.], seq 148473:149009, ack 1, win 65535, length 536
7.499590 IP 10.1.1.2.8080 > 10.1.1.1.49153: Flags [.], ack 149009, win 65535, length 0
7.499590 IP 10.1.1.1.49153 > 10.1.1.2.8080: Flags [.], seq 149009:149545, ack 1, win 65535, length 536
7.500515 IP 10.1.1.1.49153 > 10.1.1.2.8080: Flags [.], seq 149545:150081, ack 1, win 65535, length 536
7.511507 IP 10.1.1.2.8080 > 10.1.1.1.49153: Flags [.], ack 150081, win 65535, length 0
7.511507 IP 10.1.1.1.49153 > 10.1.1.2.8080: Flags [.], seq 150617:151153, ack 1, win 65535, length 536
7.512432 IP 10.1.1.1.49153 > 10.1.1.2.8080: Flags [.], seq 151153:151689, ack 1, win 65535, length 536
7.522499 IP 10.1.1.2.8080 > 10.1.1.1.49153: Flags [.], ack 150081, win 65535, length 0
7.523424 IP 10.1.1.2.8080 > 10.1.1.1.49153: Flags [.], ack 150081, win 65535, length 0
7.711507 IP 10.1.1.1.49153 > 10.1.1.2.8080: Flags [.], seq 150081:150617, ack 1, win 65535, length 536
7.722499 IP 10.1.1.2.8080 > 10.1.1.1.49153: Flags [.], ack 151689, win 65535, length 0
7.722499 IP 10.1.1.1.49153 > 10.1.1.2.8080: Flags [.], seq 151689:152225, ack 1, win 65535, length 536
7.723424 IP 10.1.1.1.49153 > 10.1.1.2.8080: Flags [.], seq 152225:152761, ack 1, win 65535, length 536
7.734416 IP 10.1.1.2.8080 > 10.1.1.1.49153: Flags [.], ack 152761, win 65535, length 0
7.734416 IP 10.1.1.1.49153 > 10.1.1.2.8080: Flags [.], seq 152761:153297, ack 1, win 65535, length 536
7.735340 IP 10.1.1.1.49153 > 10.1.1.2.8080: Flags [.], seq 153297:153833, ack 1, win 65535, length 536
7.746332 IP 10.1.1.2.8080 > 10.1.1.1.49153: Flags [.], ack 153833, win 65535, length 0
7.746332 IP 10.1.1.1.49153 > 10.1.1.2.8080: Flags [.], seq 153833:154369, ack 1, win 65535, length 536
7.747257 IP 10.1.1.1.49153 > 10.1.1.2.8080: Flags [.], seq 154369:154905, ack 1, win 65535, length 536
7.758249 IP 10.1.1.2.8080 > 10.1.1.1.49153: Flags [.], ack 154905, win 65535, length 0
7.758249 IP 10.1.1.1.49153 > 10.1.1.2.8080: Flags [.], seq 154905:155441, ack 1, win 65535, length 536
7.759174 IP 10.1.1.1.49153 > 10.1.1.2.8080: Flags [.], seq 155441:155977, ack 1, win 65535, length 536
7.770166 IP 10.1.1.2.8080 > 10.1.1.1.49153: Flags [.], ack 155977, win 65535, length 0
7.770166 IP 10.1.1.1.49153 > 10.1.1.2.8080: Flags [.], seq 156513:157049, ack 1, win 65535, length 536
7.771091 IP 10.1.1.1.49153 > 10.1.1.2.8080: Flags [.], seq 157049:157585, ack 1, win 65535, length 536
7.781158 IP 10.1.1.2.8080 > 10.1.1.1.49153: Flags [.], ack 155977, win 65535, length 0
7.782083 IP 10.1.1.2.8080 > 10.1.1.1.49153: Flags [.], ack 155977, win 65535, length 0
7.970166 IP 10.1.1.1.49153 > 10.1.1.2.8080: Flags [.], seq 155977:156513, ack 1, win 65535, length 536
7.981158 IP 10.1.1.2.8080 > 10.1.1.1.49153: Flags [.], ack 157585, win 65535, length 0
7.981158 IP 10.1.1.1.49153 > 10.1.1.2.8080: Flags [.], seq 157585:158121, ack 1, win 65535, length 536
7.982083 IP 10.1.1.1.49153 > 10.1.1.2.8080: Flags [.], seq 158121:158657, ack 1, win 65535, length 536
7.993075 IP 10.1.1.2.8080 > 10.1.1.1.49153: Flags [.], ack 158657, win 65535, length 0
7.993075 IP 10.1.1.1.49153 > 10.1.1.2.8080: Flags [.], seq 158657:159193, ack 1, win 65535, length 536
7.994000 IP 10.1.1.1.49153 > 10.1.1.2.8080: Flags [.], seq 159193:159729, ack 1, win 65535, length 536
8.004992 IP 10.1.1.2.8080 > 10.1.1.1.49153: Flags [.], ack 159729, win 65535, length 0
8.004992 IP 10.1.1.1.49153 > 10.1.1.2.8080: Flags [.], seq 159729:160265, ack 1, win 65535, length 536
8.005916 IP 10.1.1.1.49153 > 10.1.1.2.8080: Flags [.], seq 160265:160801, ack 1, win 65535, length 536
8.016908 IP 10.1.1.2.8080 > 10.1.1.1.49153: Flags [.], ack 160801, win 65535, length 0
8.016908 IP 10.1.1.1.49153 > 10.1.1.2.8080: Flags [.], seq 160801:161337, ack 1, win 65535, length 536
8.017833 IP 10.1.1.1.49153 > 10.1.1.2.8080: Flags [.], seq 161337:161873, ack 1, win 65535, length 536
8.028825 IP 10.1.1.2.8080 > 10.1.1.1.49153: Flags [.], ack 161873, win 65535, length 0
8.028825 IP 10.1.1.1.49153 > 10.1.1.2.8080: Flags [.], seq 162409:162945, ack 1, win 65535, length 536
8.029750 IP 10.1.1.1.49153 > 10.1.1.2.8080: Flags [.], seq 162945:163481, ack 1, win 65535, length 536
8.039817 IP 10.1.1.2.8080 > 10.1.1.1.49153: Flags [.], ack 161873, win 65535, length 0
8.040742 IP 10.1.1.2.8080 > 10.1.1.1.49153: Flags [.], ack 161873, win 65535, length 0
8.228825 IP 10.1.1.1.49153 > 10.1.1.2.8080: Flags [.], seq 161873:162409, ack 1, win 65535, length 536
8.239817 IP 10.1.1.2.8080 > 10.1.1.1.49153: Flags [.], ack 163481, win 65535, length 0
8.239817 IP 10.1.1.1.49153 > 10.1.1.2.8080: Flags [.], seq 163481:164017, ack 1, win 65535, length 536
8.240742 IP 10.1.1.1.49153 > 10.1.1.2.8080: Flags [.], seq 164017:164553, ack 1, win 65535, length 536
8.251734 IP 10.1.1.2.8080 > 10.1.1.1.49153: Flags [.], ack 164553, win 65535, length 0
8.251734 IP 10.1.1.1.49153 > 10.1.1.2.8080: Flags [.], seq 164553:165089, ack 1, win 65535, length 536
8.252659 IP 10.1.1.1.49153 > 10.1.1.2.8080: Flags [.], seq 165089:165625, ack 1, win 65535, length 536
8.263651 IP 10.1.1.2.8080 > 10.1.1.1.49153: Flags [.], ack 165625, win 65535, length 0
8.263651 IP 10.1.1.1.49153 > 10.1.1.2.8080: Flags [.], seq 165625:166161, ack 1, win 65535, length 536
8.264576 IP 10.1.1.1.49153 > 10.1.1.2.8080: Flags [.], seq 166161:166697, ack 1, win 65535, length 536
8.275568 IP 10.1.1.2.8080 > 10.1.1.1.49153: Flags [.], ack 166697, win 65535, length 0
8.275568 IP 10.1.1.1.49153 > 10.1.1.2.8080: Flags [.], seq 166697:167233, ack 1, win 65535, length 536
8.276492 IP 10.1.1.1.49153 > 10.1.1.2.8080: Flags [.], seq 167233:167769, ack 1, win 65535, length 536
8.287484 IP 10.1.1.2.8080 > 10.1.1.1.49153: Flags [.], ack 167769, win 65535, length 0
8.287484 IP 10.1.1.1.49153 > 10.1.1.2.8080: Flags [.], seq 168305:168841, ack 1, win 65535, length 536
8.288409 IP 10.1.1.1.49153 > 10.1.1.2.8080: Flags [.], seq 168841:169377, ack 1, win 65535, length 536
8.298476 IP 10.1.1.2.8080 > 10.1.1.1.49153: Flags [.], ack 167769, win 65535, length 0
8.299401 IP 10.1.1.2.8080 > 10.1.1.1.49153: Flags [.], ack 167769, win 65535, length 0
8.487484 IP 10.1.1.1.49153 > 10.1.1.2.8080: Flags [.], seq 167769:168305, ack 1, win 65535, length 536
8.498476 IP 10.1.1.2.8080 > 10.1.1.1.49153: Flags [.], ack 169377, win 65535, length 0
8.498476 IP 10.1.1.1.49153 > 10.1.1.2.8080: Flags [.], seq 169377:169913, ack 1, win 65535, length 536
8.499401 IP 10.1.1.1.49153 > 10.1.1.2.8080: Flags [.], seq 169913:170449, ack 1, win 65535, length 536
8.510393 IP 10.1.1.2.8080 > 10.1.1.1.49153: Flags [.], ack 170449, win 65535, length 0
8.510393 IP 10.1.1.1.49153 > 10.1.1.2.8080: Flags [.], seq 170449:170985, ack 1, win 65535, length 536
8.511318 IP 10.1.1.1.49153 > 10.1.1.2.8080: Flags [.], seq 170985:171521, ack 1, win 65535, length 536
8.522310 IP 10.1.1.2.8080 > 10.1.1.1.49153: Flags [.], ack 171521, win 65535, length 0
8.522310 IP 10.1.1.1.49153 > 10.1.1.2.8080: Flags [.], seq 171521:172057, ack 1, win 65535, length 536
8.523235 IP 10.1.1.1.49153 > 10.1.1.2.8080: Flags [.], seq 172057:172593, ack 1, win 65535, length 536
8.534227 IP 10.1.1.2.8080 > 10.1.1.1.49153: Flags [.], ack 172593, win 65535, length 0
8.534227 IP 10.1.1.1.49153 > 10.1.1.2.8080: Flags [.], seq 172593:173129, ack 1, win 65535, length 536
8.535152 IP 10.1.1.1.49153 > 10.1.1.2.8080: Flags [.], seq 173129:173665, ack 1, win 65535, length 536
8.546144 IP 10.1.1.2.8080 > 10.1.1.1.49153: Flags [.], ack 173665, win 65535, length 0
8.546144 IP 10.1.1.1.49153 > 10.1.1.2.8080: Flags [.], seq 174201:174737, ack 1, win 65535, length 536
8.547068 IP 10.1.1.1.49153 > 10.1.1.2.8080: Flags [.], seq 174737:175273, ack 1, win 65535, length 536
8.557136 IP 10.1.1.2.8080 > 10.1.1.1.49153: Flags [.], ack 173665, win 65535, length 0
8.558060 IP 10.1.1.2.8080 > 10.1.1.1.49153: Flags [.], ack 173665, win 65535, length 0
8.746144 IP 10.1.1.1.49153 > 10.1.1.2.8080: Flags [.], seq 173665:174201, ack 1, win 65535, length 536
8.757136 IP 10.1.1.2.8080 > 10.1.1.1.49153: Flags [.], ack 175273, win 65535, length 0
8.757136 IP 10.1.1.1.49153 > 10.1.1.2.8080: Flags [.], seq 175273:175809, ack 1, win 65535, length 536
8.758060 IP 10.1.1.1.49153 > 10.1.1.2.8080: Flags [.], seq 175809:176345, ack 1, win 65535, length 536
8.769052 IP 10.1.1.2.8080 > 10.1.1.1.49153: Flags [.], ack 176345, win 65535, length 0
8.769052 IP 10.1.1.1.49153 > 10.1.1.2.8080: Flags [.], seq 176345:176881, ack 1, win 65535, length 536
8.769977 IP 10.1.1.1.49153 > 10.1.1.2.8080: Flags [.], seq 176881:177417, ack 1, win 65535, length 536
8.780969 IP 10.1.1.2.8080 > 10.1.1.1.49153: Flags [.], ack 177417, win 65535, length 0
8.780969 IP 10.1.1.1.49153 > 10.1.1.2.8080: Flags [.], seq 177417:177953, ack 1, win 65535, length 536
8.781894 IP 10.1.1.1.49153 > 10.1.1.2.8080: Flags [.], seq 177953:178489, ack 1, win 65535, length 536
8.792886 IP 10.1.1.2.8080 > 10.1.1.1.49153: Flags [.], ack 178489, win 65535, length 0
8.792886 IP 10.1.1.1.49153 > 10.1.1.2.8080: Flags [.], seq 178489:179025, ack 1, win 65535, length 536
8.793811 IP 10.1.1.1.49153 > 10.1.1.2.8080: Flags [.], seq 179025:179561, ack 1, win 65535, length 536
8.804803 IP 10.1.1.2.8080 > 10.1.1.1.49153: Flags [.], ack 179561, win 65535, length 0
8.804803 IP 10.1.1.1.49153 > 10.1.1.2.8080: Flags [.], seq 180097:180633, ack 1, win 65535, length 536
8.805728 IP 10.1.1.1.49153 > 10.1.1.2.8080: Flags [.], seq 180633:181169, ack 1, win 65535, length 536
8.815795 IP 10.1.1.2.8080 > 10.1.1.1.49153: Flags [.], ack 179561, win 65535, length 0
8.816720 IP 10.1.1.2.8080 > 10.1.1.1.49153: Flags [.], ack 179561, win 65535, length 0
9.004803 IP 10.1.1.1.49153 > 10.1.1.2.8080: Flags [.], seq 179561:180097, ack 1, win 65535, length 536
9.015795 IP 10.1.1.2.8080 > 10.1.1.1.49153: Flags [.], ack 181169, win 65535, length 0
9.015795 IP 10.1.1.1.49153 > 10.1.1.2.8080: Flags [.], seq 181169:181705, ack 1, win 65535, length 536
9.016720 IP 10.1.1.1.49153 > 10.1.1.2.8080: Flags [.], seq 181705:182241, ack 1, win 65535, length 536
9.027712 IP 10.1.1.2.8080 > 10.1.1.1.49153: Flags [.], ack 182241, win 65535, length 0
9.027712 IP 10.1.1.1.49153 > 10.1.1.2.8080: Flags [.], seq 182241:182777, ack 1, win 65535, length 536
9.028636 IP 10.1.1.1.49153 > 10.1.1.2.8080: Flags [.], seq 182777:183313, ack 1, win 65535, length 536
9.039628 IP 10.1.1.2.8080 > 10.1.1.1.49153: Flags [.], ack 183313, win 65535, length 0
9.039628 IP 10.1.1.1.49153 > 10.1.1.2.8080: Flags [.], seq 183313:183849, ack 1, win 65535, length 536
9.040553 IP 10.1.1.1.49153 > 10.1.1.2.8080: Flags [.], seq 183849:184385, ack 1, win 65535, length 536
9.051545 IP 10.1.1.2.8080 > 10.1.1.1.49153: Flags [.], ack 184385, win 65535, length 0
9.051545 IP 10.1.1.1.49153 > 10.1.1.2.8080: Flags [.], seq 184385:184921, ack 1, win 65535, length 536
9.052470 IP 10.1.1.1.49153 > 10.1.1.2.8080: Flags [.], seq 184921:185457, ack 1, win 65535, length 536
9.063462 IP 10.1.1.2.8080 > 10.1.1.1.49153: Flags [.], ack 185457, win 65535, length 0
9.063462 IP 10.1.1.1.49153 > 10.1.1.2.8080: Flags [.], seq 185993:186529, ack 1, win 65535, length 536
9.064387 IP 10.1.1.1.49153 > 10.1.1.2.8080: Flags [.], seq 186529:187065, ack 1, win 65535, length 536
9.074454 IP 10.1.1.2.8080 > 10.1.1.1.49153: Flags [.], ack 185457, win 65535, length 0
9.075379 IP 10.1.1.2.8080 > 10.1.1.1.49153: Flags [.], ack 185457, win 65535, length 0
9.263462 IP 10.1.1.1.49153 > 10.1.1.2.8080: Flags [.], seq 185457:185993, ack 1, win 65535, length 536
9.274454 IP 10.1.1.2.8080 > 10.1.1.1.49153: Flags [.], ack 187065, win 65535, length 0
9.274454 IP 10.1.1.1.49153 > 10.1.1.2.8080: Flags [.], seq 187065:187601, ack 1, win 65535, length 536
9.275379 IP 10.1.1.1.49153 > 10.1.1.2.8080: Flags [.], seq 187601:188137, ack 1, win 65535, length 536
9.286371 IP 10.1.1.2.8080 > 10.1.1.1.49153: Flags [.], ack 188137, win 65535, length 0
9.286371 IP 10.1.1.1.49153 > 10.1.1.2.8080: Flags [.], seq 188137:188673, ack 1, win 65535, length 536
9.287296 IP 10.1.1.1.49153 > 10.1.1.2.8080: Flags [.], seq 188673:189209, ack 1, win 65535, length 536
9.298288 IP 10.1.1.2.8080 > 10.1.1.1.49153: Flags [.], ack 189209, win 65535, length 0
9.298288 IP 10.1.1.1.49153 > 10.1.1.2.8080: Flags [.], seq 189209:189745, ack 1, win 65535, length 536
9.299212 IP 10.1.1.1.49153 > 10.1.1.2.8080: Flags [.], seq 189745:190281, ack 1, win 65535, length 536
9.310204 IP 10.1.1.2.8080 > 10.1.1.1.49153: Flags [.], ack 190281, win 65535, length 0
9.310204 IP 10.1.1.1.49153 > 10.1.1.2.8080: Flags [.], seq 190281:190817, ack 1, win 65535, length 536
9.311129 IP 10.1.1.1.49153 > 10.1.1.2.8080: Flags [.], seq 190817:191353, ack 1, win 65535, length 536
9.322121 IP 10.1.1.2.8080 > 10.1.1.1.49153: Flags [.], ack 191353, win 65535, length 0
9.322121 IP 10.1.1.1.49153 > 10.1.1.2.8080: Flags [.], seq 191889:192425, ack 1, win 65535, length 536
9.323046 IP 10.1.1.1.49153 > 10.1.1.2.8080: Flags [.], seq 192425:192961, ack 1, win 65535, length 536
9.333113 IP 10.1.1.2.8080 > 10.1.1.1.49153: Flags [.], ack 191353, win 65535, length 0
9.334038 IP 10.1.1.2.8080 > 10.1.1.1.49153: Flags [.], ack 191353, win 65535, length 0
9.522121 IP 10.1.1.1.49153 > 10.1.1.2.8080: Flags [.], seq 191353:191889, ack 1, win 65535, length 536
9.533113 IP 10.1.1.2.8080 > 10.1.1.1.49153: Flags [.], ack 192961, win 65535, length 0
9.533113 IP 10.1.1.1.49153 > 10.1.1.2.8080: Flags [.], seq 192961:193497, ack 1, win 65535, length 536
9.534038 IP 10.1.1.1.49153 > 10.1.1.2.8080: Flags [.], seq 193497:194033, ack 1, win 65535, length 536
9.545030 IP 10.1.1.2.8080 > 10.1.1.1.49153: Flags [.], ack 194033, win 65535, length 0
9.545030 IP 10.1.1.1.49153 > 10.1.1.2.8080: Flags [.], seq 194033:194569, ack 1, win 65535, length 536
9.545955 IP 10.1.1.1.49153 > 10.1.1.2.8080: Flags [.], seq 194569:195105, ack 1, win 65535, length 536
9.556947 IP 10.1.1.2.8080 > 10.1.1.1.49153: Flags [.], ack 195105, win 65535, length 0
9.556947 IP 10.1.1.1.49153 > 10.1.1.2.8080: Flags [.], seq 195105:195641, ack 1, win 65535, length 536
9.557872 IP 10.1.1.1.49153 > 10.1.1.2.8080: Flags [.], seq 195641:196177, ack 1, win 65535, length 536
9.568864 IP 10.1.1.2.8080 > 10.1.1.1.49153: Flags [.], ack 196177, win 65535, length 0
9.568864 IP 10.1.1.1.49153 > 10.1.1.2.8080: Flags [.], seq 196177:196713, ack 1, win 65535, length 536
9.569788 IP 10.1.1.1.49153 > 10.1.1.2.8080: Flags [.], seq 196713:197249, ack 1, win 65535, length 536
9.580780 IP 10.1.1.2.8080 > 10.1.1.1.49153: Flags [.], ack 197249, win 65535, length 0
9.580780 IP 10.1.1.1.49153 > 10.1.1.2.8080: Flags [.], seq 197785:198321, ack 1, win 65535, length 536
9.581705 IP 10.1.1.1.49153 > 10.1.1.2.8080: Flags [.], seq 198321:198857, ack 1, win 65535, length 536
9.591772 IP 10.1.1.2.8080 > 10.1.1.1.49153: Flags [.], ack 197249, win 65535, length 0
9.592697 IP 10.1.1.2.8080 > 10.1.1.1.49153: Flags [.], ack 197249, win 65535, length 0
9.780780 IP 10.1.1.1.49153 > 10.1.1.2.8080: Flags [.], seq 197249:197785, ack 1, win 65535, length 536
9.791772 IP 10.1.1.2.8080 > 10.1.1.1.49153: Flags [.], ack 198857, win 65535, length 0
9.791772 IP 10.1.1.1.49153 > 10.1.1.2.8080: Flags [.], seq 198857:199393, ack 1, win 65535, length 536
9.792697 IP 10.1.1.1.49153 > 10.1.1.2.8080: Flags [.], seq 199393:199929, ack 1, win 65535, length 536
9.803689 IP 10.1.1.2.8080 > 10.1.1.1.49153: Flags [.], ack 199929, win 65535, length 0
9.803689 IP 10.1.1.1.49153 > 10.1.1.2.8080: Flags [.], seq 199929:200465, ack 1, win 65535, length 536
9.804614 IP 10.1.1.1.49153 > 10.1.1.2.8080: Flags [.], seq 200465:201001, ack 1, win 65535, length 536
9.815606 IP 10.1.1.2.8080 > 10.1.1.1.49153: Flags [.], ack 201001, win 65535, length 0
9.815606 IP 10.1.1.1.49153 > 10.1.1.2.8080: Flags [.], seq 201001:201537, ack 1, win 65535, length 536
9.816531 IP 10.1.1.1.49153 > 10.1.1.2.8080: Flags [.], seq 201537:202073, ack 1, win 65535, length 536
9.827523 IP 10.1.1.2.8080 > 10.1.1.1.49153: Flags [.], ack 202073, win 65535, length 0
9.827523 IP 10.1.1.1.49153 > 10.1.1.2.8080: Flags [.], seq 202073:202609, ack 1, win 65535, length 536
9.828448 IP 10.1.1.1.49153 > 10.1.1.2.8080: Flags [.], seq 202609:203145, ack 1, win 65535, length 536
9.839440 IP 10.1.1.2.8080 > 10.1.1.1.49153: Flags [.], ack 203145, win 65535, length 0
9.839440 IP 10.1.1.1.49153 > 10.1.1.2.8080: Flags [.], seq 203681:204217, ack 1, win 65535, length 536
9.840364 IP 10.1.1.1.49153 > 10.1.1.2.8080: Flags [.], seq 204217:204753, ack 1, win 65535, length 536
9.850432 IP 10.1.1.2.8080 > 10.1.1.1.49153: Flags [.], ack 203145, win 65535, length 0
9.851356 IP 10.1.1.2.8080 > 10.1.1.1.49153: Flags [.], ack 203145, win 65535, length 0
