1.000000 IP 10.1.1.1.49153 > 10.1.1.2.8080: Flags [S], seq 0, win 65535, length 0
1.200134 IP 10.1.1.2.8080 > 10.1.1.1.49153: Flags [S.], seq 0, ack 1, win 65535, length 0
1.200134 IP 10.1.1.1.49153 > 10.1.1.2.8080: Flags [.], ack 1, win 65535, length 0
1.200201 IP 10.1.1.1.49153 > 10.1.1.2.8080: Flags [.], seq 1:537, ack 1, win 65535, length 536
1.401193 IP 10.1.1.2.8080 > 10.1.1.1.49153: Flags [.], ack 537, win 65535, length 0
1.401193 IP 10.1.1.1.49153 > 10.1.1.2.8080: Flags [.], seq 537:1073, ack 1, win 65535, length 536
1.402118 IP 10.1.1.1.49153 > 10.1.1.2.8080: Flags [.], seq 1073:1609, ack 1, win 65535, length 536
1.603110 IP 10.1.1.2.8080 > 10.1.1.1.49153: Flags [.], ack 1609, win 65535, length 0
1.603110 IP 10.1.1.1.49153 > 10.1.1.2.8080: Flags [.], seq 1609:2145, ack 1, win 65535, length 536
1.604035 IP 10.1.1.1.49153 > 10.1.1.2.8080: Flags [.], seq 2145:2681, ack 1, win 65535, length 536
1.604960 IP 10.1.1.1.49153 > 10.1.1.2.8080: Flags [.], seq 2681:3217, ack 1, win 65535, length 536
1.805027 IP 10.1.1.2.8080 > 10.1.1.1.49153: Flags [.], ack 2681, win 65535, length 0
1.805027 IP 10.1.1.1.49153 > 10.1.1.2.8080: Flags [.], seq 3217:3753, ack 1, win 65535, length 536
1.805952 IP 10.1.1.1.49153 > 10.1.1.2.8080: Flags [.], seq 3753:4289, ack 1, win 65535, length 536
1.806876 IP 10.1.1.1.49153 > 10.1.1.2.8080: Flags [.], seq 4289:4825, ack 1, win 65535, length 536
2.005952 IP 10.1.1.2.8080 > 10.1.1.1.49153: Flags [.], ack 3217, win 65535, length 0
2.005952 IP 10.1.1.1.49153 > 10.1.1.2.8080: Flags [.], seq 4825:5361, ack 1, win 65535, length 536
2.006876 IP 10.1.1.1.49153 > 10.1.1.2.8080: Flags [.], seq 5361:5897, ack 1, win 65535, length 536
2.006944 IP 10.1.1.2.8080 > 10.1.1.1.49153: Flags [.], ack 4289, win 65535, length 0
2.007801 IP 10.1.1.1.49153 > 10.1.1.2.8080: Flags [.], seq 5897:6433, ack 1, win 65535, length 536
2.008726 IP 10.1.1.1.49153 > 10.1.1.2.8080: Flags [.], seq 6433:6969, ack 1, win 65535, length 536
2.009651 IP 10.1.1.1.49153 > 10.1.1.2.8080: Flags [.], seq 6969:7505, ack 1, win 65535, length 536
2.206944 IP 10.1.1.2.8080 > 10.1.1.1.49153: Flags [.], ack 5361, win 65535, length 0
2.206944 IP 10.1.1.1.49153 > 10.1.1.2.8080: Flags [.], seq 7505:8041, ack 1, win 65535, length 536
2.207868 IP 10.1.1.1.49153 > 10.1.1.2.8080: Flags [.], seq 8041:8577, ack 1, win 65535, length 536
2.208793 IP 10.1.1.2.8080 > 10.1.1.1.49153: Flags [.], ack 6433, win 65535, length 0
2.208793 IP 10.1.1.1.49153 > 10.1.1.2.8080: Flags [.], seq 8577:9113, ack 1, win 65535, length 536
2.209718 IP 10.1.1.1.49153 > 10.1.1.2.8080: Flags [.], seq 9113:9649, ack 1, win 65535, length 536
2.210643 IP 10.1.1.2.8080 > 10.1.1.1.49153: Flags [.], ack 7505, win 65535, length 0
2.210643 IP 10.1.1.1.49153 > 10.1.1.2.8080: Flags [.], seq 9649:10185, ack 1, win 65535, length 536
2.211568 IP 10.1.1.1.49153 > 10.1.1.2.8080: Flags [.], seq 10185:10721, ack 1, win 65535, length 536
2.212492 IP 10.1.1.1.49153 > 10.1.1.2.8080: Flags [.], seq 10721:11257, ack 1, win 65535, length 536
2.213417 IP 10.1.1.1.49153 > 10.1.1.2.8080: Flags [.], seq 11257:11793, ack 1, win 65535, length 536
2.214342 IP 10.1.1.1.49153 > 10.1.1.2.8080: Flags [.], seq 11793:12329, ack 1, win 65535, length 536
2.408860 IP 10.1.1.2.8080 > 10.1.1.1.49153: Flags [.], ack 8577, win 65535, length 0
2.408860 IP 10.1.1.1.49153 > 10.1.1.2.8080: Flags [.], seq 12329:12865, ack 1, win 65535, length 536
2.409785 IP 10.1.1.1.49153 > 10.1.1.2.8080: Flags [.], seq 12865:13401, ack 1, win 65535, length 536
2.410710 IP 10.1.1.2.8080 > 10.1.1.1.49153: Flags [.], ack 9649, win 65535, length 0
2.410710 IP 10.1.1.1.49153 > 10.1.1.2.8080: Flags [.], seq 13401:13937, ack 1, win 65535, length 536
2.411635 IP 10.1.1.1.49153 > 10.1.1.2.8080: Flags [.], seq 13937:14473, ack 1, win 65535, length 536
2.412560 IP 10.1.1.2.8080 > 10.1.1.1.49153: Flags [.], ack 10721, win 65535, length 0
2.412560 IP 10.1.1.1.49153 > 10.1.1.2.8080: Flags [.], seq 14473:15009, ack 1, win 65535, length 536
2.413484 IP 10.1.1.1.49153 > 10.1.1.2.8080: Flags [.], seq 15009:15545, ack 1, win 65535, length 536
2.414409 IP 10.1.1.2.8080 > 10.1.1.1.49153: Flags [.], ack 11793, win 65535, length 0
2.414409 IP 10.1.1.1.49153 > 10.1.1.2.8080: Flags [.], seq 15545:16081, ack 1, win 65535, length 536
2.415334 IP 10.1.1.1.49153 > 10.1.1.2.8080: Flags [.], seq 16081:16617, ack 1, win 65535, length 536
2.416259 IP 10.1.1.1.49153 > 10.1.1.2.8080: Flags [.], seq 16617:17153, ack 1, win 65535, length 536
2.417184 IP 10.1.1.1.49153 > 10.1.1.2.8080: Flags [.], seq 17153:17689, ack 1, win 65535, length 536
2.418108 IP 10.1.1.1.49153 > 10.1.1.2.8080: Flags [.], seq 17689:18225, ack 1, win 65535, length 536
2.419033 IP 10.1.1.1.49153 > 10.1.1.2.8080: Flags [.], seq 18225:18761, ack 1, win 65535, length 536
2.609852 IP 10.1.1.2.8080 > 10.1.1.1.49153: Flags [.], ack 12865, win 65535, length 0
2.609852 IP 10.1.1.1.49153 > 10.1.1.2.8080: Flags [.], seq 18761:19297, ack 1, win 65535, length 536
2.610777 IP 10.1.1.1.49153 > 10.1.1.2.8080: Flags [.], seq 19297:19833, ack 1, win 65535, length 536
2.611702 IP 10.1.1.2.8080 > 10.1.1.1.49153: Flags [.], ack 13937, win 65535, length 0
2.611702 IP 10.1.1.1.49153 > 10.1.1.2.8080: Flags [.], seq 19833:20369, ack 1, win 65535, length 536
2.612627 IP 10.1.1.1.49153 > 10.1.1.2.8080: Flags [.], seq 20369:20905, ack 1, win 65535, length 536
2.613552 IP 10.1.1.2.8080 > 10.1.1.1.49153: Flags [.], ack 15009, win 65535, length 0
2.613552 IP 10.1.1.1.49153 > 10.1.1.2.8080: Flags [.], seq 20905:21441, ack 1, win 65535, length 536
2.614476 IP 10.1.1.1.49153 > 10.1.1.2.8080: Flags [.], seq 21441:21977, ack 1, win 65535, length 536
2.615401 IP 10.1.1.2.8080 > 10.1.1.1.49153: Flags [.], ack 16081, win 65535, length 0
2.615401 IP 10.1.1.1.49153 > 10.1.1.2.8080: Flags [.], seq 21977:22513, ack 1, win 65535, length 536
2.616326 IP 10.1.1.1.49153 > 10.1.1.2.8080: Flags [.], seq 22513:23049, ack 1, win 65535, length 536
2.617251 IP 10.1.1.2.8080 > 10.1.1.1.49153: Flags [.], ack 17153, win 65535, length 0
2.617251 IP 10.1.1.1.49153 > 10.1.1.2.8080: Flags [.], seq 23049:23585, ack 1, win 65535, length 536
2.618176 IP 10.1.1.1.49153 > 10.1.1.2.8080: Flags [.], seq 23585:24121, ack 1, win 65535, length 536
2.619100 IP 10.1.1.2.8080 > 10.1.1.1.49153: Flags [.], ack 18225, win 65535, length 0
2.619100 IP 10.1.1.1.49153 > 10.1.1.2.8080: Flags [.], seq 24121:24657, ack 1, win 65535, length 536
2.620025 IP 10.1.1.1.49153 > 10.1.1.2.8080: Flags [.], seq 24657:25193, ack 1, win 65535, length 536
2.620950 IP 10.1.1.1.49153 > 10.1.1.2.8080: Flags [.], seq 25193:25729, ack 1, win 65535, length 536
2.621875 IP 10.1.1.1.49153 > 10.1.1.2.8080: Flags [.], seq 25729:26265, ack 1, win 65535, length 536
2.622800 IP 10.1.1.1.49153 > 10.1.1.2.8080: Flags [.], seq 26265:26801, ack 1, win 65535, length 536
2.623724 IP 10.1.1.1.49153 > 10.1.1.2.8080: Flags [.], seq 26801:27337, ack 1, win 65535, length 536
2.624649 IP 10.1.1.1.49153 > 10.1.1.2.8080: Flags [.], seq 27337:27873, ack 1, win 65535, length 536
2.625574 IP 10.1.1.1.49153 > 10.1.1.2.8080: Flags [.], seq 27873:28409, ack 1, win 65535, length 536
2.810844 IP 10.1.1.2.8080 > 10.1.1.1.49153: Flags [.], ack 19297, win 65535, length 0
2.810844 IP 10.1.1.1.49153 > 10.1.1.2.8080: Flags [.], seq 28409:28945, ack 1, win 65535, length 536
2.811769 IP 10.1.1.1.49153 > 10.1.1.2.8080: Flags [.], seq 28945:29481, ack 1, win 65535, length 536
2.812694 IP 10.1.1.2.8080 > 10.1.1.1.49153: Flags [.], ack 20369, win 65535, length 0
2.812694 IP 10.1.1.1.49153 > 10.1.1.2.8080: Flags [.], seq 29481:30017, ack 1, win 65535, length 536
2.813619 IP 10.1.1.1.49153 > 10.1.1.2.8080: Flags [.], seq 30017:30553, ack 1, win 65535, length 536
2.814544 IP 10.1.1.2.8080 > 10.1.1.1.49153: Flags [.], ack 21441, win 65535, length 0
2.814544 IP 10.1.1.1.49153 > 10.1.1.2.8080: Flags [.], seq 30553:31089, ack 1, win 65535, length 536
2.815468 IP 10.1.1.1.49153 > 10.1.1.2.8080: Flags [.], seq 31089:31625, ack 1, win 65535, length 536
2.816393 IP 10.1.1.2.8080 > 10.1.1.1.49153: Flags [.], ack 22513, win 65535, length 0
2.816393 IP 10.1.1.1.49153 > 10.1.1.2.8080: Flags [.], seq 31625:32161, ack 1, win 65535, length 536
2.817318 IP 10.1.1.1.49153 > 10.1.1.2.8080: Flags [.], seq 32161:32697, ack 1, win 65535, length 536
2.818243 IP 10.1.1.2.8080 > 10.1.1.1.49153: Flags [.], ack 23585, win 65535, length 0
2.818243 IP 10.1.1.1.49153 > 10.1.1.2.8080: Flags [.], seq 32697:33233, ack 1, win 65535, length 536
2.819168 IP 10.1.1.1.49153 > 10.1.1.2.8080: Flags [.], seq 33233:33769, ack 1, win 65535, length 536
2.820092 IP 10.1.1.2.8080 > 10.1.1.1.49153: Flags [.], ack 24657, win 65535, length 0
2.820092 IP 10.1.1.1.49153 > 10.1.1.2.8080: Flags [.], seq 33769:34305, ack 1, win 65535, length 536
2.821017 IP 10.1.1.1.49153 > 10.1.1.2.8080: Flags [.], seq 34305:34841, ack 1, win 65535, length 536
2.821942 IP 10.1.1.2.8080 > 10.1.1.1.49153: Flags [.], ack 25729, win 65535, length 0
2.821942 IP 10.1.1.1.49153 > 10.1.1.2.8080: Flags [.], seq 34841:35377, ack 1, win 65535, length 536
2.822867 IP 10.1.1.1.49153 > 10.1.1.2.8080: Flags [.], seq 35377:35913, ack 1, win 65535, length 536
2.823792 IP 10.1.1.2.8080 > 10.1.1.1.49153: Flags [.], ack 26801, win 65535, length 0
2.823792 IP 10.1.1.1.49153 > 10.1.1.2.8080: Flags [.], seq 35913:36449, ack 1, win 65535, length 536
2.824716 IP 10.1.1.1.49153 > 10.1.1.2.8080: Flags [.], seq 36449:36985, ack 1, win 65535, length 536
2.825641 IP 10.1.1.2.8080 > 10.1.1.1.49153: Flags [.], ack 27873, win 65535, length 0
2.825641 IP 10.1.1.1.49153 > 10.1.1.2.8080: Flags [.], seq 36985:37521, ack 1, win 65535, length 536
2.826566 IP 10.1.1.1.49153 > 10.1.1.2.8080: Flags [.], seq 37521:38057, ack 1, win 65535, length 536
2.827491 IP 10.1.1.1.49153 > 10.1.1.2.8080: Flags [.], seq 38057:38593, ack 1, win 65535, length 536
2.828416 IP 10.1.1.1.49153 > 10.1.1.2.8080: Flags [.], seq 38593:39129, ack 1, win 65535, length 536
2.829340 IP 10.1.1.1.49153 > 10.1.1.2.8080: Flags [.], seq 39129:39665, ack 1, win 65535, length 536
2.830265 IP 10.1.1.1.49153 > 10.1.1.2.8080: Flags [.], seq 39665:40201, ack 1, win 65535, length 536
2.831190 IP 10.1.1.1.49153 > 10.1.1.2.8080: Flags [.], seq 40201:40737, ack 1, win 65535, length 536
2.832115 IP 10.1.1.1.49153 > 10.1.1.2.8080: Flags [.], seq 40737:41273, ack 1, win 65535, length 536
2.833040 IP 10.1.1.1.49153 > 10.1.1.2.8080: Flags [.], seq 41273:41809, ack 1, win 65535, length 536
2.833964 IP 10.1.1.1.49153 > 10.1.1.2.8080: Flags [.], seq 41809:42345, ack 1, win 65535, length 536
2.834889 IP 10.1.1.1.49153 > 10.1.1.2.8080: Flags [.], seq 42345:42881, ack 1, win 65535, length 536
3.011836 IP 10.1.1.2.8080 > 10.1.1.1.49153: Flags [.], ack 28945, win 65535, length 0
3.011836 IP 10.1.1.1.49153 > 10.1.1.2.8080: Flags [.], seq 42881:43417, ack 1, win 65535, length 536
3.012761 IP 10.1.1.1.49153 > 10.1.1.2.8080: Flags [.], seq 43417:43953, ack 1, win 65535, length 536
3.013686 IP 10.1.1.2.8080 > 10.1.1.1.49153: Flags [.], ack 30017, win 65535, length 0
3.013686 IP 10.1.1.1.49153 > 10.1.1.2.8080: Flags [.], seq 43953:44489, ack 1, win 65535, length 536
3.014611 IP 10.1.1.1.49153 > 10.1.1.2.8080: Flags [.], seq 44489:45025, ack 1, win 65535, length 536
3.015536 IP 10.1.1.2.8080 > 10.1.1.1.49153: Flags [.], ack 31089, win 65535, length 0
3.015536 IP 10.1.1.1.49153 > 10.1.1.2.8080: Flags [.], seq 45025:45561, ack 1, win 65535, length 536
3.016460 IP 10.1.1.1.49153 > 10.1.1.2.8080: Flags [.], seq 45561:46097, ack 1, win 65535, length 536
3.017385 IP 10.1.1.2.8080 > 10.1.1.1.49153: Flags [.], ack 32161, win 65535, length 0
3.017385 IP 10.1.1.1.49153 > 10.1.1.2.8080: Flags [.], seq 46097:46633, ack 1, win 65535, length 536
3.018310 IP 10.1.1.1.49153 > 10.1.1.2.8080: Flags [.], seq 46633:47169, ack 1, win 65535, length 536
3.019235 IP 10.1.1.2.8080 > 10.1.1.1.49153: Flags [.], ack 33233, win 65535, length 0
3.019235 IP 10.1.1.1.49153 > 10.1.1.2.8080: Flags [.], seq 47169:47705, ack 1, win 65535, length 536
3.020160 IP 10.1.1.1.49153 > 10.1.1.2.8080: Flags [.], seq 47705:48241, ack 1, win 65535, length 536
3.021084 IP 10.1.1.2.8080 > 10.1.1.1.49153: Flags [.], ack 34305, win 65535, length 0
3.021084 IP 10.1.1.1.49153 > 10.1.1.2.8080: Flags [.], seq 48241:48777, ack 1, win 65535, length 536
3.022009 IP 10.1.1.1.49153 > 10.1.1.2.8080: Flags [.], seq 48777:49313, ack 1, win 65535, length 536
3.022934 IP 10.1.1.2.8080 > 10.1.1.1.49153: Flags [.], ack 35377, win 65535, length 0
3.022934 IP 10.1.1.1.49153 > 10.1.1.2.8080: Flags [.], seq 49313:49849, ack 1, win 65535, length 536
3.023859 IP 10.1.1.1.49153 > 10.1.1.2.8080: Flags [.], seq 49849:50385, ack 1, win 65535, length 536
3.024784 IP 10.1.1.2.8080 > 10.1.1.1.49153: Flags [.], ack 36449, win 65535, length 0
3.024784 IP 10.1.1.1.49153 > 10.1.1.2.8080: Flags [.], seq 50385:50921, ack 1, win 65535, length 536
3.025708 IP 10.1.1.1.49153 > 10.1.1.2.8080: Flags [.], seq 50921:51457, ack 1, win 65535, length 536
3.026633 IP 10.1.1.2.8080 > 10.1.1.1.49153: Flags [.], ack 37521, win 65535, length 0
3.026633 IP 10.1.1.1.49153 > 10.1.1.2.8080: Flags [.], seq 51457:51993, ack 1, win 65535, length 536
3.027558 IP 10.1.1.1.49153 > 10.1.1.2.8080: Flags [.], seq 51993:52529, ack 1, win 65535, length 536
3.028483 IP 10.1.1.2.8080 > 10.1.1.1.49153: Flags [.], ack 38593, win 65535, length 0
3.028483 IP 10.1.1.1.49153 > 10.1.1.2.8080: Flags [.], seq 52529:53065, ack 1, win 65535, length 536
3.029408 IP 10.1.1.1.49153 > 10.1.1.2.8080: Flags [.], seq 53065:53601, ack 1, win 65535, length 536
3.030332 IP 10.1.1.2.8080 > 10.1.1.1.49153: Flags [.], ack 39665, win 65535, length 0
3.030332 IP 10.1.1.1.49153 > 10.1.1.2.8080: Flags [.], seq 53601:54137, ack 1, win 65535, length 536
3.031257 IP 10.1.1.1.49153 > 10.1.1.2.8080: Flags [.], seq 54137:54673, ack 1, win 65535, length 536
3.032182 IP 10.1.1.2.8080 > 10.1.1.1.49153: Flags [.], ack 40737, win 65535, length 0
3.032182 IP 10.1.1.1.49153 > 10.1.1.2.8080: Flags [.], seq 54673:55209, ack 1, win 65535, length 536
3.033107 IP 10.1.1.1.49153 > 10.1.1.2.8080: Flags [.], seq 55209:55745, ack 1, win 65535, length 536
3.034032 IP 10.1.1.2.8080 > 10.1.1.1.49153: Flags [.], ack 41809, win 65535, length 0
3.034032 IP 10.1.1.1.49153 > 10.1.1.2.8080: Flags [.], seq 55745:56281, ack 1, win 65535, length 536
3.034956 IP 10.1.1.1.49153 > 10.1.1.2.8080: Flags [.], seq 56281:56817, ack 1, win 65535, length 536
3.035881 IP 10.1.1.2.8080 > 10.1.1.1.49153: Flags [.], ack 42881, win 65535, length 0
3.035881 IP 10.1.1.1.49153 > 10.1.1.2.8080: Flags [.], seq 56817:57353, ack 1, win 65535, length 536
3.036806 IP 10.1.1.1.49153 > 10.1.1.2.8080: Flags [.], seq 57353:57889, ack 1, win 65535, length 536
3.037731 IP 10.1.1.1.49153 > 10.1.1.2.8080: Flags [.], seq 57889:58425, ack 1, win 65535, length 536
3.038656 IP 10.1.1.1.49153 > 10.1.1.2.8080: Flags [.], seq 58961:59497, ack 1, win 65535, length 536
3.039580 IP 10.1.1.1.49153 > 10.1.1.2.8080: Flags [.], seq 59497:60033, ack 1, win 65535, length 536
3.040505 IP 10.1.1.1.49153 > 10.1.1.2.8080: Flags [.], seq 60569:61105, ack 1, win 65535, length 536
3.041430 IP 10.1.1.1.49153 > 10.1.1.2.8080: Flags [.], seq 61105:61641, ack 1, win 65535, length 536
3.042355 IP 10.1.1.1.49153 > 10.1.1.2.8080: Flags [.], seq 62177:62713, ack 1, win 65535, length 536
3.043280 IP 10.1.1.1.49153 > 10.1.1.2.8080: Flags [.], seq 62713:63249, ack 1, win 65535, length 536
3.044204 IP 10.1.1.1.49153 > 10.1.1.2.8080: Flags [.], seq 63785:64321, ack 1, win 65535, length 536
3.045129 IP 10.1.1.1.49153 > 10.1.1.2.8080: Flags [.], seq 64321:64857, ack 1, win 65535, length 536
3.213753 IP 10.1.1.2.8080 > 10.1.1.1.49153: Flags [.], ack 43953, win 65535, length 0
3.213753 IP 10.1.1.1.49153 > 10.1.1.2.8080: Flags [.], seq 65393:65929, ack 1, win 65535, length 536
3.214678 IP 10.1.1.1.49153 > 10.1.1.2.8080: Flags [.], seq 65929:66465, ack 1, win 65535, length 536
3.215603 IP 10.1.1.2.8080 > 10.1.1.1.49153: Flags [.], ack 45025, win 65535, length 0
3.215603 IP 10.1.1.1.49153 > 10.1.1.2.8080: Flags [.], seq 66465:67001, ack 1, win 65535, length 536
3.216528 IP 10.1.1.1.49153 > 10.1.1.2.8080: Flags [.], seq 67001:67537, ack 1, win 65535, length 536
3.217452 IP 10.1.1.2.8080 > 10.1.1.1.49153: Flags [.], ack 46097, win 65535, length 0
3.217452 IP 10.1.1.1.49153 > 10.1.1.2.8080: Flags [.], seq 67537:68073, ack 1, win 65535, length 536
3.218377 IP 10.1.1.1.49153 > 10.1.1.2.8080: Flags [.], seq 68073:68609, ack 1, win 65535, length 536
3.219302 IP 10.1.1.2.8080 > 10.1.1.1.49153: Flags [.], ack 47169, win 65535, length 0
3.219302 IP 10.1.1.1.49153 > 10.1.1.2.8080: Flags [.], seq 68609:69145, ack 1, win 65535, length 536
3.220227 IP 10.1.1.1.49153 > 10.1.1.2.8080: Flags [.], seq 69145:69681, ack 1, win 65535, length 536
3.221152 IP 10.1.1.2.8080 > 10.1.1.1.49153: Flags [.], ack 48241, win 65535, length 0
3.221152 IP 10.1.1.1.49153 > 10.1.1.2.8080: Flags [.], seq 69681:70217, ack 1, win 65535, length 536
3.222076 IP 10.1.1.1.49153 > 10.1.1.2.8080: Flags [.], seq 70217:70753, ack 1, win 65535, length 536
3.223001 IP 10.1.1.2.8080 > 10.1.1.1.49153: Flags [.], ack 49313, win 65535, length 0
3.223001 IP 10.1.1.1.49153 > 10.1.1.2.8080: Flags [.], seq 70753:71289, ack 1, win 65535, length 536
3.223926 IP 10.1.1.1.49153 > 10.1.1.2.8080: Flags [.], seq 71289:71825, ack 1, win 65535, length 536
3.224851 IP 10.1.1.2.8080 > 10.1.1.1.49153: Flags [.], ack 50385, win 65535, length 0
3.224851 IP 10.1.1.1.49153 > 10.1.1.2.8080: Flags [.], seq 71825:72361, ack 1, win 65535, length 536
3.225776 IP 10.1.1.1.49153 > 10.1.1.2.8080: Flags [.], seq 72361:72897, ack 1, win 65535, length 536
3.226700 IP 10.1.1.2.8080 > 10.1.1.1.49153: Flags [.], ack 51457, win 65535, length 0
3.226700 IP 10.1.1.1.49153 > 10.1.1.2.8080: Flags [.], seq 72897:73433, ack 1, win 65535, length 536
3.227625 IP 10.1.1.1.49153 > 10.1.1.2.8080: Flags [.], seq 73433:73969, ack 1, win 65535, length 536
3.228550 IP 10.1.1.2.8080 > 10.1.1.1.49153: Flags [.], ack 52529, win 65535, length 0
3.228550 IP 10.1.1.1.49153 > 10.1.1.2.8080: Flags [.], seq 73969:74505, ack 1, win 65535, length 536
3.229475 IP 10.1.1.1.49153 > 10.1.1.2.8080: Flags [.], seq 74505:75041, ack 1, win 65535, length 536
3.230400 IP 10.1.1.2.8080 > 10.1.1.1.49153: Flags [.], ack 53601, win 65535, length 0
3.230400 IP 10.1.1.1.49153 > 10.1.1.2.8080: Flags [.], seq 75041:75577, ack 1, win 65535, length 536
3.231324 IP 10.1.1.1.49153 > 10.1.1.2.8080: Flags [.], seq 75577:76113, ack 1, win 65535, length 536
3.232249 IP 10.1.1.2.8080 > 10.1.1.1.49153: Flags [.], ack 54673, win 65535, length 0
3.232249 IP 10.1.1.1.49153 > 10.1.1.2.8080: Flags [.], seq 76113:76649, ack 1, win 65535, length 536
3.233174 IP 10.1.1.1.49153 > 10.1.1.2.8080: Flags [.], seq 76649:77185, ack 1, win 65535, length 536
3.234099 IP 10.1.1.2.8080 > 10.1.1.1.49153: Flags [.], ack 55745, win 65535, length 0
3.234099 IP 10.1.1.1.49153 > 10.1.1.2.8080: Flags [.], seq 77185:77721, ack 1, win 65535, length 536
3.235024 IP 10.1.1.1.49153 > 10.1.1.2.8080: Flags [.], seq 77721:78257, ack 1, win 65535, length 536
3.235948 IP 10.1.1.2.8080 > 10.1.1.1.49153: Flags [.], ack 56817, win 65535, length 0
3.235948 IP 10.1.1.1.49153 > 10.1.1.2.8080: Flags [.], seq 78257:78793, ack 1, win 65535, length 536
3.236873 IP 10.1.1.1.49153 > 10.1.1.2.8080: Flags [.], seq 78793:79329, ack 1, win 65535, length 536
3.237798 IP 10.1.1.2.8080 > 10.1.1.1.49153: Flags [.], ack 57889, win 65535, length 0
3.237798 IP 10.1.1.1.49153 > 10.1.1.2.8080: Flags [.], seq 79329:79865, ack 1, win 65535, length 536
3.238723 IP 10.1.1.1.49153 > 10.1.1.2.8080: Flags [.], seq 79865:80401, ack 1, win 65535, length 536
3.239648 IP 10.1.1.2.8080 > 10.1.1.1.49153: Flags [.], ack 58425, win 65535, length 0
3.239648 IP 10.1.1.1.49153 > 10.1.1.2.8080: Flags [.], seq 80401:80937, ack 1, win 65535, length 536
3.240572 IP 10.1.1.2.8080 > 10.1.1.1.49153: Flags [.], ack 58425, win 65535, length 0
3.240572 IP 10.1.1.1.49153 > 10.1.1.2.8080: Flags [.], seq 81473:82009, ack 1, win 65535, length 536
3.241497 IP 10.1.1.2.8080 > 10.1.1.1.49153: Flags [.], ack 58425, win 65535, length 0
3.241497 IP 10.1.1.1.49153 > 10.1.1.2.8080: Flags [.], seq 82009:82545, ack 1, win 65535, length 536
3.242422 IP 10.1.1.2.8080 > 10.1.1.1.49153: Flags [.], ack 58425, win 65535, length 0
3.242422 IP 10.1.1.1.49153 > 10.1.1.2.8080: Flags [.], seq 83081:83617, ack 1, win 65535, length 536
3.243347 IP 10.1.1.2.8080 > 10.1.1.1.49153: Flags [.], ack 58425, win 65535, length 0
3.243347 IP 10.1.1.1.49153 > 10.1.1.2.8080: Flags [.], seq 83617:84153, ack 1, win 65535, length 536
3.244272 IP 10.1.1.2.8080 > 10.1.1.1.49153: Flags [.], ack 58425, win 65535, length 0
3.244272 IP 10.1.1.1.49153 > 10.1.1.2.8080: Flags [.], seq 84689:85225, ack 1, win 65535, length 536
3.245196 IP 10.1.1.2.8080 > 10.1.1.1.49153: Flags [.], ack 58425, win 65535, length 0
3.245196 IP 10.1.1.1.49153 > 10.1.1.2.8080: Flags [.], seq 85225:85761, ack 1, win 65535, length 536
3.246121 IP 10.1.1.2.8080 > 10.1.1.1.49153: Flags [.], ack 58425, win 65535, length 0
3.246121 IP 10.1.1.1.49153 > 10.1.1.2.8080: Flags [.], seq 86297:86833, ack 1, win 65535, length 536
3.247046 IP 10.1.1.1.49153 > 10.1.1.2.8080: Flags [.], seq 86833:87369, ack 1, win 65535, length 536
3.247971 IP 10.1.1.1.49153 > 10.1.1.2.8080: Flags [.], seq 87905:88441, ack 1, win 65535, length 536
3.248896 IP 10.1.1.1.49153 > 10.1.1.2.8080: Flags [.], seq 88441:88977, ack 1, win 65535, length 536
3.249820 IP 10.1.1.1.49153 > 10.1.1.2.8080: Flags [.], seq 58425:58961, ack 1, win 65535, length 536
3.414745 IP 10.1.1.2.8080 > 10.1.1.1.49153: Flags [.], ack 58425, win 65535, length 0
3.415670 IP 10.1.1.2.8080 > 10.1.1.1.49153: Flags [.], ack 58425, win 65535, length 0
3.416595 IP 10.1.1.2.8080 > 10.1.1.1.49153: Flags [.], ack 58425, win 65535, length 0
3.417520 IP 10.1.1.2.8080 > 10.1.1.1.49153: Flags [.], ack 58425, win 65535, length 0
3.418444 IP 10.1.1.2.8080 > 10.1.1.1.49153: Flags [.], ack 58425, win 65535, length 0
3.419369 IP 10.1.1.2.8080 > 10.1.1.1.49153: Flags [.], ack 58425, win 65535, length 0
3.420294 IP 10.1.1.2.8080 > 10.1.1.1.49153: Flags [.], ack 58425, win 65535, length 0
3.421219 IP 10.1.1.2.8080 > 10.1.1.1.49153: Flags [.], ack 58425, win 65535, length 0
3.422144 IP 10.1.1.2.8080 > 10.1.1.1.49153: Flags [.], ack 58425, win 65535, length 0
3.423068 IP 10.1.1.2.8080 > 10.1.1.1.49153: Flags [.], ack 58425, win 65535, length 0
3.423993 IP 10.1.1.2.8080 > 10.1.1.1.49153: Flags [.], ack 58425, win 65535, length 0
3.424918 IP 10.1.1.2.8080 > 10.1.1.1.49153: Flags [.], ack 58425, win 65535, length 0
3.425843 IP 10.1.1.2.8080 > 10.1.1.1.49153: Flags [.], ack 58425, win 65535, length 0
3.426768 IP 10.1.1.2.8080 > 10.1.1.1.49153: Flags [.], ack 58425, win 65535, length 0
3.427692 IP 10.1.1.2.8080 > 10.1.1.1.49153: Flags [.], ack 58425, win 65535, length 0
3.428617 IP 10.1.1.2.8080 > 10.1.1.1.49153: Flags [.], ack 58425, win 65535, length 0
3.429542 IP 10.1.1.2.8080 > 10.1.1.1.49153: Flags [.], ack 58425, win 65535, length 0
3.430467 IP 10.1.1.2.8080 > 10.1.1.1.49153: Flags [.], ack 58425, win 65535, length 0
3.431392 IP 10.1.1.2.8080 > 10.1.1.1.49153: Flags [.], ack 58425, win 65535, length 0
3.432316 IP 10.1.1.2.8080 > 10.1.1.1.49153: Flags [.], ack 58425, win 65535, length 0
3.433241 IP 10.1.1.2.8080 > 10.1.1.1.49153: Flags [.], ack 58425, win 65535, length 0
3.434166 IP 10.1.1.2.8080 > 10.1.1.1.49153: Flags [.], ack 58425, win 65535, length 0
3.435091 IP 10.1.1.2.8080 > 10.1.1.1.49153: Flags [.], ack 58425, win 65535, length 0
3.435091 IP 10.1.1.1.49153 > 10.1.1.2.8080: Flags [.], seq 88977:89513, ack 1, win 65535, length 536
3.436016 IP 10.1.1.2.8080 > 10.1.1.1.49153: Flags [.], ack 58425, win 65535, length 0
3.436016 IP 10.1.1.1.49153 > 10.1.1.2.8080: Flags [.], seq 89513:90049, ack 1, win 65535, length 536
3.436940 IP 10.1.1.2.8080 > 10.1.1.1.49153: Flags [.], ack 58425, win 65535, length 0
3.436940 IP 10.1.1.1.49153 > 10.1.1.2.8080: Flags [.], seq 90049:90585, ack 1, win 65535, length 536
3.437865 IP 10.1.1.2.8080 > 10.1.1.1.49153: Flags [.], ack 58425, win 65535, length 0
3.437865 IP 10.1.1.1.49153 > 10.1.1.2.8080: Flags [.], seq 90585:91121, ack 1, win 65535, length 536
3.438790 IP 10.1.1.2.8080 > 10.1.1.1.49153: Flags [.], ack 58425, win 65535, length 0
3.438790 IP 10.1.1.1.49153 > 10.1.1.2.8080: Flags [.], seq 91121:91657, ack 1, win 65535, length 536
3.439715 IP 10.1.1.2.8080 > 10.1.1.1.49153: Flags [.], ack 58425, win 65535, length 0
3.439715 IP 10.1.1.1.49153 > 10.1.1.2.8080: Flags [.], seq 91657:92193, ack 1, win 65535, length 536
3.440640 IP 10.1.1.2.8080 > 10.1.1.1.49153: Flags [.], ack 58425, win 65535, length 0
3.440640 IP 10.1.1.1.49153 > 10.1.1.2.8080: Flags [.], seq 92193:92729, ack 1, win 65535, length 536
3.441564 IP 10.1.1.2.8080 > 10.1.1.1.49153: Flags [.], ack 58425, win 65535, length 0
3.441564 IP 10.1.1.1.49153 > 10.1.1.2.8080: Flags [.], seq 92729:93265, ack 1, win 65535, length 536
3.442489 IP 10.1.1.2.8080 > 10.1.1.1.49153: Flags [.], ack 58425, win 65535, length 0
3.442489 IP 10.1.1.1.49153 > 10.1.1.2.8080: Flags [.], seq 93265:93801, ack 1, win 65535, length 536
3.443414 IP 10.1.1.2.8080 > 10.1.1.1.49153: Flags [.], ack 58425, win 65535, length 0
3.443414 IP 10.1.1.1.49153 > 10.1.1.2.8080: Flags [.], seq 93801:94337, ack 1, win 65535, length 536
3.444339 IP 10.1.1.2.8080 > 10.1.1.1.49153: Flags [.], ack 58425, win 65535, length 0
3.444339 IP 10.1.1.1.49153 > 10.1.1.2.8080: Flags [.], seq 94337:94873, ack 1, win 65535, length 536
3.445264 IP 10.1.1.2.8080 > 10.1.1.1.49153: Flags [.], ack 58425, win 65535, length 0
3.445264 IP 10.1.1.1.49153 > 10.1.1.2.8080: Flags [.], seq 94873:95409, ack 1, win 65535, length 536
3.446188 IP 10.1.1.2.8080 > 10.1.1.1.49153: Flags [.], ack 58425, win 65535, length 0
3.446188 IP 10.1.1.1.49153 > 10.1.1.2.8080: Flags [.], seq 95409:95945, ack 1, win 65535, length 536
3.447113 IP 10.1.1.2.8080 > 10.1.1.1.49153: Flags [.], ack 58425, win 65535, length 0
3.447113 IP 10.1.1.1.49153 > 10.1.1.2.8080: Flags [.], seq 95945:96481, ack 1, win 65535, length 536
3.448038 IP 10.1.1.2.8080 > 10.1.1.1.49153: Flags [.], ack 58425, win 65535, length 0
3.448038 IP 10.1.1.1.49153 > 10.1.1.2.8080: Flags [.], seq 96481:97017, ack 1, win 65535, length 536
3.448963 IP 10.1.1.2.8080 > 10.1.1.1.49153: Flags [.], ack 58425, win 65535, length 0
3.448963 IP 10.1.1.1.49153 > 10.1.1.2.8080: Flags [.], seq 97017:97553, ack 1, win 65535, length 536
3.449888 IP 10.1.1.2.8080 > 10.1.1.1.49153: Flags [.], ack 58425, win 65535, length 0
3.449888 IP 10.1.1.1.49153 > 10.1.1.2.8080: Flags [.], seq 97553:98089, ack 1, win 65535, length 536
3.450812 IP 10.1.1.2.8080 > 10.1.1.1.49153: Flags [.], ack 60033, win 65535, length 0
3.450812 IP 10.1.1.1.49153 > 10.1.1.2.8080: Flags [.], seq 60033:60569, ack 1, win 65535, length 536
3.451737 IP 10.1.1.1.49153 > 10.1.1.2.8080: Flags [.], seq 98089:98625, ack 1, win 65535, length 536
3.636083 IP 10.1.1.2.8080 > 10.1.1.1.49153: Flags [.], ack 60033, win 65535, length 0
3.636083 IP 10.1.1.1.49153 > 10.1.1.2.8080: Flags [.], seq 98625:99161, ack 1, win 65535, length 536
3.637008 IP 10.1.1.2.8080 > 10.1.1.1.49153: Flags [.], ack 60033, win 65535, length 0
3.637008 IP 10.1.1.1.49153 > 10.1.1.2.8080: Flags [.], seq 99161:99697, ack 1, win 65535, length 536
3.637932 IP 10.1.1.2.8080 > 10.1.1.1.49153: Flags [.], ack 60033, win 65535, length 0
3.637932 IP 10.1.1.1.49153 > 10.1.1.2.8080: Flags [.], seq 99697:100233, ack 1, win 65535, length 536
3.638857 IP 10.1.1.2.8080 > 10.1.1.1.49153: Flags [.], ack 60033, win 65535, length 0
3.638857 IP 10.1.1.1.49153 > 10.1.1.2.8080: Flags [.], seq 100233:100769, ack 1, win 65535, length 536
3.639782 IP 10.1.1.2.8080 > 10.1.1.1.49153: Flags [.], ack 60033, win 65535, length 0
3.639782 IP 10.1.1.1.49153 > 10.1.1.2.8080: Flags [.], seq 100769:101305, ack 1, win 65535, length 536
3.640707 IP 10.1.1.2.8080 > 10.1.1.1.49153: Flags [.], ack 60033, win 65535, length 0
3.640707 IP 10.1.1.1.49153 > 10.1.1.2.8080: Flags [.], seq 101305:101841, ack 1, win 65535, length 536
3.641632 IP 10.1.1.2.8080 > 10.1.1.1.49153: Flags [.], ack 60033, win 65535, length 0
3.641632 IP 10.1.1.1.49153 > 10.1.1.2.8080: Flags [.], seq 101841:102377, ack 1, win 65535, length 536
3.642556 IP 10.1.1.2.8080 > 10.1.1.1.49153: Flags [.], ack 60033, win 65535, length 0
3.642556 IP 10.1.1.1.49153 > 10.1.1.2.8080: Flags [.], seq 102377:102913, ack 1, win 65535, length 536
3.643481 IP 10.1.1.2.8080 > 10.1.1.1.49153: Flags [.], ack 60033, win 65535, length 0
3.643481 IP 10.1.1.1.49153 > 10.1.1.2.8080: Flags [.], seq 102913:103449, ack 1, win 65535, length 536
3.644406 IP 10.1.1.2.8080 > 10.1.1.1.49153: Flags [.], ack 60033, win 65535, length 0
3.644406 IP 10.1.1.1.49153 > 10.1.1.2.8080: Flags [.], seq 103449:103985, ack 1, win 65535, length 536
3.645331 IP 10.1.1.2.8080 > 10.1.1.1.49153: Flags [.], ack 60033, win 65535, length 0
3.645331 IP 10.1.1.1.49153 > 10.1.1.2.8080: Flags [.], seq 103985:104521, ack 1, win 65535, length 536
3.646256 IP 10.1.1.2.8080 > 10.1.1.1.49153: Flags [.], ack 60033, win 65535, length 0
3.646256 IP 10.1.1.1.49153 > 10.1.1.2.8080: Flags [.], seq 104521:105057, ack 1, win 65535, length 536
3.647180 IP 10.1.1.2.8080 > 10.1.1.1.49153: Flags [.], ack 60033, win 65535, length 0
3.647180 IP 10.1.1.1.49153 > 10.1.1.2.8080: Flags [.], seq 105057:105593, ack 1, win 65535, length 536
3.648105 IP 10.1.1.2.8080 > 10.1.1.1.49153: Flags [.], ack 60033, win 65535, length 0
3.648105 IP 10.1.1.1.49153 > 10.1.1.2.8080: Flags [.], seq 105593:106129, ack 1, win 65535, length 536
3.649030 IP 10.1.1.2.8080 > 10.1.1.1.49153: Flags [.], ack 60033, win 65535, length 0
3.649030 IP 10.1.1.1.49153 > 10.1.1.2.8080: Flags [.], seq 106129:106665, ack 1, win 65535, length 536
3.649955 IP 10.1.1.2.8080 > 10.1.1.1.49153: Flags [.], ack 60033, win 65535, length 0
3.649955 IP 10.1.1.1.49153 > 10.1.1.2.8080: Flags [.], seq 106665:107201, ack 1, win 65535, length 536
3.650880 IP 10.1.1.2.8080 > 10.1.1.1.49153: Flags [.], ack 60033, win 65535, length 0
3.650880 IP 10.1.1.1.49153 > 10.1.1.2.8080: Flags [.], seq 107201:107737, ack 1, win 65535, length 536
3.651804 IP 10.1.1.2.8080 > 10.1.1.1.49153: Flags [.], ack 61641, win 65535, length 0
3.651804 IP 10.1.1.1.49153 > 10.1.1.2.8080: Flags [.], seq 61641:62177, ack 1, win 65535, length 536
3.652729 IP 10.1.1.2.8080 > 10.1.1.1.49153: Flags [.], ack 61641, win 65535, length 0
3.652729 IP 10.1.1.1.49153 > 10.1.1.2.8080: Flags [.], seq 107737:108273, ack 1, win 65535, length 536
3.653654 IP 10.1.1.1.49153 > 10.1.1.2.8080: Flags [.], seq 108273:108809, ack 1, win 65535, length 536
3.837075 IP 10.1.1.2.8080 > 10.1.1.1.49153: Flags [.], ack 61641, win 65535, length 0
3.837075 IP 10.1.1.1.49153 > 10.1.1.2.8080: Flags [.], seq 108809:109345, ack 1, win 65535, length 536
3.838000 IP 10.1.1.2.8080 > 10.1.1.1.49153: Flags [.], ack 61641, win 65535, length 0
3.838000 IP 10.1.1.1.49153 > 10.1.1.2.8080: Flags [.], seq 109345:109881, ack 1, win 65535, length 536
3.838924 IP 10.1.1.2.8080 > 10.1.1.1.49153: Flags [.], ack 61641, win 65535, length 0
3.838924 IP 10.1.1.1.49153 > 10.1.1.2.8080: Flags [.], seq 109881:110417, ack 1, win 65535, length 536
3.839849 IP 10.1.1.2.8080 > 10.1.1.1.49153: Flags [.], ack 61641, win 65535, length 0
3.839849 IP 10.1.1.1.49153 > 10.1.1.2.8080: Flags [.], seq 110417:110953, ack 1, win 65535, length 536
3.840774 IP 10.1.1.2.8080 > 10.1.1.1.49153: Flags [.], ack 61641, win 65535, length 0
3.840774 IP 10.1.1.1.49153 > 10.1.1.2.8080: Flags [.], seq 110953:111489, ack 1, win 65535, length 536
3.841699 IP 10.1.1.2.8080 > 10.1.1.1.49153: Flags [.], ack 61641, win 65535, length 0
3.841699 IP 10.1.1.1.49153 > 10.1.1.2.8080: Flags [.], seq 111489:112025, ack 1, win 65535, length 536
3.842624 IP 10.1.1.2.8080 > 10.1.1.1.49153: Flags [.], ack 61641, win 65535, length 0
3.842624 IP 10.1.1.1.49153 > 10.1.1.2.8080: Flags [.], seq 112025:112561, ack 1, win 65535, length 536
3.843548 IP 10.1.1.2.8080 > 10.1.1.1.49153: Flags [.], ack 61641, win 65535, length 0
3.843548 IP 10.1.1.1.49153 > 10.1.1.2.8080: Flags [.], seq 112561:113097, ack 1, win 65535, length 536
3.844473 IP 10.1.1.2.8080 > 10.1.1.1.49153: Flags [.], ack 61641, win 65535, length 0
3.844473 IP 10.1.1.1.49153 > 10.1.1.2.8080: Flags [.], seq 113097:113633, ack 1, win 65535, length 536
3.845398 IP 10.1.1.2.8080 > 10.1.1.1.49153: Flags [.], ack 61641, win 65535, length 0
3.845398 IP 10.1.1.1.49153 > 10.1.1.2.8080: Flags [.], seq 113633:114169, ack 1, win 65535, length 536
3.846323 IP 10.1.1.2.8080 > 10.1.1.1.49153: Flags [.], ack 61641, win 65535, length 0
3.846323 IP 10.1.1.1.49153 > 10.1.1.2.8080: Flags [.], seq 114169:114705, ack 1, win 65535, length 536
3.847248 IP 10.1.1.2.8080 > 10.1.1.1.49153: Flags [.], ack 61641, win 65535, length 0
3.847248 IP 10.1.1.1.49153 > 10.1.1.2.8080: Flags [.], seq 114705:115241, ack 1, win 65535, length 536
3.848172 IP 10.1.1.2.8080 > 10.1.1.1.49153: Flags [.], ack 61641, win 65535, length 0
3.848172 IP 10.1.1.1.49153 > 10.1.1.2.8080: Flags [.], seq 115241:115777, ack 1, win 65535, length 536
3.849097 IP 10.1.1.2.8080 > 10.1.1.1.49153: Flags [.], ack 61641, win 65535, length 0
3.849097 IP 10.1.1.1.49153 > 10.1.1.2.8080: Flags [.], seq 115777:116313, ack 1, win 65535, length 536
3.850022 IP 10.1.1.2.8080 > 10.1.1.1.49153: Flags [.], ack 61641, win 65535, length 0
3.850022 IP 10.1.1.1.49153 > 10.1.1.2.8080: Flags [.], seq 116313:116849, ack 1, win 65535, length 536
3.850947 IP 10.1.1.2.8080 > 10.1.1.1.49153: Flags [.], ack 61641, win 65535, length 0
3.850947 IP 10.1.1.1.49153 > 10.1.1.2.8080: Flags [.], seq 116849:117385, ack 1, win 65535, length 536
3.851872 IP 10.1.1.2.8080 > 10.1.1.1.49153: Flags [.], ack 61641, win 65535, length 0
3.851872 IP 10.1.1.1.49153 > 10.1.1.2.8080: Flags [.], seq 117385:117921, ack 1, win 65535, length 536
3.852796 IP 10.1.1.2.8080 > 10.1.1.1.49153: Flags [.], ack 63249, win 65535, length 0
3.852796 IP 10.1.1.1.49153 > 10.1.1.2.8080: Flags [.], seq 63249:63785, ack 1, win 65535, length 536
3.853721 IP 10.1.1.2.8080 > 10.1.1.1.49153: Flags [.], ack 63249, win 65535, length 0
3.853721 IP 10.1.1.1.49153 > 10.1.1.2.8080: Flags [.], seq 117921:118457, ack 1, win 65535, length 536
3.854646 IP 10.1.1.2.8080 > 10.1.1.1.49153: Flags [.], ack 63249, win 65535, length 0
3.854646 IP 10.1.1.1.49153 > 10.1.1.2.8080: Flags [.], seq 118457:118993, ack 1, win 65535, length 536
3.855571 IP 10.1.1.1.49153 > 10.1.1.2.8080: Flags [.], seq 118993:119529, ack 1, win 65535, length 536
4.038067 IP 10.1.1.2.8080 > 10.1.1.1.49153: Flags [.], ack 63249, win 65535, length 0
4.038067 IP 10.1.1.1.49153 > 10.1.1.2.8080: Flags [.], seq 119529:120065, ack 1, win 65535, length 536
4.038992 IP 10.1.1.2.8080 > 10.1.1.1.49153: Flags [.], ack 63249, win 65535, length 0
4.038992 IP 10.1.1.1.49153 > 10.1.1.2.8080: Flags [.], seq 120065:120601, ack 1, win 65535, length 536
4.039916 IP 10.1.1.2.8080 > 10.1.1.1.49153: Flags [.], ack 63249, win 65535, length 0
4.039916 IP 10.1.1.1.49153 > 10.1.1.2.8080: Flags [.], seq 120601:121137, ack 1, win 65535, length 536
4.040841 IP 10.1.1.2.8080 > 10.1.1.1.49153: Flags [.], ack 63249, win 65535, length 0
4.040841 IP 10.1.1.1.49153 > 10.1.1.2.8080: Flags [.], seq 121137:121673, ack 1, win 65535, length 536
4.041766 IP 10.1.1.2.8080 > 10.1.1.1.49153: Flags [.], ack 63249, win 65535, length 0
4.041766 IP 10.1.1.1.49153 > 10.1.1.2.8080: Flags [.], seq 121673:122209, ack 1, win 65535, length 536
4.042691 IP 10.1.1.2.8080 > 10.1.1.1.49153: Flags [.], ack 63249, win 65535, length 0
4.042691 IP 10.1.1.1.49153 > 10.1.1.2.8080: Flags [.], seq 122209:122745, ack 1, win 65535, length 536
4.043616 IP 10.1.1.2.8080 > 10.1.1.1.49153: Flags [.], ack 63249, win 65535, length 0
4.043616 IP 10.1.1.1.49153 > 10.1.1.2.8080: Flags [.], seq 122745:123281, ack 1, win 65535, length 536
4.044540 IP 10.1.1.2.8080 > 10.1.1.1.49153: Flags [.], ack 63249, win 65535, length 0
4.044540 IP 10.1.1.1.49153 > 10.1.1.2.8080: Flags [.], seq 123281:123817, ack 1, win 65535, length 536
4.045465 IP 10.1.1.2.8080 > 10.1.1.1.49153: Flags [.], ack 63249, win 65535, length 0
4.045465 IP 10.1.1.1.49153 > 10.1.1.2.8080: Flags [.], seq 123817:124353, ack 1, win 65535, length 536
4.046390 IP 10.1.1.2.8080 > 10.1.1.1.49153: Flags [.], ack 63249, win 65535, length 0
4.046390 IP 10.1.1.1.49153 > 10.1.1.2.8080: Flags [.], seq 124353:124889, ack 1, win 65535, length 536
4.047315 IP 10.1.1.2.8080 > 10.1.1.1.49153: Flags [.], ack 63249, win 65535, length 0
4.047315 IP 10.1.1.1.49153 > 10.1.1.2.8080: Flags [.], seq 124889:125425, ack 1, win 65535, length 536
4.048240 IP 10.1.1.2.8080 > 10.1.1.1.49153: Flags [.], ack 63249, win 65535, length 0
4.048240 IP 10.1.1.1.49153 > 10.1.1.2.8080: Flags [.], seq 125425:125961, ack 1, win 65535, length 536
4.049164 IP 10.1.1.2.8080 > 10.1.1.1.49153: Flags [.], ack 63249, win 65535, length 0
4.049164 IP 10.1.1.1.49153 > 10.1.1.2.8080: Flags [.], seq 125961:126497, ack 1, win 65535, length 536
4.050089 IP 10.1.1.2.8080 > 10.1.1.1.49153: Flags [.], ack 63249, win 65535, length 0
4.050089 IP 10.1.1.1.49153 > 10.1.1.2.8080: Flags [.], seq 126497:127033, ack 1, win 65535, length 536
4.051014 IP 10.1.1.2.8080 > 10.1.1.1.49153: Flags [.], ack 63249, win 65535, length 0
4.051014 IP 10.1.1.1.49153 > 10.1.1.2.8080: Flags [.], seq 127033:127569, ack 1, win 65535, length 536
4.051939 IP 10.1.1.2.8080 > 10.1.1.1.49153: Flags [.], ack 63249, win 65535, length 0
4.051939 IP 10.1.1.1.49153 > 10.1.1.2.8080: Flags [.], seq 127569:128105, ack 1, win 65535, length 536
4.052864 IP 10.1.1.2.8080 > 10.1.1.1.49153: Flags [.], ack 63249, win 65535, length 0
4.052864 IP 10.1.1.1.49153 > 10.1.1.2.8080: Flags [.], seq 128105:128641, ack 1, win 65535, length 536
4.053788 IP 10.1.1.2.8080 > 10.1.1.1.49153: Flags [.], ack 64857, win 65535, length 0
4.053788 IP 10.1.1.1.49153 > 10.1.1.2.8080: Flags [.], seq 64857:65393, ack 1, win 65535, length 536
4.054713 IP 10.1.1.2.8080 > 10.1.1.1.49153: Flags [.], ack 64857, win 65535, length 0
4.054713 IP 10.1.1.1.49153 > 10.1.1.2.8080: Flags [.], seq 128641:129177, ack 1, win 65535, length 536
4.055638 IP 10.1.1.2.8080 > 10.1.1.1.49153: Flags [.], ack 64857, win 65535, length 0
4.055638 IP 10.1.1.1.49153 > 10.1.1.2.8080: Flags [.], seq 129177:129713, ack 1, win 65535, length 536
4.056563 IP 10.1.1.2.8080 > 10.1.1.1.49153: Flags [.], ack 64857, win 65535, length 0
4.056563 IP 10.1.1.1.49153 > 10.1.1.2.8080: Flags [.], seq 129713:130249, ack 1, win 65535, length 536
4.239059 IP 10.1.1.2.8080 > 10.1.1.1.49153: Flags [.], ack 64857, win 65535, length 0
4.239984 IP 10.1.1.2.8080 > 10.1.1.1.49153: Flags [.], ack 64857, win 65535, length 0
4.240908 IP 10.1.1.2.8080 > 10.1.1.1.49153: Flags [.], ack 64857, win 65535, length 0
4.241833 IP 10.1.1.2.8080 > 10.1.1.1.49153: Flags [.], ack 64857, win 65535, length 0
4.242758 IP 10.1.1.2.8080 > 10.1.1.1.49153: Flags [.], ack 64857, win 65535, length 0
4.243683 IP 10.1.1.2.8080 > 10.1.1.1.49153: Flags [.], ack 64857, win 65535, length 0
4.244608 IP 10.1.1.2.8080 > 10.1.1.1.49153: Flags [.], ack 64857, win 65535, length 0
4.245532 IP 10.1.1.2.8080 > 10.1.1.1.49153: Flags [.], ack 64857, win 65535, length 0
4.246457 IP 10.1.1.2.8080 > 10.1.1.1.49153: Flags [.], ack 64857, win 65535, length 0
4.247382 IP 10.1.1.2.8080 > 10.1.1.1.49153: Flags [.], ack 64857, win 65535, length 0
4.248307 IP 10.1.1.2.8080 > 10.1.1.1.49153: Flags [.], ack 64857, win 65535, length 0
4.249232 IP 10.1.1.2.8080 > 10.1.1.1.49153: Flags [.], ack 64857, win 65535, length 0
4.250156 IP 10.1.1.2.8080 > 10.1.1.1.49153: Flags [.], ack 64857, win 65535, length 0
4.251081 IP 10.1.1.2.8080 > 10.1.1.1.49153: Flags [.], ack 64857, win 65535, length 0
4.252006 IP 10.1.1.2.8080 > 10.1.1.1.49153: Flags [.], ack 64857, win 65535, length 0
4.252931 IP 10.1.1.2.8080 > 10.1.1.1.49153: Flags [.], ack 64857, win 65535, length 0
4.253856 IP 10.1.1.2.8080 > 10.1.1.1.49153: Flags [.], ack 64857, win 65535, length 0
4.254780 IP 10.1.1.2.8080 > 10.1.1.1.49153: Flags [.], ack 80937, win 65535, length 0
4.254780 IP 10.1.1.1.49153 > 10.1.1.2.8080: Flags [.], seq 80937:81473, ack 1, win 65535, length 536
4.255705 IP 10.1.1.2.8080 > 10.1.1.1.49153: Flags [.], ack 80937, win 65535, length 0
4.255705 IP 10.1.1.1.49153 > 10.1.1.2.8080: Flags [.], seq 130249:130785, ack 1, win 65535, length 536
4.256630 IP 10.1.1.2.8080 > 10.1.1.1.49153: Flags [.], ack 80937, win 65535, length 0
4.256630 IP 10.1.1.1.49153 > 10.1.1.2.8080: Flags [.], seq 130785:131321, ack 1, win 65535, length 536
4.257555 IP 10.1.1.2.8080 > 10.1.1.1.49153: Flags [.], ack 80937, win 65535, length 0
4.257555 IP 10.1.1.1.49153 > 10.1.1.2.8080: Flags [.], seq 131321:131857, ack 1, win 65535, length 536
4.258480 IP 10.1.1.1.49153 > 10.1.1.2.8080: Flags [.], seq 131857:132393, ack 1, win 65535, length 536
4.259404 IP 10.1.1.1.49153 > 10.1.1.2.8080: Flags [.], seq 132393:132929, ack 1, win 65535, length 536
4.260329 IP 10.1.1.1.49153 > 10.1.1.2.8080: Flags [.], seq 132929:133465, ack 1, win 65535, length 536
4.261254 IP 10.1.1.1.49153 > 10.1.1.2.8080: Flags [.], seq 133465:134001, ack 1, win 65535, length 536
4.262179 IP 10.1.1.1.49153 > 10.1.1.2.8080: Flags [.], seq 134001:134537, ack 1, win 65535, length 536
4.263104 IP 10.1.1.1.49153 > 10.1.1.2.8080: Flags [.], seq 134537:135073, ack 1, win 65535, length 536
4.264028 IP 10.1.1.1.49153 > 10.1.1.2.8080: Flags [.], seq 135073:135609, ack 1, win 65535, length 536
4.264953 IP 10.1.1.1.49153 > 10.1.1.2.8080: Flags [.], seq 140433:140969, ack 1, win 65535, length 536
4.265878 IP 10.1.1.1.49153 > 10.1.1.2.8080: Flags [.], seq 140969:141505, ack 1, win 65535, length 536
4.266803 IP 10.1.1.1.49153 > 10.1.1.2.8080: Flags [.], seq 141505:142041, ack 1, win 65535, length 536
4.455772 IP 10.1.1.2.8080 > 10.1.1.1.49153: Flags [.], ack 82545, win 65535, length 0
4.455772 IP 10.1.1.1.49153 > 10.1.1.2.8080: Flags [.], seq 82545:83081, ack 1, win 65535, length 536
4.456697 IP 10.1.1.2.8080 > 10.1.1.1.49153: Flags [.], ack 82545, win 65535, length 0
4.456697 IP 10.1.1.1.49153 > 10.1.1.2.8080: Flags [.], seq 142041:142577, ack 1, win 65535, length 536
4.457622 IP 10.1.1.2.8080 > 10.1.1.1.49153: Flags [.], ack 82545, win 65535, length 0
4.457622 IP 10.1.1.1.49153 > 10.1.1.2.8080: Flags [.], seq 142577:143113, ack 1, win 65535, length 536
4.458547 IP 10.1.1.2.8080 > 10.1.1.1.49153: Flags [.], ack 82545, win 65535, length 0
4.458547 IP 10.1.1.1.49153 > 10.1.1.2.8080: Flags [.], seq 143113:143649, ack 1, win 65535, length 536
4.459472 IP 10.1.1.2.8080 > 10.1.1.1.49153: Flags [.], ack 82545, win 65535, length 0
4.459472 IP 10.1.1.1.49153 > 10.1.1.2.8080: Flags [.], seq 143649:144185, ack 1, win 65535, length 536
4.460396 IP 10.1.1.2.8080 > 10.1.1.1.49153: Flags [.], ack 82545, win 65535, length 0
4.460396 IP 10.1.1.1.49153 > 10.1.1.2.8080: Flags [.], seq 144185:144721, ack 1, win 65535, length 536
4.461321 IP 10.1.1.2.8080 > 10.1.1.1.49153: Flags [.], ack 82545, win 65535, length 0
4.461321 IP 10.1.1.1.49153 > 10.1.1.2.8080: Flags [.], seq 144721:145257, ack 1, win 65535, length 536
4.462246 IP 10.1.1.2.8080 > 10.1.1.1.49153: Flags [.], ack 82545, win 65535, length 0
4.462246 IP 10.1.1.1.49153 > 10.1.1.2.8080: Flags [.], seq 145257:145793, ack 1, win 65535, length 536
4.463171 IP 10.1.1.2.8080 > 10.1.1.1.49153: Flags [.], ack 82545, win 65535, length 0
4.463171 IP 10.1.1.1.49153 > 10.1.1.2.8080: Flags [.], seq 145793:146329, ack 1, win 65535, length 536
4.464096 IP 10.1.1.2.8080 > 10.1.1.1.49153: Flags [.], ack 82545, win 65535, length 0
4.464096 IP 10.1.1.1.49153 > 10.1.1.2.8080: Flags [.], seq 146329:146865, ack 1, win 65535, length 536
4.465020 IP 10.1.1.2.8080 > 10.1.1.1.49153: Flags [.], ack 82545, win 65535, length 0
4.465020 IP 10.1.1.1.49153 > 10.1.1.2.8080: Flags [.], seq 146865:147401, ack 1, win 65535, length 536
4.465945 IP 10.1.1.2.8080 > 10.1.1.1.49153: Flags [.], ack 82545, win 65535, length 0
4.465945 IP 10.1.1.1.49153 > 10.1.1.2.8080: Flags [.], seq 147401:147937, ack 1, win 65535, length 536
4.466870 IP 10.1.1.2.8080 > 10.1.1.1.49153: Flags [.], ack 82545, win 65535, length 0
4.467795 IP 10.1.1.2.8080 > 10.1.1.1.49153: Flags [.], ack 82545, win 65535, length 0
4.656764 IP 10.1.1.2.8080 > 10.1.1.1.49153: Flags [.], ack 84153, win 65535, length 0
4.656764 IP 10.1.1.1.49153 > 10.1.1.2.8080: Flags [.], seq 84153:84689, ack 1, win 65535, length 536
4.657689 IP 10.1.1.2.8080 > 10.1.1.1.49153: Flags [.], ack 84153, win 65535, length 0
4.657689 IP 10.1.1.1.49153 > 10.1.1.2.8080: Flags [.], seq 147937:148473, ack 1, win 65535, length 536
4.658614 IP 10.1.1.2.8080 > 10.1.1.1.49153: Flags [.], ack 84153, win 65535, length 0
4.658614 IP 10.1.1.1.49153 > 10.1.1.2.8080: Flags [.], seq 148473:149009, ack 1, win 65535, length 536
4.659539 IP 10.1.1.2.8080 > 10.1.1.1.49153: Flags [.], ack 84153, win 65535, length 0
4.659539 IP 10.1.1.1.49153 > 10.1.1.2.8080: Flags [.], seq 149009:149545, ack 1, win 65535, length 536
4.660464 IP 10.1.1.2.8080 > 10.1.1.1.49153: Flags [.], ack 84153, win 65535, length 0
4.661388 IP 10.1.1.2.8080 > 10.1.1.1.49153: Flags [.], ack 84153, win 65535, length 0
4.662313 IP 10.1.1.2.8080 > 10.1.1.1.49153: Flags [.], ack 84153, win 65535, length 0
4.663238 IP 10.1.1.2.8080 > 10.1.1.1.49153: Flags [.], ack 84153, win 65535, length 0
4.664163 IP 10.1.1.2.8080 > 10.1.1.1.49153: Flags [.], ack 84153, win 65535, length 0
4.665088 IP 10.1.1.2.8080 > 10.1.1.1.49153: Flags [.], ack 84153, win 65535, length 0
4.666012 IP 10.1.1.2.8080 > 10.1.1.1.49153: Flags [.], ack 84153, win 65535, length 0
4.666937 IP 10.1.1.2.8080 > 10.1.1.1.49153: Flags [.], ack 84153, win 65535, length 0
4.857756 IP 10.1.1.2.8080 > 10.1.1.1.49153: Flags [.], ack 85761, win 65535, length 0
4.857756 IP 10.1.1.1.49153 > 10.1.1.2.8080: Flags [.], seq 85761:86297, ack 1, win 65535, length 536
4.858681 IP 10.1.1.2.8080 > 10.1.1.1.49153: Flags [.], ack 85761, win 65535, length 0
4.858681 IP 10.1.1.1.49153 > 10.1.1.2.8080: Flags [.], seq 149545:150081, ack 1, win 65535, length 536
4.859606 IP 10.1.1.2.8080 > 10.1.1.1.49153: Flags [.], ack 85761, win 65535, length 0
4.859606 IP 10.1.1.1.49153 > 10.1.1.2.8080: Flags [.], seq 150081:150617, ack 1, win 65535, length 536
4.860531 IP 10.1.1.2.8080 > 10.1.1.1.49153: Flags [.], ack 85761, win 65535, length 0
4.860531 IP 10.1.1.1.49153 > 10.1.1.2.8080: Flags [.], seq 150617:151153, ack 1, win 65535, length 536
5.058748 IP 10.1.1.2.8080 > 10.1.1.1.49153: Flags [.], ack 87369, win 65535, length 0
5.058748 IP 10.1.1.1.49153 > 10.1.1.2.8080: Flags [.], seq 87369:87905, ack 1, win 65535, length 536
5.059673 IP 10.1.1.2.8080 > 10.1.1.1.49153: Flags [.], ack 87369, win 65535, length 0
5.059673 IP 10.1.1.1.49153 > 10.1.1.2.8080: Flags [.], seq 151153:151689, ack 1, win 65535, length 536
5.060598 IP 10.1.1.2.8080 > 10.1.1.1.49153: Flags [.], ack 87369, win 65535, length 0
5.060598 IP 10.1.1.1.49153 > 10.1.1.2.8080: Flags [.], seq 151689:152225, ack 1, win 65535, length 536
5.061523 IP 10.1.1.2.8080 > 10.1.1.1.49153: Flags [.], ack 87369, win 65535, length 0
5.061523 IP 10.1.1.1.49153 > 10.1.1.2.8080: Flags [.], seq 152225:152761, ack 1, win 65535, length 536
5.259740 IP 10.1.1.2.8080 > 10.1.1.1.49153: Flags [.], ack 135609, win 65535, length 0
5.260665 IP 10.1.1.2.8080 > 10.1.1.1.49153: Flags [.], ack 135609, win 65535, length 0
5.261590 IP 10.1.1.2.8080 > 10.1.1.1.49153: Flags [.], ack 135609, win 65535, length 0
5.262515 IP 10.1.1.2.8080 > 10.1.1.1.49153: Flags [.], ack 135609, win 65535, length 0
5.262515 IP 10.1.1.1.49153 > 10.1.1.2.8080: Flags [.], seq 135609:136145, ack 1, win 65535, length 536
5.463507 IP 10.1.1.2.8080 > 10.1.1.1.49153: Flags [.], ack 136145, win 65535, length 0
5.463507 IP 10.1.1.1.49153 > 10.1.1.2.8080: Flags [.], seq 136145:136681, ack 1, win 65535, length 536
5.664499 IP 10.1.1.2.8080 > 10.1.1.1.49153: Flags [.], ack 136681, win 65535, length 0
5.664499 IP 10.1.1.1.49153 > 10.1.1.2.8080: Flags [.], seq 136681:137217, ack 1, win 65535, length 536
5.865491 IP 10.1.1.2.8080 > 10.1.1.1.49153: Flags [.], ack 137217, win 65535, length 0
5.865491 IP 10.1.1.1.49153 > 10.1.1.2.8080: Flags [.], seq 137217:137753, ack 1, win 65535, length 536
6.066483 IP 10.1.1.2.8080 > 10.1.1.1.49153: Flags [.], ack 137753, win 65535, length 0
6.066483 IP 10.1.1.1.49153 > 10.1.1.2.8080: Flags [.], seq 137753:138289, ack 1, win 65535, length 536
6.267475 IP 10.1.1.2.8080 > 10.1.1.1.49153: Flags [.], ack 138289, win 65535, length 0
6.267475 IP 10.1.1.1.49153 > 10.1.1.2.8080: Flags [.], seq 138289:138825, ack 1, win 65535, length 536
6.468467 IP 10.1.1.2.8080 > 10.1.1.1.49153: Flags [.], ack 138825, win 65535, length 0
6.468467 IP 10.1.1.1.49153 > 10.1.1.2.8080: Flags [.], seq 138825:139361, ack 1, win 65535, length 536
6.669459 IP 10.1.1.2.8080 > 10.1.1.1.49153: Flags [.], ack 139361, win 65535, length 0
6.669459 IP 10.1.1.1.49153 > 10.1.1.2.8080: Flags [.], seq 139361:139897, ack 1, win 65535, length 536
6.870451 IP 10.1.1.2.8080 > 10.1.1.1.49153: Flags [.], ack 139897, win 65535, length 0
6.870451 IP 10.1.1.1.49153 > 10.1.1.2.8080: Flags [.], seq 139897:140433, ack 1, win 65535, length 536
7.071443 IP 10.1.1.2.8080 > 10.1.1.1.49153: Flags [.], ack 152761, win 65535, length 0
7.071443 IP 10.1.1.1.49153 > 10.1.1.2.8080: Flags [.], seq 152761:153297, ack 1, win 65535, length 536
7.072368 IP 10.1.1.1.49153 > 10.1.1.2.8080: Flags [.], seq 153297:153833, ack 1, win 65535, length 536
7.073292 IP 10.1.1.1.49153 > 10.1.1.2.8080: Flags [.], seq 153833:154369, ack 1, win 65535, length 536
7.074217 IP 10.1.1.1.49153 > 10.1.1.2.8080: Flags [.], seq 154369:154905, ack 1, win 65535, length 536
7.075142 IP 10.1.1.1.49153 > 10.1.1.2.8080: Flags [.], seq 154905:155441, ack 1, win 65535, length 536
7.076067 IP 10.1.1.1.49153 > 10.1.1.2.8080: Flags [.], seq 155441:155977, ack 1, win 65535, length 536
7.076992 IP 10.1.1.1.49153 > 10.1.1.2.8080: Flags [.], seq 155977:156513, ack 1, win 65535, length 536
7.077916 IP 10.1.1.1.49153 > 10.1.1.2.8080: Flags [.], seq 156513:157049, ack 1, win 65535, length 536
7.078841 IP 10.1.1.1.49153 > 10.1.1.2.8080: Flags [.], seq 157049:157585, ack 1, win 65535, length 536
7.079766 IP 10.1.1.1.49153 > 10.1.1.2.8080: Flags [.], seq 157585:158121, ack 1, win 65535, length 536
7.080691 IP 10.1.1.1.49153 > 10.1.1.2.8080: Flags [.], seq 158121:158657, ack 1, win 65535, length 536
7.273360 IP 10.1.1.2.8080 > 10.1.1.1.49153: Flags [.], ack 153833, win 65535, length 0
7.273360 IP 10.1.1.1.49153 > 10.1.1.2.8080: Flags [.], seq 161337:161873, ack 1, win 65535, length 536
7.274284 IP 10.1.1.1.49153 > 10.1.1.2.8080: Flags [.], seq 161873:162409, ack 1, win 65535, length 536
7.275209 IP 10.1.1.2.8080 > 10.1.1.1.49153: Flags [.], ack 154905, win 65535, length 0
7.275209 IP 10.1.1.1.49153 > 10.1.1.2.8080: Flags [.], seq 162409:162945, ack 1, win 65535, length 536
7.276134 IP 10.1.1.1.49153 > 10.1.1.2.8080: Flags [.], seq 162945:163481, ack 1, win 65535, length 536
7.277059 IP 10.1.1.2.8080 > 10.1.1.1.49153: Flags [.], ack 155977, win 65535, length 0
7.277059 IP 10.1.1.1.49153 > 10.1.1.2.8080: Flags [.], seq 163481:164017, ack 1, win 65535, length 536
7.277984 IP 10.1.1.1.49153 > 10.1.1.2.8080: Flags [.], seq 164017:164553, ack 1, win 65535, length 536
7.278908 IP 10.1.1.2.8080 > 10.1.1.1.49153: Flags [.], ack 157049, win 65535, length 0
7.278908 IP 10.1.1.1.49153 > 10.1.1.2.8080: Flags [.], seq 164553:165089, ack 1, win 65535, length 536
7.279833 IP 10.1.1.1.49153 > 10.1.1.2.8080: Flags [.], seq 165089:165625, ack 1, win 65535, length 536
7.280758 IP 10.1.1.2.8080 > 10.1.1.1.49153: Flags [.], ack 158121, win 65535, length 0
7.280758 IP 10.1.1.1.49153 > 10.1.1.2.8080: Flags [.], seq 165625:166161, ack 1, win 65535, length 536
7.281683 IP 10.1.1.1.49153 > 10.1.1.2.8080: Flags [.], seq 166161:166697, ack 1, win 65535, length 536
7.474352 IP 10.1.1.2.8080 > 10.1.1.1.49153: Flags [.], ack 158657, win 65535, length 0
7.474352 IP 10.1.1.1.49153 > 10.1.1.2.8080: Flags [.], seq 166697:167233, ack 1, win 65535, length 536
7.475276 IP 10.1.1.2.8080 > 10.1.1.1.49153: Flags [.], ack 158657, win 65535, length 0
7.476201 IP 10.1.1.2.8080 > 10.1.1.1.49153: Flags [.], ack 158657, win 65535, length 0
7.477126 IP 10.1.1.2.8080 > 10.1.1.1.49153: Flags [.], ack 158657, win 65535, length 0
7.477126 IP 10.1.1.1.49153 > 10.1.1.2.8080: Flags [.], seq 158657:159193, ack 1, win 65535, length 536
7.478051 IP 10.1.1.2.8080 > 10.1.1.1.49153: Flags [.], ack 158657, win 65535, length 0
7.478976 IP 10.1.1.2.8080 > 10.1.1.1.49153: Flags [.], ack 158657, win 65535, length 0
7.479900 IP 10.1.1.2.8080 > 10.1.1.1.49153: Flags [.], ack 158657, win 65535, length 0
7.480825 IP 10.1.1.2.8080 > 10.1.1.1.49153: Flags [.], ack 158657, win 65535, length 0
7.481750 IP 10.1.1.2.8080 > 10.1.1.1.49153: Flags [.], ack 158657, win 65535, length 0
7.482675 IP 10.1.1.2.8080 > 10.1.1.1.49153: Flags [.], ack 158657, win 65535, length 0
7.482675 IP 10.1.1.1.49153 > 10.1.1.2.8080: Flags [.], seq 167233:167769, ack 1, win 65535, length 536
7.675344 IP 10.1.1.2.8080 > 10.1.1.1.49153: Flags [.], ack 158657, win 65535, length 0
7.675344 IP 10.1.1.1.49153 > 10.1.1.2.8080: Flags [.], seq 167769:168305, ack 1, win 65535, length 536
7.678118 IP 10.1.1.2.8080 > 10.1.1.1.49153: Flags [.], ack 159193, win 65535, length 0
7.678118 IP 10.1.1.1.49153 > 10.1.1.2.8080: Flags [.], seq 159193:159729, ack 1, win 65535, length 536
7.679043 IP 10.1.1.1.49153 > 10.1.1.2.8080: Flags [.], seq 168305:168841, ack 1, win 65535, length 536
7.683667 IP 10.1.1.2.8080 > 10.1.1.1.49153: Flags [.], ack 159193, win 65535, length 0
7.683667 IP 10.1.1.1.49153 > 10.1.1.2.8080: Flags [.], seq 168841:169377, ack 1, win 65535, length 536
7.876336 IP 10.1.1.2.8080 > 10.1.1.1.49153: Flags [.], ack 159193, win 65535, length 0
7.876336 IP 10.1.1.1.49153 > 10.1.1.2.8080: Flags [.], seq 169377:169913, ack 1, win 65535, length 536
7.879110 IP 10.1.1.2.8080 > 10.1.1.1.49153: Flags [.], ack 159729, win 65535, length 0
7.879110 IP 10.1.1.1.49153 > 10.1.1.2.8080: Flags [.], seq 159729:160265, ack 1, win 65535, length 536
7.880035 IP 10.1.1.2.8080 > 10.1.1.1.49153: Flags [.], ack 159729, win 65535, length 0
7.880035 IP 10.1.1.1.49153 > 10.1.1.2.8080: Flags [.], seq 169913:170449, ack 1, win 65535, length 536
7.880960 IP 10.1.1.1.49153 > 10.1.1.2.8080: Flags [.], seq 170449:170985, ack 1, win 65535, length 536
7.884659 IP 10.1.1.2.8080 > 10.1.1.1.49153: Flags [.], ack 159729, win 65535, length 0
7.884659 IP 10.1.1.1.49153 > 10.1.1.2.8080: Flags [.], seq 170985:171521, ack 1, win 65535, length 536
8.077328 IP 10.1.1.2.8080 > 10.1.1.1.49153: Flags [.], ack 159729, win 65535, length 0
8.077328 IP 10.1.1.1.49153 > 10.1.1.2.8080: Flags [.], seq 171521:172057, ack 1, win 65535, length 536
8.080102 IP 10.1.1.2.8080 > 10.1.1.1.49153: Flags [.], ack 160265, win 65535, length 0
8.080102 IP 10.1.1.1.49153 > 10.1.1.2.8080: Flags [.], seq 160265:160801, ack 1, win 65535, length 536
8.081027 IP 10.1.1.2.8080 > 10.1.1.1.49153: Flags [.], ack 160265, win 65535, length 0
8.081027 IP 10.1.1.1.49153 > 10.1.1.2.8080: Flags [.], seq 172057:172593, ack 1, win 65535, length 536
8.081952 IP 10.1.1.2.8080 > 10.1.1.1.49153: Flags [.], ack 160265, win 65535, length 0
8.081952 IP 10.1.1.1.49153 > 10.1.1.2.8080: Flags [.], seq 172593:173129, ack 1, win 65535, length 536
8.082876 IP 10.1.1.1.49153 > 10.1.1.2.8080: Flags [.], seq 173129:173665, ack 1, win 65535, length 536
8.085651 IP 10.1.1.2.8080 > 10.1.1.1.49153: Flags [.], ack 160265, win 65535, length 0
8.085651 IP 10.1.1.1.49153 > 10.1.1.2.8080: Flags [.], seq 173665:174201, ack 1, win 65535, length 536
8.278320 IP 10.1.1.2.8080 > 10.1.1.1.49153: Flags [.], ack 160265, win 65535, length 0
8.278320 IP 10.1.1.1.49153 > 10.1.1.2.8080: Flags [.], seq 174201:174737, ack 1, win 65535, length 536
8.281094 IP 10.1.1.2.8080 > 10.1.1.1.49153: Flags [.], ack 160801, win 65535, length 0
8.281094 IP 10.1.1.1.49153 > 10.1.1.2.8080: Flags [.], seq 160801:161337, ack 1, win 65535, length 536
8.282019 IP 10.1.1.2.8080 > 10.1.1.1.49153: Flags [.], ack 160801, win 65535, length 0
8.282019 IP 10.1.1.1.49153 > 10.1.1.2.8080: Flags [.], seq 174737:175273, ack 1, win 65535, length 536
8.282944 IP 10.1.1.2.8080 > 10.1.1.1.49153: Flags [.], ack 160801, win 65535, length 0
8.282944 IP 10.1.1.1.49153 > 10.1.1.2.8080: Flags [.], seq 175273:175809, ack 1, win 65535, length 536
8.283868 IP 10.1.1.2.8080 > 10.1.1.1.49153: Flags [.], ack 160801, win 65535, length 0
8.283868 IP 10.1.1.1.49153 > 10.1.1.2.8080: Flags [.], seq 175809:176345, ack 1, win 65535, length 536
8.284793 IP 10.1.1.1.49153 > 10.1.1.2.8080: Flags [.], seq 176345:176881, ack 1, win 65535, length 536
8.286643 IP 10.1.1.2.8080 > 10.1.1.1.49153: Flags [.], ack 160801, win 65535, length 0
8.286643 IP 10.1.1.1.49153 > 10.1.1.2.8080: Flags [.], seq 176881:177417, ack 1, win 65535, length 536
8.479312 IP 10.1.1.2.8080 > 10.1.1.1.49153: Flags [.], ack 160801, win 65535, length 0
8.479312 IP 10.1.1.1.49153 > 10.1.1.2.8080: Flags [.], seq 177417:177953, ack 1, win 65535, length 536
8.482086 IP 10.1.1.2.8080 > 10.1.1.1.49153: Flags [.], ack 174737, win 65535, length 0
8.482086 IP 10.1.1.1.49153 > 10.1.1.2.8080: Flags [.], seq 177953:178489, ack 1, win 65535, length 536
8.483011 IP 10.1.1.1.49153 > 10.1.1.2.8080: Flags [.], seq 178489:179025, ack 1, win 65535, length 536
8.483936 IP 10.1.1.2.8080 > 10.1.1.1.49153: Flags [.], ack 175809, win 65535, length 0
8.483936 IP 10.1.1.1.49153 > 10.1.1.2.8080: Flags [.], seq 179025:179561, ack 1, win 65535, length 536
8.484860 IP 10.1.1.1.49153 > 10.1.1.2.8080: Flags [.], seq 179561:180097, ack 1, win 65535, length 536
8.485785 IP 10.1.1.2.8080 > 10.1.1.1.49153: Flags [.], ack 176881, win 65535, length 0
8.485785 IP 10.1.1.1.49153 > 10.1.1.2.8080: Flags [.], seq 180097:180633, ack 1, win 65535, length 536
8.486710 IP 10.1.1.1.49153 > 10.1.1.2.8080: Flags [.], seq 180633:181169, ack 1, win 65535, length 536
8.680304 IP 10.1.1.2.8080 > 10.1.1.1.49153: Flags [.], ack 177953, win 65535, length 0
8.680304 IP 10.1.1.1.49153 > 10.1.1.2.8080: Flags [.], seq 181169:181705, ack 1, win 65535, length 536
8.681228 IP 10.1.1.1.49153 > 10.1.1.2.8080: Flags [.], seq 181705:182241, ack 1, win 65535, length 536
8.684003 IP 10.1.1.2.8080 > 10.1.1.1.49153: Flags [.], ack 179025, win 65535, length 0
8.684003 IP 10.1.1.1.49153 > 10.1.1.2.8080: Flags [.], seq 182241:182777, ack 1, win 65535, length 536
8.684928 IP 10.1.1.1.49153 > 10.1.1.2.8080: Flags [.], seq 182777:183313, ack 1, win 65535, length 536
8.685852 IP 10.1.1.2.8080 > 10.1.1.1.49153: Flags [.], ack 180097, win 65535, length 0
8.685852 IP 10.1.1.1.49153 > 10.1.1.2.8080: Flags [.], seq 183313:183849, ack 1, win 65535, length 536
8.686777 IP 10.1.1.1.49153 > 10.1.1.2.8080: Flags [.], seq 183849:184385, ack 1, win 65535, length 536
8.687702 IP 10.1.1.2.8080 > 10.1.1.1.49153: Flags [.], ack 181169, win 65535, length 0
8.687702 IP 10.1.1.1.49153 > 10.1.1.2.8080: Flags [.], seq 184385:184921, ack 1, win 65535, length 536
8.688627 IP 10.1.1.1.49153 > 10.1.1.2.8080: Flags [.], seq 184921:185457, ack 1, win 65535, length 536
8.882220 IP 10.1.1.2.8080 > 10.1.1.1.49153: Flags [.], ack 182241, win 65535, length 0
8.882220 IP 10.1.1.1.49153 > 10.1.1.2.8080: Flags [.], seq 185457:185993, ack 1, win 65535, length 536
8.883145 IP 10.1.1.1.49153 > 10.1.1.2.8080: Flags [.], seq 185993:186529, ack 1, win 65535, length 536
8.885920 IP 10.1.1.2.8080 > 10.1.1.1.49153: Flags [.], ack 183313, win 65535, length 0
8.885920 IP 10.1.1.1.49153 > 10.1.1.2.8080: Flags [.], seq 186529:187065, ack 1, win 65535, length 536
8.886844 IP 10.1.1.1.49153 > 10.1.1.2.8080: Flags [.], seq 187065:187601, ack 1, win 65535, length 536
8.887769 IP 10.1.1.2.8080 > 10.1.1.1.49153: Flags [.], ack 184385, win 65535, length 0
8.887769 IP 10.1.1.1.49153 > 10.1.1.2.8080: Flags [.], seq 187601:188137, ack 1, win 65535, length 536
8.888694 IP 10.1.1.1.49153 > 10.1.1.2.8080: Flags [.], seq 188137:188673, ack 1, win 65535, length 536
8.889619 IP 10.1.1.2.8080 > 10.1.1.1.49153: Flags [.], ack 185457, win 65535, length 0
8.889619 IP 10.1.1.1.49153 > 10.1.1.2.8080: Flags [.], seq 188673:189209, ack 1, win 65535, length 536
8.890544 IP 10.1.1.1.49153 > 10.1.1.2.8080: Flags [.], seq 189209:189745, ack 1, win 65535, length 536
8.891468 IP 10.1.1.1.49153 > 10.1.1.2.8080: Flags [.], seq 189745:190281, ack 1, win 65535, length 536
9.084137 IP 10.1.1.2.8080 > 10.1.1.1.49153: Flags [.], ack 186529, win 65535, length 0
9.084137 IP 10.1.1.1.49153 > 10.1.1.2.8080: Flags [.], seq 190281:190817, ack 1, win 65535, length 536
9.085062 IP 10.1.1.1.49153 > 10.1.1.2.8080: Flags [.], seq 190817:191353, ack 1, win 65535, length 536
9.087836 IP 10.1.1.2.8080 > 10.1.1.1.49153: Flags [.], ack 187601, win 65535, length 0
9.087836 IP 10.1.1.1.49153 > 10.1.1.2.8080: Flags [.], seq 191353:191889, ack 1, win 65535, length 536
9.088761 IP 10.1.1.1.49153 > 10.1.1.2.8080: Flags [.], seq 191889:192425, ack 1, win 65535, length 536
9.089686 IP 10.1.1.2.8080 > 10.1.1.1.49153: Flags [.], ack 188673, win 65535, length 0
9.089686 IP 10.1.1.1.49153 > 10.1.1.2.8080: Flags [.], seq 192425:192961, ack 1, win 65535, length 536
9.090611 IP 10.1.1.1.49153 > 10.1.1.2.8080: Flags [.], seq 192961:193497, ack 1, win 65535, length 536
9.091536 IP 10.1.1.2.8080 > 10.1.1.1.49153: Flags [.], ack 189745, win 65535, length 0
9.091536 IP 10.1.1.1.49153 > 10.1.1.2.8080: Flags [.], seq 193497:194033, ack 1, win 65535, length 536
9.092460 IP 10.1.1.1.49153 > 10.1.1.2.8080: Flags [.], seq 194033:194569, ack 1, win 65535, length 536
9.285129 IP 10.1.1.2.8080 > 10.1.1.1.49153: Flags [.], ack 190817, win 65535, length 0
9.285129 IP 10.1.1.1.49153 > 10.1.1.2.8080: Flags [.], seq 194569:195105, ack 1, win 65535, length 536
9.286054 IP 10.1.1.1.49153 > 10.1.1.2.8080: Flags [.], seq 195105:195641, ack 1, win 65535, length 536
9.288828 IP 10.1.1.2.8080 > 10.1.1.1.49153: Flags [.], ack 191889, win 65535, length 0
9.288828 IP 10.1.1.1.49153 > 10.1.1.2.8080: Flags [.], seq 195641:196177, ack 1, win 65535, length 536
9.289753 IP 10.1.1.1.49153 > 10.1.1.2.8080: Flags [.], seq 196177:196713, ack 1, win 65535, length 536
9.290678 IP 10.1.1.2.8080 > 10.1.1.1.49153: Flags [.], ack 192961, win 65535, length 0
9.290678 IP 10.1.1.1.49153 > 10.1.1.2.8080: Flags [.], seq 196713:197249, ack 1, win 65535, length 536
9.291603 IP 10.1.1.1.49153 > 10.1.1.2.8080: Flags [.], seq 197249:197785, ack 1, win 65535, length 536
9.292528 IP 10.1.1.2.8080 > 10.1.1.1.49153: Flags [.], ack 194033, win 65535, length 0
9.292528 IP 10.1.1.1.49153 > 10.1.1.2.8080: Flags [.], seq 197785:198321, ack 1, win 65535, length 536
9.293452 IP 10.1.1.1.49153 > 10.1.1.2.8080: Flags [.], seq 198321:198857, ack 1, win 65535, length 536
9.294377 IP 10.1.1.1.49153 > 10.1.1.2.8080: Flags [.], seq 198857:199393, ack 1, win 65535, length 536
9.486121 IP 10.1.1.2.8080 > 10.1.1.1.49153: Flags [.], ack 195105, win 65535, length 0
9.486121 IP 10.1.1.1.49153 > 10.1.1.2.8080: Flags [.], seq 199393:199929, ack 1, win 65535, length 536
9.487046 IP 10.1.1.1.49153 > 10.1.1.2.8080: Flags [.], seq 199929:200465, ack 1, win 65535, length 536
9.489820 IP 10.1.1.2.8080 > 10.1.1.1.49153: Flags [.], ack 196177, win 65535, length 0
9.489820 IP 10.1.1.1.49153 > 10.1.1.2.8080: Flags [.], seq 200465:201001, ack 1, win 65535, length 536
9.490745 IP 10.1.1.1.49153 > 10.1.1.2.8080: Flags [.], seq 201001:201537, ack 1, win 65535, length 536
9.491670 IP 10.1.1.2.8080 > 10.1.1.1.49153: Flags [.], ack 197249, win 65535, length 0
9.491670 IP 10.1.1.1.49153 > 10.1.1.2.8080: Flags [.], seq 201537:202073, ack 1, win 65535, length 536
9.492595 IP 10.1.1.1.49153 > 10.1.1.2.8080: Flags [.], seq 202073:202609, ack 1, win 65535, length 536
9.493520 IP 10.1.1.2.8080 > 10.1.1.1.49153: Flags [.], ack 198321, win 65535, length 0
9.493520 IP 10.1.1.1.49153 > 10.1.1.2.8080: Flags [.], seq 202609:203145, ack 1, win 65535, length 536
9.494444 IP 10.1.1.1.49153 > 10.1.1.2.8080: Flags [.], seq 203145:203681, ack 1, win 65535, length 536
9.495369 IP 10.1.1.2.8080 > 10.1.1.1.49153: Flags [.], ack 199393, win 65535, length 0
9.495369 IP 10.1.1.1.49153 > 10.1.1.2.8080: Flags [.], seq 203681:204217, ack 1, win 65535, length 536
9.496294 IP 10.1.1.1.49153 > 10.1.1.2.8080: Flags [.], seq 204217:204753, ack 1, win 65535, length 536
9.688038 IP 10.1.1.2.8080 > 10.1.1.1.49153: Flags [.], ack 200465, win 65535, length 0
9.688038 IP 10.1.1.1.49153 > 10.1.1.2.8080: Flags [.], seq 204753:205289, ack 1, win 65535, length 536
9.688963 IP 10.1.1.1.49153 > 10.1.1.2.8080: Flags [.], seq 205289:205825, ack 1, win 65535, length 536
9.691737 IP 10.1.1.2.8080 > 10.1.1.1.49153: Flags [.], ack 201537, win 65535, length 0
9.691737 IP 10.1.1.1.49153 > 10.1.1.2.8080: Flags [.], seq 205825:206361, ack 1, win 65535, length 536
9.692662 IP 10.1.1.1.49153 > 10.1.1.2.8080: Flags [.], seq 206361:206897, ack 1, win 65535, length 536
9.693587 IP 10.1.1.2.8080 > 10.1.1.1.49153: Flags [.], ack 202609, win 65535, length 0
9.693587 IP 10.1.1.1.49153 > 10.1.1.2.8080: Flags [.], seq 206897:207433, ack 1, win 65535, length 536
9.694512 IP 10.1.1.1.49153 > 10.1.1.2.8080: Flags [.], seq 207433:207969, ack 1, win 65535, length 536
9.695436 IP 10.1.1.2.8080 > 10.1.1.1.49153: Flags [.], ack 203681, win 65535, length 0
9.695436 IP 10.1.1.1.49153 > 10.1.1.2.8080: Flags [.], seq 207969:208505, ack 1, win 65535, length 536
9.696361 IP 10.1.1.1.49153 > 10.1.1.2.8080: Flags [.], seq 208505:209041, ack 1, win 65535, length 536
9.697286 IP 10.1.1.2.8080 > 10.1.1.1.49153: Flags [.], ack 204753, win 65535, length 0
9.697286 IP 10.1.1.1.49153 > 10.1.1.2.8080: Flags [.], seq 209041:209577, ack 1, win 65535, length 536
9.698211 IP 10.1.1.1.49153 > 10.1.1.2.8080: Flags [.], seq 209577:210113, ack 1, win 65535, length 536
9.699136 IP 10.1.1.1.49153 > 10.1.1.2.8080: Flags [.], seq 210113:210649, ack 1, win 65535, length 536
9.889955 IP 10.1.1.2.8080 > 10.1.1.1.49153: Flags [.], ack 205825, win 65535, length 0
9.889955 IP 10.1.1.1.49153 > 10.1.1.2.8080: Flags [.], seq 210649:211185, ack 1, win 65535, length 536
9.890880 IP 10.1.1.1.49153 > 10.1.1.2.8080: Flags [.], seq 211185:211721, ack 1, win 65535, length 536
9.893654 IP 10.1.1.2.8080 > 10.1.1.1.49153: Flags [.], ack 206897, win 65535, length 0
9.893654 IP 10.1.1.1.49153 > 10.1.1.2.8080: Flags [.], seq 211721:212257, ack 1, win 65535, length 536
9.894579 IP 10.1.1.1.49153 > 10.1.1.2.8080: Flags [.], seq 212257:212793, ack 1, win 65535, length 536
9.895504 IP 10.1.1.2.8080 > 10.1.1.1.49153: Flags [.], ack 207969, win 65535, length 0
9.895504 IP 10.1.1.1.49153 > 10.1.1.2.8080: Flags [.], seq 212793:213329, ack 1, win 65535, length 536
9.896428 IP 10.1.1.1.49153 > 10.1.1.2.8080: Flags [.], seq 213329:213865, ack 1, win 65535, length 536
9.897353 IP 10.1.1.2.8080 > 10.1.1.1.49153: Flags [.], ack 209041, win 65535, length 0
9.897353 IP 10.1.1.1.49153 > 10.1.1.2.8080: Flags [.], seq 213865:214401, ack 1, win 65535, length 536
9.898278 IP 10.1.1.1.49153 > 10.1.1.2.8080: Flags [.], seq 214401:214937, ack 1, win 65535, length 536
9.899203 IP 10.1.1.2.8080 > 10.1.1.1.49153: Flags [.], ack 210113, win 65535, length 0
9.899203 IP 10.1.1.1.49153 > 10.1.1.2.8080: Flags [.], seq 214937:215473, ack 1, win 65535, length 536
9.900128 IP 10.1.1.1.49153 > 10.1.1.2.8080: Flags [.], seq 215473:216009, ack 1, win 65535, length 536
