1.100067 IP 10.1.1.1.49153 > 10.1.1.2.8080: Flags [S], seq 0, win 65535, length 0
1.100067 IP 10.1.1.2.8080 > 10.1.1.1.49153: Flags [S.], seq 0, ack 1, win 65535, length 0
1.300201 IP 10.1.1.1.49153 > 10.1.1.2.8080: Flags [.], ack 1, win 65535, length 0
1.301126 IP 10.1.1.1.49153 > 10.1.1.2.8080: Flags [.], seq 1:537, ack 1, win 65535, length 536
1.301126 IP 10.1.1.2.8080 > 10.1.1.1.49153: Flags [.], ack 537, win 65535, length 0
1.502118 IP 10.1.1.1.49153 > 10.1.1.2.8080: Flags [.], seq 537:1073, ack 1, win 65535, length 536
1.503043 IP 10.1.1.1.49153 > 10.1.1.2.8080: Flags [.], seq 1073:1609, ack 1, win 65535, length 536
1.503043 IP 10.1.1.2.8080 > 10.1.1.1.49153: Flags [.], ack 1609, win 65535, length 0
1.704035 IP 10.1.1.1.49153 > 10.1.1.2.8080: Flags [.], seq 1609:2145, ack 1, win 65535, length 536
1.704960 IP 10.1.1.1.49153 > 10.1.1.2.8080: Flags [.], seq 2145:2681, ack 1, win 65535, length 536
1.704960 IP 10.1.1.2.8080 > 10.1.1.1.49153: Flags [.], ack 2681, win 65535, length 0
1.705884 IP 10.1.1.1.49153 > 10.1.1.2.8080: Flags [.], seq 2681:3217, ack 1, win 65535, length 536
1.905884 IP 10.1.1.2.8080 > 10.1.1.1.49153: Flags [.], ack 3217, win 65535, length 0
1.905952 IP 10.1.1.1.49153 > 10.1.1.2.8080: Flags [.], seq 3217:3753, ack 1, win 65535, length 536
1.906876 IP 10.1.1.1.49153 > 10.1.1.2.8080: Flags [.], seq 3753:4289, ack 1, win 65535, length 536
1.906876 IP 10.1.1.2.8080 > 10.1.1.1.49153: Flags [.], ack 4289, win 65535, length 0
1.907801 IP 10.1.1.1.49153 > 10.1.1.2.8080: Flags [.], seq 4289:4825, ack 1, win 65535, length 536
2.106876 IP 10.1.1.1.49153 > 10.1.1.2.8080: Flags [.], seq 4825:5361, ack 1, win 65535, length 536
2.106876 IP 10.1.1.2.8080 > 10.1.1.1.49153: Flags [.], ack 5361, win 65535, length 0
2.107801 IP 10.1.1.1.49153 > 10.1.1.2.8080: Flags [.], seq 5361:5897, ack 1, win 65535, length 536
2.108726 IP 10.1.1.1.49153 > 10.1.1.2.8080: Flags [.], seq 5897:6433, ack 1, win 65535, length 536
2.108726 IP 10.1.1.2.8080 > 10.1.1.1.49153: Flags [.], ack 6433, win 65535, length 0
2.109651 IP 10.1.1.1.49153 > 10.1.1.2.8080: Flags [.], seq 6433:6969, ack 1, win 65535, length 536
2.110576 IP 10.1.1.1.49153 > 10.1.1.2.8080: Flags [.], seq 6969:7505, ack 1, win 65535, length 536
2.110576 IP 10.1.1.2.8080 > 10.1.1.1.49153: Flags [.], ack 7505, win 65535, length 0
2.307868 IP 10.1.1.1.49153 > 10.1.1.2.8080: Flags [.], seq 7505:8041, ack 1, win 65535, length 536
2.308793 IP 10.1.1.1.49153 > 10.1.1.2.8080: Flags [.], seq 8041:8577, ack 1, win 65535, length 536
2.308793 IP 10.1.1.2.8080 > 10.1.1.1.49153: Flags [.], ack 8577, win 65535, length 0
2.309718 IP 10.1.1.1.49153 > 10.1.1.2.8080: Flags [.], seq 8577:9113, ack 1, win 65535, length 536
2.310643 IP 10.1.1.1.49153 > 10.1.1.2.8080: Flags [.], seq 9113:9649, ack 1, win 65535, length 536
2.310643 IP 10.1.1.2.8080 > 10.1.1.1.49153: Flags [.], ack 9649, win 65535, length 0
2.311568 IP 10.1.1.1.49153 > 10.1.1.2.8080: Flags [.], seq 9649:10185, ack 1, win 65535, length 536
2.312492 IP 10.1.1.1.49153 > 10.1.1.2.8080: Flags [.], seq 10185:10721, ack 1, win 65535, length 536
2.312492 IP 10.1.1.2.8080 > 10.1.1.1.49153: Flags [.], ack 10721, win 65535, length 0
2.313417 IP 10.1.1.1.49153 > 10.1.1.2.8080: Flags [.], seq 10721:11257, ack 1, win 65535, length 536
2.314342 IP 10.1.1.1.49153 > 10.1.1.2.8080: Flags [.], seq 11257:11793, ack 1, win 65535, length 536
2.314342 IP 10.1.1.2.8080 > 10.1.1.1.49153: Flags [.], ack 11793, win 65535, length 0
2.315267 IP 10.1.1.1.49153 > 10.1.1.2.8080: Flags [.], seq 11793:12329, ack 1, win 65535, length 536
2.509785 IP 10.1.1.1.49153 > 10.1.1.2.8080: Flags [.], seq 12329:12865, ack 1, win 65535, length 536
2.509785 IP 10.1.1.2.8080 > 10.1.1.1.49153: Flags [.], ack 12865, win 65535, length 0
2.510710 IP 10.1.1.1.49153 > 10.1.1.2.8080: Flags [.], seq 12865:13401, ack 1, win 65535, length 536
2.511635 IP 10.1.1.1.49153 > 10.1.1.2.8080: Flags [.], seq 13401:13937, ack 1, win 65535, length 536
2.511635 IP 10.1.1.2.8080 > 10.1.1.1.49153: Flags [.], ack 13937, win 65535, length 0
2.512560 IP 10.1.1.1.49153 > 10.1.1.2.8080: Flags [.], seq 13937:14473, ack 1, win 65535, length 536
2.513484 IP 10.1.1.1.49153 > 10.1.1.2.8080: Flags [.], seq 14473:15009, ack 1, win 65535, length 536
2.513484 IP 10.1.1.2.8080 > 10.1.1.1.49153: Flags [.], ack 15009, win 65535, length 0
2.514409 IP 10.1.1.1.49153 > 10.1.1.2.8080: Flags [.], seq 15009:15545, ack 1, win 65535, length 536
2.515334 IP 10.1.1.1.49153 > 10.1.1.2.8080: Flags [.], seq 15545:16081, ack 1, win 65535, length 536
2.515334 IP 10.1.1.2.8080 > 10.1.1.1.49153: Flags [.], ack 16081, win 65535, length 0
2.516259 IP 10.1.1.1.49153 > 10.1.1.2.8080: Flags [.], seq 16081:16617, ack 1, win 65535, length 536
2.517184 IP 10.1.1.1.49153 > 10.1.1.2.8080: Flags [.], seq 16617:17153, ack 1, win 65535, length 536
2.517184 IP 10.1.1.2.8080 > 10.1.1.1.49153: Flags [.], ack 17153, win 65535, length 0
2.518108 IP 10.1.1.1.49153 > 10.1.1.2.8080: Flags [.], seq 17153:17689, ack 1, win 65535, length 536
2.519033 IP 10.1.1.1.49153 > 10.1.1.2.8080: Flags [.], seq 17689:18225, ack 1, win 65535, length 536
2.519033 IP 10.1.1.2.8080 > 10.1.1.1.49153: Flags [.], ack 18225, win 65535, length 0
2.519958 IP 10.1.1.1.49153 > 10.1.1.2.8080: Flags [.], seq 18225:18761, ack 1, win 65535, length 536
2.710777 IP 10.1.1.1.49153 > 10.1.1.2.8080: Flags [.], seq 18761:19297, ack 1, win 65535, length 536
2.710777 IP 10.1.1.2.8080 > 10.1.1.1.49153: Flags [.], ack 19297, win 65535, length 0
2.711702 IP 10.1.1.1.49153 > 10.1.1.2.8080: Flags [.], seq 19297:19833, ack 1, win 65535, length 536
2.712627 IP 10.1.1.1.49153 > 10.1.1.2.8080: Flags [.], seq 19833:20369, ack 1, win 65535, length 536
2.712627 IP 10.1.1.2.8080 > 10.1.1.1.49153: Flags [.], ack 20369, win 65535, length 0
2.713552 IP 10.1.1.1.49153 > 10.1.1.2.8080: Flags [.], seq 20369:20905, ack 1, win 65535, length 536
2.714476 IP 10.1.1.1.49153 > 10.1.1.2.8080: Flags [.], seq 20905:21441, ack 1, win 65535, length 536
2.714476 IP 10.1.1.2.8080 > 10.1.1.1.49153: Flags [.], ack 21441, win 65535, length 0
2.715401 IP 10.1.1.1.49153 > 10.1.1.2.8080: Flags [.], seq 21441:21977, ack 1, win 65535, length 536
2.716326 IP 10.1.1.1.49153 > 10.1.1.2.8080: Flags [.], seq 21977:22513, ack 1, win 65535, length 536
2.716326 IP 10.1.1.2.8080 > 10.1.1.1.49153: Flags [.], ack 22513, win 65535, length 0
2.717251 IP 10.1.1.1.49153 > 10.1.1.2.8080: Flags [.], seq 22513:23049, ack 1, win 65535, length 536
2.718176 IP 10.1.1.1.49153 > 10.1.1.2.8080: Flags [.], seq 23049:23585, ack 1, win 65535, length 536
2.718176 IP 10.1.1.2.8080 > 10.1.1.1.49153: Flags [.], ack 23585, win 65535, length 0
2.719100 IP 10.1.1.1.49153 > 10.1.1.2.8080: Flags [.], seq 23585:24121, ack 1, win 65535, length 536
2.720025 IP 10.1.1.1.49153 > 10.1.1.2.8080: Flags [.], seq 24121:24657, ack 1, win 65535, length 536
2.720025 IP 10.1.1.2.8080 > 10.1.1.1.49153: Flags [.], ack 24657, win 65535, length 0
2.720950 IP 10.1.1.1.49153 > 10.1.1.2.8080: Flags [.], seq 24657:25193, ack 1, win 65535, length 536
2.721875 IP 10.1.1.1.49153 > 10.1.1.2.8080: Flags [.], seq 25193:25729, ack 1, win 65535, length 536
2.721875 IP 10.1.1.2.8080 > 10.1.1.1.49153: Flags [.], ack 25729, win 65535, length 0
2.722800 IP 10.1.1.1.49153 > 10.1.1.2.8080: Flags [.], seq 25729:26265, ack 1, win 65535, length 536
2.723724 IP 10.1.1.1.49153 > 10.1.1.2.8080: Flags [.], seq 26265:26801, ack 1, win 65535, length 536
2.723724 IP 10.1.1.2.8080 > 10.1.1.1.49153: Flags [.], ack 26801, win 65535, length 0
2.724649 IP 10.1.1.1.49153 > 10.1.1.2.8080: Flags [.], seq 26801:27337, ack 1, win 65535, length 536
2.725574 IP 10.1.1.1.49153 > 10.1.1.2.8080: Flags [.], seq 27337:27873, ack 1, win 65535, length 536
2.725574 IP 10.1.1.2.8080 > 10.1.1.1.49153: Flags [.], ack 27873, win 65535, length 0
2.726499 IP 10.1.1.1.49153 > 10.1.1.2.8080: Flags [.], seq 27873:28409, ack 1, win 65535, length 536
2.911769 IP 10.1.1.1.49153 > 10.1.1.2.8080: Flags [.], seq 28409:28945, ack 1, win 65535, length 536
2.911769 IP 10.1.1.2.8080 > 10.1.1.1.49153: Flags [.], ack 28945, win 65535, length 0
2.912694 IP 10.1.1.1.49153 > 10.1.1.2.8080: Flags [.], seq 28945:29481, ack 1, win 65535, length 536
2.913619 IP 10.1.1.1.49153 > 10.1.1.2.8080: Flags [.], seq 29481:30017, ack 1, win 65535, length 536
2.913619 IP 10.1.1.2.8080 > 10.1.1.1.49153: Flags [.], ack 30017, win 65535, length 0
2.914544 IP 10.1.1.1.49153 > 10.1.1.2.8080: Flags [.], seq 30017:30553, ack 1, win 65535, length 536
2.915468 IP 10.1.1.1.49153 > 10.1.1.2.8080: Flags [.], seq 30553:31089, ack 1, win 65535, length 536
2.915468 IP 10.1.1.2.8080 > 10.1.1.1.49153: Flags [.], ack 31089, win 65535, length 0
2.916393 IP 10.1.1.1.49153 > 10.1.1.2.8080: Flags [.], seq 31089:31625, ack 1, win 65535, length 536
2.917318 IP 10.1.1.1.49153 > 10.1.1.2.8080: Flags [.], seq 31625:32161, ack 1, win 65535, length 536
2.917318 IP 10.1.1.2.8080 > 10.1.1.1.49153: Flags [.], ack 32161, win 65535, length 0
2.918243 IP 10.1.1.1.49153 > 10.1.1.2.8080: Flags [.], seq 32161:32697, ack 1, win 65535, length 536
2.919168 IP 10.1.1.1.49153 > 10.1.1.2.8080: Flags [.], seq 32697:33233, ack 1, win 65535, length 536
2.919168 IP 10.1.1.2.8080 > 10.1.1.1.49153: Flags [.], ack 33233, win 65535, length 0
2.920092 IP 10.1.1.1.49153 > 10.1.1.2.8080: Flags [.], seq 33233:33769, ack 1, win 65535, length 536
2.921017 IP 10.1.1.1.49153 > 10.1.1.2.8080: Flags [.], seq 33769:34305, ack 1, win 65535, length 536
2.921017 IP 10.1.1.2.8080 > 10.1.1.1.49153: Flags [.], ack 34305, win 65535, length 0
2.921942 IP 10.1.1.1.49153 > 10.1.1.2.8080: Flags [.], seq 34305:34841, ack 1, win 65535, length 536
2.922867 IP 10.1.1.1.49153 > 10.1.1.2.8080: Flags [.], seq 34841:35377, ack 1, win 65535, length 536
2.922867 IP 10.1.1.2.8080 > 10.1.1.1.49153: Flags [.], ack 35377, win 65535, length 0
2.923792 IP 10.1.1.1.49153 > 10.1.1.2.8080: Flags [.], seq 35377:35913, ack 1, win 65535, length 536
2.924716 IP 10.1.1.1.49153 > 10.1.1.2.8080: Flags [.], seq 35913:36449, ack 1, win 65535, length 536
2.924716 IP 10.1.1.2.8080 > 10.1.1.1.49153: Flags [.], ack 36449, win 65535, length 0
2.925641 IP 10.1.1.1.49153 > 10.1.1.2.8080: Flags [.], seq 36449:36985, ack 1, win 65535, length 536
2.926566 IP 10.1.1.1.49153 > 10.1.1.2.8080: Flags [.], seq 36985:37521, ack 1, win 65535, length 536
2.926566 IP 10.1.1.2.8080 > 10.1.1.1.49153: Flags [.], ack 37521, win 65535, length 0
2.927491 IP 10.1.1.1.49153 > 10.1.1.2.8080: Flags [.], seq 37521:38057, ack 1, win 65535, length 536
2.928416 IP 10.1.1.1.49153 > 10.1.1.2.8080: Flags [.], seq 38057:38593, ack 1, win 65535, length 536
2.928416 IP 10.1.1.2.8080 > 10.1.1.1.49153: Flags [.], ack 38593, win 65535, length 0
2.929340 IP 10.1.1.1.49153 > 10.1.1.2.8080: Flags [.], seq 38593:39129, ack 1, win 65535, length 536
2.930265 IP 10.1.1.1.49153 > 10.1.1.2.8080: Flags [.], seq 39129:39665, ack 1, win 65535, length 536
2.930265 IP 10.1.1.2.8080 > 10.1.1.1.49153: Flags [.], ack 39665, win 65535, length 0
2.931190 IP 10.1.1.1.49153 > 10.1.1.2.8080: Flags [.], seq 39665:40201, ack 1, win 65535, length 536
2.932115 IP 10.1.1.1.49153 > 10.1.1.2.8080: Flags [.], seq 40201:40737, ack 1, win 65535, length 536
2.932115 IP 10.1.1.2.8080 > 10.1.1.1.49153: Flags [.], ack 40737, win 65535, length 0
2.933040 IP 10.1.1.1.49153 > 10.1.1.2.8080: Flags [.], seq 40737:41273, ack 1, win 65535, length 536
2.933964 IP 10.1.1.1.49153 > 10.1.1.2.8080: Flags [.], seq 41273:41809, ack 1, win 65535, length 536
2.933964 IP 10.1.1.2.8080 > 10.1.1.1.49153: Flags [.], ack 41809, win 65535, length 0
2.934889 IP 10.1.1.1.49153 > 10.1.1.2.8080: Flags [.], seq 41809:42345, ack 1, win 65535, length 536
2.935814 IP 10.1.1.1.49153 > 10.1.1.2.8080: Flags [.], seq 42345:42881, ack 1, win 65535, length 536
2.935814 IP 10.1.1.2.8080 > 10.1.1.1.49153: Flags [.], ack 42881, win 65535, length 0
3.112761 IP 10.1.1.1.49153 > 10.1.1.2.8080: Flags [.], seq 42881:43417, ack 1, win 65535, length 536
3.113686 IP 10.1.1.1.49153 > 10.1.1.2.8080: Flags [.], seq 43417:43953, ack 1, win 65535, length 536
3.113686 IP 10.1.1.2.8080 > 10.1.1.1.49153: Flags [.], ack 43953, win 65535, length 0
3.114611 IP 10.1.1.1.49153 > 10.1.1.2.8080: Flags [.], seq 43953:44489, ack 1, win 65535, length 536
3.115536 IP 10.1.1.1.49153 > 10.1.1.2.8080: Flags [.], seq 44489:45025, ack 1, win 65535, length 536
3.115536 IP 10.1.1.2.8080 > 10.1.1.1.49153: Flags [.], ack 45025, win 65535, length 0
3.116460 IP 10.1.1.1.49153 > 10.1.1.2.8080: Flags [.], seq 45025:45561, ack 1, win 65535, length 536
3.117385 IP 10.1.1.1.49153 > 10.1.1.2.8080: Flags [.], seq 45561:46097, ack 1, win 65535, length 536
3.117385 IP 10.1.1.2.8080 > 10.1.1.1.49153: Flags [.], ack 46097, win 65535, length 0
3.118310 IP 10.1.1.1.49153 > 10.1.1.2.8080: Flags [.], seq 46097:46633, ack 1, win 65535, length 536
3.119235 IP 10.1.1.1.49153 > 10.1.1.2.8080: Flags [.], seq 46633:47169, ack 1, win 65535, length 536
3.119235 IP 10.1.1.2.8080 > 10.1.1.1.49153: Flags [.], ack 47169, win 65535, length 0
3.120160 IP 10.1.1.1.49153 > 10.1.1.2.8080: Flags [.], seq 47169:47705, ack 1, win 65535, length 536
3.121084 IP 10.1.1.1.49153 > 10.1.1.2.8080: Flags [.], seq 47705:48241, ack 1, win 65535, length 536
3.121084 IP 10.1.1.2.8080 > 10.1.1.1.49153: Flags [.], ack 48241, win 65535, length 0
3.122009 IP 10.1.1.1.49153 > 10.1.1.2.8080: Flags [.], seq 48241:48777, ack 1, win 65535, length 536
3.122934 IP 10.1.1.1.49153 > 10.1.1.2.8080: Flags [.], seq 48777:49313, ack 1, win 65535, length 536
3.122934 IP 10.1.1.2.8080 > 10.1.1.1.49153: Flags [.], ack 49313, win 65535, length 0
3.123859 IP 10.1.1.1.49153 > 10.1.1.2.8080: Flags [.], seq 49313:49849, ack 1, win 65535, length 536
3.124784 IP 10.1.1.1.49153 > 10.1.1.2.8080: Flags [.], seq 49849:50385, ack 1, win 65535, length 536
3.124784 IP 10.1.1.2.8080 > 10.1.1.1.49153: Flags [.], ack 50385, win 65535, length 0
3.125708 IP 10.1.1.1.49153 > 10.1.1.2.8080: Flags [.], seq 50385:50921, ack 1, win 65535, length 536
3.126633 IP 10.1.1.1.49153 > 10.1.1.2.8080: Flags [.], seq 50921:51457, ack 1, win 65535, length 536
3.126633 IP 10.1.1.2.8080 > 10.1.1.1.49153: Flags [.], ack 51457, win 65535, length 0
3.127558 IP 10.1.1.1.49153 > 10.1.1.2.8080: Flags [.], seq 51457:51993, ack 1, win 65535, length 536
3.128483 IP 10.1.1.1.49153 > 10.1.1.2.8080: Flags [.], seq 51993:52529, ack 1, win 65535, length 536
3.128483 IP 10.1.1.2.8080 > 10.1.1.1.49153: Flags [.], ack 52529, win 65535, length 0
3.129408 IP 10.1.1.1.49153 > 10.1.1.2.8080: Flags [.], seq 52529:53065, ack 1, win 65535, length 536
3.130332 IP 10.1.1.1.49153 > 10.1.1.2.8080: Flags [.], seq 53065:53601, ack 1, win 65535, length 536
3.130332 IP 10.1.1.2.8080 > 10.1.1.1.49153: Flags [.], ack 53601, win 65535, length 0
3.131257 IP 10.1.1.1.49153 > 10.1.1.2.8080: Flags [.], seq 53601:54137, ack 1, win 65535, length 536
3.132182 IP 10.1.1.1.49153 > 10.1.1.2.8080: Flags [.], seq 54137:54673, ack 1, win 65535, length 536
3.132182 IP 10.1.1.2.8080 > 10.1.1.1.49153: Flags [.], ack 54673, win 65535, length 0
3.133107 IP 10.1.1.1.49153 > 10.1.1.2.8080: Flags [.], seq 54673:55209, ack 1, win 65535, length 536
3.134032 IP 10.1.1.1.49153 > 10.1.1.2.8080: Flags [.], seq 55209:55745, ack 1, win 65535, length 536
3.134032 IP 10.1.1.2.8080 > 10.1.1.1.49153: Flags [.], ack 55745, win 65535, length 0
3.134956 IP 10.1.1.1.49153 > 10.1.1.2.8080: Flags [.], seq 55745:56281, ack 1, win 65535, length 536
3.135881 IP 10.1.1.1.49153 > 10.1.1.2.8080: Flags [.], seq 56281:56817, ack 1, win 65535, length 536
3.135881 IP 10.1.1.2.8080 > 10.1.1.1.49153: Flags [.], ack 56817, win 65535, length 0
3.136806 IP 10.1.1.1.49153 > 10.1.1.2.8080: Flags [.], seq 56817:57353, ack 1, win 65535, length 536
3.137731 IP 10.1.1.1.49153 > 10.1.1.2.8080: Flags [.], seq 57353:57889, ack 1, win 65535, length 536
3.137731 IP 10.1.1.2.8080 > 10.1.1.1.49153: Flags [.], ack 57889, win 65535, length 0
3.138656 IP 10.1.1.1.49153 > 10.1.1.2.8080: Flags [.], seq 57889:58425, ack 1, win 65535, length 536
3.139580 IP 10.1.1.1.49153 > 10.1.1.2.8080: Flags [.], seq 58961:59497, ack 1, win 65535, length 536
3.139580 IP 10.1.1.2.8080 > 10.1.1.1.49153: Flags [.], ack 58425, win 65535, length 0
3.140505 IP 10.1.1.1.49153 > 10.1.1.2.8080: Flags [.], seq 59497:60033, ack 1, win 65535, length 536
3.140505 IP 10.1.1.2.8080 > 10.1.1.1.49153: Flags [.], ack 58425, win 65535, length 0
3.141430 IP 10.1.1.1.49153 > 10.1.1.2.8080: Flags [.], seq 60569:61105, ack 1, win 65535, length 536
3.141430 IP 10.1.1.2.8080 > 10.1.1.1.49153: Flags [.], ack 58425, win 65535, length 0
3.142355 IP 10.1.1.1.49153 > 10.1.1.2.8080: Flags [.], seq 61105:61641, ack 1, win 65535, length 536
3.142355 IP 10.1.1.2.8080 > 10.1.1.1.49153: Flags [.], ack 58425, win 65535, length 0
3.143280 IP 10.1.1.1.49153 > 10.1.1.2.8080: Flags [.], seq 62177:62713, ack 1, win 65535, length 536
3.143280 IP 10.1.1.2.8080 > 10.1.1.1.49153: Flags [.], ack 58425, win 65535, length 0
3.144204 IP 10.1.1.1.49153 > 10.1.1.2.8080: Flags [.], seq 62713:63249, ack 1, win 65535, length 536
3.144204 IP 10.1.1.2.8080 > 10.1.1.1.49153: Flags [.], ack 58425, win 65535, length 0
3.145129 IP 10.1.1.1.49153 > 10.1.1.2.8080: Flags [.], seq 63785:64321, ack 1, win 65535, length 536
3.145129 IP 10.1.1.2.8080 > 10.1.1.1.49153: Flags [.], ack 58425, win 65535, length 0
3.146054 IP 10.1.1.1.49153 > 10.1.1.2.8080: Flags [.], seq 64321:64857, ack 1, win 65535, length 536
3.146054 IP 10.1.1.2.8080 > 10.1.1.1.49153: Flags [.], ack 58425, win 65535, length 0
3.314678 IP 10.1.1.1.49153 > 10.1.1.2.8080: Flags [.], seq 65393:65929, ack 1, win 65535, length 536
3.314678 IP 10.1.1.2.8080 > 10.1.1.1.49153: Flags [.], ack 58425, win 65535, length 0
3.315603 IP 10.1.1.1.49153 > 10.1.1.2.8080: Flags [.], seq 65929:66465, ack 1, win 65535, length 536
3.315603 IP 10.1.1.2.8080 > 10.1.1.1.49153: Flags [.], ack 58425, win 65535, length 0
3.316528 IP 10.1.1.1.49153 > 10.1.1.2.8080: Flags [.], seq 66465:67001, ack 1, win 65535, length 536
3.316528 IP 10.1.1.2.8080 > 10.1.1.1.49153: Flags [.], ack 58425, win 65535, length 0
3.317452 IP 10.1.1.1.49153 > 10.1.1.2.8080: Flags [.], seq 67001:67537, ack 1, win 65535, length 536
3.317452 IP 10.1.1.2.8080 > 10.1.1.1.49153: Flags [.], ack 58425, win 65535, length 0
3.318377 IP 10.1.1.1.49153 > 10.1.1.2.8080: Flags [.], seq 67537:68073, ack 1, win 65535, length 536
3.318377 IP 10.1.1.2.8080 > 10.1.1.1.49153: Flags [.], ack 58425, win 65535, length 0
3.319302 IP 10.1.1.1.49153 > 10.1.1.2.8080: Flags [.], seq 68073:68609, ack 1, win 65535, length 536
3.319302 IP 10.1.1.2.8080 > 10.1.1.1.49153: Flags [.], ack 58425, win 65535, length 0
3.320227 IP 10.1.1.1.49153 > 10.1.1.2.8080: Flags [.], seq 68609:69145, ack 1, win 65535, length 536
3.320227 IP 10.1.1.2.8080 > 10.1.1.1.49153: Flags [.], ack 58425, win 65535, length 0
3.321152 IP 10.1.1.1.49153 > 10.1.1.2.8080: Flags [.], seq 69145:69681, ack 1, win 65535, length 536
3.321152 IP 10.1.1.2.8080 > 10.1.1.1.49153: Flags [.], ack 58425, win 65535, length 0
3.322076 IP 10.1.1.1.49153 > 10.1.1.2.8080: Flags [.], seq 69681:70217, ack 1, win 65535, length 536
3.322076 IP 10.1.1.2.8080 > 10.1.1.1.49153: Flags [.], ack 58425, win 65535, length 0
3.323001 IP 10.1.1.1.49153 > 10.1.1.2.8080: Flags [.], seq 70217:70753, ack 1, win 65535, length 536
3.323001 IP 10.1.1.2.8080 > 10.1.1.1.49153: Flags [.], ack 58425, win 65535, length 0
3.323926 IP 10.1.1.1.49153 > 10.1.1.2.8080: Flags [.], seq 70753:71289, ack 1, win 65535, length 536
3.323926 IP 10.1.1.2.8080 > 10.1.1.1.49153: Flags [.], ack 58425, win 65535, length 0
3.324851 IP 10.1.1.1.49153 > 10.1.1.2.8080: Flags [.], seq 71289:71825, ack 1, win 65535, length 536
3.324851 IP 10.1.1.2.8080 > 10.1.1.1.49153: Flags [.], ack 58425, win 65535, length 0
3.325776 IP 10.1.1.1.49153 > 10.1.1.2.8080: Flags [.], seq 71825:72361, ack 1, win 65535, length 536
3.325776 IP 10.1.1.2.8080 > 10.1.1.1.49153: Flags [.], ack 58425, win 65535, length 0
3.326700 IP 10.1.1.1.49153 > 10.1.1.2.8080: Flags [.], seq 72361:72897, ack 1, win 65535, length 536
3.326700 IP 10.1.1.2.8080 > 10.1.1.1.49153: Flags [.], ack 58425, win 65535, length 0
3.327625 IP 10.1.1.1.49153 > 10.1.1.2.8080: Flags [.], seq 72897:73433, ack 1, win 65535, length 536
3.327625 IP 10.1.1.2.8080 > 10.1.1.1.49153: Flags [.], ack 58425, win 65535, length 0
3.328550 IP 10.1.1.1.49153 > 10.1.1.2.8080: Flags [.], seq 73433:73969, ack 1, win 65535, length 536
3.328550 IP 10.1.1.2.8080 > 10.1.1.1.49153: Flags [.], ack 58425, win 65535, length 0
3.329475 IP 10.1.1.1.49153 > 10.1.1.2.8080: Flags [.], seq 73969:74505, ack 1, win 65535, length 536
3.329475 IP 10.1.1.2.8080 > 10.1.1.1.49153: Flags [.], ack 58425, win 65535, length 0
3.330400 IP 10.1.1.1.49153 > 10.1.1.2.8080: Flags [.], seq 74505:75041, ack 1, win 65535, length 536
3.330400 IP 10.1.1.2.8080 > 10.1.1.1.49153: Flags [.], ack 58425, win 65535, length 0
3.331324 IP 10.1.1.1.49153 > 10.1.1.2.8080: Flags [.], seq 75041:75577, ack 1, win 65535, length 536
3.331324 IP 10.1.1.2.8080 > 10.1.1.1.49153: Flags [.], ack 58425, win 65535, length 0
3.332249 IP 10.1.1.1.49153 > 10.1.1.2.8080: Flags [.], seq 75577:76113, ack 1, win 65535, length 536
3.332249 IP 10.1.1.2.8080 > 10.1.1.1.49153: Flags [.], ack 58425, win 65535, length 0
3.333174 IP 10.1.1.1.49153 > 10.1.1.2.8080: Flags [.], seq 76113:76649, ack 1, win 65535, length 536
3.333174 IP 10.1.1.2.8080 > 10.1.1.1.49153: Flags [.], ack 58425, win 65535, length 0
3.334099 IP 10.1.1.1.49153 > 10.1.1.2.8080: Flags [.], seq 76649:77185, ack 1, win 65535, length 536
3.334099 IP 10.1.1.2.8080 > 10.1.1.1.49153: Flags [.], ack 58425, win 65535, length 0
3.335024 IP 10.1.1.1.49153 > 10.1.1.2.8080: Flags [.], seq 77185:77721, ack 1, win 65535, length 536
3.335024 IP 10.1.1.2.8080 > 10.1.1.1.49153: Flags [.], ack 58425, win 65535, length 0
3.335948 IP 10.1.1.1.49153 > 10.1.1.2.8080: Flags [.], seq 77721:78257, ack 1, win 65535, length 536
3.335948 IP 10.1.1.2.8080 > 10.1.1.1.49153: Flags [.], ack 58425, win 65535, length 0
3.336873 IP 10.1.1.1.49153 > 10.1.1.2.8080: Flags [.], seq 78257:78793, ack 1, win 65535, length 536
3.336873 IP 10.1.1.2.8080 > 10.1.1.1.49153: Flags [.], ack 58425, win 65535, length 0
3.337798 IP 10.1.1.1.49153 > 10.1.1.2.8080: Flags [.], seq 78793:79329, ack 1, win 65535, length 536
3.337798 IP 10.1.1.2.8080 > 10.1.1.1.49153: Flags [.], ack 58425, win 65535, length 0
3.338723 IP 10.1.1.1.49153 > 10.1.1.2.8080: Flags [.], seq 79329:79865, ack 1, win 65535, length 536
3.338723 IP 10.1.1.2.8080 > 10.1.1.1.49153: Flags [.], ack 58425, win 65535, length 0
3.339648 IP 10.1.1.1.49153 > 10.1.1.2.8080: Flags [.], seq 79865:80401, ack 1, win 65535, length 536
3.339648 IP 10.1.1.2.8080 > 10.1.1.1.49153: Flags [.], ack 58425, win 65535, length 0
3.340572 IP 10.1.1.1.49153 > 10.1.1.2.8080: Flags [.], seq 80401:80937, ack 1, win 65535, length 536
3.340572 IP 10.1.1.2.8080 > 10.1.1.1.49153: Flags [.], ack 58425, win 65535, length 0
3.341497 IP 10.1.1.1.49153 > 10.1.1.2.8080: Flags [.], seq 81473:82009, ack 1, win 65535, length 536
3.341497 IP 10.1.1.2.8080 > 10.1.1.1.49153: Flags [.], ack 58425, win 65535, length 0
3.342422 IP 10.1.1.1.49153 > 10.1.1.2.8080: Flags [.], seq 82009:82545, ack 1, win 65535, length 536
3.342422 IP 10.1.1.2.8080 > 10.1.1.1.49153: Flags [.], ack 58425, win 65535, length 0
3.343347 IP 10.1.1.1.49153 > 10.1.1.2.8080: Flags [.], seq 83081:83617, ack 1, win 65535, length 536
3.343347 IP 10.1.1.2.8080 > 10.1.1.1.49153: Flags [.], ack 58425, win 65535, length 0
3.344272 IP 10.1.1.1.49153 > 10.1.1.2.8080: Flags [.], seq 83617:84153, ack 1, win 65535, length 536
3.344272 IP 10.1.1.2.8080 > 10.1.1.1.49153: Flags [.], ack 58425, win 65535, length 0
3.345196 IP 10.1.1.1.49153 > 10.1.1.2.8080: Flags [.], seq 84689:85225, ack 1, win 65535, length 536
3.345196 IP 10.1.1.2.8080 > 10.1.1.1.49153: Flags [.], ack 58425, win 65535, length 0
3.346121 IP 10.1.1.1.49153 > 10.1.1.2.8080: Flags [.], seq 85225:85761, ack 1, win 65535, length 536
3.346121 IP 10.1.1.2.8080 > 10.1.1.1.49153: Flags [.], ack 58425, win 65535, length 0
3.347046 IP 10.1.1.1.49153 > 10.1.1.2.8080: Flags [.], seq 86297:86833, ack 1, win 65535, length 536
3.347046 IP 10.1.1.2.8080 > 10.1.1.1.49153: Flags [.], ack 58425, win 65535, length 0
3.347971 IP 10.1.1.1.49153 > 10.1.1.2.8080: Flags [.], seq 86833:87369, ack 1, win 65535, length 536
3.347971 IP 10.1.1.2.8080 > 10.1.1.1.49153: Flags [.], ack 58425, win 65535, length 0
3.348896 IP 10.1.1.1.49153 > 10.1.1.2.8080: Flags [.], seq 87905:88441, ack 1, win 65535, length 536
3.348896 IP 10.1.1.2.8080 > 10.1.1.1.49153: Flags [.], ack 58425, win 65535, length 0
3.349820 IP 10.1.1.1.49153 > 10.1.1.2.8080: Flags [.], seq 88441:88977, ack 1, win 65535, length 536
3.349820 IP 10.1.1.2.8080 > 10.1.1.1.49153: Flags [.], ack 58425, win 65535, length 0
3.350745 IP 10.1.1.1.49153 > 10.1.1.2.8080: Flags [.], seq 58425:58961, ack 1, win 65535, length 536
3.350745 IP 10.1.1.2.8080 > 10.1.1.1.49153: Flags [.], ack 60033, win 65535, length 0
3.536016 IP 10.1.1.1.49153 > 10.1.1.2.8080: Flags [.], seq 88977:89513, ack 1, win 65535, length 536
3.536016 IP 10.1.1.2.8080 > 10.1.1.1.49153: Flags [.], ack 60033, win 65535, length 0
3.536940 IP 10.1.1.1.49153 > 10.1.1.2.8080: Flags [.], seq 89513:90049, ack 1, win 65535, length 536
3.536940 IP 10.1.1.2.8080 > 10.1.1.1.49153: Flags [.], ack 60033, win 65535, length 0
3.537865 IP 10.1.1.1.49153 > 10.1.1.2.8080: Flags [.], seq 90049:90585, ack 1, win 65535, length 536
3.537865 IP 10.1.1.2.8080 > 10.1.1.1.49153: Flags [.], ack 60033, win 65535, length 0
3.538790 IP 10.1.1.1.49153 > 10.1.1.2.8080: Flags [.], seq 90585:91121, ack 1, win 65535, length 536
3.538790 IP 10.1.1.2.8080 > 10.1.1.1.49153: Flags [.], ack 60033, win 65535, length 0
3.539715 IP 10.1.1.1.49153 > 10.1.1.2.8080: Flags [.], seq 91121:91657, ack 1, win 65535, length 536
3.539715 IP 10.1.1.2.8080 > 10.1.1.1.49153: Flags [.], ack 60033, win 65535, length 0
3.540640 IP 10.1.1.1.49153 > 10.1.1.2.8080: Flags [.], seq 91657:92193, ack 1, win 65535, length 536
3.540640 IP 10.1.1.2.8080 > 10.1.1.1.49153: Flags [.], ack 60033, win 65535, length 0
3.541564 IP 10.1.1.1.49153 > 10.1.1.2.8080: Flags [.], seq 92193:92729, ack 1, win 65535, length 536
3.541564 IP 10.1.1.2.8080 > 10.1.1.1.49153: Flags [.], ack 60033, win 65535, length 0
3.542489 IP 10.1.1.1.49153 > 10.1.1.2.8080: Flags [.], seq 92729:93265, ack 1, win 65535, length 536
3.542489 IP 10.1.1.2.8080 > 10.1.1.1.49153: Flags [.], ack 60033, win 65535, length 0
3.543414 IP 10.1.1.1.49153 > 10.1.1.2.8080: Flags [.], seq 93265:93801, ack 1, win 65535, length 536
3.543414 IP 10.1.1.2.8080 > 10.1.1.1.49153: Flags [.], ack 60033, win 65535, length 0
3.544339 IP 10.1.1.1.49153 > 10.1.1.2.8080: Flags [.], seq 93801:94337, ack 1, win 65535, length 536
3.544339 IP 10.1.1.2.8080 > 10.1.1.1.49153: Flags [.], ack 60033, win 65535, length 0
3.545264 IP 10.1.1.1.49153 > 10.1.1.2.8080: Flags [.], seq 94337:94873, ack 1, win 65535, length 536
3.545264 IP 10.1.1.2.8080 > 10.1.1.1.49153: Flags [.], ack 60033, win 65535, length 0
3.546188 IP 10.1.1.1.49153 > 10.1.1.2.8080: Flags [.], seq 94873:95409, ack 1, win 65535, length 536
3.546188 IP 10.1.1.2.8080 > 10.1.1.1.49153: Flags [.], ack 60033, win 65535, length 0
3.547113 IP 10.1.1.1.49153 > 10.1.1.2.8080: Flags [.], seq 95409:95945, ack 1, win 65535, length 536
3.547113 IP 10.1.1.2.8080 > 10.1.1.1.49153: Flags [.], ack 60033, win 65535, length 0
3.548038 IP 10.1.1.1.49153 > 10.1.1.2.8080: Flags [.], seq 95945:96481, ack 1, win 65535, length 536
3.548038 IP 10.1.1.2.8080 > 10.1.1.1.49153: Flags [.], ack 60033, win 65535, length 0
3.548963 IP 10.1.1.1.49153 > 10.1.1.2.8080: Flags [.], seq 96481:97017, ack 1, win 65535, length 536
3.548963 IP 10.1.1.2.8080 > 10.1.1.1.49153: Flags [.], ack 60033, win 65535, length 0
3.549888 IP 10.1.1.1.49153 > 10.1.1.2.8080: Flags [.], seq 97017:97553, ack 1, win 65535, length 536
3.549888 IP 10.1.1.2.8080 > 10.1.1.1.49153: Flags [.], ack 60033, win 65535, length 0
3.550812 IP 10.1.1.1.49153 > 10.1.1.2.8080: Flags [.], seq 97553:98089, ack 1, win 65535, length 536
3.550812 IP 10.1.1.2.8080 > 10.1.1.1.49153: Flags [.], ack 60033, win 65535, length 0
3.551737 IP 10.1.1.1.49153 > 10.1.1.2.8080: Flags [.], seq 60033:60569, ack 1, win 65535, length 536
3.551737 IP 10.1.1.2.8080 > 10.1.1.1.49153: Flags [.], ack 61641, win 65535, length 0
3.552662 IP 10.1.1.1.49153 > 10.1.1.2.8080: Flags [.], seq 98089:98625, ack 1, win 65535, length 536
3.552662 IP 10.1.1.2.8080 > 10.1.1.1.49153: Flags [.], ack 61641, win 65535, length 0
3.737008 IP 10.1.1.1.49153 > 10.1.1.2.8080: Flags [.], seq 98625:99161, ack 1, win 65535, length 536
3.737008 IP 10.1.1.2.8080 > 10.1.1.1.49153: Flags [.], ack 61641, win 65535, length 0
3.737932 IP 10.1.1.1.49153 > 10.1.1.2.8080: Flags [.], seq 99161:99697, ack 1, win 65535, length 536
3.737932 IP 10.1.1.2.8080 > 10.1.1.1.49153: Flags [.], ack 61641, win 65535, length 0
3.738857 IP 10.1.1.1.49153 > 10.1.1.2.8080: Flags [.], seq 99697:100233, ack 1, win 65535, length 536
3.738857 IP 10.1.1.2.8080 > 10.1.1.1.49153: Flags [.], ack 61641, win 65535, length 0
3.739782 IP 10.1.1.1.49153 > 10.1.1.2.8080: Flags [.], seq 100233:100769, ack 1, win 65535, length 536
3.739782 IP 10.1.1.2.8080 > 10.1.1.1.49153: Flags [.], ack 61641, win 65535, length 0
3.740707 IP 10.1.1.1.49153 > 10.1.1.2.8080: Flags [.], seq 100769:101305, ack 1, win 65535, length 536
3.740707 IP 10.1.1.2.8080 > 10.1.1.1.49153: Flags [.], ack 61641, win 65535, length 0
3.741632 IP 10.1.1.1.49153 > 10.1.1.2.8080: Flags [.], seq 101305:101841, ack 1, win 65535, length 536
3.741632 IP 10.1.1.2.8080 > 10.1.1.1.49153: Flags [.], ack 61641, win 65535, length 0
3.742556 IP 10.1.1.1.49153 > 10.1.1.2.8080: Flags [.], seq 101841:102377, ack 1, win 65535, length 536
3.742556 IP 10.1.1.2.8080 > 10.1.1.1.49153: Flags [.], ack 61641, win 65535, length 0
3.743481 IP 10.1.1.1.49153 > 10.1.1.2.8080: Flags [.], seq 102377:102913, ack 1, win 65535, length 536
3.743481 IP 10.1.1.2.8080 > 10.1.1.1.49153: Flags [.], ack 61641, win 65535, length 0
3.744406 IP 10.1.1.1.49153 > 10.1.1.2.8080: Flags [.], seq 102913:103449, ack 1, win 65535, length 536
3.744406 IP 10.1.1.2.8080 > 10.1.1.1.49153: Flags [.], ack 61641, win 65535, length 0
3.745331 IP 10.1.1.1.49153 > 10.1.1.2.8080: Flags [.], seq 103449:103985, ack 1, win 65535, length 536
3.745331 IP 10.1.1.2.8080 > 10.1.1.1.49153: Flags [.], ack 61641, win 65535, length 0
3.746256 IP 10.1.1.1.49153 > 10.1.1.2.8080: Flags [.], seq 103985:104521, ack 1, win 65535, length 536
3.746256 IP 10.1.1.2.8080 > 10.1.1.1.49153: Flags [.], ack 61641, win 65535, length 0
3.747180 IP 10.1.1.1.49153 > 10.1.1.2.8080: Flags [.], seq 104521:105057, ack 1, win 65535, length 536
3.747180 IP 10.1.1.2.8080 > 10.1.1.1.49153: Flags [.], ack 61641, win 65535, length 0
3.748105 IP 10.1.1.1.49153 > 10.1.1.2.8080: Flags [.], seq 105057:105593, ack 1, win 65535, length 536
3.748105 IP 10.1.1.2.8080 > 10.1.1.1.49153: Flags [.], ack 61641, win 65535, length 0
3.749030 IP 10.1.1.1.49153 > 10.1.1.2.8080: Flags [.], seq 105593:106129, ack 1, win 65535, length 536
3.749030 IP 10.1.1.2.8080 > 10.1.1.1.49153: Flags [.], ack 61641, win 65535, length 0
3.749955 IP 10.1.1.1.49153 > 10.1.1.2.8080: Flags [.], seq 106129:106665, ack 1, win 65535, length 536
3.749955 IP 10.1.1.2.8080 > 10.1.1.1.49153: Flags [.], ack 61641, win 65535, length 0
3.750880 IP 10.1.1.1.49153 > 10.1.1.2.8080: Flags [.], seq 106665:107201, ack 1, win 65535, length 536
3.750880 IP 10.1.1.2.8080 > 10.1.1.1.49153: Flags [.], ack 61641, win 65535, length 0
3.751804 IP 10.1.1.1.49153 > 10.1.1.2.8080: Flags [.], seq 107201:107737, ack 1, win 65535, length 536
3.751804 IP 10.1.1.2.8080 > 10.1.1.1.49153: Flags [.], ack 61641, win 65535, length 0
3.752729 IP 10.1.1.1.49153 > 10.1.1.2.8080: Flags [.], seq 61641:62177, ack 1, win 65535, length 536
3.752729 IP 10.1.1.2.8080 > 10.1.1.1.49153: Flags [.], ack 63249, win 65535, length 0
3.753654 IP 10.1.1.1.49153 > 10.1.1.2.8080: Flags [.], seq 107737:108273, ack 1, win 65535, length 536
3.753654 IP 10.1.1.2.8080 > 10.1.1.1.49153: Flags [.], ack 63249, win 65535, length 0
3.754579 IP 10.1.1.1.49153 > 10.1.1.2.8080: Flags [.], seq 108273:108809, ack 1, win 65535, length 536
3.754579 IP 10.1.1.2.8080 > 10.1.1.1.49153: Flags [.], ack 63249, win 65535, length 0
3.938000 IP 10.1.1.1.49153 > 10.1.1.2.8080: Flags [.], seq 108809:109345, ack 1, win 65535, length 536
3.938000 IP 10.1.1.2.8080 > 10.1.1.1.49153: Flags [.], ack 63249, win 65535, length 0
3.938924 IP 10.1.1.1.49153 > 10.1.1.2.8080: Flags [.], seq 109345:109881, ack 1, win 65535, length 536
3.938924 IP 10.1.1.2.8080 > 10.1.1.1.49153: Flags [.], ack 63249, win 65535, length 0
3.939849 IP 10.1.1.1.49153 > 10.1.1.2.8080: Flags [.], seq 109881:110417, ack 1, win 65535, length 536
3.939849 IP 10.1.1.2.8080 > 10.1.1.1.49153: Flags [.], ack 63249, win 65535, length 0
3.940774 IP 10.1.1.1.49153 > 10.1.1.2.8080: Flags [.], seq 110417:110953, ack 1, win 65535, length 536
3.940774 IP 10.1.1.2.8080 > 10.1.1.1.49153: Flags [.], ack 63249, win 65535, length 0
3.941699 IP 10.1.1.1.49153 > 10.1.1.2.8080: Flags [.], seq 110953:111489, ack 1, win 65535, length 536
3.941699 IP 10.1.1.2.8080 > 10.1.1.1.49153: Flags [.], ack 63249, win 65535, length 0
3.942624 IP 10.1.1.1.49153 > 10.1.1.2.8080: Flags [.], seq 111489:112025, ack 1, win 65535, length 536
3.942624 IP 10.1.1.2.8080 > 10.1.1.1.49153: Flags [.], ack 63249, win 65535, length 0
3.943548 IP 10.1.1.1.49153 > 10.1.1.2.8080: Flags [.], seq 112025:112561, ack 1, win 65535, length 536
3.943548 IP 10.1.1.2.8080 > 10.1.1.1.49153: Flags [.], ack 63249, win 65535, length 0
3.944473 IP 10.1.1.1.49153 > 10.1.1.2.8080: Flags [.], seq 112561:113097, ack 1, win 65535, length 536
3.944473 IP 10.1.1.2.8080 > 10.1.1.1.49153: Flags [.], ack 63249, win 65535, length 0
3.945398 IP 10.1.1.1.49153 > 10.1.1.2.8080: Flags [.], seq 113097:113633, ack 1, win 65535, length 536
3.945398 IP 10.1.1.2.8080 > 10.1.1.1.49153: Flags [.], ack 63249, win 65535, length 0
3.946323 IP 10.1.1.1.49153 > 10.1.1.2.8080: Flags [.], seq 113633:114169, ack 1, win 65535, length 536
3.946323 IP 10.1.1.2.8080 > 10.1.1.1.49153: Flags [.], ack 63249, win 65535, length 0
3.947248 IP 10.1.1.1.49153 > 10.1.1.2.8080: Flags [.], seq 114169:114705, ack 1, win 65535, length 536
3.947248 IP 10.1.1.2.8080 > 10.1.1.1.49153: Flags [.], ack 63249, win 65535, length 0
3.948172 IP 10.1.1.1.49153 > 10.1.1.2.8080: Flags [.], seq 114705:115241, ack 1, win 65535, length 536
3.948172 IP 10.1.1.2.8080 > 10.1.1.1.49153: Flags [.], ack 63249, win 65535, length 0
3.949097 IP 10.1.1.1.49153 > 10.1.1.2.8080: Flags [.], seq 115241:115777, ack 1, win 65535, length 536
3.949097 IP 10.1.1.2.8080 > 10.1.1.1.49153: Flags [.], ack 63249, win 65535, length 0
3.950022 IP 10.1.1.1.49153 > 10.1.1.2.8080: Flags [.], seq 115777:116313, ack 1, win 65535, length 536
3.950022 IP 10.1.1.2.8080 > 10.1.1.1.49153: Flags [.], ack 63249, win 65535, length 0
3.950947 IP 10.1.1.1.49153 > 10.1.1.2.8080: Flags [.], seq 116313:116849, ack 1, win 65535, length 536
3.950947 IP 10.1.1.2.8080 > 10.1.1.1.49153: Flags [.], ack 63249, win 65535, length 0
3.951872 IP 10.1.1.1.49153 > 10.1.1.2.8080: Flags [.], seq 116849:117385, ack 1, win 65535, length 536
3.951872 IP 10.1.1.2.8080 > 10.1.1.1.49153: Flags [.], ack 63249, win 65535, length 0
3.952796 IP 10.1.1.1.49153 > 10.1.1.2.8080: Flags [.], seq 117385:117921, ack 1, win 65535, length 536
3.952796 IP 10.1.1.2.8080 > 10.1.1.1.49153: Flags [.], ack 63249, win 65535, length 0
3.953721 IP 10.1.1.1.49153 > 10.1.1.2.8080: Flags [.], seq 63249:63785, ack 1, win 65535, length 536
3.953721 IP 10.1.1.2.8080 > 10.1.1.1.49153: Flags [.], ack 64857, win 65535, length 0
3.954646 IP 10.1.1.1.49153 > 10.1.1.2.8080: Flags [.], seq 117921:118457, ack 1, win 65535, length 536
3.954646 IP 10.1.1.2.8080 > 10.1.1.1.49153: Flags [.], ack 64857, win 65535, length 0
3.955571 IP 10.1.1.1.49153 > 10.1.1.2.8080: Flags [.], seq 118457:118993, ack 1, win 65535, length 536
3.955571 IP 10.1.1.2.8080 > 10.1.1.1.49153: Flags [.], ack 64857, win 65535, length 0
3.956496 IP 10.1.1.1.49153 > 10.1.1.2.8080: Flags [.], seq 118993:119529, ack 1, win 65535, length 536
3.956496 IP 10.1.1.2.8080 > 10.1.1.1.49153: Flags [.], ack 64857, win 65535, length 0
4.138992 IP 10.1.1.1.49153 > 10.1.1.2.8080: Flags [.], seq 119529:120065, ack 1, win 65535, length 536
4.138992 IP 10.1.1.2.8080 > 10.1.1.1.49153: Flags [.], ack 64857, win 65535, length 0
4.139916 IP 10.1.1.1.49153 > 10.1.1.2.8080: Flags [.], seq 120065:120601, ack 1, win 65535, length 536
4.139916 IP 10.1.1.2.8080 > 10.1.1.1.49153: Flags [.], ack 64857, win 65535, length 0
4.140841 IP 10.1.1.1.49153 > 10.1.1.2.8080: Flags [.], seq 120601:121137, ack 1, win 65535, length 536
4.140841 IP 10.1.1.2.8080 > 10.1.1.1.49153: Flags [.], ack 64857, win 65535, length 0
4.141766 IP 10.1.1.1.49153 > 10.1.1.2.8080: Flags [.], seq 121137:121673, ack 1, win 65535, length 536
4.141766 IP 10.1.1.2.8080 > 10.1.1.1.49153: Flags [.], ack 64857, win 65535, length 0
4.142691 IP 10.1.1.1.49153 > 10.1.1.2.8080: Flags [.], seq 121673:122209, ack 1, win 65535, length 536
4.142691 IP 10.1.1.2.8080 > 10.1.1.1.49153: Flags [.], ack 64857, win 65535, length 0
4.143616 IP 10.1.1.1.49153 > 10.1.1.2.8080: Flags [.], seq 122209:122745, ack 1, win 65535, length 536
4.143616 IP 10.1.1.2.8080 > 10.1.1.1.49153: Flags [.], ack 64857, win 65535, length 0
4.144540 IP 10.1.1.1.49153 > 10.1.1.2.8080: Flags [.], seq 122745:123281, ack 1, win 65535, length 536
4.144540 IP 10.1.1.2.8080 > 10.1.1.1.49153: Flags [.], ack 64857, win 65535, length 0
4.145465 IP 10.1.1.1.49153 > 10.1.1.2.8080: Flags [.], seq 123281:123817, ack 1, win 65535, length 536
4.145465 IP 10.1.1.2.8080 > 10.1.1.1.49153: Flags [.], ack 64857, win 65535, length 0
4.146390 IP 10.1.1.1.49153 > 10.1.1.2.8080: Flags [.], seq 123817:124353, ack 1, win 65535, length 536
4.146390 IP 10.1.1.2.8080 > 10.1.1.1.49153: Flags [.], ack 64857, win 65535, length 0
4.147315 IP 10.1.1.1.49153 > 10.1.1.2.8080: Flags [.], seq 124353:124889, ack 1, win 65535, length 536
4.147315 IP 10.1.1.2.8080 > 10.1.1.1.49153: Flags [.], ack 64857, win 65535, length 0
4.148240 IP 10.1.1.1.49153 > 10.1.1.2.8080: Flags [.], seq 124889:125425, ack 1, win 65535, length 536
4.148240 IP 10.1.1.2.8080 > 10.1.1.1.49153: Flags [.], ack 64857, win 65535, length 0
4.149164 IP 10.1.1.1.49153 > 10.1.1.2.8080: Flags [.], seq 125425:125961, ack 1, win 65535, length 536
4.149164 IP 10.1.1.2.8080 > 10.1.1.1.49153: Flags [.], ack 64857, win 65535, length 0
4.150089 IP 10.1.1.1.49153 > 10.1.1.2.8080: Flags [.], seq 125961:126497, ack 1, win 65535, length 536
4.150089 IP 10.1.1.2.8080 > 10.1.1.1.49153: Flags [.], ack 64857, win 65535, length 0
4.151014 IP 10.1.1.1.49153 > 10.1.1.2.8080: Flags [.], seq 126497:127033, ack 1, win 65535, length 536
4.151014 IP 10.1.1.2.8080 > 10.1.1.1.49153: Flags [.], ack 64857, win 65535, length 0
4.151939 IP 10.1.1.1.49153 > 10.1.1.2.8080: Flags [.], seq 127033:127569, ack 1, win 65535, length 536
4.151939 IP 10.1.1.2.8080 > 10.1.1.1.49153: Flags [.], ack 64857, win 65535, length 0
4.152864 IP 10.1.1.1.49153 > 10.1.1.2.8080: Flags [.], seq 127569:128105, ack 1, win 65535, length 536
4.152864 IP 10.1.1.2.8080 > 10.1.1.1.49153: Flags [.], ack 64857, win 65535, length 0
4.153788 IP 10.1.1.1.49153 > 10.1.1.2.8080: Flags [.], seq 128105:128641, ack 1, win 65535, length 536
4.153788 IP 10.1.1.2.8080 > 10.1.1.1.49153: Flags [.], ack 64857, win 65535, length 0
4.154713 IP 10.1.1.1.49153 > 10.1.1.2.8080: Flags [.], seq 64857:65393, ack 1, win 65535, length 536
4.154713 IP 10.1.1.2.8080 > 10.1.1.1.49153: Flags [.], ack 80937, win 65535, length 0
4.155638 IP 10.1.1.1.49153 > 10.1.1.2.8080: Flags [.], seq 128641:129177, ack 1, win 65535, length 536
4.155638 IP 10.1.1.2.8080 > 10.1.1.1.49153: Flags [.], ack 80937, win 65535, length 0
4.156563 IP 10.1.1.1.49153 > 10.1.1.2.8080: Flags [.], seq 129177:129713, ack 1, win 65535, length 536
4.156563 IP 10.1.1.2.8080 > 10.1.1.1.49153: Flags [.], ack 80937, win 65535, length 0
4.157488 IP 10.1.1.1.49153 > 10.1.1.2.8080: Flags [.], seq 129713:130249, ack 1, win 65535, length 536
4.157488 IP 10.1.1.2.8080 > 10.1.1.1.49153: Flags [.], ack 80937, win 65535, length 0
4.355705 IP 10.1.1.1.49153 > 10.1.1.2.8080: Flags [.], seq 80937:81473, ack 1, win 65535, length 536
4.355705 IP 10.1.1.2.8080 > 10.1.1.1.49153: Flags [.], ack 82545, win 65535, length 0
4.356630 IP 10.1.1.1.49153 > 10.1.1.2.8080: Flags [.], seq 130249:130785, ack 1, win 65535, length 536
4.356630 IP 10.1.1.2.8080 > 10.1.1.1.49153: Flags [.], ack 82545, win 65535, length 0
4.357555 IP 10.1.1.1.49153 > 10.1.1.2.8080: Flags [.], seq 130785:131321, ack 1, win 65535, length 536
4.357555 IP 10.1.1.2.8080 > 10.1.1.1.49153: Flags [.], ack 82545, win 65535, length 0
4.358480 IP 10.1.1.1.49153 > 10.1.1.2.8080: Flags [.], seq 131321:131857, ack 1, win 65535, length 536
4.358480 IP 10.1.1.2.8080 > 10.1.1.1.49153: Flags [.], ack 82545, win 65535, length 0
4.359404 IP 10.1.1.1.49153 > 10.1.1.2.8080: Flags [.], seq 131857:132393, ack 1, win 65535, length 536
4.359404 IP 10.1.1.2.8080 > 10.1.1.1.49153: Flags [.], ack 82545, win 65535, length 0
4.360329 IP 10.1.1.1.49153 > 10.1.1.2.8080: Flags [.], seq 132393:132929, ack 1, win 65535, length 536
4.360329 IP 10.1.1.2.8080 > 10.1.1.1.49153: Flags [.], ack 82545, win 65535, length 0
4.361254 IP 10.1.1.1.49153 > 10.1.1.2.8080: Flags [.], seq 132929:133465, ack 1, win 65535, length 536
4.361254 IP 10.1.1.2.8080 > 10.1.1.1.49153: Flags [.], ack 82545, win 65535, length 0
4.362179 IP 10.1.1.1.49153 > 10.1.1.2.8080: Flags [.], seq 133465:134001, ack 1, win 65535, length 536
4.362179 IP 10.1.1.2.8080 > 10.1.1.1.49153: Flags [.], ack 82545, win 65535, length 0
4.363104 IP 10.1.1.1.49153 > 10.1.1.2.8080: Flags [.], seq 134001:134537, ack 1, win 65535, length 536
4.363104 IP 10.1.1.2.8080 > 10.1.1.1.49153: Flags [.], ack 82545, win 65535, length 0
4.364028 IP 10.1.1.1.49153 > 10.1.1.2.8080: Flags [.], seq 134537:135073, ack 1, win 65535, length 536
4.364028 IP 10.1.1.2.8080 > 10.1.1.1.49153: Flags [.], ack 82545, win 65535, length 0
4.364953 IP 10.1.1.1.49153 > 10.1.1.2.8080: Flags [.], seq 135073:135609, ack 1, win 65535, length 536
4.364953 IP 10.1.1.2.8080 > 10.1.1.1.49153: Flags [.], ack 82545, win 65535, length 0
4.365878 IP 10.1.1.1.49153 > 10.1.1.2.8080: Flags [.], seq 140433:140969, ack 1, win 65535, length 536
4.365878 IP 10.1.1.2.8080 > 10.1.1.1.49153: Flags [.], ack 82545, win 65535, length 0
4.366803 IP 10.1.1.1.49153 > 10.1.1.2.8080: Flags [.], seq 140969:141505, ack 1, win 65535, length 536
4.366803 IP 10.1.1.2.8080 > 10.1.1.1.49153: Flags [.], ack 82545, win 65535, length 0
4.367728 IP 10.1.1.1.49153 > 10.1.1.2.8080: Flags [.], seq 141505:142041, ack 1, win 65535, length 536
4.367728 IP 10.1.1.2.8080 > 10.1.1.1.49153: Flags [.], ack 82545, win 65535, length 0
4.556697 IP 10.1.1.1.49153 > 10.1.1.2.8080: Flags [.], seq 82545:83081, ack 1, win 65535, length 536
4.556697 IP 10.1.1.2.8080 > 10.1.1.1.49153: Flags [.], ack 84153, win 65535, length 0
4.557622 IP 10.1.1.1.49153 > 10.1.1.2.8080: Flags [.], seq 142041:142577, ack 1, win 65535, length 536
4.557622 IP 10.1.1.2.8080 > 10.1.1.1.49153: Flags [.], ack 84153, win 65535, length 0
4.558547 IP 10.1.1.1.49153 > 10.1.1.2.8080: Flags [.], seq 142577:143113, ack 1, win 65535, length 536
4.558547 IP 10.1.1.2.8080 > 10.1.1.1.49153: Flags [.], ack 84153, win 65535, length 0
4.559472 IP 10.1.1.1.49153 > 10.1.1.2.8080: Flags [.], seq 143113:143649, ack 1, win 65535, length 536
4.559472 IP 10.1.1.2.8080 > 10.1.1.1.49153: Flags [.], ack 84153, win 65535, length 0
4.560396 IP 10.1.1.1.49153 > 10.1.1.2.8080: Flags [.], seq 143649:144185, ack 1, win 65535, length 536
4.560396 IP 10.1.1.2.8080 > 10.1.1.1.49153: Flags [.], ack 84153, win 65535, length 0
4.561321 IP 10.1.1.1.49153 > 10.1.1.2.8080: Flags [.], seq 144185:144721, ack 1, win 65535, length 536
4.561321 IP 10.1.1.2.8080 > 10.1.1.1.49153: Flags [.], ack 84153, win 65535, length 0
4.562246 IP 10.1.1.1.49153 > 10.1.1.2.8080: Flags [.], seq 144721:145257, ack 1, win 65535, length 536
4.562246 IP 10.1.1.2.8080 > 10.1.1.1.49153: Flags [.], ack 84153, win 65535, length 0
4.563171 IP 10.1.1.1.49153 > 10.1.1.2.8080: Flags [.], seq 145257:145793, ack 1, win 65535, length 536
4.563171 IP 10.1.1.2.8080 > 10.1.1.1.49153: Flags [.], ack 84153, win 65535, length 0
4.564096 IP 10.1.1.1.49153 > 10.1.1.2.8080: Flags [.], seq 145793:146329, ack 1, win 65535, length 536
4.564096 IP 10.1.1.2.8080 > 10.1.1.1.49153: Flags [.], ack 84153, win 65535, length 0
4.565020 IP 10.1.1.1.49153 > 10.1.1.2.8080: Flags [.], seq 146329:146865, ack 1, win 65535, length 536
4.565020 IP 10.1.1.2.8080 > 10.1.1.1.49153: Flags [.], ack 84153, win 65535, length 0
4.565945 IP 10.1.1.1.49153 > 10.1.1.2.8080: Flags [.], seq 146865:147401, ack 1, win 65535, length 536
4.565945 IP 10.1.1.2.8080 > 10.1.1.1.49153: Flags [.], ack 84153, win 65535, length 0
4.566870 IP 10.1.1.1.49153 > 10.1.1.2.8080: Flags [.], seq 147401:147937, ack 1, win 65535, length 536
4.566870 IP 10.1.1.2.8080 > 10.1.1.1.49153: Flags [.], ack 84153, win 65535, length 0
4.757689 IP 10.1.1.1.49153 > 10.1.1.2.8080: Flags [.], seq 84153:84689, ack 1, win 65535, length 536
4.757689 IP 10.1.1.2.8080 > 10.1.1.1.49153: Flags [.], ack 85761, win 65535, length 0
4.758614 IP 10.1.1.1.49153 > 10.1.1.2.8080: Flags [.], seq 147937:148473, ack 1, win 65535, length 536
4.758614 IP 10.1.1.2.8080 > 10.1.1.1.49153: Flags [.], ack 85761, win 65535, length 0
4.759539 IP 10.1.1.1.49153 > 10.1.1.2.8080: Flags [.], seq 148473:149009, ack 1, win 65535, length 536
4.759539 IP 10.1.1.2.8080 > 10.1.1.1.49153: Flags [.], ack 85761, win 65535, length 0
4.760464 IP 10.1.1.1.49153 > 10.1.1.2.8080: Flags [.], seq 149009:149545, ack 1, win 65535, length 536
4.760464 IP 10.1.1.2.8080 > 10.1.1.1.49153: Flags [.], ack 85761, win 65535, length 0
4.958681 IP 10.1.1.1.49153 > 10.1.1.2.8080: Flags [.], seq 85761:86297, ack 1, win 65535, length 536
4.958681 IP 10.1.1.2.8080 > 10.1.1.1.49153: Flags [.], ack 87369, win 65535, length 0
4.959606 IP 10.1.1.1.49153 > 10.1.1.2.8080: Flags [.], seq 149545:150081, ack 1, win 65535, length 536
4.959606 IP 10.1.1.2.8080 > 10.1.1.1.49153: Flags [.], ack 87369, win 65535, length 0
4.960531 IP 10.1.1.1.49153 > 10.1.1.2.8080: Flags [.], seq 150081:150617, ack 1, win 65535, length 536
4.960531 IP 10.1.1.2.8080 > 10.1.1.1.49153: Flags [.], ack 87369, win 65535, length 0
4.961456 IP 10.1.1.1.49153 > 10.1.1.2.8080: Flags [.], seq 150617:151153, ack 1, win 65535, length 536
4.961456 IP 10.1.1.2.8080 > 10.1.1.1.49153: Flags [.], ack 87369, win 65535, length 0
5.159673 IP 10.1.1.1.49153 > 10.1.1.2.8080: Flags [.], seq 87369:87905, ack 1, win 65535, length 536
5.159673 IP 10.1.1.2.8080 > 10.1.1.1.49153: Flags [.], ack 135609, win 65535, length 0
5.160598 IP 10.1.1.1.49153 > 10.1.1.2.8080: Flags [.], seq 151153:151689, ack 1, win 65535, length 536
5.160598 IP 10.1.1.2.8080 > 10.1.1.1.49153: Flags [.], ack 135609, win 65535, length 0
5.161523 IP 10.1.1.1.49153 > 10.1.1.2.8080: Flags [.], seq 151689:152225, ack 1, win 65535, length 536
5.161523 IP 10.1.1.2.8080 > 10.1.1.1.49153: Flags [.], ack 135609, win 65535, length 0
5.162448 IP 10.1.1.1.49153 > 10.1.1.2.8080: Flags [.], seq 152225:152761, ack 1, win 65535, length 536
5.162448 IP 10.1.1.2.8080 > 10.1.1.1.49153: Flags [.], ack 135609, win 65535, length 0
5.363440 IP 10.1.1.1.49153 > 10.1.1.2.8080: Flags [.], seq 135609:136145, ack 1, win 65535, length 536
5.363440 IP 10.1.1.2.8080 > 10.1.1.1.49153: Flags [.], ack 136145, win 65535, length 0
5.564432 IP 10.1.1.1.49153 > 10.1.1.2.8080: Flags [.], seq 136145:136681, ack 1, win 65535, length 536
5.564432 IP 10.1.1.2.8080 > 10.1.1.1.49153: Flags [.], ack 136681, win 65535, length 0
5.765424 IP 10.1.1.1.49153 > 10.1.1.2.8080: Flags [.], seq 136681:137217, ack 1, win 65535, length 536
5.765424 IP 10.1.1.2.8080 > 10.1.1.1.49153: Flags [.], ack 137217, win 65535, length 0
5.966416 IP 10.1.1.1.49153 > 10.1.1.2.8080: Flags [.], seq 137217:137753, ack 1, win 65535, length 536
5.966416 IP 10.1.1.2.8080 > 10.1.1.1.49153: Flags [.], ack 137753, win 65535, length 0
6.167408 IP 10.1.1.1.49153 > 10.1.1.2.8080: Flags [.], seq 137753:138289, ack 1, win 65535, length 536
6.167408 IP 10.1.1.2.8080 > 10.1.1.1.49153: Flags [.], ack 138289, win 65535, length 0
6.368400 IP 10.1.1.1.49153 > 10.1.1.2.8080: Flags [.], seq 138289:138825, ack 1, win 65535, length 536
6.368400 IP 10.1.1.2.8080 > 10.1.1.1.49153: Flags [.], ack 138825, win 65535, length 0
6.569392 IP 10.1.1.1.49153 > 10.1.1.2.8080: Flags [.], seq 138825:139361, ack 1, win 65535, length 536
6.569392 IP 10.1.1.2.8080 > 10.1.1.1.49153: Flags [.], ack 139361, win 65535, length 0
6.770384 IP 10.1.1.1.49153 > 10.1.1.2.8080: Flags [.], seq 139361:139897, ack 1, win 65535, length 536
6.770384 IP 10.1.1.2.8080 > 10.1.1.1.49153: Flags [.], ack 139897, win 65535, length 0
6.971376 IP 10.1.1.1.49153 > 10.1.1.2.8080: Flags [.], seq 139897:140433, ack 1, win 65535, length 536
6.971376 IP 10.1.1.2.8080 > 10.1.1.1.49153: Flags [.], ack 152761, win 65535, length 0
7.172368 IP 10.1.1.1.49153 > 10.1.1.2.8080: Flags [.], seq 152761:153297, ack 1, win 65535, length 536
7.173292 IP 10.1.1.1.49153 > 10.1.1.2.8080: Flags [.], seq 153297:153833, ack 1, win 65535, length 536
7.173292 IP 10.1.1.2.8080 > 10.1.1.1.49153: Flags [.], ack 153833, win 65535, length 0
7.174217 IP 10.1.1.1.49153 > 10.1.1.2.8080: Flags [.], seq 153833:154369, ack 1, win 65535, length 536
7.175142 IP 10.1.1.1.49153 > 10.1.1.2.8080: Flags [.], seq 154369:154905, ack 1, win 65535, length 536
7.175142 IP 10.1.1.2.8080 > 10.1.1.1.49153: Flags [.], ack 154905, win 65535, length 0
7.176067 IP 10.1.1.1.49153 > 10.1.1.2.8080: Flags [.], seq 154905:155441, ack 1, win 65535, length 536
7.176992 IP 10.1.1.1.49153 > 10.1.1.2.8080: Flags [.], seq 155441:155977, ack 1, win 65535, length 536
7.176992 IP 10.1.1.2.8080 > 10.1.1.1.49153: Flags [.], ack 155977, win 65535, length 0
7.177916 IP 10.1.1.1.49153 > 10.1.1.2.8080: Flags [.], seq 155977:156513, ack 1, win 65535, length 536
7.178841 IP 10.1.1.1.49153 > 10.1.1.2.8080: Flags [.], seq 156513:157049, ack 1, win 65535, length 536
7.178841 IP 10.1.1.2.8080 > 10.1.1.1.49153: Flags [.], ack 157049, win 65535, length 0
7.179766 IP 10.1.1.1.49153 > 10.1.1.2.8080: Flags [.], seq 157049:157585, ack 1, win 65535, length 536
7.180691 IP 10.1.1.1.49153 > 10.1.1.2.8080: Flags [.], seq 157585:158121, ack 1, win 65535, length 536
7.180691 IP 10.1.1.2.8080 > 10.1.1.1.49153: Flags [.], ack 158121, win 65535, length 0
7.181616 IP 10.1.1.1.49153 > 10.1.1.2.8080: Flags [.], seq 158121:158657, ack 1, win 65535, length 536
7.374284 IP 10.1.1.1.49153 > 10.1.1.2.8080: Flags [.], seq 161337:161873, ack 1, win 65535, length 536
7.374284 IP 10.1.1.2.8080 > 10.1.1.1.49153: Flags [.], ack 158657, win 65535, length 0
7.375209 IP 10.1.1.1.49153 > 10.1.1.2.8080: Flags [.], seq 161873:162409, ack 1, win 65535, length 536
7.375209 IP 10.1.1.2.8080 > 10.1.1.1.49153: Flags [.], ack 158657, win 65535, length 0
7.376134 IP 10.1.1.1.49153 > 10.1.1.2.8080: Flags [.], seq 162409:162945, ack 1, win 65535, length 536
7.376134 IP 10.1.1.2.8080 > 10.1.1.1.49153: Flags [.], ack 158657, win 65535, length 0
7.377059 IP 10.1.1.1.49153 > 10.1.1.2.8080: Flags [.], seq 162945:163481, ack 1, win 65535, length 536
7.377059 IP 10.1.1.2.8080 > 10.1.1.1.49153: Flags [.], ack 158657, win 65535, length 0
7.377984 IP 10.1.1.1.49153 > 10.1.1.2.8080: Flags [.], seq 163481:164017, ack 1, win 65535, length 536
7.377984 IP 10.1.1.2.8080 > 10.1.1.1.49153: Flags [.], ack 158657, win 65535, length 0
7.378908 IP 10.1.1.1.49153 > 10.1.1.2.8080: Flags [.], seq 164017:164553, ack 1, win 65535, length 536
7.378908 IP 10.1.1.2.8080 > 10.1.1.1.49153: Flags [.], ack 158657, win 65535, length 0
7.379833 IP 10.1.1.1.49153 > 10.1.1.2.8080: Flags [.], seq 164553:165089, ack 1, win 65535, length 536
7.379833 IP 10.1.1.2.8080 > 10.1.1.1.49153: Flags [.], ack 158657, win 65535, length 0
7.380758 IP 10.1.1.1.49153 > 10.1.1.2.8080: Flags [.], seq 165089:165625, ack 1, win 65535, length 536
7.380758 IP 10.1.1.2.8080 > 10.1.1.1.49153: Flags [.], ack 158657, win 65535, length 0
7.381683 IP 10.1.1.1.49153 > 10.1.1.2.8080: Flags [.], seq 165625:166161, ack 1, win 65535, length 536
7.381683 IP 10.1.1.2.8080 > 10.1.1.1.49153: Flags [.], ack 158657, win 65535, length 0
7.382608 IP 10.1.1.1.49153 > 10.1.1.2.8080: Flags [.], seq 166161:166697, ack 1, win 65535, length 536
7.382608 IP 10.1.1.2.8080 > 10.1.1.1.49153: Flags [.], ack 158657, win 65535, length 0
7.575276 IP 10.1.1.1.49153 > 10.1.1.2.8080: Flags [.], seq 166697:167233, ack 1, win 65535, length 536
7.575276 IP 10.1.1.2.8080 > 10.1.1.1.49153: Flags [.], ack 158657, win 65535, length 0
7.578051 IP 10.1.1.1.49153 > 10.1.1.2.8080: Flags [.], seq 158657:159193, ack 1, win 65535, length 536
7.578051 IP 10.1.1.2.8080 > 10.1.1.1.49153: Flags [.], ack 159193, win 65535, length 0
7.583600 IP 10.1.1.1.49153 > 10.1.1.2.8080: Flags [.], seq 167233:167769, ack 1, win 65535, length 536
7.583600 IP 10.1.1.2.8080 > 10.1.1.1.49153: Flags [.], ack 159193, win 65535, length 0
7.776268 IP 10.1.1.1.49153 > 10.1.1.2.8080: Flags [.], seq 167769:168305, ack 1, win 65535, length 536
7.776268 IP 10.1.1.2.8080 > 10.1.1.1.49153: Flags [.], ack 159193, win 65535, length 0
7.779043 IP 10.1.1.1.49153 > 10.1.1.2.8080: Flags [.], seq 159193:159729, ack 1, win 65535, length 536
7.779043 IP 10.1.1.2.8080 > 10.1.1.1.49153: Flags [.], ack 159729, win 65535, length 0
7.779968 IP 10.1.1.1.49153 > 10.1.1.2.8080: Flags [.], seq 168305:168841, ack 1, win 65535, length 536
7.779968 IP 10.1.1.2.8080 > 10.1.1.1.49153: Flags [.], ack 159729, win 65535, length 0
7.784592 IP 10.1.1.1.49153 > 10.1.1.2.8080: Flags [.], seq 168841:169377, ack 1, win 65535, length 536
7.784592 IP 10.1.1.2.8080 > 10.1.1.1.49153: Flags [.], ack 159729, win 65535, length 0
7.977260 IP 10.1.1.1.49153 > 10.1.1.2.8080: Flags [.], seq 169377:169913, ack 1, win 65535, length 536
7.977260 IP 10.1.1.2.8080 > 10.1.1.1.49153: Flags [.], ack 159729, win 65535, length 0
7.980035 IP 10.1.1.1.49153 > 10.1.1.2.8080: Flags [.], seq 159729:160265, ack 1, win 65535, length 536
7.980035 IP 10.1.1.2.8080 > 10.1.1.1.49153: Flags [.], ack 160265, win 65535, length 0
7.980960 IP 10.1.1.1.49153 > 10.1.1.2.8080: Flags [.], seq 169913:170449, ack 1, win 65535, length 536
7.980960 IP 10.1.1.2.8080 > 10.1.1.1.49153: Flags [.], ack 160265, win 65535, length 0
7.981884 IP 10.1.1.1.49153 > 10.1.1.2.8080: Flags [.], seq 170449:170985, ack 1, win 65535, length 536
7.981884 IP 10.1.1.2.8080 > 10.1.1.1.49153: Flags [.], ack 160265, win 65535, length 0
7.985584 IP 10.1.1.1.49153 > 10.1.1.2.8080: Flags [.], seq 170985:171521, ack 1, win 65535, length 536
7.985584 IP 10.1.1.2.8080 > 10.1.1.1.49153: Flags [.], ack 160265, win 65535, length 0
8.178252 IP 10.1.1.1.49153 > 10.1.1.2.8080: Flags [.], seq 171521:172057, ack 1, win 65535, length 536
8.178252 IP 10.1.1.2.8080 > 10.1.1.1.49153: Flags [.], ack 160265, win 65535, length 0
8.181027 IP 10.1.1.1.49153 > 10.1.1.2.8080: Flags [.], seq 160265:160801, ack 1, win 65535, length 536
8.181027 IP 10.1.1.2.8080 > 10.1.1.1.49153: Flags [.], ack 160801, win 65535, length 0
8.181952 IP 10.1.1.1.49153 > 10.1.1.2.8080: Flags [.], seq 172057:172593, ack 1, win 65535, length 536
8.181952 IP 10.1.1.2.8080 > 10.1.1.1.49153: Flags [.], ack 160801, win 65535, length 0
8.182876 IP 10.1.1.1.49153 > 10.1.1.2.8080: Flags [.], seq 172593:173129, ack 1, win 65535, length 536
8.182876 IP 10.1.1.2.8080 > 10.1.1.1.49153: Flags [.], ack 160801, win 65535, length 0
8.183801 IP 10.1.1.1.49153 > 10.1.1.2.8080: Flags [.], seq 173129:173665, ack 1, win 65535, length 536
8.183801 IP 10.1.1.2.8080 > 10.1.1.1.49153: Flags [.], ack 160801, win 65535, length 0
8.186576 IP 10.1.1.1.49153 > 10.1.1.2.8080: Flags [.], seq 173665:174201, ack 1, win 65535, length 536
8.186576 IP 10.1.1.2.8080 > 10.1.1.1.49153: Flags [.], ack 160801, win 65535, length 0
8.379244 IP 10.1.1.1.49153 > 10.1.1.2.8080: Flags [.], seq 174201:174737, ack 1, win 65535, length 536
8.379244 IP 10.1.1.2.8080 > 10.1.1.1.49153: Flags [.], ack 160801, win 65535, length 0
8.382019 IP 10.1.1.1.49153 > 10.1.1.2.8080: Flags [.], seq 160801:161337, ack 1, win 65535, length 536
8.382019 IP 10.1.1.2.8080 > 10.1.1.1.49153: Flags [.], ack 174737, win 65535, length 0
8.382944 IP 10.1.1.1.49153 > 10.1.1.2.8080: Flags [.], seq 174737:175273, ack 1, win 65535, length 536
8.383868 IP 10.1.1.1.49153 > 10.1.1.2.8080: Flags [.], seq 175273:175809, ack 1, win 65535, length 536
8.383868 IP 10.1.1.2.8080 > 10.1.1.1.49153: Flags [.], ack 175809, win 65535, length 0
8.384793 IP 10.1.1.1.49153 > 10.1.1.2.8080: Flags [.], seq 175809:176345, ack 1, win 65535, length 536
8.385718 IP 10.1.1.1.49153 > 10.1.1.2.8080: Flags [.], seq 176345:176881, ack 1, win 65535, length 536
8.385718 IP 10.1.1.2.8080 > 10.1.1.1.49153: Flags [.], ack 176881, win 65535, length 0
8.387568 IP 10.1.1.1.49153 > 10.1.1.2.8080: Flags [.], seq 176881:177417, ack 1, win 65535, length 536
8.580236 IP 10.1.1.1.49153 > 10.1.1.2.8080: Flags [.], seq 177417:177953, ack 1, win 65535, length 536
8.580236 IP 10.1.1.2.8080 > 10.1.1.1.49153: Flags [.], ack 177953, win 65535, length 0
8.583011 IP 10.1.1.1.49153 > 10.1.1.2.8080: Flags [.], seq 177953:178489, ack 1, win 65535, length 536
8.583936 IP 10.1.1.1.49153 > 10.1.1.2.8080: Flags [.], seq 178489:179025, ack 1, win 65535, length 536
8.583936 IP 10.1.1.2.8080 > 10.1.1.1.49153: Flags [.], ack 179025, win 65535, length 0
8.584860 IP 10.1.1.1.49153 > 10.1.1.2.8080: Flags [.], seq 179025:179561, ack 1, win 65535, length 536
8.585785 IP 10.1.1.1.49153 > 10.1.1.2.8080: Flags [.], seq 179561:180097, ack 1, win 65535, length 536
8.585785 IP 10.1.1.2.8080 > 10.1.1.1.49153: Flags [.], ack 180097, win 65535, length 0
8.586710 IP 10.1.1.1.49153 > 10.1.1.2.8080: Flags [.], seq 180097:180633, ack 1, win 65535, length 536
8.587635 IP 10.1.1.1.49153 > 10.1.1.2.8080: Flags [.], seq 180633:181169, ack 1, win 65535, length 536
8.587635 IP 10.1.1.2.8080 > 10.1.1.1.49153: Flags [.], ack 181169, win 65535, length 0
8.781228 IP 10.1.1.1.49153 > 10.1.1.2.8080: Flags [.], seq 181169:181705, ack 1, win 65535, length 536
8.782153 IP 10.1.1.1.49153 > 10.1.1.2.8080: Flags [.], seq 181705:182241, ack 1, win 65535, length 536
8.782153 IP 10.1.1.2.8080 > 10.1.1.1.49153: Flags [.], ack 182241, win 65535, length 0
8.784928 IP 10.1.1.1.49153 > 10.1.1.2.8080: Flags [.], seq 182241:182777, ack 1, win 65535, length 536
8.785852 IP 10.1.1.1.49153 > 10.1.1.2.8080: Flags [.], seq 182777:183313, ack 1, win 65535, length 536
8.785852 IP 10.1.1.2.8080 > 10.1.1.1.49153: Flags [.], ack 183313, win 65535, length 0
8.786777 IP 10.1.1.1.49153 > 10.1.1.2.8080: Flags [.], seq 183313:183849, ack 1, win 65535, length 536
8.787702 IP 10.1.1.1.49153 > 10.1.1.2.8080: Flags [.], seq 183849:184385, ack 1, win 65535, length 536
8.787702 IP 10.1.1.2.8080 > 10.1.1.1.49153: Flags [.], ack 184385, win 65535, length 0
8.788627 IP 10.1.1.1.49153 > 10.1.1.2.8080: Flags [.], seq 184385:184921, ack 1, win 65535, length 536
8.789552 IP 10.1.1.1.49153 > 10.1.1.2.8080: Flags [.], seq 184921:185457, ack 1, win 65535, length 536
8.789552 IP 10.1.1.2.8080 > 10.1.1.1.49153: Flags [.], ack 185457, win 65535, length 0
8.983145 IP 10.1.1.1.49153 > 10.1.1.2.8080: Flags [.], seq 185457:185993, ack 1, win 65535, length 536
8.984070 IP 10.1.1.1.49153 > 10.1.1.2.8080: Flags [.], seq 185993:186529, ack 1, win 65535, length 536
8.984070 IP 10.1.1.2.8080 > 10.1.1.1.49153: Flags [.], ack 186529, win 65535, length 0
8.986844 IP 10.1.1.1.49153 > 10.1.1.2.8080: Flags [.], seq 186529:187065, ack 1, win 65535, length 536
8.987769 IP 10.1.1.1.49153 > 10.1.1.2.8080: Flags [.], seq 187065:187601, ack 1, win 65535, length 536
8.987769 IP 10.1.1.2.8080 > 10.1.1.1.49153: Flags [.], ack 187601, win 65535, length 0
8.988694 IP 10.1.1.1.49153 > 10.1.1.2.8080: Flags [.], seq 187601:188137, ack 1, win 65535, length 536
8.989619 IP 10.1.1.1.49153 > 10.1.1.2.8080: Flags [.], seq 188137:188673, ack 1, win 65535, length 536
8.989619 IP 10.1.1.2.8080 > 10.1.1.1.49153: Flags [.], ack 188673, win 65535, length 0
8.990544 IP 10.1.1.1.49153 > 10.1.1.2.8080: Flags [.], seq 188673:189209, ack 1, win 65535, length 536
8.991468 IP 10.1.1.1.49153 > 10.1.1.2.8080: Flags [.], seq 189209:189745, ack 1, win 65535, length 536
8.991468 IP 10.1.1.2.8080 > 10.1.1.1.49153: Flags [.], ack 189745, win 65535, length 0
8.992393 IP 10.1.1.1.49153 > 10.1.1.2.8080: Flags [.], seq 189745:190281, ack 1, win 65535, length 536
9.185062 IP 10.1.1.1.49153 > 10.1.1.2.8080: Flags [.], seq 190281:190817, ack 1, win 65535, length 536
9.185062 IP 10.1.1.2.8080 > 10.1.1.1.49153: Flags [.], ack 190817, win 65535, length 0
9.185987 IP 10.1.1.1.49153 > 10.1.1.2.8080: Flags [.], seq 190817:191353, ack 1, win 65535, length 536
9.188761 IP 10.1.1.1.49153 > 10.1.1.2.8080: Flags [.], seq 191353:191889, ack 1, win 65535, length 536
9.188761 IP 10.1.1.2.8080 > 10.1.1.1.49153: Flags [.], ack 191889, win 65535, length 0
9.189686 IP 10.1.1.1.49153 > 10.1.1.2.8080: Flags [.], seq 191889:192425, ack 1, win 65535, length 536
9.190611 IP 10.1.1.1.49153 > 10.1.1.2.8080: Flags [.], seq 192425:192961, ack 1, win 65535, length 536
9.190611 IP 10.1.1.2.8080 > 10.1.1.1.49153: Flags [.], ack 192961, win 65535, length 0
9.191536 IP 10.1.1.1.49153 > 10.1.1.2.8080: Flags [.], seq 192961:193497, ack 1, win 65535, length 536
9.192460 IP 10.1.1.1.49153 > 10.1.1.2.8080: Flags [.], seq 193497:194033, ack 1, win 65535, length 536
9.192460 IP 10.1.1.2.8080 > 10.1.1.1.49153: Flags [.], ack 194033, win 65535, length 0
9.193385 IP 10.1.1.1.49153 > 10.1.1.2.8080: Flags [.], seq 194033:194569, ack 1, win 65535, length 536
9.386054 IP 10.1.1.1.49153 > 10.1.1.2.8080: Flags [.], seq 194569:195105, ack 1, win 65535, length 536
9.386054 IP 10.1.1.2.8080 > 10.1.1.1.49153: Flags [.], ack 195105, win 65535, length 0
9.386979 IP 10.1.1.1.49153 > 10.1.1.2.8080: Flags [.], seq 195105:195641, ack 1, win 65535, length 536
9.389753 IP 10.1.1.1.49153 > 10.1.1.2.8080: Flags [.], seq 195641:196177, ack 1, win 65535, length 536
9.389753 IP 10.1.1.2.8080 > 10.1.1.1.49153: Flags [.], ack 196177, win 65535, length 0
9.390678 IP 10.1.1.1.49153 > 10.1.1.2.8080: Flags [.], seq 196177:196713, ack 1, win 65535, length 536
9.391603 IP 10.1.1.1.49153 > 10.1.1.2.8080: Flags [.], seq 196713:197249, ack 1, win 65535, length 536
9.391603 IP 10.1.1.2.8080 > 10.1.1.1.49153: Flags [.], ack 197249, win 65535, length 0
9.392528 IP 10.1.1.1.49153 > 10.1.1.2.8080: Flags [.], seq 197249:197785, ack 1, win 65535, length 536
9.393452 IP 10.1.1.1.49153 > 10.1.1.2.8080: Flags [.], seq 197785:198321, ack 1, win 65535, length 536
9.393452 IP 10.1.1.2.8080 > 10.1.1.1.49153: Flags [.], ack 198321, win 65535, length 0
9.394377 IP 10.1.1.1.49153 > 10.1.1.2.8080: Flags [.], seq 198321:198857, ack 1, win 65535, length 536
9.395302 IP 10.1.1.1.49153 > 10.1.1.2.8080: Flags [.], seq 198857:199393, ack 1, win 65535, length 536
9.395302 IP 10.1.1.2.8080 > 10.1.1.1.49153: Flags [.], ack 199393, win 65535, length 0
9.587046 IP 10.1.1.1.49153 > 10.1.1.2.8080: Flags [.], seq 199393:199929, ack 1, win 65535, length 536
9.587971 IP 10.1.1.1.49153 > 10.1.1.2.8080: Flags [.], seq 199929:200465, ack 1, win 65535, length 536
9.587971 IP 10.1.1.2.8080 > 10.1.1.1.49153: Flags [.], ack 200465, win 65535, length 0
9.590745 IP 10.1.1.1.49153 > 10.1.1.2.8080: Flags [.], seq 200465:201001, ack 1, win 65535, length 536
9.591670 IP 10.1.1.1.49153 > 10.1.1.2.8080: Flags [.], seq 201001:201537, ack 1, win 65535, length 536
9.591670 IP 10.1.1.2.8080 > 10.1.1.1.49153: Flags [.], ack 201537, win 65535, length 0
9.592595 IP 10.1.1.1.49153 > 10.1.1.2.8080: Flags [.], seq 201537:202073, ack 1, win 65535, length 536
9.593520 IP 10.1.1.1.49153 > 10.1.1.2.8080: Flags [.], seq 202073:202609, ack 1, win 65535, length 536
9.593520 IP 10.1.1.2.8080 > 10.1.1.1.49153: Flags [.], ack 202609, win 65535, length 0
9.594444 IP 10.1.1.1.49153 > 10.1.1.2.8080: Flags [.], seq 202609:203145, ack 1, win 65535, length 536
9.595369 IP 10.1.1.1.49153 > 10.1.1.2.8080: Flags [.], seq 203145:203681, ack 1, win 65535, length 536
9.595369 IP 10.1.1.2.8080 > 10.1.1.1.49153: Flags [.], ack 203681, win 65535, length 0
9.596294 IP 10.1.1.1.49153 > 10.1.1.2.8080: Flags [.], seq 203681:204217, ack 1, win 65535, length 536
9.597219 IP 10.1.1.1.49153 > 10.1.1.2.8080: Flags [.], seq 204217:204753, ack 1, win 65535, length 536
9.597219 IP 10.1.1.2.8080 > 10.1.1.1.49153: Flags [.], ack 204753, win 65535, length 0
9.788963 IP 10.1.1.1.49153 > 10.1.1.2.8080: Flags [.], seq 204753:205289, ack 1, win 65535, length 536
9.789888 IP 10.1.1.1.49153 > 10.1.1.2.8080: Flags [.], seq 205289:205825, ack 1, win 65535, length 536
9.789888 IP 10.1.1.2.8080 > 10.1.1.1.49153: Flags [.], ack 205825, win 65535, length 0
9.792662 IP 10.1.1.1.49153 > 10.1.1.2.8080: Flags [.], seq 205825:206361, ack 1, win 65535, length 536
9.793587 IP 10.1.1.1.49153 > 10.1.1.2.8080: Flags [.], seq 206361:206897, ack 1, win 65535, length 536
9.793587 IP 10.1.1.2.8080 > 10.1.1.1.49153: Flags [.], ack 206897, win 65535, length 0
9.794512 IP 10.1.1.1.49153 > 10.1.1.2.8080: Flags [.], seq 206897:207433, ack 1, win 65535, length 536
9.795436 IP 10.1.1.1.49153 > 10.1.1.2.8080: Flags [.], seq 207433:207969, ack 1, win 65535, length 536
9.795436 IP 10.1.1.2.8080 > 10.1.1.1.49153: Flags [.], ack 207969, win 65535, length 0
9.796361 IP 10.1.1.1.49153 > 10.1.1.2.8080: Flags [.], seq 207969:208505, ack 1, win 65535, length 536
9.797286 IP 10.1.1.1.49153 > 10.1.1.2.8080: Flags [.], seq 208505:209041, ack 1, win 65535, length 536
9.797286 IP 10.1.1.2.8080 > 10.1.1.1.49153: Flags [.], ack 209041, win 65535, length 0
9.798211 IP 10.1.1.1.49153 > 10.1.1.2.8080: Flags [.], seq 209041:209577, ack 1, win 65535, length 536
9.799136 IP 10.1.1.1.49153 > 10.1.1.2.8080: Flags [.], seq 209577:210113, ack 1, win 65535, length 536
9.799136 IP 10.1.1.2.8080 > 10.1.1.1.49153: Flags [.], ack 210113, win 65535, length 0
9.800060 IP 10.1.1.1.49153 > 10.1.1.2.8080: Flags [.], seq 210113:210649, ack 1, win 65535, length 536
9.990880 IP 10.1.1.1.49153 > 10.1.1.2.8080: Flags [.], seq 210649:211185, ack 1, win 65535, length 536
9.990880 IP 10.1.1.2.8080 > 10.1.1.1.49153: Flags [.], ack 211185, win 65535, length 0
9.991804 IP 10.1.1.1.49153 > 10.1.1.2.8080: Flags [.], seq 211185:211721, ack 1, win 65535, length 536
9.994579 IP 10.1.1.1.49153 > 10.1.1.2.8080: Flags [.], seq 211721:212257, ack 1, win 65535, length 536
9.994579 IP 10.1.1.2.8080 > 10.1.1.1.49153: Flags [.], ack 212257, win 65535, length 0
9.995504 IP 10.1.1.1.49153 > 10.1.1.2.8080: Flags [.], seq 212257:212793, ack 1, win 65535, length 536
9.996428 IP 10.1.1.1.49153 > 10.1.1.2.8080: Flags [.], seq 212793:213329, ack 1, win 65535, length 536
9.996428 IP 10.1.1.2.8080 > 10.1.1.1.49153: Flags [.], ack 213329, win 65535, length 0
9.997353 IP 10.1.1.1.49153 > 10.1.1.2.8080: Flags [.], seq 213329:213865, ack 1, win 65535, length 536
9.998278 IP 10.1.1.1.49153 > 10.1.1.2.8080: Flags [.], seq 213865:214401, ack 1, win 65535, length 536
9.998278 IP 10.1.1.2.8080 > 10.1.1.1.49153: Flags [.], ack 214401, win 65535, length 0
9.999203 IP 10.1.1.1.49153 > 10.1.1.2.8080: Flags [.], seq 214401:214937, ack 1, win 65535, length 536
