1.005067 IP 10.1.1.1.49153 > 10.1.1.2.8080: Flags [S], seq 0, win 65535, length 0
1.005067 IP 10.1.1.2.8080 > 10.1.1.1.49153: Flags [S.], seq 0, ack 1, win 65535, length 0
1.015201 IP 10.1.1.1.49153 > 10.1.1.2.8080: Flags [.], ack 1, win 65535, length 0
1.016126 IP 10.1.1.1.49153 > 10.1.1.2.8080: Flags [.], seq 1:537, ack 1, win 65535, length 536
1.016126 IP 10.1.1.2.8080 > 10.1.1.1.49153: Flags [.], ack 537, win 65535, length 0
1.027118 IP 10.1.1.1.49153 > 10.1.1.2.8080: Flags [.], seq 537:1073, ack 1, win 65535, length 536
1.028043 IP 10.1.1.1.49153 > 10.1.1.2.8080: Flags [.], seq 1073:1609, ack 1, win 65535, length 536
1.028043 IP 10.1.1.2.8080 > 10.1.1.1.49153: Flags [.], ack 1609, win 65535, length 0
1.039035 IP 10.1.1.1.49153 > 10.1.1.2.8080: Flags [.], seq 1609:2145, ack 1, win 65535, length 536
1.039960 IP 10.1.1.1.49153 > 10.1.1.2.8080: Flags [.], seq 2145:2681, ack 1, win 65535, length 536
1.039960 IP 10.1.1.2.8080 > 10.1.1.1.49153: Flags [.], ack 2681, win 65535, length 0
1.040884 IP 10.1.1.1.49153 > 10.1.1.2.8080: Flags [.], seq 2681:3217, ack 1, win 65535, length 536
1.050952 IP 10.1.1.1.49153 > 10.1.1.2.8080: Flags [.], seq 3217:3753, ack 1, win 65535, length 536
1.050952 IP 10.1.1.2.8080 > 10.1.1.1.49153: Flags [.], ack 3753, win 65535, length 0
1.051876 IP 10.1.1.1.49153 > 10.1.1.2.8080: Flags [.], seq 3753:4289, ack 1, win 65535, length 536
1.052801 IP 10.1.1.1.49153 > 10.1.1.2.8080: Flags [.], seq 4289:4825, ack 1, win 65535, length 536
1.052801 IP 10.1.1.2.8080 > 10.1.1.1.49153: Flags [.], ack 4825, win 65535, length 0
1.061944 IP 10.1.1.1.49153 > 10.1.1.2.8080: Flags [.], seq 4825:5361, ack 1, win 65535, length 536
1.062868 IP 10.1.1.1.49153 > 10.1.1.2.8080: Flags [.], seq 5361:5897, ack 1, win 65535, length 536
1.062868 IP 10.1.1.2.8080 > 10.1.1.1.49153: Flags [.], ack 5897, win 65535, length 0
1.063793 IP 10.1.1.1.49153 > 10.1.1.2.8080: Flags [.], seq 5897:6433, ack 1, win 65535, length 536
1.064718 IP 10.1.1.1.49153 > 10.1.1.2.8080: Flags [.], seq 6433:6969, ack 1, win 65535, length 536
1.064718 IP 10.1.1.2.8080 > 10.1.1.1.49153: Flags [.], ack 6969, win 65535, length 0
1.065643 IP 10.1.1.1.49153 > 10.1.1.2.8080: Flags [.], seq 6969:7505, ack 1, win 65535, length 536
1.066568 IP 10.1.1.1.49153 > 10.1.1.2.8080: Flags [.], seq 7505:8041, ack 1, win 65535, length 536
1.066568 IP 10.1.1.2.8080 > 10.1.1.1.49153: Flags [.], ack 8041, win 65535, length 0
1.073860 IP 10.1.1.1.49153 > 10.1.1.2.8080: Flags [.], seq 8041:8577, ack 1, win 65535, length 536
1.074785 IP 10.1.1.1.49153 > 10.1.1.2.8080: Flags [.], seq 8577:9113, ack 1, win 65535, length 536
1.074785 IP 10.1.1.2.8080 > 10.1.1.1.49153: Flags [.], ack 9113, win 65535, length 0
1.075710 IP 10.1.1.1.49153 > 10.1.1.2.8080: Flags [.], seq 9113:9649, ack 1, win 65535, length 536
1.076635 IP 10.1.1.1.49153 > 10.1.1.2.8080: Flags [.], seq 9649:10185, ack 1, win 65535, length 536
1.076635 IP 10.1.1.2.8080 > 10.1.1.1.49153: Flags [.], ack 10185, win 65535, length 0
1.077560 IP 10.1.1.1.49153 > 10.1.1.2.8080: Flags [.], seq 10185:10721, ack 1, win 65535, length 536
1.078484 IP 10.1.1.1.49153 > 10.1.1.2.8080: Flags [.], seq 10721:11257, ack 1, win 65535, length 536
1.078484 IP 10.1.1.2.8080 > 10.1.1.1.49153: Flags [.], ack 11257, win 65535, length 0
1.079409 IP 10.1.1.1.49153 > 10.1.1.2.8080: Flags [.], seq 11257:11793, ack 1, win 65535, length 536
1.080334 IP 10.1.1.1.49153 > 10.1.1.2.8080: Flags [.], seq 11793:12329, ack 1, win 65535, length 536
1.080334 IP 10.1.1.2.8080 > 10.1.1.1.49153: Flags [.], ack 12329, win 65535, length 0
1.081259 IP 10.1.1.1.49153 > 10.1.1.2.8080: Flags [.], seq 12329:12865, ack 1, win 65535, length 536
1.085777 IP 10.1.1.1.49153 > 10.1.1.2.8080: Flags [.], seq 12865:13401, ack 1, win 65535, length 536
1.085777 IP 10.1.1.2.8080 > 10.1.1.1.49153: Flags [.], ack 13401, win 65535, length 0
1.086702 IP 10.1.1.1.49153 > 10.1.1.2.8080: Flags [.], seq 13401:13937, ack 1, win 65535, length 536
1.087627 IP 10.1.1.1.49153 > 10.1.1.2.8080: Flags [.], seq 13937:14473, ack 1, win 65535, length 536
1.087627 IP 10.1.1.2.8080 > 10.1.1.1.49153: Flags [.], ack 14473, win 65535, length 0
1.088552 IP 10.1.1.1.49153 > 10.1.1.2.8080: Flags [.], seq 14473:15009, ack 1, win 65535, length 536
1.089476 IP 10.1.1.1.49153 > 10.1.1.2.8080: Flags [.], seq 15009:15545, ack 1, win 65535, length 536
1.089476 IP 10.1.1.2.8080 > 10.1.1.1.49153: Flags [.], ack 15545, win 65535, length 0
1.090401 IP 10.1.1.1.49153 > 10.1.1.2.8080: Flags [.], seq 15545:16081, ack 1, win 65535, length 536
1.091326 IP 10.1.1.1.49153 > 10.1.1.2.8080: Flags [.], seq 16081:16617, ack 1, win 65535, length 536
1.091326 IP 10.1.1.2.8080 > 10.1.1.1.49153: Flags [.], ack 16617, win 65535, length 0
1.092251 IP 10.1.1.1.49153 > 10.1.1.2.8080: Flags [.], seq 16617:17153, ack 1, win 65535, length 536
1.093176 IP 10.1.1.1.49153 > 10.1.1.2.8080: Flags [.], seq 17153:17689, ack 1, win 65535, length 536
1.093176 IP 10.1.1.2.8080 > 10.1.1.1.49153: Flags [.], ack 17689, win 65535, length 0
1.094100 IP 10.1.1.1.49153 > 10.1.1.2.8080: Flags [.], seq 17689:18225, ack 1, win 65535, length 536
1.095025 IP 10.1.1.1.49153 > 10.1.1.2.8080: Flags [.], seq 18225:18761, ack 1, win 65535, length 536
1.095025 IP 10.1.1.2.8080 > 10.1.1.1.49153: Flags [.], ack 18761, win 65535, length 0
1.095950 IP 10.1.1.1.49153 > 10.1.1.2.8080: Flags [.], seq 18761:19297, ack 1, win 65535, length 536
1.096875 IP 10.1.1.1.49153 > 10.1.1.2.8080: Flags [.], seq 19297:19833, ack 1, win 65535, length 536
1.096875 IP 10.1.1.2.8080 > 10.1.1.1.49153: Flags [.], ack 19833, win 65535, length 0
1.097800 IP 10.1.1.1.49153 > 10.1.1.2.8080: Flags [.], seq 19833:20369, ack 1, win 65535, length 536
1.098724 IP 10.1.1.1.49153 > 10.1.1.2.8080: Flags [.], seq 20369:20905, ack 1, win 65535, length 536
1.098724 IP 10.1.1.2.8080 > 10.1.1.1.49153: Flags [.], ack 20905, win 65535, length 0
1.099649 IP 10.1.1.1.49153 > 10.1.1.2.8080: Flags [.], seq 20905:21441, ack 1, win 65535, length 536
1.100574 IP 10.1.1.1.49153 > 10.1.1.2.8080: Flags [.], seq 21441:21977, ack 1, win 65535, length 536
1.100574 IP 10.1.1.2.8080 > 10.1.1.1.49153: Flags [.], ack 21977, win 65535, length 0
1.101499 IP 10.1.1.1.49153 > 10.1.1.2.8080: Flags [.], seq 21977:22513, ack 1, win 65535, length 536
1.102424 IP 10.1.1.1.49153 > 10.1.1.2.8080: Flags [.], seq 22513:23049, ack 1, win 65535, length 536
1.102424 IP 10.1.1.2.8080 > 10.1.1.1.49153: Flags [.], ack 23049, win 65535, length 0
1.103348 IP 10.1.1.1.49153 > 10.1.1.2.8080: Flags [.], seq 23049:23585, ack 1, win 65535, length 536
1.104273 IP 10.1.1.1.49153 > 10.1.1.2.8080: Flags [.], seq 23585:24121, ack 1, win 65535, length 536
1.104273 IP 10.1.1.2.8080 > 10.1.1.1.49153: Flags [.], ack 24121, win 65535, length 0
1.105198 IP 10.1.1.1.49153 > 10.1.1.2.8080: Flags [.], seq 24121:24657, ack 1, win 65535, length 536
1.106123 IP 10.1.1.1.49153 > 10.1.1.2.8080: Flags [.], seq 24657:25193, ack 1, win 65535, length 536
1.106123 IP 10.1.1.2.8080 > 10.1.1.1.49153: Flags [.], ack 25193, win 65535, length 0
1.107048 IP 10.1.1.1.49153 > 10.1.1.2.8080: Flags [.], seq 25193:25729, ack 1, win 65535, length 536
1.107972 IP 10.1.1.1.49153 > 10.1.1.2.8080: Flags [.], seq 25729:26265, ack 1, win 65535, length 536
1.107972 IP 10.1.1.2.8080 > 10.1.1.1.49153: Flags [.], ack 26265, win 65535, length 0
1.108897 IP 10.1.1.1.49153 > 10.1.1.2.8080: Flags [.], seq 26265:26801, ack 1, win 65535, length 536
1.109822 IP 10.1.1.1.49153 > 10.1.1.2.8080: Flags [.], seq 26801:27337, ack 1, win 65535, length 536
1.109822 IP 10.1.1.2.8080 > 10.1.1.1.49153: Flags [.], ack 27337, win 65535, length 0
1.110747 IP 10.1.1.1.49153 > 10.1.1.2.8080: Flags [.], seq 27337:27873, ack 1, win 65535, length 536
1.111672 IP 10.1.1.1.49153 > 10.1.1.2.8080: Flags [.], seq 27873:28409, ack 1, win 65535, length 536
1.111672 IP 10.1.1.2.8080 > 10.1.1.1.49153: Flags [.], ack 28409, win 65535, length 0
1.112596 IP 10.1.1.1.49153 > 10.1.1.2.8080: Flags [.], seq 28409:28945, ack 1, win 65535, length 536
1.113521 IP 10.1.1.1.49153 > 10.1.1.2.8080: Flags [.], seq 28945:29481, ack 1, win 65535, length 536
1.113521 IP 10.1.1.2.8080 > 10.1.1.1.49153: Flags [.], ack 29481, win 65535, length 0
1.114446 IP 10.1.1.1.49153 > 10.1.1.2.8080: Flags [.], seq 29481:30017, ack 1, win 65535, length 536
1.115371 IP 10.1.1.1.49153 > 10.1.1.2.8080: Flags [.], seq 30017:30553, ack 1, win 65535, length 536
1.115371 IP 10.1.1.2.8080 > 10.1.1.1.49153: Flags [.], ack 30553, win 65535, length 0
1.116296 IP 10.1.1.1.49153 > 10.1.1.2.8080: Flags [.], seq 30553:31089, ack 1, win 65535, length 536
1.117220 IP 10.1.1.1.49153 > 10.1.1.2.8080: Flags [.], seq 31089:31625, ack 1, win 65535, length 536
1.117220 IP 10.1.1.2.8080 > 10.1.1.1.49153: Flags [.], ack 31625, win 65535, length 0
1.118145 IP 10.1.1.1.49153 > 10.1.1.2.8080: Flags [.], seq 31625:32161, ack 1, win 65535, length 536
1.119070 IP 10.1.1.1.49153 > 10.1.1.2.8080: Flags [.], seq 32161:32697, ack 1, win 65535, length 536
1.119070 IP 10.1.1.2.8080 > 10.1.1.1.49153: Flags [.], ack 32697, win 65535, length 0
1.119995 IP 10.1.1.1.49153 > 10.1.1.2.8080: Flags [.], seq 32697:33233, ack 1, win 65535, length 536
1.120920 IP 10.1.1.1.49153 > 10.1.1.2.8080: Flags [.], seq 33769:34305, ack 1, win 65535, length 536
1.120920 IP 10.1.1.2.8080 > 10.1.1.1.49153: Flags [.], ack 33233, win 65535, length 0
1.121844 IP 10.1.1.1.49153 > 10.1.1.2.8080: Flags [.], seq 34305:34841, ack 1, win 65535, length 536
1.121844 IP 10.1.1.2.8080 > 10.1.1.1.49153: Flags [.], ack 33233, win 65535, length 0
1.122769 IP 10.1.1.1.49153 > 10.1.1.2.8080: Flags [.], seq 35377:35913, ack 1, win 65535, length 536
1.122769 IP 10.1.1.2.8080 > 10.1.1.1.49153: Flags [.], ack 33233, win 65535, length 0
1.123694 IP 10.1.1.1.49153 > 10.1.1.2.8080: Flags [.], seq 35913:36449, ack 1, win 65535, length 536
1.123694 IP 10.1.1.2.8080 > 10.1.1.1.49153: Flags [.], ack 33233, win 65535, length 0
1.124619 IP 10.1.1.1.49153 > 10.1.1.2.8080: Flags [.], seq 36985:37521, ack 1, win 65535, length 536
1.124619 IP 10.1.1.2.8080 > 10.1.1.1.49153: Flags [.], ack 33233, win 65535, length 0
1.125544 IP 10.1.1.1.49153 > 10.1.1.2.8080: Flags [.], seq 37521:38057, ack 1, win 65535, length 536
1.125544 IP 10.1.1.2.8080 > 10.1.1.1.49153: Flags [.], ack 33233, win 65535, length 0
1.126468 IP 10.1.1.1.49153 > 10.1.1.2.8080: Flags [.], seq 38593:39129, ack 1, win 65535, length 536
1.126468 IP 10.1.1.2.8080 > 10.1.1.1.49153: Flags [.], ack 33233, win 65535, length 0
1.127393 IP 10.1.1.1.49153 > 10.1.1.2.8080: Flags [.], seq 39129:39665, ack 1, win 65535, length 536
1.127393 IP 10.1.1.2.8080 > 10.1.1.1.49153: Flags [.], ack 33233, win 65535, length 0
1.128318 IP 10.1.1.1.49153 > 10.1.1.2.8080: Flags [.], seq 40201:40737, ack 1, win 65535, length 536
1.128318 IP 10.1.1.2.8080 > 10.1.1.1.49153: Flags [.], ack 33233, win 65535, length 0
1.129243 IP 10.1.1.1.49153 > 10.1.1.2.8080: Flags [.], seq 40737:41273, ack 1, win 65535, length 536
1.129243 IP 10.1.1.2.8080 > 10.1.1.1.49153: Flags [.], ack 33233, win 65535, length 0
1.130168 IP 10.1.1.1.49153 > 10.1.1.2.8080: Flags [.], seq 41809:42345, ack 1, win 65535, length 536
1.130168 IP 10.1.1.2.8080 > 10.1.1.1.49153: Flags [.], ack 33233, win 65535, length 0
1.131092 IP 10.1.1.1.49153 > 10.1.1.2.8080: Flags [.], seq 42345:42881, ack 1, win 65535, length 536
1.131092 IP 10.1.1.2.8080 > 10.1.1.1.49153: Flags [.], ack 33233, win 65535, length 0
1.132017 IP 10.1.1.1.49153 > 10.1.1.2.8080: Flags [.], seq 43417:43953, ack 1, win 65535, length 536
1.132017 IP 10.1.1.2.8080 > 10.1.1.1.49153: Flags [.], ack 33233, win 65535, length 0
1.132942 IP 10.1.1.1.49153 > 10.1.1.2.8080: Flags [.], seq 43953:44489, ack 1, win 65535, length 536
1.132942 IP 10.1.1.2.8080 > 10.1.1.1.49153: Flags [.], ack 33233, win 65535, length 0
1.133867 IP 10.1.1.1.49153 > 10.1.1.2.8080: Flags [.], seq 45025:45561, ack 1, win 65535, length 536
1.133867 IP 10.1.1.2.8080 > 10.1.1.1.49153: Flags [.], ack 33233, win 65535, length 0
1.134792 IP 10.1.1.1.49153 > 10.1.1.2.8080: Flags [.], seq 45561:46097, ack 1, win 65535, length 536
1.134792 IP 10.1.1.2.8080 > 10.1.1.1.49153: Flags [.], ack 33233, win 65535, length 0
1.135716 IP 10.1.1.1.49153 > 10.1.1.2.8080: Flags [.], seq 46633:47169, ack 1, win 65535, length 536
1.135716 IP 10.1.1.2.8080 > 10.1.1.1.49153: Flags [.], ack 33233, win 65535, length 0
1.136641 IP 10.1.1.1.49153 > 10.1.1.2.8080: Flags [.], seq 47169:47705, ack 1, win 65535, length 536
1.136641 IP 10.1.1.2.8080 > 10.1.1.1.49153: Flags [.], ack 33233, win 65535, length 0
1.137566 IP 10.1.1.1.49153 > 10.1.1.2.8080: Flags [.], seq 48241:48777, ack 1, win 65535, length 536
1.137566 IP 10.1.1.2.8080 > 10.1.1.1.49153: Flags [.], ack 33233, win 65535, length 0
1.138491 IP 10.1.1.1.49153 > 10.1.1.2.8080: Flags [.], seq 48777:49313, ack 1, win 65535, length 536
1.138491 IP 10.1.1.2.8080 > 10.1.1.1.49153: Flags [.], ack 33233, win 65535, length 0
1.139416 IP 10.1.1.1.49153 > 10.1.1.2.8080: Flags [.], seq 49849:50385, ack 1, win 65535, length 536
1.139416 IP 10.1.1.2.8080 > 10.1.1.1.49153: Flags [.], ack 33233, win 65535, length 0
1.140340 IP 10.1.1.1.49153 > 10.1.1.2.8080: Flags [.], seq 50385:50921, ack 1, win 65535, length 536
1.140340 IP 10.1.1.2.8080 > 10.1.1.1.49153: Flags [.], ack 33233, win 65535, length 0
1.141265 IP 10.1.1.1.49153 > 10.1.1.2.8080: Flags [.], seq 33233:33769, ack 1, win 65535, length 536
1.141265 IP 10.1.1.2.8080 > 10.1.1.1.49153: Flags [.], ack 34841, win 65535, length 0
1.152257 IP 10.1.1.1.49153 > 10.1.1.2.8080: Flags [.], seq 34841:35377, ack 1, win 65535, length 536
1.152257 IP 10.1.1.2.8080 > 10.1.1.1.49153: Flags [.], ack 36449, win 65535, length 0
1.153182 IP 10.1.1.1.49153 > 10.1.1.2.8080: Flags [.], seq 35377:35913, ack 1, win 65535, length 536
1.153182 IP 10.1.1.2.8080 > 10.1.1.1.49153: Flags [.], ack 36449, win 65535, length 0
1.163249 IP 10.1.1.1.49153 > 10.1.1.2.8080: Flags [.], seq 36449:36985, ack 1, win 65535, length 536
1.163249 IP 10.1.1.2.8080 > 10.1.1.1.49153: Flags [.], ack 38057, win 65535, length 0
1.164174 IP 10.1.1.1.49153 > 10.1.1.2.8080: Flags [.], seq 36985:37521, ack 1, win 65535, length 536
1.164174 IP 10.1.1.2.8080 > 10.1.1.1.49153: Flags [.], ack 38057, win 65535, length 0
1.165099 IP 10.1.1.1.49153 > 10.1.1.2.8080: Flags [.], seq 37521:38057, ack 1, win 65535, length 536
1.165099 IP 10.1.1.2.8080 > 10.1.1.1.49153: Flags [.], ack 38057, win 65535, length 0
1.174241 IP 10.1.1.1.49153 > 10.1.1.2.8080: Flags [.], seq 38057:38593, ack 1, win 65535, length 536
1.174241 IP 10.1.1.2.8080 > 10.1.1.1.49153: Flags [.], ack 39665, win 65535, length 0
1.175166 IP 10.1.1.1.49153 > 10.1.1.2.8080: Flags [.], seq 38593:39129, ack 1, win 65535, length 536
1.175166 IP 10.1.1.2.8080 > 10.1.1.1.49153: Flags [.], ack 39665, win 65535, length 0
1.176091 IP 10.1.1.1.49153 > 10.1.1.2.8080: Flags [.], seq 39129:39665, ack 1, win 65535, length 536
1.176091 IP 10.1.1.2.8080 > 10.1.1.1.49153: Flags [.], ack 39665, win 65535, length 0
1.177016 IP 10.1.1.1.49153 > 10.1.1.2.8080: Flags [.], seq 39665:40201, ack 1, win 65535, length 536
1.177016 IP 10.1.1.2.8080 > 10.1.1.1.49153: Flags [.], ack 41273, win 65535, length 0
1.185233 IP 10.1.1.1.49153 > 10.1.1.2.8080: Flags [.], seq 40201:40737, ack 1, win 65535, length 536
1.185233 IP 10.1.1.2.8080 > 10.1.1.1.49153: Flags [.], ack 41273, win 65535, length 0
1.186158 IP 10.1.1.1.49153 > 10.1.1.2.8080: Flags [.], seq 40737:41273, ack 1, win 65535, length 536
1.186158 IP 10.1.1.2.8080 > 10.1.1.1.49153: Flags [.], ack 41273, win 65535, length 0
1.187083 IP 10.1.1.1.49153 > 10.1.1.2.8080: Flags [.], seq 41273:41809, ack 1, win 65535, length 536
1.187083 IP 10.1.1.2.8080 > 10.1.1.1.49153: Flags [.], ack 42881, win 65535, length 0
1.188008 IP 10.1.1.1.49153 > 10.1.1.2.8080: Flags [.], seq 41809:42345, ack 1, win 65535, length 536
1.188008 IP 10.1.1.2.8080 > 10.1.1.1.49153: Flags [.], ack 42881, win 65535, length 0
1.188932 IP 10.1.1.1.49153 > 10.1.1.2.8080: Flags [.], seq 42345:42881, ack 1, win 65535, length 536
1.188932 IP 10.1.1.2.8080 > 10.1.1.1.49153: Flags [.], ack 42881, win 65535, length 0
1.189857 IP 10.1.1.1.49153 > 10.1.1.2.8080: Flags [.], seq 42881:43417, ack 1, win 65535, length 536
1.189857 IP 10.1.1.2.8080 > 10.1.1.1.49153: Flags [.], ack 44489, win 65535, length 0
1.190782 IP 10.1.1.1.49153 > 10.1.1.2.8080: Flags [.], seq 43417:43953, ack 1, win 65535, length 536
1.190782 IP 10.1.1.2.8080 > 10.1.1.1.49153: Flags [.], ack 44489, win 65535, length 0
1.191707 IP 10.1.1.1.49153 > 10.1.1.2.8080: Flags [.], seq 43953:44489, ack 1, win 65535, length 536
1.191707 IP 10.1.1.2.8080 > 10.1.1.1.49153: Flags [.], ack 44489, win 65535, length 0
1.198075 IP 10.1.1.1.49153 > 10.1.1.2.8080: Flags [.], seq 44489:45025, ack 1, win 65535, length 536
1.198075 IP 10.1.1.2.8080 > 10.1.1.1.49153: Flags [.], ack 46097, win 65535, length 0
1.199000 IP 10.1.1.1.49153 > 10.1.1.2.8080: Flags [.], seq 45025:45561, ack 1, win 65535, length 536
1.199000 IP 10.1.1.2.8080 > 10.1.1.1.49153: Flags [.], ack 46097, win 65535, length 0
1.199924 IP 10.1.1.1.49153 > 10.1.1.2.8080: Flags [.], seq 45561:46097, ack 1, win 65535, length 536
1.199924 IP 10.1.1.2.8080 > 10.1.1.1.49153: Flags [.], ack 46097, win 65535, length 0
1.200849 IP 10.1.1.1.49153 > 10.1.1.2.8080: Flags [.], seq 46097:46633, ack 1, win 65535, length 536
1.200849 IP 10.1.1.2.8080 > 10.1.1.1.49153: Flags [.], ack 47705, win 65535, length 0
1.201774 IP 10.1.1.1.49153 > 10.1.1.2.8080: Flags [.], seq 46633:47169, ack 1, win 65535, length 536
1.201774 IP 10.1.1.2.8080 > 10.1.1.1.49153: Flags [.], ack 47705, win 65535, length 0
1.202699 IP 10.1.1.1.49153 > 10.1.1.2.8080: Flags [.], seq 47169:47705, ack 1, win 65535, length 536
1.202699 IP 10.1.1.2.8080 > 10.1.1.1.49153: Flags [.], ack 47705, win 65535, length 0
1.203624 IP 10.1.1.1.49153 > 10.1.1.2.8080: Flags [.], seq 47705:48241, ack 1, win 65535, length 536
1.203624 IP 10.1.1.2.8080 > 10.1.1.1.49153: Flags [.], ack 49313, win 65535, length 0
1.204548 IP 10.1.1.1.49153 > 10.1.1.2.8080: Flags [.], seq 48241:48777, ack 1, win 65535, length 536
1.204548 IP 10.1.1.2.8080 > 10.1.1.1.49153: Flags [.], ack 49313, win 65535, length 0
1.209067 IP 10.1.1.1.49153 > 10.1.1.2.8080: Flags [.], seq 48777:49313, ack 1, win 65535, length 536
1.209067 IP 10.1.1.2.8080 > 10.1.1.1.49153: Flags [.], ack 49313, win 65535, length 0
1.209992 IP 10.1.1.1.49153 > 10.1.1.2.8080: Flags [.], seq 49313:49849, ack 1, win 65535, length 536
1.209992 IP 10.1.1.2.8080 > 10.1.1.1.49153: Flags [.], ack 50921, win 65535, length 0
1.210916 IP 10.1.1.1.49153 > 10.1.1.2.8080: Flags [.], seq 49849:50385, ack 1, win 65535, length 536
1.210916 IP 10.1.1.2.8080 > 10.1.1.1.49153: Flags [.], ack 50921, win 65535, length 0
1.211841 IP 10.1.1.1.49153 > 10.1.1.2.8080: Flags [.], seq 50385:50921, ack 1, win 65535, length 536
1.211841 IP 10.1.1.2.8080 > 10.1.1.1.49153: Flags [.], ack 50921, win 65535, length 0
1.212766 IP 10.1.1.1.49153 > 10.1.1.2.8080: Flags [.], seq 50921:51457, ack 1, win 65535, length 536
1.213691 IP 10.1.1.1.49153 > 10.1.1.2.8080: Flags [.], seq 51457:51993, ack 1, win 65535, length 536
1.213691 IP 10.1.1.2.8080 > 10.1.1.1.49153: Flags [.], ack 51993, win 65535, length 0
1.214616 IP 10.1.1.1.49153 > 10.1.1.2.8080: Flags [.], seq 51993:52529, ack 1, win 65535, length 536
1.215540 IP 10.1.1.1.49153 > 10.1.1.2.8080: Flags [.], seq 52529:53065, ack 1, win 65535, length 536
1.215540 IP 10.1.1.2.8080 > 10.1.1.1.49153: Flags [.], ack 53065, win 65535, length 0
1.216465 IP 10.1.1.1.49153 > 10.1.1.2.8080: Flags [.], seq 53065:53601, ack 1, win 65535, length 536
1.217390 IP 10.1.1.1.49153 > 10.1.1.2.8080: Flags [.], seq 53601:54137, ack 1, win 65535, length 536
1.217390 IP 10.1.1.2.8080 > 10.1.1.1.49153: Flags [.], ack 54137, win 65535, length 0
1.218315 IP 10.1.1.1.49153 > 10.1.1.2.8080: Flags [.], seq 54137:54673, ack 1, win 65535, length 536
1.219240 IP 10.1.1.1.49153 > 10.1.1.2.8080: Flags [.], seq 54673:55209, ack 1, win 65535, length 536
1.219240 IP 10.1.1.2.8080 > 10.1.1.1.49153: Flags [.], ack 55209, win 65535, length 0
1.220984 IP 10.1.1.1.49153 > 10.1.1.2.8080: Flags [.], seq 55209:55745, ack 1, win 65535, length 536
1.221908 IP 10.1.1.1.49153 > 10.1.1.2.8080: Flags [.], seq 55745:56281, ack 1, win 65535, length 536
1.221908 IP 10.1.1.2.8080 > 10.1.1.1.49153: Flags [.], ack 56281, win 65535, length 0
1.222833 IP 10.1.1.1.49153 > 10.1.1.2.8080: Flags [.], seq 56281:56817, ack 1, win 65535, length 536
1.223758 IP 10.1.1.1.49153 > 10.1.1.2.8080: Flags [.], seq 56817:57353, ack 1, win 65535, length 536
1.223758 IP 10.1.1.2.8080 > 10.1.1.1.49153: Flags [.], ack 57353, win 65535, length 0
1.224683 IP 10.1.1.1.49153 > 10.1.1.2.8080: Flags [.], seq 57353:57889, ack 1, win 65535, length 536
1.225608 IP 10.1.1.1.49153 > 10.1.1.2.8080: Flags [.], seq 57889:58425, ack 1, win 65535, length 536
1.225608 IP 10.1.1.2.8080 > 10.1.1.1.49153: Flags [.], ack 58425, win 65535, length 0
1.226532 IP 10.1.1.1.49153 > 10.1.1.2.8080: Flags [.], seq 58425:58961, ack 1, win 65535, length 536
1.227457 IP 10.1.1.1.49153 > 10.1.1.2.8080: Flags [.], seq 58961:59497, ack 1, win 65535, length 536
1.227457 IP 10.1.1.2.8080 > 10.1.1.1.49153: Flags [.], ack 59497, win 65535, length 0
1.228382 IP 10.1.1.1.49153 > 10.1.1.2.8080: Flags [.], seq 59497:60033, ack 1, win 65535, length 536
1.229307 IP 10.1.1.1.49153 > 10.1.1.2.8080: Flags [.], seq 60033:60569, ack 1, win 65535, length 536
1.229307 IP 10.1.1.2.8080 > 10.1.1.1.49153: Flags [.], ack 60569, win 65535, length 0
1.230232 IP 10.1.1.1.49153 > 10.1.1.2.8080: Flags [.], seq 60569:61105, ack 1, win 65535, length 536
1.231156 IP 10.1.1.1.49153 > 10.1.1.2.8080: Flags [.], seq 61105:61641, ack 1, win 65535, length 536
1.231156 IP 10.1.1.2.8080 > 10.1.1.1.49153: Flags [.], ack 61641, win 65535, length 0
1.232081 IP 10.1.1.1.49153 > 10.1.1.2.8080: Flags [.], seq 61641:62177, ack 1, win 65535, length 536
1.233006 IP 10.1.1.1.49153 > 10.1.1.2.8080: Flags [.], seq 62177:62713, ack 1, win 65535, length 536
1.233006 IP 10.1.1.2.8080 > 10.1.1.1.49153: Flags [.], ack 62713, win 65535, length 0
1.233931 IP 10.1.1.1.49153 > 10.1.1.2.8080: Flags [.], seq 62713:63249, ack 1, win 65535, length 536
1.234856 IP 10.1.1.1.49153 > 10.1.1.2.8080: Flags [.], seq 63249:63785, ack 1, win 65535, length 536
1.234856 IP 10.1.1.2.8080 > 10.1.1.1.49153: Flags [.], ack 63785, win 65535, length 0
1.235780 IP 10.1.1.1.49153 > 10.1.1.2.8080: Flags [.], seq 63785:64321, ack 1, win 65535, length 536
1.236705 IP 10.1.1.1.49153 > 10.1.1.2.8080: Flags [.], seq 64321:64857, ack 1, win 65535, length 536
1.236705 IP 10.1.1.2.8080 > 10.1.1.1.49153: Flags [.], ack 64857, win 65535, length 0
1.237630 IP 10.1.1.1.49153 > 10.1.1.2.8080: Flags [.], seq 64857:65393, ack 1, win 65535, length 536
1.238555 IP 10.1.1.1.49153 > 10.1.1.2.8080: Flags [.], seq 65393:65929, ack 1, win 65535, length 536
1.238555 IP 10.1.1.2.8080 > 10.1.1.1.49153: Flags [.], ack 65929, win 65535, length 0
1.239480 IP 10.1.1.1.49153 > 10.1.1.2.8080: Flags [.], seq 65929:66465, ack 1, win 65535, length 536
1.240404 IP 10.1.1.1.49153 > 10.1.1.2.8080: Flags [.], seq 66465:67001, ack 1, win 65535, length 536
1.240404 IP 10.1.1.2.8080 > 10.1.1.1.49153: Flags [.], ack 67001, win 65535, length 0
1.241329 IP 10.1.1.1.49153 > 10.1.1.2.8080: Flags [.], seq 67001:67537, ack 1, win 65535, length 536
1.242254 IP 10.1.1.1.49153 > 10.1.1.2.8080: Flags [.], seq 67537:68073, ack 1, win 65535, length 536
1.242254 IP 10.1.1.2.8080 > 10.1.1.1.49153: Flags [.], ack 68073, win 65535, length 0
1.243179 IP 10.1.1.1.49153 > 10.1.1.2.8080: Flags [.], seq 68073:68609, ack 1, win 65535, length 536
1.244104 IP 10.1.1.1.49153 > 10.1.1.2.8080: Flags [.], seq 68609:69145, ack 1, win 65535, length 536
1.244104 IP 10.1.1.2.8080 > 10.1.1.1.49153: Flags [.], ack 69145, win 65535, length 0
1.245028 IP 10.1.1.1.49153 > 10.1.1.2.8080: Flags [.], seq 69145:69681, ack 1, win 65535, length 536
1.245953 IP 10.1.1.1.49153 > 10.1.1.2.8080: Flags [.], seq 69681:70217, ack 1, win 65535, length 536
1.245953 IP 10.1.1.2.8080 > 10.1.1.1.49153: Flags [.], ack 70217, win 65535, length 0
1.246878 IP 10.1.1.1.49153 > 10.1.1.2.8080: Flags [.], seq 70217:70753, ack 1, win 65535, length 536
1.247803 IP 10.1.1.1.49153 > 10.1.1.2.8080: Flags [.], seq 70753:71289, ack 1, win 65535, length 536
1.247803 IP 10.1.1.2.8080 > 10.1.1.1.49153: Flags [.], ack 71289, win 65535, length 0
1.248728 IP 10.1.1.1.49153 > 10.1.1.2.8080: Flags [.], seq 71289:71825, ack 1, win 65535, length 536
1.249652 IP 10.1.1.1.49153 > 10.1.1.2.8080: Flags [.], seq 71825:72361, ack 1, win 65535, length 536
1.249652 IP 10.1.1.2.8080 > 10.1.1.1.49153: Flags [.], ack 72361, win 65535, length 0
1.250577 IP 10.1.1.1.49153 > 10.1.1.2.8080: Flags [.], seq 72361:72897, ack 1, win 65535, length 536
1.251502 IP 10.1.1.1.49153 > 10.1.1.2.8080: Flags [.], seq 72897:73433, ack 1, win 65535, length 536
1.251502 IP 10.1.1.2.8080 > 10.1.1.1.49153: Flags [.], ack 73433, win 65535, length 0
1.252427 IP 10.1.1.1.49153 > 10.1.1.2.8080: Flags [.], seq 73433:73969, ack 1, win 65535, length 536
1.253352 IP 10.1.1.1.49153 > 10.1.1.2.8080: Flags [.], seq 73969:74505, ack 1, win 65535, length 536
1.253352 IP 10.1.1.2.8080 > 10.1.1.1.49153: Flags [.], ack 74505, win 65535, length 0
1.254276 IP 10.1.1.1.49153 > 10.1.1.2.8080: Flags [.], seq 74505:75041, ack 1, win 65535, length 536
1.255201 IP 10.1.1.1.49153 > 10.1.1.2.8080: Flags [.], seq 75041:75577, ack 1, win 65535, length 536
1.255201 IP 10.1.1.2.8080 > 10.1.1.1.49153: Flags [.], ack 75577, win 65535, length 0
1.256126 IP 10.1.1.1.49153 > 10.1.1.2.8080: Flags [.], seq 75577:76113, ack 1, win 65535, length 536
1.257051 IP 10.1.1.1.49153 > 10.1.1.2.8080: Flags [.], seq 76113:76649, ack 1, win 65535, length 536
1.257051 IP 10.1.1.2.8080 > 10.1.1.1.49153: Flags [.], ack 76649, win 65535, length 0
1.257976 IP 10.1.1.1.49153 > 10.1.1.2.8080: Flags [.], seq 76649:77185, ack 1, win 65535, length 536
1.258900 IP 10.1.1.1.49153 > 10.1.1.2.8080: Flags [.], seq 77185:77721, ack 1, win 65535, length 536
1.258900 IP 10.1.1.2.8080 > 10.1.1.1.49153: Flags [.], ack 77721, win 65535, length 0
1.259825 IP 10.1.1.1.49153 > 10.1.1.2.8080: Flags [.], seq 77721:78257, ack 1, win 65535, length 536
1.260750 IP 10.1.1.1.49153 > 10.1.1.2.8080: Flags [.], seq 78257:78793, ack 1, win 65535, length 536
1.260750 IP 10.1.1.2.8080 > 10.1.1.1.49153: Flags [.], ack 78793, win 65535, length 0
1.261675 IP 10.1.1.1.49153 > 10.1.1.2.8080: Flags [.], seq 78793:79329, ack 1, win 65535, length 536
1.262600 IP 10.1.1.1.49153 > 10.1.1.2.8080: Flags [.], seq 79329:79865, ack 1, win 65535, length 536
1.262600 IP 10.1.1.2.8080 > 10.1.1.1.49153: Flags [.], ack 79865, win 65535, length 0
1.263524 IP 10.1.1.1.49153 > 10.1.1.2.8080: Flags [.], seq 79865:80401, ack 1, win 65535, length 536
1.264449 IP 10.1.1.1.49153 > 10.1.1.2.8080: Flags [.], seq 80401:80937, ack 1, win 65535, length 536
1.264449 IP 10.1.1.2.8080 > 10.1.1.1.49153: Flags [.], ack 80937, win 65535, length 0
1.265374 IP 10.1.1.1.49153 > 10.1.1.2.8080: Flags [.], seq 80937:81473, ack 1, win 65535, length 536
1.266299 IP 10.1.1.1.49153 > 10.1.1.2.8080: Flags [.], seq 81473:82009, ack 1, win 65535, length 536
1.266299 IP 10.1.1.2.8080 > 10.1.1.1.49153: Flags [.], ack 82009, win 65535, length 0
1.267224 IP 10.1.1.1.49153 > 10.1.1.2.8080: Flags [.], seq 82009:82545, ack 1, win 65535, length 536
1.268148 IP 10.1.1.1.49153 > 10.1.1.2.8080: Flags [.], seq 82545:83081, ack 1, win 65535, length 536
1.268148 IP 10.1.1.2.8080 > 10.1.1.1.49153: Flags [.], ack 83081, win 65535, length 0
1.269073 IP 10.1.1.1.49153 > 10.1.1.2.8080: Flags [.], seq 83081:83617, ack 1, win 65535, length 536
1.269998 IP 10.1.1.1.49153 > 10.1.1.2.8080: Flags [.], seq 83617:84153, ack 1, win 65535, length 536
1.269998 IP 10.1.1.2.8080 > 10.1.1.1.49153: Flags [.], ack 84153, win 65535, length 0
1.270923 IP 10.1.1.1.49153 > 10.1.1.2.8080: Flags [.], seq 84153:84689, ack 1, win 65535, length 536
1.271848 IP 10.1.1.1.49153 > 10.1.1.2.8080: Flags [.], seq 84689:85225, ack 1, win 65535, length 536
1.271848 IP 10.1.1.2.8080 > 10.1.1.1.49153: Flags [.], ack 85225, win 65535, length 0
1.272772 IP 10.1.1.1.49153 > 10.1.1.2.8080: Flags [.], seq 85225:85761, ack 1, win 65535, length 536
1.273697 IP 10.1.1.1.49153 > 10.1.1.2.8080: Flags [.], seq 85761:86297, ack 1, win 65535, length 536
1.273697 IP 10.1.1.2.8080 > 10.1.1.1.49153: Flags [.], ack 86297, win 65535, length 0
1.274622 IP 10.1.1.1.49153 > 10.1.1.2.8080: Flags [.], seq 86297:86833, ack 1, win 65535, length 536
1.275547 IP 10.1.1.1.49153 > 10.1.1.2.8080: Flags [.], seq 86833:87369, ack 1, win 65535, length 536
1.275547 IP 10.1.1.2.8080 > 10.1.1.1.49153: Flags [.], ack 87369, win 65535, length 0
1.276472 IP 10.1.1.1.49153 > 10.1.1.2.8080: Flags [.], seq 87369:87905, ack 1, win 65535, length 536
1.277396 IP 10.1.1.1.49153 > 10.1.1.2.8080: Flags [.], seq 87905:88441, ack 1, win 65535, length 536
1.277396 IP 10.1.1.2.8080 > 10.1.1.1.49153: Flags [.], ack 88441, win 65535, length 0
1.278321 IP 10.1.1.1.49153 > 10.1.1.2.8080: Flags [.], seq 88441:88977, ack 1, win 65535, length 536
1.279246 IP 10.1.1.1.49153 > 10.1.1.2.8080: Flags [.], seq 88977:89513, ack 1, win 65535, length 536
1.279246 IP 10.1.1.2.8080 > 10.1.1.1.49153: Flags [.], ack 89513, win 65535, length 0
1.280171 IP 10.1.1.1.49153 > 10.1.1.2.8080: Flags [.], seq 89513:90049, ack 1, win 65535, length 536
1.281096 IP 10.1.1.1.49153 > 10.1.1.2.8080: Flags [.], seq 90049:90585, ack 1, win 65535, length 536
1.281096 IP 10.1.1.2.8080 > 10.1.1.1.49153: Flags [.], ack 90585, win 65535, length 0
1.282020 IP 10.1.1.1.49153 > 10.1.1.2.8080: Flags [.], seq 90585:91121, ack 1, win 65535, length 536
1.282945 IP 10.1.1.1.49153 > 10.1.1.2.8080: Flags [.], seq 91121:91657, ack 1, win 65535, length 536
1.282945 IP 10.1.1.2.8080 > 10.1.1.1.49153: Flags [.], ack 91657, win 65535, length 0
1.283870 IP 10.1.1.1.49153 > 10.1.1.2.8080: Flags [.], seq 91657:92193, ack 1, win 65535, length 536
1.284795 IP 10.1.1.1.49153 > 10.1.1.2.8080: Flags [.], seq 92193:92729, ack 1, win 65535, length 536
1.284795 IP 10.1.1.2.8080 > 10.1.1.1.49153: Flags [.], ack 92729, win 65535, length 0
1.285720 IP 10.1.1.1.49153 > 10.1.1.2.8080: Flags [.], seq 92729:93265, ack 1, win 65535, length 536
1.286644 IP 10.1.1.1.49153 > 10.1.1.2.8080: Flags [.], seq 93265:93801, ack 1, win 65535, length 536
1.286644 IP 10.1.1.2.8080 > 10.1.1.1.49153: Flags [.], ack 93801, win 65535, length 0
1.287569 IP 10.1.1.1.49153 > 10.1.1.2.8080: Flags [.], seq 93801:94337, ack 1, win 65535, length 536
1.288494 IP 10.1.1.1.49153 > 10.1.1.2.8080: Flags [.], seq 94337:94873, ack 1, win 65535, length 536
1.288494 IP 10.1.1.2.8080 > 10.1.1.1.49153: Flags [.], ack 94873, win 65535, length 0
1.289419 IP 10.1.1.1.49153 > 10.1.1.2.8080: Flags [.], seq 94873:95409, ack 1, win 65535, length 536
1.290344 IP 10.1.1.1.49153 > 10.1.1.2.8080: Flags [.], seq 95409:95945, ack 1, win 65535, length 536
1.290344 IP 10.1.1.2.8080 > 10.1.1.1.49153: Flags [.], ack 95945, win 65535, length 0
1.291268 IP 10.1.1.1.49153 > 10.1.1.2.8080: Flags [.], seq 95945:96481, ack 1, win 65535, length 536
1.292193 IP 10.1.1.1.49153 > 10.1.1.2.8080: Flags [.], seq 96481:97017, ack 1, win 65535, length 536
1.292193 IP 10.1.1.2.8080 > 10.1.1.1.49153: Flags [.], ack 97017, win 65535, length 0
1.293118 IP 10.1.1.1.49153 > 10.1.1.2.8080: Flags [.], seq 97017:97553, ack 1, win 65535, length 536
1.294043 IP 10.1.1.1.49153 > 10.1.1.2.8080: Flags [.], seq 97553:98089, ack 1, win 65535, length 536
1.294043 IP 10.1.1.2.8080 > 10.1.1.1.49153: Flags [.], ack 98089, win 65535, length 0
1.294968 IP 10.1.1.1.49153 > 10.1.1.2.8080: Flags [.], seq 98089:98625, ack 1, win 65535, length 536
1.295892 IP 10.1.1.1.49153 > 10.1.1.2.8080: Flags [.], seq 98625:99161, ack 1, win 65535, length 536
1.295892 IP 10.1.1.2.8080 > 10.1.1.1.49153: Flags [.], ack 99161, win 65535, length 0
1.296817 IP 10.1.1.1.49153 > 10.1.1.2.8080: Flags [.], seq 99161:99697, ack 1, win 65535, length 536
1.297742 IP 10.1.1.1.49153 > 10.1.1.2.8080: Flags [.], seq 99697:100233, ack 1, win 65535, length 536
1.297742 IP 10.1.1.2.8080 > 10.1.1.1.49153: Flags [.], ack 100233, win 65535, length 0
1.298667 IP 10.1.1.1.49153 > 10.1.1.2.8080: Flags [.], seq 100233:100769, ack 1, win 65535, length 536
1.299592 IP 10.1.1.1.49153 > 10.1.1.2.8080: Flags [.], seq 100769:101305, ack 1, win 65535, length 536
1.299592 IP 10.1.1.2.8080 > 10.1.1.1.49153: Flags [.], ack 101305, win 65535, length 0
1.300516 IP 10.1.1.1.49153 > 10.1.1.2.8080: Flags [.], seq 101305:101841, ack 1, win 65535, length 536
1.301441 IP 10.1.1.1.49153 > 10.1.1.2.8080: Flags [.], seq 101841:102377, ack 1, win 65535, length 536
1.301441 IP 10.1.1.2.8080 > 10.1.1.1.49153: Flags [.], ack 102377, win 65535, length 0
1.302366 IP 10.1.1.1.49153 > 10.1.1.2.8080: Flags [.], seq 102377:102913, ack 1, win 65535, length 536
1.303291 IP 10.1.1.1.49153 > 10.1.1.2.8080: Flags [.], seq 102913:103449, ack 1, win 65535, length 536
1.303291 IP 10.1.1.2.8080 > 10.1.1.1.49153: Flags [.], ack 103449, win 65535, length 0
1.304216 IP 10.1.1.1.49153 > 10.1.1.2.8080: Flags [.], seq 103449:103985, ack 1, win 65535, length 536
1.305140 IP 10.1.1.1.49153 > 10.1.1.2.8080: Flags [.], seq 103985:104521, ack 1, win 65535, length 536
1.305140 IP 10.1.1.2.8080 > 10.1.1.1.49153: Flags [.], ack 104521, win 65535, length 0
1.306065 IP 10.1.1.1.49153 > 10.1.1.2.8080: Flags [.], seq 104521:105057, ack 1, win 65535, length 536
1.306990 IP 10.1.1.1.49153 > 10.1.1.2.8080: Flags [.], seq 105057:105593, ack 1, win 65535, length 536
1.306990 IP 10.1.1.2.8080 > 10.1.1.1.49153: Flags [.], ack 105593, win 65535, length 0
1.307915 IP 10.1.1.1.49153 > 10.1.1.2.8080: Flags [.], seq 105593:106129, ack 1, win 65535, length 536
1.308840 IP 10.1.1.1.49153 > 10.1.1.2.8080: Flags [.], seq 106129:106665, ack 1, win 65535, length 536
1.308840 IP 10.1.1.2.8080 > 10.1.1.1.49153: Flags [.], ack 106665, win 65535, length 0
1.309764 IP 10.1.1.1.49153 > 10.1.1.2.8080: Flags [.], seq 106665:107201, ack 1, win 65535, length 536
1.310689 IP 10.1.1.1.49153 > 10.1.1.2.8080: Flags [.], seq 107201:107737, ack 1, win 65535, length 536
1.310689 IP 10.1.1.2.8080 > 10.1.1.1.49153: Flags [.], ack 107737, win 65535, length 0
1.311614 IP 10.1.1.1.49153 > 10.1.1.2.8080: Flags [.], seq 107737:108273, ack 1, win 65535, length 536
1.312539 IP 10.1.1.1.49153 > 10.1.1.2.8080: Flags [.], seq 108273:108809, ack 1, win 65535, length 536
1.312539 IP 10.1.1.2.8080 > 10.1.1.1.49153: Flags [.], ack 108809, win 65535, length 0
1.313464 IP 10.1.1.1.49153 > 10.1.1.2.8080: Flags [.], seq 108809:109345, ack 1, win 65535, length 536
1.314388 IP 10.1.1.1.49153 > 10.1.1.2.8080: Flags [.], seq 109345:109881, ack 1, win 65535, length 536
1.314388 IP 10.1.1.2.8080 > 10.1.1.1.49153: Flags [.], ack 109881, win 65535, length 0
1.315313 IP 10.1.1.1.49153 > 10.1.1.2.8080: Flags [.], seq 109881:110417, ack 1, win 65535, length 536
1.316238 IP 10.1.1.1.49153 > 10.1.1.2.8080: Flags [.], seq 110417:110953, ack 1, win 65535, length 536
1.316238 IP 10.1.1.2.8080 > 10.1.1.1.49153: Flags [.], ack 110953, win 65535, length 0
1.317163 IP 10.1.1.1.49153 > 10.1.1.2.8080: Flags [.], seq 110953:111489, ack 1, win 65535, length 536
1.318088 IP 10.1.1.1.49153 > 10.1.1.2.8080: Flags [.], seq 111489:112025, ack 1, win 65535, length 536
1.318088 IP 10.1.1.2.8080 > 10.1.1.1.49153: Flags [.], ack 112025, win 65535, length 0
1.319012 IP 10.1.1.1.49153 > 10.1.1.2.8080: Flags [.], seq 112025:112561, ack 1, win 65535, length 536
1.319937 IP 10.1.1.1.49153 > 10.1.1.2.8080: Flags [.], seq 112561:113097, ack 1, win 65535, length 536
1.319937 IP 10.1.1.2.8080 > 10.1.1.1.49153: Flags [.], ack 113097, win 65535, length 0
1.320862 IP 10.1.1.1.49153 > 10.1.1.2.8080: Flags [.], seq 113097:113633, ack 1, win 65535, length 536
1.321787 IP 10.1.1.1.49153 > 10.1.1.2.8080: Flags [.], seq 113633:114169, ack 1, win 65535, length 536
1.321787 IP 10.1.1.2.8080 > 10.1.1.1.49153: Flags [.], ack 114169, win 65535, length 0
1.322712 IP 10.1.1.1.49153 > 10.1.1.2.8080: Flags [.], seq 114169:114705, ack 1, win 65535, length 536
1.323636 IP 10.1.1.1.49153 > 10.1.1.2.8080: Flags [.], seq 114705:115241, ack 1, win 65535, length 536
1.323636 IP 10.1.1.2.8080 > 10.1.1.1.49153: Flags [.], ack 115241, win 65535, length 0
1.324561 IP 10.1.1.1.49153 > 10.1.1.2.8080: Flags [.], seq 115241:115777, ack 1, win 65535, length 536
1.325486 IP 10.1.1.1.49153 > 10.1.1.2.8080: Flags [.], seq 115777:116313, ack 1, win 65535, length 536
1.325486 IP 10.1.1.2.8080 > 10.1.1.1.49153: Flags [.], ack 116313, win 65535, length 0
1.326411 IP 10.1.1.1.49153 > 10.1.1.2.8080: Flags [.], seq 116313:116849, ack 1, win 65535, length 536
1.327336 IP 10.1.1.1.49153 > 10.1.1.2.8080: Flags [.], seq 116849:117385, ack 1, win 65535, length 536
1.327336 IP 10.1.1.2.8080 > 10.1.1.1.49153: Flags [.], ack 117385, win 65535, length 0
1.328260 IP 10.1.1.1.49153 > 10.1.1.2.8080: Flags [.], seq 117385:117921, ack 1, win 65535, length 536
1.329185 IP 10.1.1.1.49153 > 10.1.1.2.8080: Flags [.], seq 117921:118457, ack 1, win 65535, length 536
1.329185 IP 10.1.1.2.8080 > 10.1.1.1.49153: Flags [.], ack 118457, win 65535, length 0
1.330110 IP 10.1.1.1.49153 > 10.1.1.2.8080: Flags [.], seq 118457:118993, ack 1, win 65535, length 536
1.331035 IP 10.1.1.1.49153 > 10.1.1.2.8080: Flags [.], seq 118993:119529, ack 1, win 65535, length 536
1.331035 IP 10.1.1.2.8080 > 10.1.1.1.49153: Flags [.], ack 119529, win 65535, length 0
1.331960 IP 10.1.1.1.49153 > 10.1.1.2.8080: Flags [.], seq 119529:120065, ack 1, win 65535, length 536
1.332884 IP 10.1.1.1.49153 > 10.1.1.2.8080: Flags [.], seq 120065:120601, ack 1, win 65535, length 536
1.332884 IP 10.1.1.2.8080 > 10.1.1.1.49153: Flags [.], ack 120601, win 65535, length 0
1.333809 IP 10.1.1.1.49153 > 10.1.1.2.8080: Flags [.], seq 120601:121137, ack 1, win 65535, length 536
1.334734 IP 10.1.1.1.49153 > 10.1.1.2.8080: Flags [.], seq 121137:121673, ack 1, win 65535, length 536
1.334734 IP 10.1.1.2.8080 > 10.1.1.1.49153: Flags [.], ack 121673, win 65535, length 0
1.335659 IP 10.1.1.1.49153 > 10.1.1.2.8080: Flags [.], seq 121673:122209, ack 1, win 65535, length 536
1.336584 IP 10.1.1.1.49153 > 10.1.1.2.8080: Flags [.], seq 122209:122745, ack 1, win 65535, length 536
1.336584 IP 10.1.1.2.8080 > 10.1.1.1.49153: Flags [.], ack 122745, win 65535, length 0
1.337508 IP 10.1.1.1.49153 > 10.1.1.2.8080: Flags [.], seq 122745:123281, ack 1, win 65535, length 536
1.338433 IP 10.1.1.1.49153 > 10.1.1.2.8080: Flags [.], seq 123281:123817, ack 1, win 65535, length 536
1.338433 IP 10.1.1.2.8080 > 10.1.1.1.49153: Flags [.], ack 123817, win 65535, length 0
1.339358 IP 10.1.1.1.49153 > 10.1.1.2.8080: Flags [.], seq 123817:124353, ack 1, win 65535, length 536
1.340283 IP 10.1.1.1.49153 > 10.1.1.2.8080: Flags [.], seq 124353:124889, ack 1, win 65535, length 536
1.340283 IP 10.1.1.2.8080 > 10.1.1.1.49153: Flags [.], ack 124889, win 65535, length 0
1.341208 IP 10.1.1.1.49153 > 10.1.1.2.8080: Flags [.], seq 124889:125425, ack 1, win 65535, length 536
1.342132 IP 10.1.1.1.49153 > 10.1.1.2.8080: Flags [.], seq 125425:125961, ack 1, win 65535, length 536
1.342132 IP 10.1.1.2.8080 > 10.1.1.1.49153: Flags [.], ack 125961, win 65535, length 0
1.343057 IP 10.1.1.1.49153 > 10.1.1.2.8080: Flags [.], seq 125961:126497, ack 1, win 65535, length 536
1.343982 IP 10.1.1.1.49153 > 10.1.1.2.8080: Flags [.], seq 126497:127033, ack 1, win 65535, length 536
1.343982 IP 10.1.1.2.8080 > 10.1.1.1.49153: Flags [.], ack 127033, win 65535, length 0
1.344907 IP 10.1.1.1.49153 > 10.1.1.2.8080: Flags [.], seq 127033:127569, ack 1, win 65535, length 536
1.345832 IP 10.1.1.1.49153 > 10.1.1.2.8080: Flags [.], seq 127569:128105, ack 1, win 65535, length 536
1.345832 IP 10.1.1.2.8080 > 10.1.1.1.49153: Flags [.], ack 128105, win 65535, length 0
1.346756 IP 10.1.1.1.49153 > 10.1.1.2.8080: Flags [.], seq 128105:128641, ack 1, win 65535, length 536
1.347681 IP 10.1.1.1.49153 > 10.1.1.2.8080: Flags [.], seq 128641:129177, ack 1, win 65535, length 536
