1.010067 IP 10.1.1.1.49153 > 10.1.1.2.8080: Flags [S], seq 0, win 65535, length 0
1.010067 IP 10.1.1.2.8080 > 10.1.1.1.49153: Flags [S.], seq 0, ack 1, win 65535, length 0
1.030201 IP 10.1.1.1.49153 > 10.1.1.2.8080: Flags [.], ack 1, win 65535, length 0
1.031126 IP 10.1.1.1.49153 > 10.1.1.2.8080: Flags [.], seq 1:537, ack 1, win 65535, length 536
1.031126 IP 10.1.1.2.8080 > 10.1.1.1.49153: Flags [.], ack 537, win 65535, length 0
1.052118 IP 10.1.1.1.49153 > 10.1.1.2.8080: Flags [.], seq 537:1073, ack 1, win 65535, length 536
1.053043 IP 10.1.1.1.49153 > 10.1.1.2.8080: Flags [.], seq 1073:1609, ack 1, win 65535, length 536
1.053043 IP 10.1.1.2.8080 > 10.1.1.1.49153: Flags [.], ack 1609, win 65535, length 0
1.074035 IP 10.1.1.1.49153 > 10.1.1.2.8080: Flags [.], seq 1609:2145, ack 1, win 65535, length 536
1.074960 IP 10.1.1.1.49153 > 10.1.1.2.8080: Flags [.], seq 2145:2681, ack 1, win 65535, length 536
1.074960 IP 10.1.1.2.8080 > 10.1.1.1.49153: Flags [.], ack 2681, win 65535, length 0
1.075884 IP 10.1.1.1.49153 > 10.1.1.2.8080: Flags [.], seq 2681:3217, ack 1, win 65535, length 536
1.095952 IP 10.1.1.1.49153 > 10.1.1.2.8080: Flags [.], seq 3217:3753, ack 1, win 65535, length 536
1.095952 IP 10.1.1.2.8080 > 10.1.1.1.49153: Flags [.], ack 3753, win 65535, length 0
1.096876 IP 10.1.1.1.49153 > 10.1.1.2.8080: Flags [.], seq 3753:4289, ack 1, win 65535, length 536
1.097801 IP 10.1.1.1.49153 > 10.1.1.2.8080: Flags [.], seq 4289:4825, ack 1, win 65535, length 536
1.097801 IP 10.1.1.2.8080 > 10.1.1.1.49153: Flags [.], ack 4825, win 65535, length 0
1.116944 IP 10.1.1.1.49153 > 10.1.1.2.8080: Flags [.], seq 4825:5361, ack 1, win 65535, length 536
1.117868 IP 10.1.1.1.49153 > 10.1.1.2.8080: Flags [.], seq 5361:5897, ack 1, win 65535, length 536
1.117868 IP 10.1.1.2.8080 > 10.1.1.1.49153: Flags [.], ack 5897, win 65535, length 0
1.118793 IP 10.1.1.1.49153 > 10.1.1.2.8080: Flags [.], seq 5897:6433, ack 1, win 65535, length 536
1.119718 IP 10.1.1.1.49153 > 10.1.1.2.8080: Flags [.], seq 6433:6969, ack 1, win 65535, length 536
1.119718 IP 10.1.1.2.8080 > 10.1.1.1.49153: Flags [.], ack 6969, win 65535, length 0
1.120643 IP 10.1.1.1.49153 > 10.1.1.2.8080: Flags [.], seq 6969:7505, ack 1, win 65535, length 536
1.121568 IP 10.1.1.1.49153 > 10.1.1.2.8080: Flags [.], seq 7505:8041, ack 1, win 65535, length 536
1.121568 IP 10.1.1.2.8080 > 10.1.1.1.49153: Flags [.], ack 8041, win 65535, length 0
1.138860 IP 10.1.1.1.49153 > 10.1.1.2.8080: Flags [.], seq 8041:8577, ack 1, win 65535, length 536
1.139785 IP 10.1.1.1.49153 > 10.1.1.2.8080: Flags [.], seq 8577:9113, ack 1, win 65535, length 536
1.139785 IP 10.1.1.2.8080 > 10.1.1.1.49153: Flags [.], ack 9113, win 65535, length 0
1.140710 IP 10.1.1.1.49153 > 10.1.1.2.8080: Flags [.], seq 9113:9649, ack 1, win 65535, length 536
1.141635 IP 10.1.1.1.49153 > 10.1.1.2.8080: Flags [.], seq 9649:10185, ack 1, win 65535, length 536
1.141635 IP 10.1.1.2.8080 > 10.1.1.1.49153: Flags [.], ack 10185, win 65535, length 0
1.142560 IP 10.1.1.1.49153 > 10.1.1.2.8080: Flags [.], seq 10185:10721, ack 1, win 65535, length 536
1.143484 IP 10.1.1.1.49153 > 10.1.1.2.8080: Flags [.], seq 10721:11257, ack 1, win 65535, length 536
1.143484 IP 10.1.1.2.8080 > 10.1.1.1.49153: Flags [.], ack 11257, win 65535, length 0
1.144409 IP 10.1.1.1.49153 > 10.1.1.2.8080: Flags [.], seq 11257:11793, ack 1, win 65535, length 536
1.145334 IP 10.1.1.1.49153 > 10.1.1.2.8080: Flags [.], seq 11793:12329, ack 1, win 65535, length 536
1.145334 IP 10.1.1.2.8080 > 10.1.1.1.49153: Flags [.], ack 12329, win 65535, length 0
1.146259 IP 10.1.1.1.49153 > 10.1.1.2.8080: Flags [.], seq 12329:12865, ack 1, win 65535, length 536
1.160777 IP 10.1.1.1.49153 > 10.1.1.2.8080: Flags [.], seq 12865:13401, ack 1, win 65535, length 536
1.160777 IP 10.1.1.2.8080 > 10.1.1.1.49153: Flags [.], ack 13401, win 65535, length 0
1.161702 IP 10.1.1.1.49153 > 10.1.1.2.8080: Flags [.], seq 13401:13937, ack 1, win 65535, length 536
1.162627 IP 10.1.1.1.49153 > 10.1.1.2.8080: Flags [.], seq 13937:14473, ack 1, win 65535, length 536
1.162627 IP 10.1.1.2.8080 > 10.1.1.1.49153: Flags [.], ack 14473, win 65535, length 0
1.163552 IP 10.1.1.1.49153 > 10.1.1.2.8080: Flags [.], seq 14473:15009, ack 1, win 65535, length 536
1.164476 IP 10.1.1.1.49153 > 10.1.1.2.8080: Flags [.], seq 15009:15545, ack 1, win 65535, length 536
1.164476 IP 10.1.1.2.8080 > 10.1.1.1.49153: Flags [.], ack 15545, win 65535, length 0
1.165401 IP 10.1.1.1.49153 > 10.1.1.2.8080: Flags [.], seq 15545:16081, ack 1, win 65535, length 536
1.166326 IP 10.1.1.1.49153 > 10.1.1.2.8080: Flags [.], seq 16081:16617, ack 1, win 65535, length 536
1.166326 IP 10.1.1.2.8080 > 10.1.1.1.49153: Flags [.], ack 16617, win 65535, length 0
1.167251 IP 10.1.1.1.49153 > 10.1.1.2.8080: Flags [.], seq 16617:17153, ack 1, win 65535, length 536
1.168176 IP 10.1.1.1.49153 > 10.1.1.2.8080: Flags [.], seq 17153:17689, ack 1, win 65535, length 536
1.168176 IP 10.1.1.2.8080 > 10.1.1.1.49153: Flags [.], ack 17689, win 65535, length 0
1.169100 IP 10.1.1.1.49153 > 10.1.1.2.8080: Flags [.], seq 17689:18225, ack 1, win 65535, length 536
1.170025 IP 10.1.1.1.49153 > 10.1.1.2.8080: Flags [.], seq 18225:18761, ack 1, win 65535, length 536
1.170025 IP 10.1.1.2.8080 > 10.1.1.1.49153: Flags [.], ack 18761, win 65535, length 0
1.170950 IP 10.1.1.1.49153 > 10.1.1.2.8080: Flags [.], seq 18761:19297, ack 1, win 65535, length 536
1.181769 IP 10.1.1.1.49153 > 10.1.1.2.8080: Flags [.], seq 19297:19833, ack 1, win 65535, length 536
1.181769 IP 10.1.1.2.8080 > 10.1.1.1.49153: Flags [.], ack 19833, win 65535, length 0
1.182694 IP 10.1.1.1.49153 > 10.1.1.2.8080: Flags [.], seq 19833:20369, ack 1, win 65535, length 536
1.183619 IP 10.1.1.1.49153 > 10.1.1.2.8080: Flags [.], seq 20369:20905, ack 1, win 65535, length 536
1.183619 IP 10.1.1.2.8080 > 10.1.1.1.49153: Flags [.], ack 20905, win 65535, length 0
1.184544 IP 10.1.1.1.49153 > 10.1.1.2.8080: Flags [.], seq 20905:21441, ack 1, win 65535, length 536
1.185468 IP 10.1.1.1.49153 > 10.1.1.2.8080: Flags [.], seq 21441:21977, ack 1, win 65535, length 536
1.185468 IP 10.1.1.2.8080 > 10.1.1.1.49153: Flags [.], ack 21977, win 65535, length 0
1.186393 IP 10.1.1.1.49153 > 10.1.1.2.8080: Flags [.], seq 21977:22513, ack 1, win 65535, length 536
1.187318 IP 10.1.1.1.49153 > 10.1.1.2.8080: Flags [.], seq 22513:23049, ack 1, win 65535, length 536
1.187318 IP 10.1.1.2.8080 > 10.1.1.1.49153: Flags [.], ack 23049, win 65535, length 0
1.188243 IP 10.1.1.1.49153 > 10.1.1.2.8080: Flags [.], seq 23049:23585, ack 1, win 65535, length 536
1.189168 IP 10.1.1.1.49153 > 10.1.1.2.8080: Flags [.], seq 23585:24121, ack 1, win 65535, length 536
1.189168 IP 10.1.1.2.8080 > 10.1.1.1.49153: Flags [.], ack 24121, win 65535, length 0
1.190092 IP 10.1.1.1.49153 > 10.1.1.2.8080: Flags [.], seq 24121:24657, ack 1, win 65535, length 536
1.191017 IP 10.1.1.1.49153 > 10.1.1.2.8080: Flags [.], seq 24657:25193, ack 1, win 65535, length 536
1.191017 IP 10.1.1.2.8080 > 10.1.1.1.49153: Flags [.], ack 25193, win 65535, length 0
1.191942 IP 10.1.1.1.49153 > 10.1.1.2.8080: Flags [.], seq 25193:25729, ack 1, win 65535, length 536
1.192867 IP 10.1.1.1.49153 > 10.1.1.2.8080: Flags [.], seq 25729:26265, ack 1, win 65535, length 536
1.192867 IP 10.1.1.2.8080 > 10.1.1.1.49153: Flags [.], ack 26265, win 65535, length 0
1.193792 IP 10.1.1.1.49153 > 10.1.1.2.8080: Flags [.], seq 26265:26801, ack 1, win 65535, length 536
1.194716 IP 10.1.1.1.49153 > 10.1.1.2.8080: Flags [.], seq 26801:27337, ack 1, win 65535, length 536
1.194716 IP 10.1.1.2.8080 > 10.1.1.1.49153: Flags [.], ack 27337, win 65535, length 0
1.195641 IP 10.1.1.1.49153 > 10.1.1.2.8080: Flags [.], seq 27337:27873, ack 1, win 65535, length 536
1.196566 IP 10.1.1.1.49153 > 10.1.1.2.8080: Flags [.], seq 27873:28409, ack 1, win 65535, length 536
1.196566 IP 10.1.1.2.8080 > 10.1.1.1.49153: Flags [.], ack 28409, win 65535, length 0
1.197491 IP 10.1.1.1.49153 > 10.1.1.2.8080: Flags [.], seq 28409:28945, ack 1, win 65535, length 536
1.202761 IP 10.1.1.1.49153 > 10.1.1.2.8080: Flags [.], seq 28945:29481, ack 1, win 65535, length 536
1.202761 IP 10.1.1.2.8080 > 10.1.1.1.49153: Flags [.], ack 29481, win 65535, length 0
1.203686 IP 10.1.1.1.49153 > 10.1.1.2.8080: Flags [.], seq 29481:30017, ack 1, win 65535, length 536
1.204611 IP 10.1.1.1.49153 > 10.1.1.2.8080: Flags [.], seq 30017:30553, ack 1, win 65535, length 536
1.204611 IP 10.1.1.2.8080 > 10.1.1.1.49153: Flags [.], ack 30553, win 65535, length 0
1.205536 IP 10.1.1.1.49153 > 10.1.1.2.8080: Flags [.], seq 30553:31089, ack 1, win 65535, length 536
1.206460 IP 10.1.1.1.49153 > 10.1.1.2.8080: Flags [.], seq 31089:31625, ack 1, win 65535, length 536
1.206460 IP 10.1.1.2.8080 > 10.1.1.1.49153: Flags [.], ack 31625, win 65535, length 0
1.207385 IP 10.1.1.1.49153 > 10.1.1.2.8080: Flags [.], seq 31625:32161, ack 1, win 65535, length 536
1.208310 IP 10.1.1.1.49153 > 10.1.1.2.8080: Flags [.], seq 32161:32697, ack 1, win 65535, length 536
1.208310 IP 10.1.1.2.8080 > 10.1.1.1.49153: Flags [.], ack 32697, win 65535, length 0
1.209235 IP 10.1.1.1.49153 > 10.1.1.2.8080: Flags [.], seq 32697:33233, ack 1, win 65535, length 536
1.210160 IP 10.1.1.1.49153 > 10.1.1.2.8080: Flags [.], seq 33233:33769, ack 1, win 65535, length 536
1.210160 IP 10.1.1.2.8080 > 10.1.1.1.49153: Flags [.], ack 33769, win 65535, length 0
1.211084 IP 10.1.1.1.49153 > 10.1.1.2.8080: Flags [.], seq 33769:34305, ack 1, win 65535, length 536
1.212009 IP 10.1.1.1.49153 > 10.1.1.2.8080: Flags [.], seq 34305:34841, ack 1, win 65535, length 536
1.212009 IP 10.1.1.2.8080 > 10.1.1.1.49153: Flags [.], ack 34841, win 65535, length 0
1.212934 IP 10.1.1.1.49153 > 10.1.1.2.8080: Flags [.], seq 34841:35377, ack 1, win 65535, length 536
1.213859 IP 10.1.1.1.49153 > 10.1.1.2.8080: Flags [.], seq 35377:35913, ack 1, win 65535, length 536
1.213859 IP 10.1.1.2.8080 > 10.1.1.1.49153: Flags [.], ack 35913, win 65535, length 0
1.214784 IP 10.1.1.1.49153 > 10.1.1.2.8080: Flags [.], seq 35913:36449, ack 1, win 65535, length 536
1.215708 IP 10.1.1.1.49153 > 10.1.1.2.8080: Flags [.], seq 36449:36985, ack 1, win 65535, length 536
1.215708 IP 10.1.1.2.8080 > 10.1.1.1.49153: Flags [.], ack 36985, win 65535, length 0
1.216633 IP 10.1.1.1.49153 > 10.1.1.2.8080: Flags [.], seq 36985:37521, ack 1, win 65535, length 536
1.217558 IP 10.1.1.1.49153 > 10.1.1.2.8080: Flags [.], seq 37521:38057, ack 1, win 65535, length 536
1.217558 IP 10.1.1.2.8080 > 10.1.1.1.49153: Flags [.], ack 38057, win 65535, length 0
1.218483 IP 10.1.1.1.49153 > 10.1.1.2.8080: Flags [.], seq 38057:38593, ack 1, win 65535, length 536
1.219408 IP 10.1.1.1.49153 > 10.1.1.2.8080: Flags [.], seq 38593:39129, ack 1, win 65535, length 536
1.219408 IP 10.1.1.2.8080 > 10.1.1.1.49153: Flags [.], ack 39129, win 65535, length 0
1.220332 IP 10.1.1.1.49153 > 10.1.1.2.8080: Flags [.], seq 39129:39665, ack 1, win 65535, length 536
1.221257 IP 10.1.1.1.49153 > 10.1.1.2.8080: Flags [.], seq 39665:40201, ack 1, win 65535, length 536
1.221257 IP 10.1.1.2.8080 > 10.1.1.1.49153: Flags [.], ack 40201, win 65535, length 0
1.222182 IP 10.1.1.1.49153 > 10.1.1.2.8080: Flags [.], seq 40201:40737, ack 1, win 65535, length 536
1.223107 IP 10.1.1.1.49153 > 10.1.1.2.8080: Flags [.], seq 40737:41273, ack 1, win 65535, length 536
1.223107 IP 10.1.1.2.8080 > 10.1.1.1.49153: Flags [.], ack 41273, win 65535, length 0
1.224032 IP 10.1.1.1.49153 > 10.1.1.2.8080: Flags [.], seq 41273:41809, ack 1, win 65535, length 536
1.224956 IP 10.1.1.1.49153 > 10.1.1.2.8080: Flags [.], seq 41809:42345, ack 1, win 65535, length 536
1.224956 IP 10.1.1.2.8080 > 10.1.1.1.49153: Flags [.], ack 42345, win 65535, length 0
1.225881 IP 10.1.1.1.49153 > 10.1.1.2.8080: Flags [.], seq 42345:42881, ack 1, win 65535, length 536
1.226806 IP 10.1.1.1.49153 > 10.1.1.2.8080: Flags [.], seq 42881:43417, ack 1, win 65535, length 536
1.226806 IP 10.1.1.2.8080 > 10.1.1.1.49153: Flags [.], ack 43417, win 65535, length 0
1.227731 IP 10.1.1.1.49153 > 10.1.1.2.8080: Flags [.], seq 43417:43953, ack 1, win 65535, length 536
1.228656 IP 10.1.1.1.49153 > 10.1.1.2.8080: Flags [.], seq 43953:44489, ack 1, win 65535, length 536
1.228656 IP 10.1.1.2.8080 > 10.1.1.1.49153: Flags [.], ack 44489, win 65535, length 0
1.229580 IP 10.1.1.1.49153 > 10.1.1.2.8080: Flags [.], seq 44489:45025, ack 1, win 65535, length 536
1.230505 IP 10.1.1.1.49153 > 10.1.1.2.8080: Flags [.], seq 45025:45561, ack 1, win 65535, length 536
1.230505 IP 10.1.1.2.8080 > 10.1.1.1.49153: Flags [.], ack 45561, win 65535, length 0
1.231430 IP 10.1.1.1.49153 > 10.1.1.2.8080: Flags [.], seq 45561:46097, ack 1, win 65535, length 536
1.232355 IP 10.1.1.1.49153 > 10.1.1.2.8080: Flags [.], seq 46097:46633, ack 1, win 65535, length 536
1.232355 IP 10.1.1.2.8080 > 10.1.1.1.49153: Flags [.], ack 46633, win 65535, length 0
1.233280 IP 10.1.1.1.49153 > 10.1.1.2.8080: Flags [.], seq 46633:47169, ack 1, win 65535, length 536
1.234204 IP 10.1.1.1.49153 > 10.1.1.2.8080: Flags [.], seq 47169:47705, ack 1, win 65535, length 536
1.234204 IP 10.1.1.2.8080 > 10.1.1.1.49153: Flags [.], ack 47705, win 65535, length 0
1.235129 IP 10.1.1.1.49153 > 10.1.1.2.8080: Flags [.], seq 47705:48241, ack 1, win 65535, length 536
1.236054 IP 10.1.1.1.49153 > 10.1.1.2.8080: Flags [.], seq 48241:48777, ack 1, win 65535, length 536
1.236054 IP 10.1.1.2.8080 > 10.1.1.1.49153: Flags [.], ack 48777, win 65535, length 0
1.236979 IP 10.1.1.1.49153 > 10.1.1.2.8080: Flags [.], seq 48777:49313, ack 1, win 65535, length 536
1.237904 IP 10.1.1.1.49153 > 10.1.1.2.8080: Flags [.], seq 49313:49849, ack 1, win 65535, length 536
1.237904 IP 10.1.1.2.8080 > 10.1.1.1.49153: Flags [.], ack 49849, win 65535, length 0
1.238828 IP 10.1.1.1.49153 > 10.1.1.2.8080: Flags [.], seq 49849:50385, ack 1, win 65535, length 536
1.239753 IP 10.1.1.1.49153 > 10.1.1.2.8080: Flags [.], seq 50385:50921, ack 1, win 65535, length 536
1.239753 IP 10.1.1.2.8080 > 10.1.1.1.49153: Flags [.], ack 50921, win 65535, length 0
1.240678 IP 10.1.1.1.49153 > 10.1.1.2.8080: Flags [.], seq 51457:51993, ack 1, win 65535, length 536
1.240678 IP 10.1.1.2.8080 > 10.1.1.1.49153: Flags [.], ack 50921, win 65535, length 0
1.241603 IP 10.1.1.1.49153 > 10.1.1.2.8080: Flags [.], seq 51993:52529, ack 1, win 65535, length 536
1.241603 IP 10.1.1.2.8080 > 10.1.1.1.49153: Flags [.], ack 50921, win 65535, length 0
1.242528 IP 10.1.1.1.49153 > 10.1.1.2.8080: Flags [.], seq 53065:53601, ack 1, win 65535, length 536
1.242528 IP 10.1.1.2.8080 > 10.1.1.1.49153: Flags [.], ack 50921, win 65535, length 0
1.243452 IP 10.1.1.1.49153 > 10.1.1.2.8080: Flags [.], seq 53601:54137, ack 1, win 65535, length 536
1.243452 IP 10.1.1.2.8080 > 10.1.1.1.49153: Flags [.], ack 50921, win 65535, length 0
1.244377 IP 10.1.1.1.49153 > 10.1.1.2.8080: Flags [.], seq 54673:55209, ack 1, win 65535, length 536
1.244377 IP 10.1.1.2.8080 > 10.1.1.1.49153: Flags [.], ack 50921, win 65535, length 0
1.245302 IP 10.1.1.1.49153 > 10.1.1.2.8080: Flags [.], seq 55209:55745, ack 1, win 65535, length 536
1.245302 IP 10.1.1.2.8080 > 10.1.1.1.49153: Flags [.], ack 50921, win 65535, length 0
1.246227 IP 10.1.1.1.49153 > 10.1.1.2.8080: Flags [.], seq 56281:56817, ack 1, win 65535, length 536
1.246227 IP 10.1.1.2.8080 > 10.1.1.1.49153: Flags [.], ack 50921, win 65535, length 0
1.247152 IP 10.1.1.1.49153 > 10.1.1.2.8080: Flags [.], seq 56817:57353, ack 1, win 65535, length 536
1.247152 IP 10.1.1.2.8080 > 10.1.1.1.49153: Flags [.], ack 50921, win 65535, length 0
1.248076 IP 10.1.1.1.49153 > 10.1.1.2.8080: Flags [.], seq 57889:58425, ack 1, win 65535, length 536
1.248076 IP 10.1.1.2.8080 > 10.1.1.1.49153: Flags [.], ack 50921, win 65535, length 0
1.249001 IP 10.1.1.1.49153 > 10.1.1.2.8080: Flags [.], seq 58425:58961, ack 1, win 65535, length 536
1.249001 IP 10.1.1.2.8080 > 10.1.1.1.49153: Flags [.], ack 50921, win 65535, length 0
1.249926 IP 10.1.1.1.49153 > 10.1.1.2.8080: Flags [.], seq 59497:60033, ack 1, win 65535, length 536
1.249926 IP 10.1.1.2.8080 > 10.1.1.1.49153: Flags [.], ack 50921, win 65535, length 0
1.250851 IP 10.1.1.1.49153 > 10.1.1.2.8080: Flags [.], seq 60033:60569, ack 1, win 65535, length 536
1.250851 IP 10.1.1.2.8080 > 10.1.1.1.49153: Flags [.], ack 50921, win 65535, length 0
1.251776 IP 10.1.1.1.49153 > 10.1.1.2.8080: Flags [.], seq 61105:61641, ack 1, win 65535, length 536
1.251776 IP 10.1.1.2.8080 > 10.1.1.1.49153: Flags [.], ack 50921, win 65535, length 0
1.252700 IP 10.1.1.1.49153 > 10.1.1.2.8080: Flags [.], seq 61641:62177, ack 1, win 65535, length 536
1.252700 IP 10.1.1.2.8080 > 10.1.1.1.49153: Flags [.], ack 50921, win 65535, length 0
1.253625 IP 10.1.1.1.49153 > 10.1.1.2.8080: Flags [.], seq 62713:63249, ack 1, win 65535, length 536
1.253625 IP 10.1.1.2.8080 > 10.1.1.1.49153: Flags [.], ack 50921, win 65535, length 0
1.254550 IP 10.1.1.1.49153 > 10.1.1.2.8080: Flags [.], seq 63249:63785, ack 1, win 65535, length 536
1.254550 IP 10.1.1.2.8080 > 10.1.1.1.49153: Flags [.], ack 50921, win 65535, length 0
1.255475 IP 10.1.1.1.49153 > 10.1.1.2.8080: Flags [.], seq 64321:64857, ack 1, win 65535, length 536
1.255475 IP 10.1.1.2.8080 > 10.1.1.1.49153: Flags [.], ack 50921, win 65535, length 0
1.256400 IP 10.1.1.1.49153 > 10.1.1.2.8080: Flags [.], seq 64857:65393, ack 1, win 65535, length 536
1.256400 IP 10.1.1.2.8080 > 10.1.1.1.49153: Flags [.], ack 50921, win 65535, length 0
1.257324 IP 10.1.1.1.49153 > 10.1.1.2.8080: Flags [.], seq 65929:66465, ack 1, win 65535, length 536
1.257324 IP 10.1.1.2.8080 > 10.1.1.1.49153: Flags [.], ack 50921, win 65535, length 0
1.258249 IP 10.1.1.1.49153 > 10.1.1.2.8080: Flags [.], seq 66465:67001, ack 1, win 65535, length 536
1.258249 IP 10.1.1.2.8080 > 10.1.1.1.49153: Flags [.], ack 50921, win 65535, length 0
1.259174 IP 10.1.1.1.49153 > 10.1.1.2.8080: Flags [.], seq 67537:68073, ack 1, win 65535, length 536
1.259174 IP 10.1.1.2.8080 > 10.1.1.1.49153: Flags [.], ack 50921, win 65535, length 0
1.260099 IP 10.1.1.1.49153 > 10.1.1.2.8080: Flags [.], seq 68073:68609, ack 1, win 65535, length 536
1.260099 IP 10.1.1.2.8080 > 10.1.1.1.49153: Flags [.], ack 50921, win 65535, length 0
1.261024 IP 10.1.1.1.49153 > 10.1.1.2.8080: Flags [.], seq 69145:69681, ack 1, win 65535, length 536
1.261024 IP 10.1.1.2.8080 > 10.1.1.1.49153: Flags [.], ack 50921, win 65535, length 0
1.261948 IP 10.1.1.1.49153 > 10.1.1.2.8080: Flags [.], seq 69681:70217, ack 1, win 65535, length 536
1.261948 IP 10.1.1.2.8080 > 10.1.1.1.49153: Flags [.], ack 50921, win 65535, length 0
1.262873 IP 10.1.1.1.49153 > 10.1.1.2.8080: Flags [.], seq 70753:71289, ack 1, win 65535, length 536
1.262873 IP 10.1.1.2.8080 > 10.1.1.1.49153: Flags [.], ack 50921, win 65535, length 0
1.263798 IP 10.1.1.1.49153 > 10.1.1.2.8080: Flags [.], seq 71289:71825, ack 1, win 65535, length 536
1.263798 IP 10.1.1.2.8080 > 10.1.1.1.49153: Flags [.], ack 50921, win 65535, length 0
1.264723 IP 10.1.1.1.49153 > 10.1.1.2.8080: Flags [.], seq 72361:72897, ack 1, win 65535, length 536
1.264723 IP 10.1.1.2.8080 > 10.1.1.1.49153: Flags [.], ack 50921, win 65535, length 0
1.265648 IP 10.1.1.1.49153 > 10.1.1.2.8080: Flags [.], seq 72897:73433, ack 1, win 65535, length 536
1.265648 IP 10.1.1.2.8080 > 10.1.1.1.49153: Flags [.], ack 50921, win 65535, length 0
1.266572 IP 10.1.1.1.49153 > 10.1.1.2.8080: Flags [.], seq 73969:74505, ack 1, win 65535, length 536
1.266572 IP 10.1.1.2.8080 > 10.1.1.1.49153: Flags [.], ack 50921, win 65535, length 0
1.267497 IP 10.1.1.1.49153 > 10.1.1.2.8080: Flags [.], seq 74505:75041, ack 1, win 65535, length 536
1.267497 IP 10.1.1.2.8080 > 10.1.1.1.49153: Flags [.], ack 50921, win 65535, length 0
1.268422 IP 10.1.1.1.49153 > 10.1.1.2.8080: Flags [.], seq 75577:76113, ack 1, win 65535, length 536
1.268422 IP 10.1.1.2.8080 > 10.1.1.1.49153: Flags [.], ack 50921, win 65535, length 0
1.269347 IP 10.1.1.1.49153 > 10.1.1.2.8080: Flags [.], seq 76113:76649, ack 1, win 65535, length 536
1.269347 IP 10.1.1.2.8080 > 10.1.1.1.49153: Flags [.], ack 50921, win 65535, length 0
1.270272 IP 10.1.1.1.49153 > 10.1.1.2.8080: Flags [.], seq 50921:51457, ack 1, win 65535, length 536
1.270272 IP 10.1.1.2.8080 > 10.1.1.1.49153: Flags [.], ack 52529, win 65535, length 0
1.284790 IP 10.1.1.1.49153 > 10.1.1.2.8080: Flags [.], seq 77185:77721, ack 1, win 65535, length 536
1.284790 IP 10.1.1.2.8080 > 10.1.1.1.49153: Flags [.], ack 52529, win 65535, length 0
1.285715 IP 10.1.1.1.49153 > 10.1.1.2.8080: Flags [.], seq 77721:78257, ack 1, win 65535, length 536
1.285715 IP 10.1.1.2.8080 > 10.1.1.1.49153: Flags [.], ack 52529, win 65535, length 0
1.286640 IP 10.1.1.1.49153 > 10.1.1.2.8080: Flags [.], seq 78257:78793, ack 1, win 65535, length 536
1.286640 IP 10.1.1.2.8080 > 10.1.1.1.49153: Flags [.], ack 52529, win 65535, length 0
1.287564 IP 10.1.1.1.49153 > 10.1.1.2.8080: Flags [.], seq 78793:79329, ack 1, win 65535, length 536
1.287564 IP 10.1.1.2.8080 > 10.1.1.1.49153: Flags [.], ack 52529, win 65535, length 0
1.288489 IP 10.1.1.1.49153 > 10.1.1.2.8080: Flags [.], seq 79329:79865, ack 1, win 65535, length 536
1.288489 IP 10.1.1.2.8080 > 10.1.1.1.49153: Flags [.], ack 52529, win 65535, length 0
1.289414 IP 10.1.1.1.49153 > 10.1.1.2.8080: Flags [.], seq 79865:80401, ack 1, win 65535, length 536
1.289414 IP 10.1.1.2.8080 > 10.1.1.1.49153: Flags [.], ack 52529, win 65535, length 0
1.290339 IP 10.1.1.1.49153 > 10.1.1.2.8080: Flags [.], seq 80401:80937, ack 1, win 65535, length 536
1.290339 IP 10.1.1.2.8080 > 10.1.1.1.49153: Flags [.], ack 52529, win 65535, length 0
1.291264 IP 10.1.1.1.49153 > 10.1.1.2.8080: Flags [.], seq 52529:53065, ack 1, win 65535, length 536
1.291264 IP 10.1.1.2.8080 > 10.1.1.1.49153: Flags [.], ack 54137, win 65535, length 0
1.292188 IP 10.1.1.1.49153 > 10.1.1.2.8080: Flags [.], seq 80937:81473, ack 1, win 65535, length 536
1.292188 IP 10.1.1.2.8080 > 10.1.1.1.49153: Flags [.], ack 54137, win 65535, length 0
1.305782 IP 10.1.1.1.49153 > 10.1.1.2.8080: Flags [.], seq 81473:82009, ack 1, win 65535, length 536
1.305782 IP 10.1.1.2.8080 > 10.1.1.1.49153: Flags [.], ack 54137, win 65535, length 0
1.306707 IP 10.1.1.1.49153 > 10.1.1.2.8080: Flags [.], seq 82009:82545, ack 1, win 65535, length 536
1.306707 IP 10.1.1.2.8080 > 10.1.1.1.49153: Flags [.], ack 54137, win 65535, length 0
1.307632 IP 10.1.1.1.49153 > 10.1.1.2.8080: Flags [.], seq 82545:83081, ack 1, win 65535, length 536
1.307632 IP 10.1.1.2.8080 > 10.1.1.1.49153: Flags [.], ack 54137, win 65535, length 0
1.308556 IP 10.1.1.1.49153 > 10.1.1.2.8080: Flags [.], seq 83081:83617, ack 1, win 65535, length 536
1.308556 IP 10.1.1.2.8080 > 10.1.1.1.49153: Flags [.], ack 54137, win 65535, length 0
1.309481 IP 10.1.1.1.49153 > 10.1.1.2.8080: Flags [.], seq 83617:84153, ack 1, win 65535, length 536
1.309481 IP 10.1.1.2.8080 > 10.1.1.1.49153: Flags [.], ack 54137, win 65535, length 0
1.310406 IP 10.1.1.1.49153 > 10.1.1.2.8080: Flags [.], seq 84153:84689, ack 1, win 65535, length 536
1.310406 IP 10.1.1.2.8080 > 10.1.1.1.49153: Flags [.], ack 54137, win 65535, length 0
1.311331 IP 10.1.1.1.49153 > 10.1.1.2.8080: Flags [.], seq 84689:85225, ack 1, win 65535, length 536
1.311331 IP 10.1.1.2.8080 > 10.1.1.1.49153: Flags [.], ack 54137, win 65535, length 0
1.312256 IP 10.1.1.1.49153 > 10.1.1.2.8080: Flags [.], seq 54137:54673, ack 1, win 65535, length 536
1.312256 IP 10.1.1.2.8080 > 10.1.1.1.49153: Flags [.], ack 55745, win 65535, length 0
1.313180 IP 10.1.1.1.49153 > 10.1.1.2.8080: Flags [.], seq 85225:85761, ack 1, win 65535, length 536
1.313180 IP 10.1.1.2.8080 > 10.1.1.1.49153: Flags [.], ack 55745, win 65535, length 0
1.314105 IP 10.1.1.1.49153 > 10.1.1.2.8080: Flags [.], seq 85761:86297, ack 1, win 65535, length 536
1.314105 IP 10.1.1.2.8080 > 10.1.1.1.49153: Flags [.], ack 55745, win 65535, length 0
1.326774 IP 10.1.1.1.49153 > 10.1.1.2.8080: Flags [.], seq 86297:86833, ack 1, win 65535, length 536
1.326774 IP 10.1.1.2.8080 > 10.1.1.1.49153: Flags [.], ack 55745, win 65535, length 0
1.327699 IP 10.1.1.1.49153 > 10.1.1.2.8080: Flags [.], seq 86833:87369, ack 1, win 65535, length 536
1.327699 IP 10.1.1.2.8080 > 10.1.1.1.49153: Flags [.], ack 55745, win 65535, length 0
1.328624 IP 10.1.1.1.49153 > 10.1.1.2.8080: Flags [.], seq 87369:87905, ack 1, win 65535, length 536
1.328624 IP 10.1.1.2.8080 > 10.1.1.1.49153: Flags [.], ack 55745, win 65535, length 0
1.329548 IP 10.1.1.1.49153 > 10.1.1.2.8080: Flags [.], seq 87905:88441, ack 1, win 65535, length 536
1.329548 IP 10.1.1.2.8080 > 10.1.1.1.49153: Flags [.], ack 55745, win 65535, length 0
1.330473 IP 10.1.1.1.49153 > 10.1.1.2.8080: Flags [.], seq 88441:88977, ack 1, win 65535, length 536
1.330473 IP 10.1.1.2.8080 > 10.1.1.1.49153: Flags [.], ack 55745, win 65535, length 0
1.331398 IP 10.1.1.1.49153 > 10.1.1.2.8080: Flags [.], seq 88977:89513, ack 1, win 65535, length 536
1.331398 IP 10.1.1.2.8080 > 10.1.1.1.49153: Flags [.], ack 55745, win 65535, length 0
1.332323 IP 10.1.1.1.49153 > 10.1.1.2.8080: Flags [.], seq 89513:90049, ack 1, win 65535, length 536
1.332323 IP 10.1.1.2.8080 > 10.1.1.1.49153: Flags [.], ack 55745, win 65535, length 0
1.333248 IP 10.1.1.1.49153 > 10.1.1.2.8080: Flags [.], seq 55745:56281, ack 1, win 65535, length 536
1.333248 IP 10.1.1.2.8080 > 10.1.1.1.49153: Flags [.], ack 57353, win 65535, length 0
1.334172 IP 10.1.1.1.49153 > 10.1.1.2.8080: Flags [.], seq 90049:90585, ack 1, win 65535, length 536
1.334172 IP 10.1.1.2.8080 > 10.1.1.1.49153: Flags [.], ack 57353, win 65535, length 0
1.335097 IP 10.1.1.1.49153 > 10.1.1.2.8080: Flags [.], seq 90585:91121, ack 1, win 65535, length 536
1.335097 IP 10.1.1.2.8080 > 10.1.1.1.49153: Flags [.], ack 57353, win 65535, length 0
1.336022 IP 10.1.1.1.49153 > 10.1.1.2.8080: Flags [.], seq 91121:91657, ack 1, win 65535, length 536
1.336022 IP 10.1.1.2.8080 > 10.1.1.1.49153: Flags [.], ack 57353, win 65535, length 0
1.347766 IP 10.1.1.1.49153 > 10.1.1.2.8080: Flags [.], seq 91657:92193, ack 1, win 65535, length 536
1.347766 IP 10.1.1.2.8080 > 10.1.1.1.49153: Flags [.], ack 57353, win 65535, length 0
1.348691 IP 10.1.1.1.49153 > 10.1.1.2.8080: Flags [.], seq 92193:92729, ack 1, win 65535, length 536
1.348691 IP 10.1.1.2.8080 > 10.1.1.1.49153: Flags [.], ack 57353, win 65535, length 0
1.349616 IP 10.1.1.1.49153 > 10.1.1.2.8080: Flags [.], seq 92729:93265, ack 1, win 65535, length 536
1.349616 IP 10.1.1.2.8080 > 10.1.1.1.49153: Flags [.], ack 57353, win 65535, length 0
1.350540 IP 10.1.1.1.49153 > 10.1.1.2.8080: Flags [.], seq 93265:93801, ack 1, win 65535, length 536
1.350540 IP 10.1.1.2.8080 > 10.1.1.1.49153: Flags [.], ack 57353, win 65535, length 0
1.351465 IP 10.1.1.1.49153 > 10.1.1.2.8080: Flags [.], seq 93801:94337, ack 1, win 65535, length 536
1.351465 IP 10.1.1.2.8080 > 10.1.1.1.49153: Flags [.], ack 57353, win 65535, length 0
1.352390 IP 10.1.1.1.49153 > 10.1.1.2.8080: Flags [.], seq 94337:94873, ack 1, win 65535, length 536
1.352390 IP 10.1.1.2.8080 > 10.1.1.1.49153: Flags [.], ack 57353, win 65535, length 0
1.353315 IP 10.1.1.1.49153 > 10.1.1.2.8080: Flags [.], seq 94873:95409, ack 1, win 65535, length 536
1.353315 IP 10.1.1.2.8080 > 10.1.1.1.49153: Flags [.], ack 57353, win 65535, length 0
1.354240 IP 10.1.1.1.49153 > 10.1.1.2.8080: Flags [.], seq 57353:57889, ack 1, win 65535, length 536
1.354240 IP 10.1.1.2.8080 > 10.1.1.1.49153: Flags [.], ack 58961, win 65535, length 0
1.355164 IP 10.1.1.1.49153 > 10.1.1.2.8080: Flags [.], seq 95409:95945, ack 1, win 65535, length 536
1.355164 IP 10.1.1.2.8080 > 10.1.1.1.49153: Flags [.], ack 58961, win 65535, length 0
1.356089 IP 10.1.1.1.49153 > 10.1.1.2.8080: Flags [.], seq 95945:96481, ack 1, win 65535, length 536
1.356089 IP 10.1.1.2.8080 > 10.1.1.1.49153: Flags [.], ack 58961, win 65535, length 0
1.357014 IP 10.1.1.1.49153 > 10.1.1.2.8080: Flags [.], seq 96481:97017, ack 1, win 65535, length 536
1.357014 IP 10.1.1.2.8080 > 10.1.1.1.49153: Flags [.], ack 58961, win 65535, length 0
1.357939 IP 10.1.1.1.49153 > 10.1.1.2.8080: Flags [.], seq 97017:97553, ack 1, win 65535, length 536
1.357939 IP 10.1.1.2.8080 > 10.1.1.1.49153: Flags [.], ack 58961, win 65535, length 0
1.368758 IP 10.1.1.1.49153 > 10.1.1.2.8080: Flags [.], seq 97553:98089, ack 1, win 65535, length 536
1.368758 IP 10.1.1.2.8080 > 10.1.1.1.49153: Flags [.], ack 58961, win 65535, length 0
1.369683 IP 10.1.1.1.49153 > 10.1.1.2.8080: Flags [.], seq 98089:98625, ack 1, win 65535, length 536
1.369683 IP 10.1.1.2.8080 > 10.1.1.1.49153: Flags [.], ack 58961, win 65535, length 0
1.370608 IP 10.1.1.1.49153 > 10.1.1.2.8080: Flags [.], seq 98625:99161, ack 1, win 65535, length 536
1.370608 IP 10.1.1.2.8080 > 10.1.1.1.49153: Flags [.], ack 58961, win 65535, length 0
1.371532 IP 10.1.1.1.49153 > 10.1.1.2.8080: Flags [.], seq 99161:99697, ack 1, win 65535, length 536
1.371532 IP 10.1.1.2.8080 > 10.1.1.1.49153: Flags [.], ack 58961, win 65535, length 0
1.372457 IP 10.1.1.1.49153 > 10.1.1.2.8080: Flags [.], seq 99697:100233, ack 1, win 65535, length 536
1.372457 IP 10.1.1.2.8080 > 10.1.1.1.49153: Flags [.], ack 58961, win 65535, length 0
1.373382 IP 10.1.1.1.49153 > 10.1.1.2.8080: Flags [.], seq 100233:100769, ack 1, win 65535, length 536
1.373382 IP 10.1.1.2.8080 > 10.1.1.1.49153: Flags [.], ack 58961, win 65535, length 0
1.374307 IP 10.1.1.1.49153 > 10.1.1.2.8080: Flags [.], seq 100769:101305, ack 1, win 65535, length 536
1.374307 IP 10.1.1.2.8080 > 10.1.1.1.49153: Flags [.], ack 58961, win 65535, length 0
1.375232 IP 10.1.1.1.49153 > 10.1.1.2.8080: Flags [.], seq 58961:59497, ack 1, win 65535, length 536
1.375232 IP 10.1.1.2.8080 > 10.1.1.1.49153: Flags [.], ack 60569, win 65535, length 0
1.376156 IP 10.1.1.1.49153 > 10.1.1.2.8080: Flags [.], seq 101305:101841, ack 1, win 65535, length 536
1.376156 IP 10.1.1.2.8080 > 10.1.1.1.49153: Flags [.], ack 60569, win 65535, length 0
1.377081 IP 10.1.1.1.49153 > 10.1.1.2.8080: Flags [.], seq 101841:102377, ack 1, win 65535, length 536
1.377081 IP 10.1.1.2.8080 > 10.1.1.1.49153: Flags [.], ack 60569, win 65535, length 0
1.378006 IP 10.1.1.1.49153 > 10.1.1.2.8080: Flags [.], seq 102377:102913, ack 1, win 65535, length 536
1.378006 IP 10.1.1.2.8080 > 10.1.1.1.49153: Flags [.], ack 60569, win 65535, length 0
1.378931 IP 10.1.1.1.49153 > 10.1.1.2.8080: Flags [.], seq 102913:103449, ack 1, win 65535, length 536
1.378931 IP 10.1.1.2.8080 > 10.1.1.1.49153: Flags [.], ack 60569, win 65535, length 0
1.379856 IP 10.1.1.1.49153 > 10.1.1.2.8080: Flags [.], seq 103449:103985, ack 1, win 65535, length 536
1.379856 IP 10.1.1.2.8080 > 10.1.1.1.49153: Flags [.], ack 60569, win 65535, length 0
1.389750 IP 10.1.1.1.49153 > 10.1.1.2.8080: Flags [.], seq 103985:104521, ack 1, win 65535, length 536
1.389750 IP 10.1.1.2.8080 > 10.1.1.1.49153: Flags [.], ack 60569, win 65535, length 0
1.390675 IP 10.1.1.1.49153 > 10.1.1.2.8080: Flags [.], seq 104521:105057, ack 1, win 65535, length 536
1.390675 IP 10.1.1.2.8080 > 10.1.1.1.49153: Flags [.], ack 60569, win 65535, length 0
1.391600 IP 10.1.1.1.49153 > 10.1.1.2.8080: Flags [.], seq 105057:105593, ack 1, win 65535, length 536
1.391600 IP 10.1.1.2.8080 > 10.1.1.1.49153: Flags [.], ack 60569, win 65535, length 0
1.392524 IP 10.1.1.1.49153 > 10.1.1.2.8080: Flags [.], seq 105593:106129, ack 1, win 65535, length 536
1.392524 IP 10.1.1.2.8080 > 10.1.1.1.49153: Flags [.], ack 60569, win 65535, length 0
1.393449 IP 10.1.1.1.49153 > 10.1.1.2.8080: Flags [.], seq 106129:106665, ack 1, win 65535, length 536
1.393449 IP 10.1.1.2.8080 > 10.1.1.1.49153: Flags [.], ack 60569, win 65535, length 0
1.394374 IP 10.1.1.1.49153 > 10.1.1.2.8080: Flags [.], seq 106665:107201, ack 1, win 65535, length 536
1.394374 IP 10.1.1.2.8080 > 10.1.1.1.49153: Flags [.], ack 60569, win 65535, length 0
1.395299 IP 10.1.1.1.49153 > 10.1.1.2.8080: Flags [.], seq 107201:107737, ack 1, win 65535, length 536
1.395299 IP 10.1.1.2.8080 > 10.1.1.1.49153: Flags [.], ack 60569, win 65535, length 0
1.396224 IP 10.1.1.1.49153 > 10.1.1.2.8080: Flags [.], seq 60569:61105, ack 1, win 65535, length 536
1.396224 IP 10.1.1.2.8080 > 10.1.1.1.49153: Flags [.], ack 62177, win 65535, length 0
1.397148 IP 10.1.1.1.49153 > 10.1.1.2.8080: Flags [.], seq 107737:108273, ack 1, win 65535, length 536
1.397148 IP 10.1.1.2.8080 > 10.1.1.1.49153: Flags [.], ack 62177, win 65535, length 0
1.398073 IP 10.1.1.1.49153 > 10.1.1.2.8080: Flags [.], seq 108273:108809, ack 1, win 65535, length 536
1.398073 IP 10.1.1.2.8080 > 10.1.1.1.49153: Flags [.], ack 62177, win 65535, length 0
1.398998 IP 10.1.1.1.49153 > 10.1.1.2.8080: Flags [.], seq 108809:109345, ack 1, win 65535, length 536
1.398998 IP 10.1.1.2.8080 > 10.1.1.1.49153: Flags [.], ack 62177, win 65535, length 0
1.399923 IP 10.1.1.1.49153 > 10.1.1.2.8080: Flags [.], seq 109345:109881, ack 1, win 65535, length 536
1.399923 IP 10.1.1.2.8080 > 10.1.1.1.49153: Flags [.], ack 62177, win 65535, length 0
1.400848 IP 10.1.1.1.49153 > 10.1.1.2.8080: Flags [.], seq 109881:110417, ack 1, win 65535, length 536
1.400848 IP 10.1.1.2.8080 > 10.1.1.1.49153: Flags [.], ack 62177, win 65535, length 0
1.401772 IP 10.1.1.1.49153 > 10.1.1.2.8080: Flags [.], seq 110417:110953, ack 1, win 65535, length 536
1.401772 IP 10.1.1.2.8080 > 10.1.1.1.49153: Flags [.], ack 62177, win 65535, length 0
1.410742 IP 10.1.1.1.49153 > 10.1.1.2.8080: Flags [.], seq 110953:111489, ack 1, win 65535, length 536
1.410742 IP 10.1.1.2.8080 > 10.1.1.1.49153: Flags [.], ack 62177, win 65535, length 0
1.411667 IP 10.1.1.1.49153 > 10.1.1.2.8080: Flags [.], seq 111489:112025, ack 1, win 65535, length 536
1.411667 IP 10.1.1.2.8080 > 10.1.1.1.49153: Flags [.], ack 62177, win 65535, length 0
1.412592 IP 10.1.1.1.49153 > 10.1.1.2.8080: Flags [.], seq 112025:112561, ack 1, win 65535, length 536
1.412592 IP 10.1.1.2.8080 > 10.1.1.1.49153: Flags [.], ack 62177, win 65535, length 0
1.413516 IP 10.1.1.1.49153 > 10.1.1.2.8080: Flags [.], seq 112561:113097, ack 1, win 65535, length 536
1.413516 IP 10.1.1.2.8080 > 10.1.1.1.49153: Flags [.], ack 62177, win 65535, length 0
1.414441 IP 10.1.1.1.49153 > 10.1.1.2.8080: Flags [.], seq 113097:113633, ack 1, win 65535, length 536
1.414441 IP 10.1.1.2.8080 > 10.1.1.1.49153: Flags [.], ack 62177, win 65535, length 0
1.415366 IP 10.1.1.1.49153 > 10.1.1.2.8080: Flags [.], seq 113633:114169, ack 1, win 65535, length 536
1.415366 IP 10.1.1.2.8080 > 10.1.1.1.49153: Flags [.], ack 62177, win 65535, length 0
1.416291 IP 10.1.1.1.49153 > 10.1.1.2.8080: Flags [.], seq 114169:114705, ack 1, win 65535, length 536
1.416291 IP 10.1.1.2.8080 > 10.1.1.1.49153: Flags [.], ack 62177, win 65535, length 0
1.417216 IP 10.1.1.1.49153 > 10.1.1.2.8080: Flags [.], seq 62177:62713, ack 1, win 65535, length 536
1.417216 IP 10.1.1.2.8080 > 10.1.1.1.49153: Flags [.], ack 63785, win 65535, length 0
1.418140 IP 10.1.1.1.49153 > 10.1.1.2.8080: Flags [.], seq 114705:115241, ack 1, win 65535, length 536
1.418140 IP 10.1.1.2.8080 > 10.1.1.1.49153: Flags [.], ack 63785, win 65535, length 0
1.419065 IP 10.1.1.1.49153 > 10.1.1.2.8080: Flags [.], seq 115241:115777, ack 1, win 65535, length 536
1.419065 IP 10.1.1.2.8080 > 10.1.1.1.49153: Flags [.], ack 63785, win 65535, length 0
1.419990 IP 10.1.1.1.49153 > 10.1.1.2.8080: Flags [.], seq 115777:116313, ack 1, win 65535, length 536
1.419990 IP 10.1.1.2.8080 > 10.1.1.1.49153: Flags [.], ack 63785, win 65535, length 0
1.420915 IP 10.1.1.1.49153 > 10.1.1.2.8080: Flags [.], seq 116313:116849, ack 1, win 65535, length 536
1.420915 IP 10.1.1.2.8080 > 10.1.1.1.49153: Flags [.], ack 63785, win 65535, length 0
1.421840 IP 10.1.1.1.49153 > 10.1.1.2.8080: Flags [.], seq 116849:117385, ack 1, win 65535, length 536
1.421840 IP 10.1.1.2.8080 > 10.1.1.1.49153: Flags [.], ack 63785, win 65535, length 0
1.422764 IP 10.1.1.1.49153 > 10.1.1.2.8080: Flags [.], seq 117385:117921, ack 1, win 65535, length 536
1.422764 IP 10.1.1.2.8080 > 10.1.1.1.49153: Flags [.], ack 63785, win 65535, length 0
1.423689 IP 10.1.1.1.49153 > 10.1.1.2.8080: Flags [.], seq 117921:118457, ack 1, win 65535, length 536
1.423689 IP 10.1.1.2.8080 > 10.1.1.1.49153: Flags [.], ack 63785, win 65535, length 0
1.431734 IP 10.1.1.1.49153 > 10.1.1.2.8080: Flags [.], seq 118457:118993, ack 1, win 65535, length 536
1.431734 IP 10.1.1.2.8080 > 10.1.1.1.49153: Flags [.], ack 63785, win 65535, length 0
1.432659 IP 10.1.1.1.49153 > 10.1.1.2.8080: Flags [.], seq 118993:119529, ack 1, win 65535, length 536
1.432659 IP 10.1.1.2.8080 > 10.1.1.1.49153: Flags [.], ack 63785, win 65535, length 0
1.433584 IP 10.1.1.1.49153 > 10.1.1.2.8080: Flags [.], seq 119529:120065, ack 1, win 65535, length 536
1.433584 IP 10.1.1.2.8080 > 10.1.1.1.49153: Flags [.], ack 63785, win 65535, length 0
1.434508 IP 10.1.1.1.49153 > 10.1.1.2.8080: Flags [.], seq 120065:120601, ack 1, win 65535, length 536
1.434508 IP 10.1.1.2.8080 > 10.1.1.1.49153: Flags [.], ack 63785, win 65535, length 0
1.435433 IP 10.1.1.1.49153 > 10.1.1.2.8080: Flags [.], seq 120601:121137, ack 1, win 65535, length 536
1.435433 IP 10.1.1.2.8080 > 10.1.1.1.49153: Flags [.], ack 63785, win 65535, length 0
1.436358 IP 10.1.1.1.49153 > 10.1.1.2.8080: Flags [.], seq 121137:121673, ack 1, win 65535, length 536
1.436358 IP 10.1.1.2.8080 > 10.1.1.1.49153: Flags [.], ack 63785, win 65535, length 0
1.437283 IP 10.1.1.1.49153 > 10.1.1.2.8080: Flags [.], seq 121673:122209, ack 1, win 65535, length 536
1.437283 IP 10.1.1.2.8080 > 10.1.1.1.49153: Flags [.], ack 63785, win 65535, length 0
1.438208 IP 10.1.1.1.49153 > 10.1.1.2.8080: Flags [.], seq 63785:64321, ack 1, win 65535, length 536
1.438208 IP 10.1.1.2.8080 > 10.1.1.1.49153: Flags [.], ack 65393, win 65535, length 0
1.439132 IP 10.1.1.1.49153 > 10.1.1.2.8080: Flags [.], seq 122209:122745, ack 1, win 65535, length 536
1.439132 IP 10.1.1.2.8080 > 10.1.1.1.49153: Flags [.], ack 65393, win 65535, length 0
1.440057 IP 10.1.1.1.49153 > 10.1.1.2.8080: Flags [.], seq 122745:123281, ack 1, win 65535, length 536
1.440057 IP 10.1.1.2.8080 > 10.1.1.1.49153: Flags [.], ack 65393, win 65535, length 0
1.440982 IP 10.1.1.1.49153 > 10.1.1.2.8080: Flags [.], seq 123281:123817, ack 1, win 65535, length 536
1.440982 IP 10.1.1.2.8080 > 10.1.1.1.49153: Flags [.], ack 65393, win 65535, length 0
1.441907 IP 10.1.1.1.49153 > 10.1.1.2.8080: Flags [.], seq 123817:124353, ack 1, win 65535, length 536
1.441907 IP 10.1.1.2.8080 > 10.1.1.1.49153: Flags [.], ack 65393, win 65535, length 0
1.442832 IP 10.1.1.1.49153 > 10.1.1.2.8080: Flags [.], seq 124353:124889, ack 1, win 65535, length 536
1.442832 IP 10.1.1.2.8080 > 10.1.1.1.49153: Flags [.], ack 65393, win 65535, length 0
1.443756 IP 10.1.1.1.49153 > 10.1.1.2.8080: Flags [.], seq 124889:125425, ack 1, win 65535, length 536
1.443756 IP 10.1.1.2.8080 > 10.1.1.1.49153: Flags [.], ack 65393, win 65535, length 0
1.444681 IP 10.1.1.1.49153 > 10.1.1.2.8080: Flags [.], seq 125425:125961, ack 1, win 65535, length 536
1.444681 IP 10.1.1.2.8080 > 10.1.1.1.49153: Flags [.], ack 65393, win 65535, length 0
1.445606 IP 10.1.1.1.49153 > 10.1.1.2.8080: Flags [.], seq 125961:126497, ack 1, win 65535, length 536
1.445606 IP 10.1.1.2.8080 > 10.1.1.1.49153: Flags [.], ack 65393, win 65535, length 0
1.452726 IP 10.1.1.1.49153 > 10.1.1.2.8080: Flags [.], seq 126497:127033, ack 1, win 65535, length 536
1.452726 IP 10.1.1.2.8080 > 10.1.1.1.49153: Flags [.], ack 65393, win 65535, length 0
1.453651 IP 10.1.1.1.49153 > 10.1.1.2.8080: Flags [.], seq 127033:127569, ack 1, win 65535, length 536
1.453651 IP 10.1.1.2.8080 > 10.1.1.1.49153: Flags [.], ack 65393, win 65535, length 0
1.454576 IP 10.1.1.1.49153 > 10.1.1.2.8080: Flags [.], seq 127569:128105, ack 1, win 65535, length 536
1.454576 IP 10.1.1.2.8080 > 10.1.1.1.49153: Flags [.], ack 65393, win 65535, length 0
1.455500 IP 10.1.1.1.49153 > 10.1.1.2.8080: Flags [.], seq 128105:128641, ack 1, win 65535, length 536
1.455500 IP 10.1.1.2.8080 > 10.1.1.1.49153: Flags [.], ack 65393, win 65535, length 0
1.456425 IP 10.1.1.1.49153 > 10.1.1.2.8080: Flags [.], seq 128641:129177, ack 1, win 65535, length 536
1.456425 IP 10.1.1.2.8080 > 10.1.1.1.49153: Flags [.], ack 65393, win 65535, length 0
1.459200 IP 10.1.1.1.49153 > 10.1.1.2.8080: Flags [.], seq 65393:65929, ack 1, win 65535, length 536
