1.000000 IP 10.1.1.1.49153 > 10.1.1.2.8080: Flags [S], seq 0, win 65535, length 0
1.010134 IP 10.1.1.2.8080 > 10.1.1.1.49153: Flags [S.], seq 0, ack 1, win 65535, length 0
1.010134 IP 10.1.1.1.49153 > 10.1.1.2.8080: Flags [.], ack 1, win 65535, length 0
1.010201 IP 10.1.1.1.49153 > 10.1.1.2.8080: Flags [.], seq 1:537, ack 1, win 65535, length 536
1.021193 IP 10.1.1.2.8080 > 10.1.1.1.49153: Flags [.], ack 537, win 65535, length 0
1.021193 IP 10.1.1.1.49153 > 10.1.1.2.8080: Flags [.], seq 537:1073, ack 1, win 65535, length 536
1.022118 IP 10.1.1.1.49153 > 10.1.1.2.8080: Flags [.], seq 1073:1609, ack 1, win 65535, length 536
1.221193 IP 10.1.1.1.49153 > 10.1.1.2.8080: Flags [.], seq 537:1073, ack 1, win 65535, length 536
1.432185 IP 10.1.1.2.8080 > 10.1.1.1.49153: Flags [.], ack 1073, win 65535, length 0
1.432185 IP 10.1.1.1.49153 > 10.1.1.2.8080: Flags [.], seq 1073:1609, ack 1, win 65535, length 536
1.433110 IP 10.1.1.1.49153 > 10.1.1.2.8080: Flags [.], seq 1609:2145, ack 1, win 65535, length 536
1.444102 IP 10.1.1.2.8080 > 10.1.1.1.49153: Flags [.], ack 1073, win 65535, length 0
1.832185 IP 10.1.1.1.49153 > 10.1.1.2.8080: Flags [.], seq 1073:1609, ack 1, win 65535, length 536
1.843177 IP 10.1.1.2.8080 > 10.1.1.1.49153: Flags [.], ack 2145, win 65535, length 0
1.843177 IP 10.1.1.1.49153 > 10.1.1.2.8080: Flags [.], seq 2145:2681, ack 1, win 65535, length 536
1.844102 IP 10.1.1.1.49153 > 10.1.1.2.8080: Flags [.], seq 2681:3217, ack 1, win 65535, length 536
1.855094 IP 10.1.1.2.8080 > 10.1.1.1.49153: Flags [.], ack 3217, win 65535, length 0
1.855094 IP 10.1.1.1.49153 > 10.1.1.2.8080: Flags [.], seq 3217:3753, ack 1, win 65535, length 536
1.856019 IP 10.1.1.1.49153 > 10.1.1.2.8080: Flags [.], seq 3753:4289, ack 1, win 65535, length 536
2.055094 IP 10.1.1.1.49153 > 10.1.1.2.8080: Flags [.], seq 3217:3753, ack 1, win 65535, length 536
2.066086 IP 10.1.1.2.8080 > 10.1.1.1.49153: Flags [.], ack 3753, win 65535, length 0
2.066086 IP 10.1.1.1.49153 > 10.1.1.2.8080: Flags [.], seq 3753:4289, ack 1, win 65535, length 536
2.066153 IP 10.1.1.2.8080 > 10.1.1.1.49153: Flags [.], ack 3753, win 65535, length 0
2.067011 IP 10.1.1.1.49153 > 10.1.1.2.8080: Flags [.], seq 4289:4825, ack 1, win 65535, length 536
2.078003 IP 10.1.1.2.8080 > 10.1.1.1.49153: Flags [.], ack 3753, win 65535, length 0
2.466086 IP 10.1.1.1.49153 > 10.1.1.2.8080: Flags [.], seq 3753:4289, ack 1, win 65535, length 536
2.477078 IP 10.1.1.2.8080 > 10.1.1.1.49153: Flags [.], ack 4825, win 65535, length 0
2.477078 IP 10.1.1.1.49153 > 10.1.1.2.8080: Flags [.], seq 4825:5361, ack 1, win 65535, length 536
2.478003 IP 10.1.1.1.49153 > 10.1.1.2.8080: Flags [.], seq 5361:5897, ack 1, win 65535, length 536
2.688070 IP 10.1.1.2.8080 > 10.1.1.1.49153: Flags [.], ack 5361, win 65535, length 0
2.688070 IP 10.1.1.1.49153 > 10.1.1.2.8080: Flags [.], seq 5897:6433, ack 1, win 65535, length 536
2.699062 IP 10.1.1.2.8080 > 10.1.1.1.49153: Flags [.], ack 5361, win 65535, length 0
2.888070 IP 10.1.1.1.49153 > 10.1.1.2.8080: Flags [.], seq 5361:5897, ack 1, win 65535, length 536
3.288070 IP 10.1.1.1.49153 > 10.1.1.2.8080: Flags [.], seq 5361:5897, ack 1, win 65535, length 536
4.088070 IP 10.1.1.1.49153 > 10.1.1.2.8080: Flags [.], seq 5361:5897, ack 1, win 65535, length 536
5.688070 IP 10.1.1.1.49153 > 10.1.1.2.8080: Flags [.], seq 5361:5897, ack 1, win 65535, length 536
8.888070 IP 10.1.1.1.49153 > 10.1.1.2.8080: Flags [.], seq 5361:5897, ack 1, win 65535, length 536
8.899062 IP 10.1.1.2.8080 > 10.1.1.1.49153: Flags [.], ack 6433, win 65535, length 0
8.899062 IP 10.1.1.1.49153 > 10.1.1.2.8080: Flags [.], seq 6433:6969, ack 1, win 65535, length 536
8.899987 IP 10.1.1.1.49153 > 10.1.1.2.8080: Flags [.], seq 6969:7505, ack 1, win 65535, length 536
9.110054 IP 10.1.1.2.8080 > 10.1.1.1.49153: Flags [.], ack 6969, win 65535, length 0
9.110054 IP 10.1.1.1.49153 > 10.1.1.2.8080: Flags [.], seq 7505:8041, ack 1, win 65535, length 536
9.335054 IP 10.1.1.1.49153 > 10.1.1.2.8080: Flags [.], seq 6969:7505, ack 1, win 65535, length 536
9.546046 IP 10.1.1.2.8080 > 10.1.1.1.49153: Flags [.], ack 7505, win 65535, length 0
9.546046 IP 10.1.1.1.49153 > 10.1.1.2.8080: Flags [.], seq 7505:8041, ack 1, win 65535, length 536
9.546971 IP 10.1.1.1.49153 > 10.1.1.2.8080: Flags [.], seq 8041:8577, ack 1, win 65535, length 536
9.557963 IP 10.1.1.2.8080 > 10.1.1.1.49153: Flags [.], ack 8577, win 65535, length 0
9.557963 IP 10.1.1.1.49153 > 10.1.1.2.8080: Flags [.], seq 8577:9113, ack 1, win 65535, length 536
9.558888 IP 10.1.1.1.49153 > 10.1.1.2.8080: Flags [.], seq 9113:9649, ack 1, win 65535, length 536
9.569880 IP 10.1.1.2.8080 > 10.1.1.1.49153: Flags [.], ack 8577, win 65535, length 0
