1.005067 IP 10.1.1.1.49153 > 10.1.1.2.8080: Flags [S], seq 0, win 65535, length 0
1.005067 IP 10.1.1.2.8080 > 10.1.1.1.49153: Flags [S.], seq 0, ack 1, win 65535, length 0
1.015201 IP 10.1.1.1.49153 > 10.1.1.2.8080: Flags [.], ack 1, win 65535, length 0
1.016126 IP 10.1.1.1.49153 > 10.1.1.2.8080: Flags [.], seq 1:537, ack 1, win 65535, length 536
1.016126 IP 10.1.1.2.8080 > 10.1.1.1.49153: Flags [.], ack 537, win 65535, length 0
1.027118 IP 10.1.1.1.49153 > 10.1.1.2.8080: Flags [.], seq 537:1073, ack 1, win 65535, length 536
1.028043 IP 10.1.1.1.49153 > 10.1.1.2.8080: Flags [.], seq 1073:1609, ack 1, win 65535, length 536
1.028043 IP 10.1.1.2.8080 > 10.1.1.1.49153: Flags [.], ack 1609, win 65535, length 0
1.039035 IP 10.1.1.1.49153 > 10.1.1.2.8080: Flags [.], seq 1609:2145, ack 1, win 65535, length 536
1.039960 IP 10.1.1.1.49153 > 10.1.1.2.8080: Flags [.], seq 2145:2681, ack 1, win 65535, length 536
1.039960 IP 10.1.1.2.8080 > 10.1.1.1.49153: Flags [.], ack 2681, win 65535, length 0
1.040884 IP 10.1.1.1.49153 > 10.1.1.2.8080: Flags [.], seq 2681:3217, ack 1, win 65535, length 536
1.050952 IP 10.1.1.1.49153 > 10.1.1.2.8080: Flags [.], seq 3217:3753, ack 1, win 65535, length 536
1.050952 IP 10.1.1.2.8080 > 10.1.1.1.49153: Flags [.], ack 3753, win 65535, length 0
1.051876 IP 10.1.1.1.49153 > 10.1.1.2.8080: Flags [.], seq 3753:4289, ack 1, win 65535, length 536
1.052801 IP 10.1.1.1.49153 > 10.1.1.2.8080: Flags [.], seq 4289:4825, ack 1, win 65535, length 536
1.052801 IP 10.1.1.2.8080 > 10.1.1.1.49153: Flags [.], ack 4825, win 65535, length 0
1.061944 IP 10.1.1.1.49153 > 10.1.1.2.8080: Flags [.], seq 4825:5361, ack 1, win 65535, length 536
1.062868 IP 10.1.1.1.49153 > 10.1.1.2.8080: Flags [.], seq 5361:5897, ack 1, win 65535, length 536
1.062868 IP 10.1.1.2.8080 > 10.1.1.1.49153: Flags [.], ack 5897, win 65535, length 0
1.063793 IP 10.1.1.1.49153 > 10.1.1.2.8080: Flags [.], seq 5897:6433, ack 1, win 65535, length 536
1.065643 IP 10.1.1.1.49153 > 10.1.1.2.8080: Flags [.], seq 6969:7505, ack 1, win 65535, length 536
1.065643 IP 10.1.1.2.8080 > 10.1.1.1.49153: Flags [.], ack 6433, win 65535, length 0
1.066568 IP 10.1.1.1.49153 > 10.1.1.2.8080: Flags [.], seq 7505:8041, ack 1, win 65535, length 536
1.066568 IP 10.1.1.2.8080 > 10.1.1.1.49153: Flags [.], ack 6433, win 65535, length 0
1.073860 IP 10.1.1.1.49153 > 10.1.1.2.8080: Flags [.], seq 8041:8577, ack 1, win 65535, length 536
1.073860 IP 10.1.1.2.8080 > 10.1.1.1.49153: Flags [.], ack 6433, win 65535, length 0
1.074785 IP 10.1.1.1.49153 > 10.1.1.2.8080: Flags [.], seq 8577:9113, ack 1, win 65535, length 536
1.074785 IP 10.1.1.2.8080 > 10.1.1.1.49153: Flags [.], ack 6433, win 65535, length 0
1.075710 IP 10.1.1.1.49153 > 10.1.1.2.8080: Flags [.], seq 9113:9649, ack 1, win 65535, length 536
1.075710 IP 10.1.1.2.8080 > 10.1.1.1.49153: Flags [.], ack 6433, win 65535, length 0
1.076635 IP 10.1.1.1.49153 > 10.1.1.2.8080: Flags [.], seq 9649:10185, ack 1, win 65535, length 536
1.076635 IP 10.1.1.2.8080 > 10.1.1.1.49153: Flags [.], ack 6433, win 65535, length 0
1.077560 IP 10.1.1.1.49153 > 10.1.1.2.8080: Flags [.], seq 10185:10721, ack 1, win 65535, length 536
1.077560 IP 10.1.1.2.8080 > 10.1.1.1.49153: Flags [.], ack 6433, win 65535, length 0
1.085777 IP 10.1.1.1.49153 > 10.1.1.2.8080: Flags [.], seq 6433:6969, ack 1, win 65535, length 536
1.085777 IP 10.1.1.2.8080 > 10.1.1.1.49153: Flags [.], ack 10721, win 65535, length 0
1.087627 IP 10.1.1.1.49153 > 10.1.1.2.8080: Flags [.], seq 10721:11257, ack 1, win 65535, length 536
1.088552 IP 10.1.1.1.49153 > 10.1.1.2.8080: Flags [.], seq 11257:11793, ack 1, win 65535, length 536
1.088552 IP 10.1.1.2.8080 > 10.1.1.1.49153: Flags [.], ack 11793, win 65535, length 0
1.096769 IP 10.1.1.1.49153 > 10.1.1.2.8080: Flags [.], seq 11793:12329, ack 1, win 65535, length 536
1.097694 IP 10.1.1.1.49153 > 10.1.1.2.8080: Flags [.], seq 12329:12865, ack 1, win 65535, length 536
1.097694 IP 10.1.1.2.8080 > 10.1.1.1.49153: Flags [.], ack 12865, win 65535, length 0
1.099544 IP 10.1.1.1.49153 > 10.1.1.2.8080: Flags [.], seq 12865:13401, ack 1, win 65535, length 536
1.100468 IP 10.1.1.1.49153 > 10.1.1.2.8080: Flags [.], seq 13401:13937, ack 1, win 65535, length 536
1.100468 IP 10.1.1.2.8080 > 10.1.1.1.49153: Flags [.], ack 13937, win 65535, length 0
1.108686 IP 10.1.1.1.49153 > 10.1.1.2.8080: Flags [.], seq 13937:14473, ack 1, win 65535, length 536
1.109611 IP 10.1.1.1.49153 > 10.1.1.2.8080: Flags [.], seq 14473:15009, ack 1, win 65535, length 536
1.109611 IP 10.1.1.2.8080 > 10.1.1.1.49153: Flags [.], ack 15009, win 65535, length 0
1.111460 IP 10.1.1.1.49153 > 10.1.1.2.8080: Flags [.], seq 15009:15545, ack 1, win 65535, length 536
1.112385 IP 10.1.1.1.49153 > 10.1.1.2.8080: Flags [.], seq 15545:16081, ack 1, win 65535, length 536
1.112385 IP 10.1.1.2.8080 > 10.1.1.1.49153: Flags [.], ack 16081, win 65535, length 0
1.120603 IP 10.1.1.1.49153 > 10.1.1.2.8080: Flags [.], seq 16081:16617, ack 1, win 65535, length 536
1.121528 IP 10.1.1.1.49153 > 10.1.1.2.8080: Flags [.], seq 16617:17153, ack 1, win 65535, length 536
1.121528 IP 10.1.1.2.8080 > 10.1.1.1.49153: Flags [.], ack 17153, win 65535, length 0
1.123377 IP 10.1.1.1.49153 > 10.1.1.2.8080: Flags [.], seq 17689:18225, ack 1, win 65535, length 536
1.123377 IP 10.1.1.2.8080 > 10.1.1.1.49153: Flags [.], ack 17153, win 65535, length 0
1.124302 IP 10.1.1.1.49153 > 10.1.1.2.8080: Flags [.], seq 18225:18761, ack 1, win 65535, length 536
1.124302 IP 10.1.1.2.8080 > 10.1.1.1.49153: Flags [.], ack 17153, win 65535, length 0
1.132520 IP 10.1.1.1.49153 > 10.1.1.2.8080: Flags [.], seq 18761:19297, ack 1, win 65535, length 536
1.132520 IP 10.1.1.2.8080 > 10.1.1.1.49153: Flags [.], ack 17153, win 65535, length 0
1.133444 IP 10.1.1.1.49153 > 10.1.1.2.8080: Flags [.], seq 19297:19833, ack 1, win 65535, length 536
1.133444 IP 10.1.1.2.8080 > 10.1.1.1.49153: Flags [.], ack 17153, win 65535, length 0
1.143512 IP 10.1.1.1.49153 > 10.1.1.2.8080: Flags [.], seq 17153:17689, ack 1, win 65535, length 536
1.143512 IP 10.1.1.2.8080 > 10.1.1.1.49153: Flags [.], ack 19833, win 65535, length 0
1.144436 IP 10.1.1.1.49153 > 10.1.1.2.8080: Flags [.], seq 19833:20369, ack 1, win 65535, length 536
1.154504 IP 10.1.1.1.49153 > 10.1.1.2.8080: Flags [.], seq 20369:20905, ack 1, win 65535, length 536
1.154504 IP 10.1.1.2.8080 > 10.1.1.1.49153: Flags [.], ack 20905, win 65535, length 0
1.165496 IP 10.1.1.1.49153 > 10.1.1.2.8080: Flags [.], seq 20905:21441, ack 1, win 65535, length 536
1.166420 IP 10.1.1.1.49153 > 10.1.1.2.8080: Flags [.], seq 21441:21977, ack 1, win 65535, length 536
1.166420 IP 10.1.1.2.8080 > 10.1.1.1.49153: Flags [.], ack 21977, win 65535, length 0
1.167345 IP 10.1.1.1.49153 > 10.1.1.2.8080: Flags [.], seq 21977:22513, ack 1, win 65535, length 536
1.177412 IP 10.1.1.1.49153 > 10.1.1.2.8080: Flags [.], seq 22513:23049, ack 1, win 65535, length 536
1.177412 IP 10.1.1.2.8080 > 10.1.1.1.49153: Flags [.], ack 23049, win 65535, length 0
1.178337 IP 10.1.1.1.49153 > 10.1.1.2.8080: Flags [.], seq 23049:23585, ack 1, win 65535, length 536
1.188404 IP 10.1.1.1.49153 > 10.1.1.2.8080: Flags [.], seq 23585:24121, ack 1, win 65535, length 536
1.188404 IP 10.1.1.2.8080 > 10.1.1.1.49153: Flags [.], ack 24121, win 65535, length 0
1.189329 IP 10.1.1.1.49153 > 10.1.1.2.8080: Flags [.], seq 24121:24657, ack 1, win 65535, length 536
1.199396 IP 10.1.1.1.49153 > 10.1.1.2.8080: Flags [.], seq 24657:25193, ack 1, win 65535, length 536
1.199396 IP 10.1.1.2.8080 > 10.1.1.1.49153: Flags [.], ack 25193, win 65535, length 0
1.200321 IP 10.1.1.1.49153 > 10.1.1.2.8080: Flags [.], seq 25193:25729, ack 1, win 65535, length 536
1.201246 IP 10.1.1.1.49153 > 10.1.1.2.8080: Flags [.], seq 25729:26265, ack 1, win 65535, length 536
1.201246 IP 10.1.1.2.8080 > 10.1.1.1.49153: Flags [.], ack 26265, win 65535, length 0
1.210388 IP 10.1.1.1.49153 > 10.1.1.2.8080: Flags [.], seq 26265:26801, ack 1, win 65535, length 536
1.211313 IP 10.1.1.1.49153 > 10.1.1.2.8080: Flags [.], seq 26801:27337, ack 1, win 65535, length 536
1.211313 IP 10.1.1.2.8080 > 10.1.1.1.49153: Flags [.], ack 27337, win 65535, length 0
1.212238 IP 10.1.1.1.49153 > 10.1.1.2.8080: Flags [.], seq 27337:27873, ack 1, win 65535, length 536
1.213163 IP 10.1.1.1.49153 > 10.1.1.2.8080: Flags [.], seq 27873:28409, ack 1, win 65535, length 536
1.213163 IP 10.1.1.2.8080 > 10.1.1.1.49153: Flags [.], ack 28409, win 65535, length 0
1.222305 IP 10.1.1.1.49153 > 10.1.1.2.8080: Flags [.], seq 28409:28945, ack 1, win 65535, length 536
1.223230 IP 10.1.1.1.49153 > 10.1.1.2.8080: Flags [.], seq 28945:29481, ack 1, win 65535, length 536
1.223230 IP 10.1.1.2.8080 > 10.1.1.1.49153: Flags [.], ack 29481, win 65535, length 0
1.224155 IP 10.1.1.1.49153 > 10.1.1.2.8080: Flags [.], seq 29481:30017, ack 1, win 65535, length 536
1.225080 IP 10.1.1.1.49153 > 10.1.1.2.8080: Flags [.], seq 30017:30553, ack 1, win 65535, length 536
1.225080 IP 10.1.1.2.8080 > 10.1.1.1.49153: Flags [.], ack 30553, win 65535, length 0
1.234222 IP 10.1.1.1.49153 > 10.1.1.2.8080: Flags [.], seq 30553:31089, ack 1, win 65535, length 536
1.235147 IP 10.1.1.1.49153 > 10.1.1.2.8080: Flags [.], seq 31089:31625, ack 1, win 65535, length 536
1.235147 IP 10.1.1.2.8080 > 10.1.1.1.49153: Flags [.], ack 31625, win 65535, length 0
1.236072 IP 10.1.1.1.49153 > 10.1.1.2.8080: Flags [.], seq 31625:32161, ack 1, win 65535, length 536
1.236996 IP 10.1.1.1.49153 > 10.1.1.2.8080: Flags [.], seq 32161:32697, ack 1, win 65535, length 536
1.236996 IP 10.1.1.2.8080 > 10.1.1.1.49153: Flags [.], ack 32697, win 65535, length 0
1.237921 IP 10.1.1.1.49153 > 10.1.1.2.8080: Flags [.], seq 32697:33233, ack 1, win 65535, length 536
1.246139 IP 10.1.1.1.49153 > 10.1.1.2.8080: Flags [.], seq 33233:33769, ack 1, win 65535, length 536
1.246139 IP 10.1.1.2.8080 > 10.1.1.1.49153: Flags [.], ack 33769, win 65535, length 0
1.247064 IP 10.1.1.1.49153 > 10.1.1.2.8080: Flags [.], seq 33769:34305, ack 1, win 65535, length 536
1.247988 IP 10.1.1.1.49153 > 10.1.1.2.8080: Flags [.], seq 34305:34841, ack 1, win 65535, length 536
1.247988 IP 10.1.1.2.8080 > 10.1.1.1.49153: Flags [.], ack 34841, win 65535, length 0
1.248913 IP 10.1.1.1.49153 > 10.1.1.2.8080: Flags [.], seq 34841:35377, ack 1, win 65535, length 536
1.257131 IP 10.1.1.1.49153 > 10.1.1.2.8080: Flags [.], seq 35377:35913, ack 1, win 65535, length 536
1.257131 IP 10.1.1.2.8080 > 10.1.1.1.49153: Flags [.], ack 35913, win 65535, length 0
1.258056 IP 10.1.1.1.49153 > 10.1.1.2.8080: Flags [.], seq 35913:36449, ack 1, win 65535, length 536
1.258980 IP 10.1.1.1.49153 > 10.1.1.2.8080: Flags [.], seq 36449:36985, ack 1, win 65535, length 536
1.258980 IP 10.1.1.2.8080 > 10.1.1.1.49153: Flags [.], ack 36985, win 65535, length 0
1.259905 IP 10.1.1.1.49153 > 10.1.1.2.8080: Flags [.], seq 36985:37521, ack 1, win 65535, length 536
1.260830 IP 10.1.1.1.49153 > 10.1.1.2.8080: Flags [.], seq 37521:38057, ack 1, win 65535, length 536
1.260830 IP 10.1.1.2.8080 > 10.1.1.1.49153: Flags [.], ack 38057, win 65535, length 0
1.268123 IP 10.1.1.1.49153 > 10.1.1.2.8080: Flags [.], seq 38057:38593, ack 1, win 65535, length 536
1.269048 IP 10.1.1.1.49153 > 10.1.1.2.8080: Flags [.], seq 38593:39129, ack 1, win 65535, length 536
1.269048 IP 10.1.1.2.8080 > 10.1.1.1.49153: Flags [.], ack 39129, win 65535, length 0
1.269972 IP 10.1.1.1.49153 > 10.1.1.2.8080: Flags [.], seq 39129:39665, ack 1, win 65535, length 536
1.270897 IP 10.1.1.1.49153 > 10.1.1.2.8080: Flags [.], seq 39665:40201, ack 1, win 65535, length 536
1.270897 IP 10.1.1.2.8080 > 10.1.1.1.49153: Flags [.], ack 40201, win 65535, length 0
1.271822 IP 10.1.1.1.49153 > 10.1.1.2.8080: Flags [.], seq 40201:40737, ack 1, win 65535, length 536
1.272747 IP 10.1.1.1.49153 > 10.1.1.2.8080: Flags [.], seq 40737:41273, ack 1, win 65535, length 536
1.272747 IP 10.1.1.2.8080 > 10.1.1.1.49153: Flags [.], ack 41273, win 65535, length 0
1.280040 IP 10.1.1.1.49153 > 10.1.1.2.8080: Flags [.], seq 41273:41809, ack 1, win 65535, length 536
1.280964 IP 10.1.1.1.49153 > 10.1.1.2.8080: Flags [.], seq 41809:42345, ack 1, win 65535, length 536
1.280964 IP 10.1.1.2.8080 > 10.1.1.1.49153: Flags [.], ack 42345, win 65535, length 0
1.281889 IP 10.1.1.1.49153 > 10.1.1.2.8080: Flags [.], seq 42345:42881, ack 1, win 65535, length 536
1.282814 IP 10.1.1.1.49153 > 10.1.1.2.8080: Flags [.], seq 42881:43417, ack 1, win 65535, length 536
1.282814 IP 10.1.1.2.8080 > 10.1.1.1.49153: Flags [.], ack 43417, win 65535, length 0
1.283739 IP 10.1.1.1.49153 > 10.1.1.2.8080: Flags [.], seq 43417:43953, ack 1, win 65535, length 536
1.285588 IP 10.1.1.1.49153 > 10.1.1.2.8080: Flags [.], seq 44489:45025, ack 1, win 65535, length 536
1.285588 IP 10.1.1.2.8080 > 10.1.1.1.49153: Flags [.], ack 43953, win 65535, length 0
1.291956 IP 10.1.1.1.49153 > 10.1.1.2.8080: Flags [.], seq 45025:45561, ack 1, win 65535, length 536
1.291956 IP 10.1.1.2.8080 > 10.1.1.1.49153: Flags [.], ack 43953, win 65535, length 0
1.292881 IP 10.1.1.1.49153 > 10.1.1.2.8080: Flags [.], seq 45561:46097, ack 1, win 65535, length 536
1.292881 IP 10.1.1.2.8080 > 10.1.1.1.49153: Flags [.], ack 43953, win 65535, length 0
1.293806 IP 10.1.1.1.49153 > 10.1.1.2.8080: Flags [.], seq 46097:46633, ack 1, win 65535, length 536
1.293806 IP 10.1.1.2.8080 > 10.1.1.1.49153: Flags [.], ack 43953, win 65535, length 0
1.294731 IP 10.1.1.1.49153 > 10.1.1.2.8080: Flags [.], seq 46633:47169, ack 1, win 65535, length 536
1.294731 IP 10.1.1.2.8080 > 10.1.1.1.49153: Flags [.], ack 43953, win 65535, length 0
1.296580 IP 10.1.1.1.49153 > 10.1.1.2.8080: Flags [.], seq 47169:47705, ack 1, win 65535, length 536
1.296580 IP 10.1.1.2.8080 > 10.1.1.1.49153: Flags [.], ack 43953, win 65535, length 0
1.304798 IP 10.1.1.1.49153 > 10.1.1.2.8080: Flags [.], seq 43953:44489, ack 1, win 65535, length 536
1.304798 IP 10.1.1.2.8080 > 10.1.1.1.49153: Flags [.], ack 47705, win 65535, length 0
1.315790 IP 10.1.1.1.49153 > 10.1.1.2.8080: Flags [.], seq 48241:48777, ack 1, win 65535, length 536
1.315790 IP 10.1.1.2.8080 > 10.1.1.1.49153: Flags [.], ack 47705, win 65535, length 0
1.316715 IP 10.1.1.1.49153 > 10.1.1.2.8080: Flags [.], seq 48777:49313, ack 1, win 65535, length 536
1.316715 IP 10.1.1.2.8080 > 10.1.1.1.49153: Flags [.], ack 47705, win 65535, length 0
1.515790 IP 10.1.1.1.49153 > 10.1.1.2.8080: Flags [.], seq 47705:48241, ack 1, win 65535, length 536
1.515790 IP 10.1.1.2.8080 > 10.1.1.1.49153: Flags [.], ack 49313, win 65535, length 0
1.526782 IP 10.1.1.1.49153 > 10.1.1.2.8080: Flags [.], seq 49313:49849, ack 1, win 65535, length 536
1.527707 IP 10.1.1.1.49153 > 10.1.1.2.8080: Flags [.], seq 49849:50385, ack 1, win 65535, length 536
1.527707 IP 10.1.1.2.8080 > 10.1.1.1.49153: Flags [.], ack 50385, win 65535, length 0
1.539624 IP 10.1.1.1.49153 > 10.1.1.2.8080: Flags [.], seq 50921:51457, ack 1, win 65535, length 536
1.539624 IP 10.1.1.2.8080 > 10.1.1.1.49153: Flags [.], ack 50385, win 65535, length 0
1.738699 IP 10.1.1.1.49153 > 10.1.1.2.8080: Flags [.], seq 50385:50921, ack 1, win 65535, length 536
1.738699 IP 10.1.1.2.8080 > 10.1.1.1.49153: Flags [.], ack 51457, win 65535, length 0
1.750616 IP 10.1.1.1.49153 > 10.1.1.2.8080: Flags [.], seq 51993:52529, ack 1, win 65535, length 536
1.750616 IP 10.1.1.2.8080 > 10.1.1.1.49153: Flags [.], ack 51457, win 65535, length 0
2.149691 IP 10.1.1.1.49153 > 10.1.1.2.8080: Flags [.], seq 51457:51993, ack 1, win 65535, length 536
2.149691 IP 10.1.1.2.8080 > 10.1.1.1.49153: Flags [.], ack 52529, win 65535, length 0
2.160683 IP 10.1.1.1.49153 > 10.1.1.2.8080: Flags [.], seq 52529:53065, ack 1, win 65535, length 536
2.161608 IP 10.1.1.1.49153 > 10.1.1.2.8080: Flags [.], seq 53065:53601, ack 1, win 65535, length 536
2.161608 IP 10.1.1.2.8080 > 10.1.1.1.49153: Flags [.], ack 53601, win 65535, length 0
2.172600 IP 10.1.1.1.49153 > 10.1.1.2.8080: Flags [.], seq 53601:54137, ack 1, win 65535, length 536
2.372600 IP 10.1.1.2.8080 > 10.1.1.1.49153: Flags [.], ack 54137, win 65535, length 0
2.372600 IP 10.1.1.1.49153 > 10.1.1.2.8080: Flags [.], seq 53601:54137, ack 1, win 65535, length 536
2.372667 IP 10.1.1.2.8080 > 10.1.1.1.49153: Flags [.], ack 54137, win 65535, length 0
2.383592 IP 10.1.1.1.49153 > 10.1.1.2.8080: Flags [.], seq 54137:54673, ack 1, win 65535, length 536
2.384516 IP 10.1.1.1.49153 > 10.1.1.2.8080: Flags [.], seq 54673:55209, ack 1, win 65535, length 536
2.384516 IP 10.1.1.2.8080 > 10.1.1.1.49153: Flags [.], ack 55209, win 65535, length 0
2.395508 IP 10.1.1.1.49153 > 10.1.1.2.8080: Flags [.], seq 55209:55745, ack 1, win 65535, length 536
2.396433 IP 10.1.1.1.49153 > 10.1.1.2.8080: Flags [.], seq 55745:56281, ack 1, win 65535, length 536
2.396433 IP 10.1.1.2.8080 > 10.1.1.1.49153: Flags [.], ack 56281, win 65535, length 0
2.407425 IP 10.1.1.1.49153 > 10.1.1.2.8080: Flags [.], seq 56281:56817, ack 1, win 65535, length 536
2.408350 IP 10.1.1.1.49153 > 10.1.1.2.8080: Flags [.], seq 56817:57353, ack 1, win 65535, length 536
2.408350 IP 10.1.1.2.8080 > 10.1.1.1.49153: Flags [.], ack 57353, win 65535, length 0
2.419342 IP 10.1.1.1.49153 > 10.1.1.2.8080: Flags [.], seq 57353:57889, ack 1, win 65535, length 536
2.420267 IP 10.1.1.1.49153 > 10.1.1.2.8080: Flags [.], seq 57889:58425, ack 1, win 65535, length 536
2.420267 IP 10.1.1.2.8080 > 10.1.1.1.49153: Flags [.], ack 58425, win 65535, length 0
2.421192 IP 10.1.1.1.49153 > 10.1.1.2.8080: Flags [.], seq 58425:58961, ack 1, win 65535, length 536
2.431259 IP 10.1.1.1.49153 > 10.1.1.2.8080: Flags [.], seq 58961:59497, ack 1, win 65535, length 536
2.431259 IP 10.1.1.2.8080 > 10.1.1.1.49153: Flags [.], ack 59497, win 65535, length 0
2.432184 IP 10.1.1.1.49153 > 10.1.1.2.8080: Flags [.], seq 59497:60033, ack 1, win 65535, length 536
2.442251 IP 10.1.1.1.49153 > 10.1.1.2.8080: Flags [.], seq 60033:60569, ack 1, win 65535, length 536
2.442251 IP 10.1.1.2.8080 > 10.1.1.1.49153: Flags [.], ack 60569, win 65535, length 0
2.443176 IP 10.1.1.1.49153 > 10.1.1.2.8080: Flags [.], seq 60569:61105, ack 1, win 65535, length 536
2.453243 IP 10.1.1.1.49153 > 10.1.1.2.8080: Flags [.], seq 61105:61641, ack 1, win 65535, length 536
2.453243 IP 10.1.1.2.8080 > 10.1.1.1.49153: Flags [.], ack 61641, win 65535, length 0
2.454168 IP 10.1.1.1.49153 > 10.1.1.2.8080: Flags [.], seq 61641:62177, ack 1, win 65535, length 536
2.455092 IP 10.1.1.1.49153 > 10.1.1.2.8080: Flags [.], seq 62177:62713, ack 1, win 65535, length 536
2.455092 IP 10.1.1.2.8080 > 10.1.1.1.49153: Flags [.], ack 62713, win 65535, length 0
2.464235 IP 10.1.1.1.49153 > 10.1.1.2.8080: Flags [.], seq 62713:63249, ack 1, win 65535, length 536
2.465160 IP 10.1.1.1.49153 > 10.1.1.2.8080: Flags [.], seq 63249:63785, ack 1, win 65535, length 536
2.465160 IP 10.1.1.2.8080 > 10.1.1.1.49153: Flags [.], ack 63785, win 65535, length 0
2.466084 IP 10.1.1.1.49153 > 10.1.1.2.8080: Flags [.], seq 63785:64321, ack 1, win 65535, length 536
2.467009 IP 10.1.1.1.49153 > 10.1.1.2.8080: Flags [.], seq 64321:64857, ack 1, win 65535, length 536
2.467009 IP 10.1.1.2.8080 > 10.1.1.1.49153: Flags [.], ack 64857, win 65535, length 0
2.476152 IP 10.1.1.1.49153 > 10.1.1.2.8080: Flags [.], seq 64857:65393, ack 1, win 65535, length 536
2.477076 IP 10.1.1.1.49153 > 10.1.1.2.8080: Flags [.], seq 65393:65929, ack 1, win 65535, length 536
2.477076 IP 10.1.1.2.8080 > 10.1.1.1.49153: Flags [.], ack 65929, win 65535, length 0
2.478001 IP 10.1.1.1.49153 > 10.1.1.2.8080: Flags [.], seq 65929:66465, ack 1, win 65535, length 536
2.478926 IP 10.1.1.1.49153 > 10.1.1.2.8080: Flags [.], seq 66465:67001, ack 1, win 65535, length 536
2.478926 IP 10.1.1.2.8080 > 10.1.1.1.49153: Flags [.], ack 67001, win 65535, length 0
2.488068 IP 10.1.1.1.49153 > 10.1.1.2.8080: Flags [.], seq 67001:67537, ack 1, win 65535, length 536
2.488993 IP 10.1.1.1.49153 > 10.1.1.2.8080: Flags [.], seq 67537:68073, ack 1, win 65535, length 536
2.488993 IP 10.1.1.2.8080 > 10.1.1.1.49153: Flags [.], ack 68073, win 65535, length 0
2.489918 IP 10.1.1.1.49153 > 10.1.1.2.8080: Flags [.], seq 68073:68609, ack 1, win 65535, length 536
2.490843 IP 10.1.1.1.49153 > 10.1.1.2.8080: Flags [.], seq 68609:69145, ack 1, win 65535, length 536
2.490843 IP 10.1.1.2.8080 > 10.1.1.1.49153: Flags [.], ack 69145, win 65535, length 0
2.491768 IP 10.1.1.1.49153 > 10.1.1.2.8080: Flags [.], seq 69145:69681, ack 1, win 65535, length 536
2.499985 IP 10.1.1.1.49153 > 10.1.1.2.8080: Flags [.], seq 69681:70217, ack 1, win 65535, length 536
2.499985 IP 10.1.1.2.8080 > 10.1.1.1.49153: Flags [.], ack 70217, win 65535, length 0
2.500910 IP 10.1.1.1.49153 > 10.1.1.2.8080: Flags [.], seq 70217:70753, ack 1, win 65535, length 536
2.501835 IP 10.1.1.1.49153 > 10.1.1.2.8080: Flags [.], seq 70753:71289, ack 1, win 65535, length 536
2.501835 IP 10.1.1.2.8080 > 10.1.1.1.49153: Flags [.], ack 71289, win 65535, length 0
2.502760 IP 10.1.1.1.49153 > 10.1.1.2.8080: Flags [.], seq 71289:71825, ack 1, win 65535, length 536
2.510977 IP 10.1.1.1.49153 > 10.1.1.2.8080: Flags [.], seq 71825:72361, ack 1, win 65535, length 536
2.510977 IP 10.1.1.2.8080 > 10.1.1.1.49153: Flags [.], ack 72361, win 65535, length 0
2.511902 IP 10.1.1.1.49153 > 10.1.1.2.8080: Flags [.], seq 72361:72897, ack 1, win 65535, length 536
2.512827 IP 10.1.1.1.49153 > 10.1.1.2.8080: Flags [.], seq 72897:73433, ack 1, win 65535, length 536
2.512827 IP 10.1.1.2.8080 > 10.1.1.1.49153: Flags [.], ack 73433, win 65535, length 0
2.513752 IP 10.1.1.1.49153 > 10.1.1.2.8080: Flags [.], seq 73433:73969, ack 1, win 65535, length 536
2.514676 IP 10.1.1.1.49153 > 10.1.1.2.8080: Flags [.], seq 73969:74505, ack 1, win 65535, length 536
2.514676 IP 10.1.1.2.8080 > 10.1.1.1.49153: Flags [.], ack 74505, win 65535, length 0
2.521969 IP 10.1.1.1.49153 > 10.1.1.2.8080: Flags [.], seq 74505:75041, ack 1, win 65535, length 536
2.522894 IP 10.1.1.1.49153 > 10.1.1.2.8080: Flags [.], seq 75041:75577, ack 1, win 65535, length 536
2.522894 IP 10.1.1.2.8080 > 10.1.1.1.49153: Flags [.], ack 75577, win 65535, length 0
2.523819 IP 10.1.1.1.49153 > 10.1.1.2.8080: Flags [.], seq 75577:76113, ack 1, win 65535, length 536
2.524744 IP 10.1.1.1.49153 > 10.1.1.2.8080: Flags [.], seq 76113:76649, ack 1, win 65535, length 536
2.524744 IP 10.1.1.2.8080 > 10.1.1.1.49153: Flags [.], ack 76649, win 65535, length 0
2.525668 IP 10.1.1.1.49153 > 10.1.1.2.8080: Flags [.], seq 76649:77185, ack 1, win 65535, length 536
2.526593 IP 10.1.1.1.49153 > 10.1.1.2.8080: Flags [.], seq 77185:77721, ack 1, win 65535, length 536
2.526593 IP 10.1.1.2.8080 > 10.1.1.1.49153: Flags [.], ack 77721, win 65535, length 0
2.533886 IP 10.1.1.1.49153 > 10.1.1.2.8080: Flags [.], seq 77721:78257, ack 1, win 65535, length 536
2.534811 IP 10.1.1.1.49153 > 10.1.1.2.8080: Flags [.], seq 78257:78793, ack 1, win 65535, length 536
2.534811 IP 10.1.1.2.8080 > 10.1.1.1.49153: Flags [.], ack 78793, win 65535, length 0
2.535736 IP 10.1.1.1.49153 > 10.1.1.2.8080: Flags [.], seq 78793:79329, ack 1, win 65535, length 536
2.536660 IP 10.1.1.1.49153 > 10.1.1.2.8080: Flags [.], seq 79329:79865, ack 1, win 65535, length 536
2.536660 IP 10.1.1.2.8080 > 10.1.1.1.49153: Flags [.], ack 79865, win 65535, length 0
2.537585 IP 10.1.1.1.49153 > 10.1.1.2.8080: Flags [.], seq 79865:80401, ack 1, win 65535, length 536
2.538510 IP 10.1.1.1.49153 > 10.1.1.2.8080: Flags [.], seq 80401:80937, ack 1, win 65535, length 536
2.538510 IP 10.1.1.2.8080 > 10.1.1.1.49153: Flags [.], ack 80937, win 65535, length 0
2.539435 IP 10.1.1.1.49153 > 10.1.1.2.8080: Flags [.], seq 80937:81473, ack 1, win 65535, length 536
2.545803 IP 10.1.1.1.49153 > 10.1.1.2.8080: Flags [.], seq 81473:82009, ack 1, win 65535, length 536
2.545803 IP 10.1.1.2.8080 > 10.1.1.1.49153: Flags [.], ack 82009, win 65535, length 0
2.546728 IP 10.1.1.1.49153 > 10.1.1.2.8080: Flags [.], seq 82009:82545, ack 1, win 65535, length 536
2.547652 IP 10.1.1.1.49153 > 10.1.1.2.8080: Flags [.], seq 82545:83081, ack 1, win 65535, length 536
2.547652 IP 10.1.1.2.8080 > 10.1.1.1.49153: Flags [.], ack 83081, win 65535, length 0
2.548577 IP 10.1.1.1.49153 > 10.1.1.2.8080: Flags [.], seq 83081:83617, ack 1, win 65535, length 536
2.549502 IP 10.1.1.1.49153 > 10.1.1.2.8080: Flags [.], seq 83617:84153, ack 1, win 65535, length 536
2.549502 IP 10.1.1.2.8080 > 10.1.1.1.49153: Flags [.], ack 84153, win 65535, length 0
2.550427 IP 10.1.1.1.49153 > 10.1.1.2.8080: Flags [.], seq 84153:84689, ack 1, win 65535, length 536
2.556795 IP 10.1.1.1.49153 > 10.1.1.2.8080: Flags [.], seq 84689:85225, ack 1, win 65535, length 536
2.556795 IP 10.1.1.2.8080 > 10.1.1.1.49153: Flags [.], ack 85225, win 65535, length 0
2.557720 IP 10.1.1.1.49153 > 10.1.1.2.8080: Flags [.], seq 85225:85761, ack 1, win 65535, length 536
2.558644 IP 10.1.1.1.49153 > 10.1.1.2.8080: Flags [.], seq 85761:86297, ack 1, win 65535, length 536
2.558644 IP 10.1.1.2.8080 > 10.1.1.1.49153: Flags [.], ack 86297, win 65535, length 0
2.559569 IP 10.1.1.1.49153 > 10.1.1.2.8080: Flags [.], seq 86297:86833, ack 1, win 65535, length 536
2.560494 IP 10.1.1.1.49153 > 10.1.1.2.8080: Flags [.], seq 86833:87369, ack 1, win 65535, length 536
2.560494 IP 10.1.1.2.8080 > 10.1.1.1.49153: Flags [.], ack 87369, win 65535, length 0
2.561419 IP 10.1.1.1.49153 > 10.1.1.2.8080: Flags [.], seq 87369:87905, ack 1, win 65535, length 536
2.567787 IP 10.1.1.1.49153 > 10.1.1.2.8080: Flags [.], seq 87905:88441, ack 1, win 65535, length 536
2.567787 IP 10.1.1.2.8080 > 10.1.1.1.49153: Flags [.], ack 88441, win 65535, length 0
2.568712 IP 10.1.1.1.49153 > 10.1.1.2.8080: Flags [.], seq 88441:88977, ack 1, win 65535, length 536
2.569636 IP 10.1.1.1.49153 > 10.1.1.2.8080: Flags [.], seq 88977:89513, ack 1, win 65535, length 536
2.569636 IP 10.1.1.2.8080 > 10.1.1.1.49153: Flags [.], ack 89513, win 65535, length 0
2.570561 IP 10.1.1.1.49153 > 10.1.1.2.8080: Flags [.], seq 89513:90049, ack 1, win 65535, length 536
2.571486 IP 10.1.1.1.49153 > 10.1.1.2.8080: Flags [.], seq 90049:90585, ack 1, win 65535, length 536
2.571486 IP 10.1.1.2.8080 > 10.1.1.1.49153: Flags [.], ack 90585, win 65535, length 0
2.572411 IP 10.1.1.1.49153 > 10.1.1.2.8080: Flags [.], seq 90585:91121, ack 1, win 65535, length 536
2.573336 IP 10.1.1.1.49153 > 10.1.1.2.8080: Flags [.], seq 91121:91657, ack 1, win 65535, length 536
2.573336 IP 10.1.1.2.8080 > 10.1.1.1.49153: Flags [.], ack 91657, win 65535, length 0
2.578779 IP 10.1.1.1.49153 > 10.1.1.2.8080: Flags [.], seq 91657:92193, ack 1, win 65535, length 536
2.579704 IP 10.1.1.1.49153 > 10.1.1.2.8080: Flags [.], seq 92193:92729, ack 1, win 65535, length 536
2.579704 IP 10.1.1.2.8080 > 10.1.1.1.49153: Flags [.], ack 92729, win 65535, length 0
2.580628 IP 10.1.1.1.49153 > 10.1.1.2.8080: Flags [.], seq 92729:93265, ack 1, win 65535, length 536
2.581553 IP 10.1.1.1.49153 > 10.1.1.2.8080: Flags [.], seq 93265:93801, ack 1, win 65535, length 536
2.581553 IP 10.1.1.2.8080 > 10.1.1.1.49153: Flags [.], ack 93801, win 65535, length 0
2.582478 IP 10.1.1.1.49153 > 10.1.1.2.8080: Flags [.], seq 93801:94337, ack 1, win 65535, length 536
2.583403 IP 10.1.1.1.49153 > 10.1.1.2.8080: Flags [.], seq 94337:94873, ack 1, win 65535, length 536
2.583403 IP 10.1.1.2.8080 > 10.1.1.1.49153: Flags [.], ack 94873, win 65535, length 0
2.584328 IP 10.1.1.1.49153 > 10.1.1.2.8080: Flags [.], seq 94873:95409, ack 1, win 65535, length 536
2.585252 IP 10.1.1.1.49153 > 10.1.1.2.8080: Flags [.], seq 95409:95945, ack 1, win 65535, length 536
2.585252 IP 10.1.1.2.8080 > 10.1.1.1.49153: Flags [.], ack 95945, win 65535, length 0
2.590696 IP 10.1.1.1.49153 > 10.1.1.2.8080: Flags [.], seq 95945:96481, ack 1, win 65535, length 536
2.591620 IP 10.1.1.1.49153 > 10.1.1.2.8080: Flags [.], seq 96481:97017, ack 1, win 65535, length 536
2.591620 IP 10.1.1.2.8080 > 10.1.1.1.49153: Flags [.], ack 97017, win 65535, length 0
2.592545 IP 10.1.1.1.49153 > 10.1.1.2.8080: Flags [.], seq 97017:97553, ack 1, win 65535, length 536
2.593470 IP 10.1.1.1.49153 > 10.1.1.2.8080: Flags [.], seq 97553:98089, ack 1, win 65535, length 536
2.593470 IP 10.1.1.2.8080 > 10.1.1.1.49153: Flags [.], ack 98089, win 65535, length 0
2.594395 IP 10.1.1.1.49153 > 10.1.1.2.8080: Flags [.], seq 98089:98625, ack 1, win 65535, length 536
2.595320 IP 10.1.1.1.49153 > 10.1.1.2.8080: Flags [.], seq 98625:99161, ack 1, win 65535, length 536
2.595320 IP 10.1.1.2.8080 > 10.1.1.1.49153: Flags [.], ack 99161, win 65535, length 0
2.597169 IP 10.1.1.1.49153 > 10.1.1.2.8080: Flags [.], seq 99697:100233, ack 1, win 65535, length 536
2.597169 IP 10.1.1.2.8080 > 10.1.1.1.49153: Flags [.], ack 99161, win 65535, length 0
2.598094 IP 10.1.1.1.49153 > 10.1.1.2.8080: Flags [.], seq 100233:100769, ack 1, win 65535, length 536
2.598094 IP 10.1.1.2.8080 > 10.1.1.1.49153: Flags [.], ack 99161, win 65535, length 0
2.602612 IP 10.1.1.1.49153 > 10.1.1.2.8080: Flags [.], seq 100769:101305, ack 1, win 65535, length 536
2.602612 IP 10.1.1.2.8080 > 10.1.1.1.49153: Flags [.], ack 99161, win 65535, length 0
2.603537 IP 10.1.1.1.49153 > 10.1.1.2.8080: Flags [.], seq 101305:101841, ack 1, win 65535, length 536
2.603537 IP 10.1.1.2.8080 > 10.1.1.1.49153: Flags [.], ack 99161, win 65535, length 0
2.604462 IP 10.1.1.1.49153 > 10.1.1.2.8080: Flags [.], seq 101841:102377, ack 1, win 65535, length 536
2.604462 IP 10.1.1.2.8080 > 10.1.1.1.49153: Flags [.], ack 99161, win 65535, length 0
2.606312 IP 10.1.1.1.49153 > 10.1.1.2.8080: Flags [.], seq 102913:103449, ack 1, win 65535, length 536
2.606312 IP 10.1.1.2.8080 > 10.1.1.1.49153: Flags [.], ack 99161, win 65535, length 0
2.607236 IP 10.1.1.1.49153 > 10.1.1.2.8080: Flags [.], seq 103449:103985, ack 1, win 65535, length 536
2.607236 IP 10.1.1.2.8080 > 10.1.1.1.49153: Flags [.], ack 99161, win 65535, length 0
2.613604 IP 10.1.1.1.49153 > 10.1.1.2.8080: Flags [.], seq 99161:99697, ack 1, win 65535, length 536
2.613604 IP 10.1.1.2.8080 > 10.1.1.1.49153: Flags [.], ack 102377, win 65535, length 0
2.617304 IP 10.1.1.1.49153 > 10.1.1.2.8080: Flags [.], seq 103985:104521, ack 1, win 65535, length 536
2.617304 IP 10.1.1.2.8080 > 10.1.1.1.49153: Flags [.], ack 102377, win 65535, length 0
2.618228 IP 10.1.1.1.49153 > 10.1.1.2.8080: Flags [.], seq 104521:105057, ack 1, win 65535, length 536
2.618228 IP 10.1.1.2.8080 > 10.1.1.1.49153: Flags [.], ack 102377, win 65535, length 0
2.624596 IP 10.1.1.1.49153 > 10.1.1.2.8080: Flags [.], seq 102377:102913, ack 1, win 65535, length 536
2.624596 IP 10.1.1.2.8080 > 10.1.1.1.49153: Flags [.], ack 105057, win 65535, length 0
2.625521 IP 10.1.1.1.49153 > 10.1.1.2.8080: Flags [.], seq 105057:105593, ack 1, win 65535, length 536
2.628296 IP 10.1.1.1.49153 > 10.1.1.2.8080: Flags [.], seq 105593:106129, ack 1, win 65535, length 536
2.628296 IP 10.1.1.2.8080 > 10.1.1.1.49153: Flags [.], ack 106129, win 65535, length 0
2.629220 IP 10.1.1.1.49153 > 10.1.1.2.8080: Flags [.], seq 106129:106665, ack 1, win 65535, length 536
2.635588 IP 10.1.1.1.49153 > 10.1.1.2.8080: Flags [.], seq 106665:107201, ack 1, win 65535, length 536
2.635588 IP 10.1.1.2.8080 > 10.1.1.1.49153: Flags [.], ack 107201, win 65535, length 0
2.639288 IP 10.1.1.1.49153 > 10.1.1.2.8080: Flags [.], seq 107201:107737, ack 1, win 65535, length 536
2.640212 IP 10.1.1.1.49153 > 10.1.1.2.8080: Flags [.], seq 107737:108273, ack 1, win 65535, length 536
2.640212 IP 10.1.1.2.8080 > 10.1.1.1.49153: Flags [.], ack 108273, win 65535, length 0
2.646580 IP 10.1.1.1.49153 > 10.1.1.2.8080: Flags [.], seq 108273:108809, ack 1, win 65535, length 536
2.647505 IP 10.1.1.1.49153 > 10.1.1.2.8080: Flags [.], seq 108809:109345, ack 1, win 65535, length 536
2.647505 IP 10.1.1.2.8080 > 10.1.1.1.49153: Flags [.], ack 109345, win 65535, length 0
2.648430 IP 10.1.1.1.49153 > 10.1.1.2.8080: Flags [.], seq 109345:109881, ack 1, win 65535, length 536
2.651204 IP 10.1.1.1.49153 > 10.1.1.2.8080: Flags [.], seq 109881:110417, ack 1, win 65535, length 536
2.651204 IP 10.1.1.2.8080 > 10.1.1.1.49153: Flags [.], ack 110417, win 65535, length 0
2.652129 IP 10.1.1.1.49153 > 10.1.1.2.8080: Flags [.], seq 110417:110953, ack 1, win 65535, length 536
2.658497 IP 10.1.1.1.49153 > 10.1.1.2.8080: Flags [.], seq 110953:111489, ack 1, win 65535, length 536
2.658497 IP 10.1.1.2.8080 > 10.1.1.1.49153: Flags [.], ack 111489, win 65535, length 0
2.659422 IP 10.1.1.1.49153 > 10.1.1.2.8080: Flags [.], seq 111489:112025, ack 1, win 65535, length 536
2.662196 IP 10.1.1.1.49153 > 10.1.1.2.8080: Flags [.], seq 112025:112561, ack 1, win 65535, length 536
2.662196 IP 10.1.1.2.8080 > 10.1.1.1.49153: Flags [.], ack 112561, win 65535, length 0
2.663121 IP 10.1.1.1.49153 > 10.1.1.2.8080: Flags [.], seq 112561:113097, ack 1, win 65535, length 536
2.669489 IP 10.1.1.1.49153 > 10.1.1.2.8080: Flags [.], seq 113097:113633, ack 1, win 65535, length 536
2.669489 IP 10.1.1.2.8080 > 10.1.1.1.49153: Flags [.], ack 113633, win 65535, length 0
2.670414 IP 10.1.1.1.49153 > 10.1.1.2.8080: Flags [.], seq 113633:114169, ack 1, win 65535, length 536
2.673188 IP 10.1.1.1.49153 > 10.1.1.2.8080: Flags [.], seq 114169:114705, ack 1, win 65535, length 536
2.673188 IP 10.1.1.2.8080 > 10.1.1.1.49153: Flags [.], ack 114705, win 65535, length 0
2.674113 IP 10.1.1.1.49153 > 10.1.1.2.8080: Flags [.], seq 114705:115241, ack 1, win 65535, length 536
2.675038 IP 10.1.1.1.49153 > 10.1.1.2.8080: Flags [.], seq 115241:115777, ack 1, win 65535, length 536
2.675038 IP 10.1.1.2.8080 > 10.1.1.1.49153: Flags [.], ack 115777, win 65535, length 0
2.680481 IP 10.1.1.1.49153 > 10.1.1.2.8080: Flags [.], seq 115777:116313, ack 1, win 65535, length 536
2.681406 IP 10.1.1.1.49153 > 10.1.1.2.8080: Flags [.], seq 116313:116849, ack 1, win 65535, length 536
2.681406 IP 10.1.1.2.8080 > 10.1.1.1.49153: Flags [.], ack 116849, win 65535, length 0
2.684180 IP 10.1.1.1.49153 > 10.1.1.2.8080: Flags [.], seq 116849:117385, ack 1, win 65535, length 536
2.685105 IP 10.1.1.1.49153 > 10.1.1.2.8080: Flags [.], seq 117385:117921, ack 1, win 65535, length 536
2.685105 IP 10.1.1.2.8080 > 10.1.1.1.49153: Flags [.], ack 117921, win 65535, length 0
2.686030 IP 10.1.1.1.49153 > 10.1.1.2.8080: Flags [.], seq 117921:118457, ack 1, win 65535, length 536
2.686955 IP 10.1.1.1.49153 > 10.1.1.2.8080: Flags [.], seq 118457:118993, ack 1, win 65535, length 536
2.686955 IP 10.1.1.2.8080 > 10.1.1.1.49153: Flags [.], ack 118993, win 65535, length 0
2.692398 IP 10.1.1.1.49153 > 10.1.1.2.8080: Flags [.], seq 118993:119529, ack 1, win 65535, length 536
2.693323 IP 10.1.1.1.49153 > 10.1.1.2.8080: Flags [.], seq 119529:120065, ack 1, win 65535, length 536
2.693323 IP 10.1.1.2.8080 > 10.1.1.1.49153: Flags [.], ack 120065, win 65535, length 0
2.696097 IP 10.1.1.1.49153 > 10.1.1.2.8080: Flags [.], seq 120065:120601, ack 1, win 65535, length 536
2.697022 IP 10.1.1.1.49153 > 10.1.1.2.8080: Flags [.], seq 120601:121137, ack 1, win 65535, length 536
2.697022 IP 10.1.1.2.8080 > 10.1.1.1.49153: Flags [.], ack 121137, win 65535, length 0
2.697947 IP 10.1.1.1.49153 > 10.1.1.2.8080: Flags [.], seq 121137:121673, ack 1, win 65535, length 536
2.698872 IP 10.1.1.1.49153 > 10.1.1.2.8080: Flags [.], seq 121673:122209, ack 1, win 65535, length 536
2.698872 IP 10.1.1.2.8080 > 10.1.1.1.49153: Flags [.], ack 122209, win 65535, length 0
2.704315 IP 10.1.1.1.49153 > 10.1.1.2.8080: Flags [.], seq 122209:122745, ack 1, win 65535, length 536
2.705240 IP 10.1.1.1.49153 > 10.1.1.2.8080: Flags [.], seq 122745:123281, ack 1, win 65535, length 536
2.705240 IP 10.1.1.2.8080 > 10.1.1.1.49153: Flags [.], ack 123281, win 65535, length 0
2.706164 IP 10.1.1.1.49153 > 10.1.1.2.8080: Flags [.], seq 123281:123817, ack 1, win 65535, length 536
2.708014 IP 10.1.1.1.49153 > 10.1.1.2.8080: Flags [.], seq 123817:124353, ack 1, win 65535, length 536
2.708014 IP 10.1.1.2.8080 > 10.1.1.1.49153: Flags [.], ack 124353, win 65535, length 0
2.708939 IP 10.1.1.1.49153 > 10.1.1.2.8080: Flags [.], seq 124353:124889, ack 1, win 65535, length 536
2.709864 IP 10.1.1.1.49153 > 10.1.1.2.8080: Flags [.], seq 124889:125425, ack 1, win 65535, length 536
2.709864 IP 10.1.1.2.8080 > 10.1.1.1.49153: Flags [.], ack 125425, win 65535, length 0
2.710788 IP 10.1.1.1.49153 > 10.1.1.2.8080: Flags [.], seq 125425:125961, ack 1, win 65535, length 536
2.716232 IP 10.1.1.1.49153 > 10.1.1.2.8080: Flags [.], seq 125961:126497, ack 1, win 65535, length 536
2.716232 IP 10.1.1.2.8080 > 10.1.1.1.49153: Flags [.], ack 126497, win 65535, length 0
2.717156 IP 10.1.1.1.49153 > 10.1.1.2.8080: Flags [.], seq 126497:127033, ack 1, win 65535, length 536
2.719006 IP 10.1.1.1.49153 > 10.1.1.2.8080: Flags [.], seq 127033:127569, ack 1, win 65535, length 536
2.719006 IP 10.1.1.2.8080 > 10.1.1.1.49153: Flags [.], ack 127569, win 65535, length 0
2.719931 IP 10.1.1.1.49153 > 10.1.1.2.8080: Flags [.], seq 127569:128105, ack 1, win 65535, length 536
2.721780 IP 10.1.1.1.49153 > 10.1.1.2.8080: Flags [.], seq 128641:129177, ack 1, win 65535, length 536
2.721780 IP 10.1.1.2.8080 > 10.1.1.1.49153: Flags [.], ack 128105, win 65535, length 0
2.727224 IP 10.1.1.1.49153 > 10.1.1.2.8080: Flags [.], seq 129177:129713, ack 1, win 65535, length 536
2.727224 IP 10.1.1.2.8080 > 10.1.1.1.49153: Flags [.], ack 128105, win 65535, length 0
2.728148 IP 10.1.1.1.49153 > 10.1.1.2.8080: Flags [.], seq 129713:130249, ack 1, win 65535, length 536
2.728148 IP 10.1.1.2.8080 > 10.1.1.1.49153: Flags [.], ack 128105, win 65535, length 0
2.729998 IP 10.1.1.1.49153 > 10.1.1.2.8080: Flags [.], seq 130249:130785, ack 1, win 65535, length 536
2.729998 IP 10.1.1.2.8080 > 10.1.1.1.49153: Flags [.], ack 128105, win 65535, length 0
2.730923 IP 10.1.1.1.49153 > 10.1.1.2.8080: Flags [.], seq 130785:131321, ack 1, win 65535, length 536
2.730923 IP 10.1.1.2.8080 > 10.1.1.1.49153: Flags [.], ack 128105, win 65535, length 0
2.731848 IP 10.1.1.1.49153 > 10.1.1.2.8080: Flags [.], seq 131321:131857, ack 1, win 65535, length 536
2.731848 IP 10.1.1.2.8080 > 10.1.1.1.49153: Flags [.], ack 128105, win 65535, length 0
2.732772 IP 10.1.1.1.49153 > 10.1.1.2.8080: Flags [.], seq 131857:132393, ack 1, win 65535, length 536
2.732772 IP 10.1.1.2.8080 > 10.1.1.1.49153: Flags [.], ack 128105, win 65535, length 0
2.740990 IP 10.1.1.1.49153 > 10.1.1.2.8080: Flags [.], seq 128105:128641, ack 1, win 65535, length 536
2.740990 IP 10.1.1.2.8080 > 10.1.1.1.49153: Flags [.], ack 132393, win 65535, length 0
2.742840 IP 10.1.1.1.49153 > 10.1.1.2.8080: Flags [.], seq 132393:132929, ack 1, win 65535, length 536
2.743764 IP 10.1.1.1.49153 > 10.1.1.2.8080: Flags [.], seq 132929:133465, ack 1, win 65535, length 536
2.743764 IP 10.1.1.2.8080 > 10.1.1.1.49153: Flags [.], ack 133465, win 65535, length 0
2.751982 IP 10.1.1.1.49153 > 10.1.1.2.8080: Flags [.], seq 133465:134001, ack 1, win 65535, length 536
2.752907 IP 10.1.1.1.49153 > 10.1.1.2.8080: Flags [.], seq 134001:134537, ack 1, win 65535, length 536
2.752907 IP 10.1.1.2.8080 > 10.1.1.1.49153: Flags [.], ack 134537, win 65535, length 0
2.754756 IP 10.1.1.1.49153 > 10.1.1.2.8080: Flags [.], seq 134537:135073, ack 1, win 65535, length 536
2.755681 IP 10.1.1.1.49153 > 10.1.1.2.8080: Flags [.], seq 135073:135609, ack 1, win 65535, length 536
2.755681 IP 10.1.1.2.8080 > 10.1.1.1.49153: Flags [.], ack 135609, win 65535, length 0
2.763899 IP 10.1.1.1.49153 > 10.1.1.2.8080: Flags [.], seq 135609:136145, ack 1, win 65535, length 536
2.764824 IP 10.1.1.1.49153 > 10.1.1.2.8080: Flags [.], seq 136145:136681, ack 1, win 65535, length 536
2.764824 IP 10.1.1.2.8080 > 10.1.1.1.49153: Flags [.], ack 136681, win 65535, length 0
2.766673 IP 10.1.1.1.49153 > 10.1.1.2.8080: Flags [.], seq 136681:137217, ack 1, win 65535, length 536
2.767598 IP 10.1.1.1.49153 > 10.1.1.2.8080: Flags [.], seq 137217:137753, ack 1, win 65535, length 536
2.767598 IP 10.1.1.2.8080 > 10.1.1.1.49153: Flags [.], ack 137753, win 65535, length 0
2.775816 IP 10.1.1.1.49153 > 10.1.1.2.8080: Flags [.], seq 137753:138289, ack 1, win 65535, length 536
2.776740 IP 10.1.1.1.49153 > 10.1.1.2.8080: Flags [.], seq 138289:138825, ack 1, win 65535, length 536
2.776740 IP 10.1.1.2.8080 > 10.1.1.1.49153: Flags [.], ack 138825, win 65535, length 0
2.777665 IP 10.1.1.1.49153 > 10.1.1.2.8080: Flags [.], seq 138825:139361, ack 1, win 65535, length 536
2.778590 IP 10.1.1.1.49153 > 10.1.1.2.8080: Flags [.], seq 139361:139897, ack 1, win 65535, length 536
2.778590 IP 10.1.1.2.8080 > 10.1.1.1.49153: Flags [.], ack 139897, win 65535, length 0
2.779515 IP 10.1.1.1.49153 > 10.1.1.2.8080: Flags [.], seq 139897:140433, ack 1, win 65535, length 536
2.787732 IP 10.1.1.1.49153 > 10.1.1.2.8080: Flags [.], seq 140433:140969, ack 1, win 65535, length 536
2.787732 IP 10.1.1.2.8080 > 10.1.1.1.49153: Flags [.], ack 140969, win 65535, length 0
2.788657 IP 10.1.1.1.49153 > 10.1.1.2.8080: Flags [.], seq 140969:141505, ack 1, win 65535, length 536
2.789582 IP 10.1.1.1.49153 > 10.1.1.2.8080: Flags [.], seq 141505:142041, ack 1, win 65535, length 536
2.789582 IP 10.1.1.2.8080 > 10.1.1.1.49153: Flags [.], ack 142041, win 65535, length 0
2.790507 IP 10.1.1.1.49153 > 10.1.1.2.8080: Flags [.], seq 142041:142577, ack 1, win 65535, length 536
2.798724 IP 10.1.1.1.49153 > 10.1.1.2.8080: Flags [.], seq 142577:143113, ack 1, win 65535, length 536
2.798724 IP 10.1.1.2.8080 > 10.1.1.1.49153: Flags [.], ack 143113, win 65535, length 0
2.799649 IP 10.1.1.1.49153 > 10.1.1.2.8080: Flags [.], seq 143113:143649, ack 1, win 65535, length 536
2.800574 IP 10.1.1.1.49153 > 10.1.1.2.8080: Flags [.], seq 143649:144185, ack 1, win 65535, length 536
2.800574 IP 10.1.1.2.8080 > 10.1.1.1.49153: Flags [.], ack 144185, win 65535, length 0
2.801499 IP 10.1.1.1.49153 > 10.1.1.2.8080: Flags [.], seq 144185:144721, ack 1, win 65535, length 536
2.802424 IP 10.1.1.1.49153 > 10.1.1.2.8080: Flags [.], seq 144721:145257, ack 1, win 65535, length 536
2.802424 IP 10.1.1.2.8080 > 10.1.1.1.49153: Flags [.], ack 145257, win 65535, length 0
2.809716 IP 10.1.1.1.49153 > 10.1.1.2.8080: Flags [.], seq 145257:145793, ack 1, win 65535, length 536
2.810641 IP 10.1.1.1.49153 > 10.1.1.2.8080: Flags [.], seq 145793:146329, ack 1, win 65535, length 536
2.810641 IP 10.1.1.2.8080 > 10.1.1.1.49153: Flags [.], ack 146329, win 65535, length 0
2.811566 IP 10.1.1.1.49153 > 10.1.1.2.8080: Flags [.], seq 146329:146865, ack 1, win 65535, length 536
2.812491 IP 10.1.1.1.49153 > 10.1.1.2.8080: Flags [.], seq 146865:147401, ack 1, win 65535, length 536
2.812491 IP 10.1.1.2.8080 > 10.1.1.1.49153: Flags [.], ack 147401, win 65535, length 0
2.813416 IP 10.1.1.1.49153 > 10.1.1.2.8080: Flags [.], seq 147401:147937, ack 1, win 65535, length 536
2.814340 IP 10.1.1.1.49153 > 10.1.1.2.8080: Flags [.], seq 147937:148473, ack 1, win 65535, length 536
2.814340 IP 10.1.1.2.8080 > 10.1.1.1.49153: Flags [.], ack 148473, win 65535, length 0
2.821633 IP 10.1.1.1.49153 > 10.1.1.2.8080: Flags [.], seq 148473:149009, ack 1, win 65535, length 536
2.822558 IP 10.1.1.1.49153 > 10.1.1.2.8080: Flags [.], seq 149009:149545, ack 1, win 65535, length 536
2.822558 IP 10.1.1.2.8080 > 10.1.1.1.49153: Flags [.], ack 149545, win 65535, length 0
2.823483 IP 10.1.1.1.49153 > 10.1.1.2.8080: Flags [.], seq 149545:150081, ack 1, win 65535, length 536
2.824408 IP 10.1.1.1.49153 > 10.1.1.2.8080: Flags [.], seq 150081:150617, ack 1, win 65535, length 536
2.824408 IP 10.1.1.2.8080 > 10.1.1.1.49153: Flags [.], ack 150617, win 65535, length 0
2.825332 IP 10.1.1.1.49153 > 10.1.1.2.8080: Flags [.], seq 150617:151153, ack 1, win 65535, length 536
2.826257 IP 10.1.1.1.49153 > 10.1.1.2.8080: Flags [.], seq 151153:151689, ack 1, win 65535, length 536
2.826257 IP 10.1.1.2.8080 > 10.1.1.1.49153: Flags [.], ack 151689, win 65535, length 0
2.833550 IP 10.1.1.1.49153 > 10.1.1.2.8080: Flags [.], seq 151689:152225, ack 1, win 65535, length 536
2.834475 IP 10.1.1.1.49153 > 10.1.1.2.8080: Flags [.], seq 152225:152761, ack 1, win 65535, length 536
2.834475 IP 10.1.1.2.8080 > 10.1.1.1.49153: Flags [.], ack 152761, win 65535, length 0
2.835400 IP 10.1.1.1.49153 > 10.1.1.2.8080: Flags [.], seq 152761:153297, ack 1, win 65535, length 536
2.836324 IP 10.1.1.1.49153 > 10.1.1.2.8080: Flags [.], seq 153297:153833, ack 1, win 65535, length 536
2.836324 IP 10.1.1.2.8080 > 10.1.1.1.49153: Flags [.], ack 153833, win 65535, length 0
2.837249 IP 10.1.1.1.49153 > 10.1.1.2.8080: Flags [.], seq 153833:154369, ack 1, win 65535, length 536
2.838174 IP 10.1.1.1.49153 > 10.1.1.2.8080: Flags [.], seq 154369:154905, ack 1, win 65535, length 536
2.838174 IP 10.1.1.2.8080 > 10.1.1.1.49153: Flags [.], ack 154905, win 65535, length 0
2.839099 IP 10.1.1.1.49153 > 10.1.1.2.8080: Flags [.], seq 154905:155441, ack 1, win 65535, length 536
2.845467 IP 10.1.1.1.49153 > 10.1.1.2.8080: Flags [.], seq 155441:155977, ack 1, win 65535, length 536
2.845467 IP 10.1.1.2.8080 > 10.1.1.1.49153: Flags [.], ack 155977, win 65535, length 0
2.846392 IP 10.1.1.1.49153 > 10.1.1.2.8080: Flags [.], seq 155977:156513, ack 1, win 65535, length 536
2.847316 IP 10.1.1.1.49153 > 10.1.1.2.8080: Flags [.], seq 156513:157049, ack 1, win 65535, length 536
2.847316 IP 10.1.1.2.8080 > 10.1.1.1.49153: Flags [.], ack 157049, win 65535, length 0
2.848241 IP 10.1.1.1.49153 > 10.1.1.2.8080: Flags [.], seq 157049:157585, ack 1, win 65535, length 536
2.849166 IP 10.1.1.1.49153 > 10.1.1.2.8080: Flags [.], seq 157585:158121, ack 1, win 65535, length 536
2.849166 IP 10.1.1.2.8080 > 10.1.1.1.49153: Flags [.], ack 158121, win 65535, length 0
2.850091 IP 10.1.1.1.49153 > 10.1.1.2.8080: Flags [.], seq 158121:158657, ack 1, win 65535, length 536
2.856459 IP 10.1.1.1.49153 > 10.1.1.2.8080: Flags [.], seq 158657:159193, ack 1, win 65535, length 536
2.856459 IP 10.1.1.2.8080 > 10.1.1.1.49153: Flags [.], ack 159193, win 65535, length 0
2.858308 IP 10.1.1.1.49153 > 10.1.1.2.8080: Flags [.], seq 159729:160265, ack 1, win 65535, length 536
2.858308 IP 10.1.1.2.8080 > 10.1.1.1.49153: Flags [.], ack 159193, win 65535, length 0
2.859233 IP 10.1.1.1.49153 > 10.1.1.2.8080: Flags [.], seq 160265:160801, ack 1, win 65535, length 536
2.859233 IP 10.1.1.2.8080 > 10.1.1.1.49153: Flags [.], ack 159193, win 65535, length 0
2.860158 IP 10.1.1.1.49153 > 10.1.1.2.8080: Flags [.], seq 160801:161337, ack 1, win 65535, length 536
2.860158 IP 10.1.1.2.8080 > 10.1.1.1.49153: Flags [.], ack 159193, win 65535, length 0
2.861083 IP 10.1.1.1.49153 > 10.1.1.2.8080: Flags [.], seq 161337:161873, ack 1, win 65535, length 536
2.861083 IP 10.1.1.2.8080 > 10.1.1.1.49153: Flags [.], ack 159193, win 65535, length 0
2.862008 IP 10.1.1.1.49153 > 10.1.1.2.8080: Flags [.], seq 161873:162409, ack 1, win 65535, length 536
2.862008 IP 10.1.1.2.8080 > 10.1.1.1.49153: Flags [.], ack 159193, win 65535, length 0
2.868376 IP 10.1.1.1.49153 > 10.1.1.2.8080: Flags [.], seq 162945:163481, ack 1, win 65535, length 536
2.868376 IP 10.1.1.2.8080 > 10.1.1.1.49153: Flags [.], ack 159193, win 65535, length 0
2.871150 IP 10.1.1.1.49153 > 10.1.1.2.8080: Flags [.], seq 159193:159729, ack 1, win 65535, length 536
2.871150 IP 10.1.1.2.8080 > 10.1.1.1.49153: Flags [.], ack 162409, win 65535, length 0
2.873000 IP 10.1.1.1.49153 > 10.1.1.2.8080: Flags [.], seq 163481:164017, ack 1, win 65535, length 536
2.873000 IP 10.1.1.2.8080 > 10.1.1.1.49153: Flags [.], ack 162409, win 65535, length 0
2.879368 IP 10.1.1.1.49153 > 10.1.1.2.8080: Flags [.], seq 164017:164553, ack 1, win 65535, length 536
2.879368 IP 10.1.1.2.8080 > 10.1.1.1.49153: Flags [.], ack 162409, win 65535, length 0
2.882142 IP 10.1.1.1.49153 > 10.1.1.2.8080: Flags [.], seq 162409:162945, ack 1, win 65535, length 536
2.882142 IP 10.1.1.2.8080 > 10.1.1.1.49153: Flags [.], ack 164553, win 65535, length 0
2.883067 IP 10.1.1.1.49153 > 10.1.1.2.8080: Flags [.], seq 164553:165089, ack 1, win 65535, length 536
2.883992 IP 10.1.1.1.49153 > 10.1.1.2.8080: Flags [.], seq 165089:165625, ack 1, win 65535, length 536
2.883992 IP 10.1.1.2.8080 > 10.1.1.1.49153: Flags [.], ack 165625, win 65535, length 0
2.890360 IP 10.1.1.1.49153 > 10.1.1.2.8080: Flags [.], seq 165625:166161, ack 1, win 65535, length 536
2.893134 IP 10.1.1.1.49153 > 10.1.1.2.8080: Flags [.], seq 166161:166697, ack 1, win 65535, length 536
2.893134 IP 10.1.1.2.8080 > 10.1.1.1.49153: Flags [.], ack 166697, win 65535, length 0
2.894984 IP 10.1.1.1.49153 > 10.1.1.2.8080: Flags [.], seq 166697:167233, ack 1, win 65535, length 536
2.895908 IP 10.1.1.1.49153 > 10.1.1.2.8080: Flags [.], seq 167233:167769, ack 1, win 65535, length 536
2.895908 IP 10.1.1.2.8080 > 10.1.1.1.49153: Flags [.], ack 167769, win 65535, length 0
2.904126 IP 10.1.1.1.49153 > 10.1.1.2.8080: Flags [.], seq 167769:168305, ack 1, win 65535, length 536
2.905051 IP 10.1.1.1.49153 > 10.1.1.2.8080: Flags [.], seq 168305:168841, ack 1, win 65535, length 536
2.905051 IP 10.1.1.2.8080 > 10.1.1.1.49153: Flags [.], ack 168841, win 65535, length 0
2.906900 IP 10.1.1.1.49153 > 10.1.1.2.8080: Flags [.], seq 168841:169377, ack 1, win 65535, length 536
2.907825 IP 10.1.1.1.49153 > 10.1.1.2.8080: Flags [.], seq 169377:169913, ack 1, win 65535, length 536
2.907825 IP 10.1.1.2.8080 > 10.1.1.1.49153: Flags [.], ack 169913, win 65535, length 0
2.916043 IP 10.1.1.1.49153 > 10.1.1.2.8080: Flags [.], seq 169913:170449, ack 1, win 65535, length 536
2.916968 IP 10.1.1.1.49153 > 10.1.1.2.8080: Flags [.], seq 170449:170985, ack 1, win 65535, length 536
2.916968 IP 10.1.1.2.8080 > 10.1.1.1.49153: Flags [.], ack 170985, win 65535, length 0
2.917892 IP 10.1.1.1.49153 > 10.1.1.2.8080: Flags [.], seq 170985:171521, ack 1, win 65535, length 536
2.918817 IP 10.1.1.1.49153 > 10.1.1.2.8080: Flags [.], seq 171521:172057, ack 1, win 65535, length 536
2.918817 IP 10.1.1.2.8080 > 10.1.1.1.49153: Flags [.], ack 172057, win 65535, length 0
2.919742 IP 10.1.1.1.49153 > 10.1.1.2.8080: Flags [.], seq 172057:172593, ack 1, win 65535, length 536
2.927960 IP 10.1.1.1.49153 > 10.1.1.2.8080: Flags [.], seq 172593:173129, ack 1, win 65535, length 536
2.927960 IP 10.1.1.2.8080 > 10.1.1.1.49153: Flags [.], ack 173129, win 65535, length 0
2.928884 IP 10.1.1.1.49153 > 10.1.1.2.8080: Flags [.], seq 173129:173665, ack 1, win 65535, length 536
2.929809 IP 10.1.1.1.49153 > 10.1.1.2.8080: Flags [.], seq 173665:174201, ack 1, win 65535, length 536
2.929809 IP 10.1.1.2.8080 > 10.1.1.1.49153: Flags [.], ack 174201, win 65535, length 0
2.930734 IP 10.1.1.1.49153 > 10.1.1.2.8080: Flags [.], seq 174201:174737, ack 1, win 65535, length 536
2.939876 IP 10.1.1.1.49153 > 10.1.1.2.8080: Flags [.], seq 175273:175809, ack 1, win 65535, length 536
2.939876 IP 10.1.1.2.8080 > 10.1.1.1.49153: Flags [.], ack 174737, win 65535, length 0
2.940801 IP 10.1.1.1.49153 > 10.1.1.2.8080: Flags [.], seq 175809:176345, ack 1, win 65535, length 536
2.940801 IP 10.1.1.2.8080 > 10.1.1.1.49153: Flags [.], ack 174737, win 65535, length 0
2.941726 IP 10.1.1.1.49153 > 10.1.1.2.8080: Flags [.], seq 176345:176881, ack 1, win 65535, length 536
2.941726 IP 10.1.1.2.8080 > 10.1.1.1.49153: Flags [.], ack 174737, win 65535, length 0
2.942651 IP 10.1.1.1.49153 > 10.1.1.2.8080: Flags [.], seq 176881:177417, ack 1, win 65535, length 536
2.942651 IP 10.1.1.2.8080 > 10.1.1.1.49153: Flags [.], ack 174737, win 65535, length 0
2.950868 IP 10.1.1.1.49153 > 10.1.1.2.8080: Flags [.], seq 177417:177953, ack 1, win 65535, length 536
2.950868 IP 10.1.1.2.8080 > 10.1.1.1.49153: Flags [.], ack 174737, win 65535, length 0
2.953643 IP 10.1.1.1.49153 > 10.1.1.2.8080: Flags [.], seq 174737:175273, ack 1, win 65535, length 536
2.953643 IP 10.1.1.2.8080 > 10.1.1.1.49153: Flags [.], ack 177953, win 65535, length 0
2.964635 IP 10.1.1.1.49153 > 10.1.1.2.8080: Flags [.], seq 178489:179025, ack 1, win 65535, length 536
2.964635 IP 10.1.1.2.8080 > 10.1.1.1.49153: Flags [.], ack 177953, win 65535, length 0
2.965560 IP 10.1.1.1.49153 > 10.1.1.2.8080: Flags [.], seq 179025:179561, ack 1, win 65535, length 536
2.965560 IP 10.1.1.2.8080 > 10.1.1.1.49153: Flags [.], ack 177953, win 65535, length 0
3.164635 IP 10.1.1.1.49153 > 10.1.1.2.8080: Flags [.], seq 177953:178489, ack 1, win 65535, length 536
3.164635 IP 10.1.1.2.8080 > 10.1.1.1.49153: Flags [.], ack 179561, win 65535, length 0
3.175627 IP 10.1.1.1.49153 > 10.1.1.2.8080: Flags [.], seq 179561:180097, ack 1, win 65535, length 536
3.176552 IP 10.1.1.1.49153 > 10.1.1.2.8080: Flags [.], seq 180097:180633, ack 1, win 65535, length 536
3.176552 IP 10.1.1.2.8080 > 10.1.1.1.49153: Flags [.], ack 180633, win 65535, length 0
3.187544 IP 10.1.1.1.49153 > 10.1.1.2.8080: Flags [.], seq 180633:181169, ack 1, win 65535, length 536
3.188468 IP 10.1.1.1.49153 > 10.1.1.2.8080: Flags [.], seq 181169:181705, ack 1, win 65535, length 536
3.188468 IP 10.1.1.2.8080 > 10.1.1.1.49153: Flags [.], ack 181705, win 65535, length 0
3.199460 IP 10.1.1.1.49153 > 10.1.1.2.8080: Flags [.], seq 181705:182241, ack 1, win 65535, length 536
3.200385 IP 10.1.1.1.49153 > 10.1.1.2.8080: Flags [.], seq 182241:182777, ack 1, win 65535, length 536
3.200385 IP 10.1.1.2.8080 > 10.1.1.1.49153: Flags [.], ack 182777, win 65535, length 0
3.211377 IP 10.1.1.1.49153 > 10.1.1.2.8080: Flags [.], seq 182777:183313, ack 1, win 65535, length 536
3.212302 IP 10.1.1.1.49153 > 10.1.1.2.8080: Flags [.], seq 183313:183849, ack 1, win 65535, length 536
3.212302 IP 10.1.1.2.8080 > 10.1.1.1.49153: Flags [.], ack 183849, win 65535, length 0
3.213227 IP 10.1.1.1.49153 > 10.1.1.2.8080: Flags [.], seq 183849:184385, ack 1, win 65535, length 536
3.223294 IP 10.1.1.1.49153 > 10.1.1.2.8080: Flags [.], seq 184385:184921, ack 1, win 65535, length 536
3.223294 IP 10.1.1.2.8080 > 10.1.1.1.49153: Flags [.], ack 184921, win 65535, length 0
3.224219 IP 10.1.1.1.49153 > 10.1.1.2.8080: Flags [.], seq 184921:185457, ack 1, win 65535, length 536
3.235211 IP 10.1.1.1.49153 > 10.1.1.2.8080: Flags [.], seq 185993:186529, ack 1, win 65535, length 536
3.235211 IP 10.1.1.2.8080 > 10.1.1.1.49153: Flags [.], ack 185457, win 65535, length 0
3.246203 IP 10.1.1.1.49153 > 10.1.1.2.8080: Flags [.], seq 186529:187065, ack 1, win 65535, length 536
3.246203 IP 10.1.1.2.8080 > 10.1.1.1.49153: Flags [.], ack 185457, win 65535, length 0
3.247128 IP 10.1.1.1.49153 > 10.1.1.2.8080: Flags [.], seq 187065:187601, ack 1, win 65535, length 536
3.247128 IP 10.1.1.2.8080 > 10.1.1.1.49153: Flags [.], ack 185457, win 65535, length 0
3.446203 IP 10.1.1.1.49153 > 10.1.1.2.8080: Flags [.], seq 185457:185993, ack 1, win 65535, length 536
3.446203 IP 10.1.1.2.8080 > 10.1.1.1.49153: Flags [.], ack 187601, win 65535, length 0
3.457195 IP 10.1.1.1.49153 > 10.1.1.2.8080: Flags [.], seq 187601:188137, ack 1, win 65535, length 536
3.458120 IP 10.1.1.1.49153 > 10.1.1.2.8080: Flags [.], seq 188137:188673, ack 1, win 65535, length 536
3.458120 IP 10.1.1.2.8080 > 10.1.1.1.49153: Flags [.], ack 188673, win 65535, length 0
3.469112 IP 10.1.1.1.49153 > 10.1.1.2.8080: Flags [.], seq 188673:189209, ack 1, win 65535, length 536
3.669112 IP 10.1.1.2.8080 > 10.1.1.1.49153: Flags [.], ack 189209, win 65535, length 0
3.669112 IP 10.1.1.1.49153 > 10.1.1.2.8080: Flags [.], seq 188673:189209, ack 1, win 65535, length 536
3.669179 IP 10.1.1.2.8080 > 10.1.1.1.49153: Flags [.], ack 189209, win 65535, length 0
3.680104 IP 10.1.1.1.49153 > 10.1.1.2.8080: Flags [.], seq 189209:189745, ack 1, win 65535, length 536
3.880104 IP 10.1.1.2.8080 > 10.1.1.1.49153: Flags [.], ack 189745, win 65535, length 0
3.891096 IP 10.1.1.1.49153 > 10.1.1.2.8080: Flags [.], seq 190281:190817, ack 1, win 65535, length 536
3.891096 IP 10.1.1.2.8080 > 10.1.1.1.49153: Flags [.], ack 189745, win 65535, length 0
4.291096 IP 10.1.1.1.49153 > 10.1.1.2.8080: Flags [.], seq 189745:190281, ack 1, win 65535, length 536
4.291096 IP 10.1.1.2.8080 > 10.1.1.1.49153: Flags [.], ack 190817, win 65535, length 0
4.302088 IP 10.1.1.1.49153 > 10.1.1.2.8080: Flags [.], seq 190817:191353, ack 1, win 65535, length 536
4.303012 IP 10.1.1.1.49153 > 10.1.1.2.8080: Flags [.], seq 191353:191889, ack 1, win 65535, length 536
4.303012 IP 10.1.1.2.8080 > 10.1.1.1.49153: Flags [.], ack 191889, win 65535, length 0
4.314004 IP 10.1.1.1.49153 > 10.1.1.2.8080: Flags [.], seq 191889:192425, ack 1, win 65535, length 536
4.314929 IP 10.1.1.1.49153 > 10.1.1.2.8080: Flags [.], seq 192425:192961, ack 1, win 65535, length 536
4.314929 IP 10.1.1.2.8080 > 10.1.1.1.49153: Flags [.], ack 192961, win 65535, length 0
4.325921 IP 10.1.1.1.49153 > 10.1.1.2.8080: Flags [.], seq 192961:193497, ack 1, win 65535, length 536
4.326846 IP 10.1.1.1.49153 > 10.1.1.2.8080: Flags [.], seq 193497:194033, ack 1, win 65535, length 536
4.326846 IP 10.1.1.2.8080 > 10.1.1.1.49153: Flags [.], ack 194033, win 65535, length 0
4.337838 IP 10.1.1.1.49153 > 10.1.1.2.8080: Flags [.], seq 194033:194569, ack 1, win 65535, length 536
4.338763 IP 10.1.1.1.49153 > 10.1.1.2.8080: Flags [.], seq 194569:195105, ack 1, win 65535, length 536
4.338763 IP 10.1.1.2.8080 > 10.1.1.1.49153: Flags [.], ack 195105, win 65535, length 0
4.349755 IP 10.1.1.1.49153 > 10.1.1.2.8080: Flags [.], seq 195641:196177, ack 1, win 65535, length 536
4.349755 IP 10.1.1.2.8080 > 10.1.1.1.49153: Flags [.], ack 195105, win 65535, length 0
4.350680 IP 10.1.1.1.49153 > 10.1.1.2.8080: Flags [.], seq 196177:196713, ack 1, win 65535, length 536
4.350680 IP 10.1.1.2.8080 > 10.1.1.1.49153: Flags [.], ack 195105, win 65535, length 0
4.549755 IP 10.1.1.1.49153 > 10.1.1.2.8080: Flags [.], seq 195105:195641, ack 1, win 65535, length 536
4.549755 IP 10.1.1.2.8080 > 10.1.1.1.49153: Flags [.], ack 196713, win 65535, length 0
4.560747 IP 10.1.1.1.49153 > 10.1.1.2.8080: Flags [.], seq 196713:197249, ack 1, win 65535, length 536
4.561672 IP 10.1.1.1.49153 > 10.1.1.2.8080: Flags [.], seq 197249:197785, ack 1, win 65535, length 536
4.561672 IP 10.1.1.2.8080 > 10.1.1.1.49153: Flags [.], ack 197785, win 65535, length 0
4.573588 IP 10.1.1.1.49153 > 10.1.1.2.8080: Flags [.], seq 198321:198857, ack 1, win 65535, length 536
4.573588 IP 10.1.1.2.8080 > 10.1.1.1.49153: Flags [.], ack 197785, win 65535, length 0
4.772664 IP 10.1.1.1.49153 > 10.1.1.2.8080: Flags [.], seq 197785:198321, ack 1, win 65535, length 536
4.772664 IP 10.1.1.2.8080 > 10.1.1.1.49153: Flags [.], ack 198857, win 65535, length 0
4.783656 IP 10.1.1.1.49153 > 10.1.1.2.8080: Flags [.], seq 198857:199393, ack 1, win 65535, length 536
4.784580 IP 10.1.1.1.49153 > 10.1.1.2.8080: Flags [.], seq 199393:199929, ack 1, win 65535, length 536
4.784580 IP 10.1.1.2.8080 > 10.1.1.1.49153: Flags [.], ack 199929, win 65535, length 0
4.795572 IP 10.1.1.1.49153 > 10.1.1.2.8080: Flags [.], seq 199929:200465, ack 1, win 65535, length 536
4.796497 IP 10.1.1.1.49153 > 10.1.1.2.8080: Flags [.], seq 200465:201001, ack 1, win 65535, length 536
4.796497 IP 10.1.1.2.8080 > 10.1.1.1.49153: Flags [.], ack 201001, win 65535, length 0
4.807489 IP 10.1.1.1.49153 > 10.1.1.2.8080: Flags [.], seq 201001:201537, ack 1, win 65535, length 536
4.808414 IP 10.1.1.1.49153 > 10.1.1.2.8080: Flags [.], seq 201537:202073, ack 1, win 65535, length 536
4.808414 IP 10.1.1.2.8080 > 10.1.1.1.49153: Flags [.], ack 202073, win 65535, length 0
4.819406 IP 10.1.1.1.49153 > 10.1.1.2.8080: Flags [.], seq 202073:202609, ack 1, win 65535, length 536
4.820331 IP 10.1.1.1.49153 > 10.1.1.2.8080: Flags [.], seq 202609:203145, ack 1, win 65535, length 536
4.820331 IP 10.1.1.2.8080 > 10.1.1.1.49153: Flags [.], ack 203145, win 65535, length 0
4.821256 IP 10.1.1.1.49153 > 10.1.1.2.8080: Flags [.], seq 203145:203681, ack 1, win 65535, length 536
4.831323 IP 10.1.1.1.49153 > 10.1.1.2.8080: Flags [.], seq 203681:204217, ack 1, win 65535, length 536
4.831323 IP 10.1.1.2.8080 > 10.1.1.1.49153: Flags [.], ack 204217, win 65535, length 0
4.832248 IP 10.1.1.1.49153 > 10.1.1.2.8080: Flags [.], seq 204217:204753, ack 1, win 65535, length 536
4.842315 IP 10.1.1.1.49153 > 10.1.1.2.8080: Flags [.], seq 204753:205289, ack 1, win 65535, length 536
4.842315 IP 10.1.1.2.8080 > 10.1.1.1.49153: Flags [.], ack 205289, win 65535, length 0
4.843240 IP 10.1.1.1.49153 > 10.1.1.2.8080: Flags [.], seq 205289:205825, ack 1, win 65535, length 536
4.853307 IP 10.1.1.1.49153 > 10.1.1.2.8080: Flags [.], seq 205825:206361, ack 1, win 65535, length 536
4.853307 IP 10.1.1.2.8080 > 10.1.1.1.49153: Flags [.], ack 206361, win 65535, length 0
4.854232 IP 10.1.1.1.49153 > 10.1.1.2.8080: Flags [.], seq 206361:206897, ack 1, win 65535, length 536
4.855156 IP 10.1.1.1.49153 > 10.1.1.2.8080: Flags [.], seq 206897:207433, ack 1, win 65535, length 536
4.855156 IP 10.1.1.2.8080 > 10.1.1.1.49153: Flags [.], ack 207433, win 65535, length 0
4.864299 IP 10.1.1.1.49153 > 10.1.1.2.8080: Flags [.], seq 207433:207969, ack 1, win 65535, length 536
4.865224 IP 10.1.1.1.49153 > 10.1.1.2.8080: Flags [.], seq 207969:208505, ack 1, win 65535, length 536
4.865224 IP 10.1.1.2.8080 > 10.1.1.1.49153: Flags [.], ack 208505, win 65535, length 0
4.866148 IP 10.1.1.1.49153 > 10.1.1.2.8080: Flags [.], seq 208505:209041, ack 1, win 65535, length 536
4.876216 IP 10.1.1.1.49153 > 10.1.1.2.8080: Flags [.], seq 209577:210113, ack 1, win 65535, length 536
4.876216 IP 10.1.1.2.8080 > 10.1.1.1.49153: Flags [.], ack 209041, win 65535, length 0
4.877140 IP 10.1.1.1.49153 > 10.1.1.2.8080: Flags [.], seq 210113:210649, ack 1, win 65535, length 536
4.877140 IP 10.1.1.2.8080 > 10.1.1.1.49153: Flags [.], ack 209041, win 65535, length 0
4.887208 IP 10.1.1.1.49153 > 10.1.1.2.8080: Flags [.], seq 210649:211185, ack 1, win 65535, length 536
4.887208 IP 10.1.1.2.8080 > 10.1.1.1.49153: Flags [.], ack 209041, win 65535, length 0
5.087208 IP 10.1.1.1.49153 > 10.1.1.2.8080: Flags [.], seq 209041:209577, ack 1, win 65535, length 536
5.087208 IP 10.1.1.2.8080 > 10.1.1.1.49153: Flags [.], ack 211185, win 65535, length 0
5.098200 IP 10.1.1.1.49153 > 10.1.1.2.8080: Flags [.], seq 211185:211721, ack 1, win 65535, length 536
5.099124 IP 10.1.1.1.49153 > 10.1.1.2.8080: Flags [.], seq 211721:212257, ack 1, win 65535, length 536
5.099124 IP 10.1.1.2.8080 > 10.1.1.1.49153: Flags [.], ack 212257, win 65535, length 0
5.110116 IP 10.1.1.1.49153 > 10.1.1.2.8080: Flags [.], seq 212257:212793, ack 1, win 65535, length 536
5.111041 IP 10.1.1.1.49153 > 10.1.1.2.8080: Flags [.], seq 212793:213329, ack 1, win 65535, length 536
5.111041 IP 10.1.1.2.8080 > 10.1.1.1.49153: Flags [.], ack 213329, win 65535, length 0
5.122033 IP 10.1.1.1.49153 > 10.1.1.2.8080: Flags [.], seq 213329:213865, ack 1, win 65535, length 536
5.122958 IP 10.1.1.1.49153 > 10.1.1.2.8080: Flags [.], seq 213865:214401, ack 1, win 65535, length 536
5.122958 IP 10.1.1.2.8080 > 10.1.1.1.49153: Flags [.], ack 214401, win 65535, length 0
5.133950 IP 10.1.1.1.49153 > 10.1.1.2.8080: Flags [.], seq 214401:214937, ack 1, win 65535, length 536
5.134875 IP 10.1.1.1.49153 > 10.1.1.2.8080: Flags [.], seq 214937:215473, ack 1, win 65535, length 536
5.134875 IP 10.1.1.2.8080 > 10.1.1.1.49153: Flags [.], ack 215473, win 65535, length 0
5.135800 IP 10.1.1.1.49153 > 10.1.1.2.8080: Flags [.], seq 215473:216009, ack 1, win 65535, length 536
5.145867 IP 10.1.1.1.49153 > 10.1.1.2.8080: Flags [.], seq 216009:216545, ack 1, win 65535, length 536
5.145867 IP 10.1.1.2.8080 > 10.1.1.1.49153: Flags [.], ack 216545, win 65535, length 0
5.146792 IP 10.1.1.1.49153 > 10.1.1.2.8080: Flags [.], seq 216545:217081, ack 1, win 65535, length 536
5.156859 IP 10.1.1.1.49153 > 10.1.1.2.8080: Flags [.], seq 217081:217617, ack 1, win 65535, length 536
5.156859 IP 10.1.1.2.8080 > 10.1.1.1.49153: Flags [.], ack 217617, win 65535, length 0
5.157784 IP 10.1.1.1.49153 > 10.1.1.2.8080: Flags [.], seq 217617:218153, ack 1, win 65535, length 536
5.167851 IP 10.1.1.1.49153 > 10.1.1.2.8080: Flags [.], seq 218153:218689, ack 1, win 65535, length 536
5.167851 IP 10.1.1.2.8080 > 10.1.1.1.49153: Flags [.], ack 218689, win 65535, length 0
5.168776 IP 10.1.1.1.49153 > 10.1.1.2.8080: Flags [.], seq 218689:219225, ack 1, win 65535, length 536
5.169700 IP 10.1.1.1.49153 > 10.1.1.2.8080: Flags [.], seq 219225:219761, ack 1, win 65535, length 536
5.169700 IP 10.1.1.2.8080 > 10.1.1.1.49153: Flags [.], ack 219761, win 65535, length 0
5.178843 IP 10.1.1.1.49153 > 10.1.1.2.8080: Flags [.], seq 219761:220297, ack 1, win 65535, length 536
5.180692 IP 10.1.1.1.49153 > 10.1.1.2.8080: Flags [.], seq 220833:221369, ack 1, win 65535, length 536
5.180692 IP 10.1.1.2.8080 > 10.1.1.1.49153: Flags [.], ack 220297, win 65535, length 0
5.181617 IP 10.1.1.1.49153 > 10.1.1.2.8080: Flags [.], seq 221369:221905, ack 1, win 65535, length 536
5.181617 IP 10.1.1.2.8080 > 10.1.1.1.49153: Flags [.], ack 220297, win 65535, length 0
5.191684 IP 10.1.1.1.49153 > 10.1.1.2.8080: Flags [.], seq 221905:222441, ack 1, win 65535, length 536
5.191684 IP 10.1.1.2.8080 > 10.1.1.1.49153: Flags [.], ack 220297, win 65535, length 0
5.391684 IP 10.1.1.1.49153 > 10.1.1.2.8080: Flags [.], seq 220297:220833, ack 1, win 65535, length 536
5.391684 IP 10.1.1.2.8080 > 10.1.1.1.49153: Flags [.], ack 222441, win 65535, length 0
5.402676 IP 10.1.1.1.49153 > 10.1.1.2.8080: Flags [.], seq 222441:222977, ack 1, win 65535, length 536
5.403601 IP 10.1.1.1.49153 > 10.1.1.2.8080: Flags [.], seq 222977:223513, ack 1, win 65535, length 536
5.403601 IP 10.1.1.2.8080 > 10.1.1.1.49153: Flags [.], ack 223513, win 65535, length 0
5.414593 IP 10.1.1.1.49153 > 10.1.1.2.8080: Flags [.], seq 223513:224049, ack 1, win 65535, length 536
5.415518 IP 10.1.1.1.49153 > 10.1.1.2.8080: Flags [.], seq 224049:224585, ack 1, win 65535, length 536
5.415518 IP 10.1.1.2.8080 > 10.1.1.1.49153: Flags [.], ack 224585, win 65535, length 0
5.427435 IP 10.1.1.1.49153 > 10.1.1.2.8080: Flags [.], seq 225121:225657, ack 1, win 65535, length 536
5.427435 IP 10.1.1.2.8080 > 10.1.1.1.49153: Flags [.], ack 224585, win 65535, length 0
5.626510 IP 10.1.1.1.49153 > 10.1.1.2.8080: Flags [.], seq 224585:225121, ack 1, win 65535, length 536
5.626510 IP 10.1.1.2.8080 > 10.1.1.1.49153: Flags [.], ack 225657, win 65535, length 0
5.637502 IP 10.1.1.1.49153 > 10.1.1.2.8080: Flags [.], seq 225657:226193, ack 1, win 65535, length 536
5.638427 IP 10.1.1.1.49153 > 10.1.1.2.8080: Flags [.], seq 226193:226729, ack 1, win 65535, length 536
5.638427 IP 10.1.1.2.8080 > 10.1.1.1.49153: Flags [.], ack 226729, win 65535, length 0
5.649419 IP 10.1.1.1.49153 > 10.1.1.2.8080: Flags [.], seq 226729:227265, ack 1, win 65535, length 536
5.650344 IP 10.1.1.1.49153 > 10.1.1.2.8080: Flags [.], seq 227265:227801, ack 1, win 65535, length 536
5.650344 IP 10.1.1.2.8080 > 10.1.1.1.49153: Flags [.], ack 227801, win 65535, length 0
5.661336 IP 10.1.1.1.49153 > 10.1.1.2.8080: Flags [.], seq 227801:228337, ack 1, win 65535, length 536
5.662260 IP 10.1.1.1.49153 > 10.1.1.2.8080: Flags [.], seq 228337:228873, ack 1, win 65535, length 536
5.662260 IP 10.1.1.2.8080 > 10.1.1.1.49153: Flags [.], ack 228873, win 65535, length 0
5.673252 IP 10.1.1.1.49153 > 10.1.1.2.8080: Flags [.], seq 228873:229409, ack 1, win 65535, length 536
5.674177 IP 10.1.1.1.49153 > 10.1.1.2.8080: Flags [.], seq 229409:229945, ack 1, win 65535, length 536
5.674177 IP 10.1.1.2.8080 > 10.1.1.1.49153: Flags [.], ack 229945, win 65535, length 0
5.675102 IP 10.1.1.1.49153 > 10.1.1.2.8080: Flags [.], seq 229945:230481, ack 1, win 65535, length 536
5.685169 IP 10.1.1.1.49153 > 10.1.1.2.8080: Flags [.], seq 230481:231017, ack 1, win 65535, length 536
5.685169 IP 10.1.1.2.8080 > 10.1.1.1.49153: Flags [.], ack 231017, win 65535, length 0
5.686094 IP 10.1.1.1.49153 > 10.1.1.2.8080: Flags [.], seq 231017:231553, ack 1, win 65535, length 536
5.696161 IP 10.1.1.1.49153 > 10.1.1.2.8080: Flags [.], seq 231553:232089, ack 1, win 65535, length 536
5.696161 IP 10.1.1.2.8080 > 10.1.1.1.49153: Flags [.], ack 232089, win 65535, length 0
5.697086 IP 10.1.1.1.49153 > 10.1.1.2.8080: Flags [.], seq 232089:232625, ack 1, win 65535, length 536
5.707153 IP 10.1.1.1.49153 > 10.1.1.2.8080: Flags [.], seq 232625:233161, ack 1, win 65535, length 536
5.707153 IP 10.1.1.2.8080 > 10.1.1.1.49153: Flags [.], ack 233161, win 65535, length 0
5.708078 IP 10.1.1.1.49153 > 10.1.1.2.8080: Flags [.], seq 233161:233697, ack 1, win 65535, length 536
5.709003 IP 10.1.1.1.49153 > 10.1.1.2.8080: Flags [.], seq 233697:234233, ack 1, win 65535, length 536
5.709003 IP 10.1.1.2.8080 > 10.1.1.1.49153: Flags [.], ack 234233, win 65535, length 0
5.718145 IP 10.1.1.1.49153 > 10.1.1.2.8080: Flags [.], seq 234233:234769, ack 1, win 65535, length 536
5.719070 IP 10.1.1.1.49153 > 10.1.1.2.8080: Flags [.], seq 234769:235305, ack 1, win 65535, length 536
5.719070 IP 10.1.1.2.8080 > 10.1.1.1.49153: Flags [.], ack 235305, win 65535, length 0
5.719995 IP 10.1.1.1.49153 > 10.1.1.2.8080: Flags [.], seq 235305:235841, ack 1, win 65535, length 536
5.720920 IP 10.1.1.1.49153 > 10.1.1.2.8080: Flags [.], seq 235841:236377, ack 1, win 65535, length 536
5.720920 IP 10.1.1.2.8080 > 10.1.1.1.49153: Flags [.], ack 236377, win 65535, length 0
5.730062 IP 10.1.1.1.49153 > 10.1.1.2.8080: Flags [.], seq 236377:236913, ack 1, win 65535, length 536
5.730987 IP 10.1.1.1.49153 > 10.1.1.2.8080: Flags [.], seq 236913:237449, ack 1, win 65535, length 536
5.730987 IP 10.1.1.2.8080 > 10.1.1.1.49153: Flags [.], ack 237449, win 65535, length 0
5.731912 IP 10.1.1.1.49153 > 10.1.1.2.8080: Flags [.], seq 237449:237985, ack 1, win 65535, length 536
5.732836 IP 10.1.1.1.49153 > 10.1.1.2.8080: Flags [.], seq 237985:238521, ack 1, win 65535, length 536
5.732836 IP 10.1.1.2.8080 > 10.1.1.1.49153: Flags [.], ack 238521, win 65535, length 0
5.741979 IP 10.1.1.1.49153 > 10.1.1.2.8080: Flags [.], seq 238521:239057, ack 1, win 65535, length 536
5.742904 IP 10.1.1.1.49153 > 10.1.1.2.8080: Flags [.], seq 239057:239593, ack 1, win 65535, length 536
5.742904 IP 10.1.1.2.8080 > 10.1.1.1.49153: Flags [.], ack 239593, win 65535, length 0
5.743828 IP 10.1.1.1.49153 > 10.1.1.2.8080: Flags [.], seq 239593:240129, ack 1, win 65535, length 536
5.744753 IP 10.1.1.1.49153 > 10.1.1.2.8080: Flags [.], seq 240129:240665, ack 1, win 65535, length 536
5.744753 IP 10.1.1.2.8080 > 10.1.1.1.49153: Flags [.], ack 240665, win 65535, length 0
5.745678 IP 10.1.1.1.49153 > 10.1.1.2.8080: Flags [.], seq 240665:241201, ack 1, win 65535, length 536
5.753896 IP 10.1.1.1.49153 > 10.1.1.2.8080: Flags [.], seq 241201:241737, ack 1, win 65535, length 536
5.753896 IP 10.1.1.2.8080 > 10.1.1.1.49153: Flags [.], ack 241737, win 65535, length 0
5.754820 IP 10.1.1.1.49153 > 10.1.1.2.8080: Flags [.], seq 241737:242273, ack 1, win 65535, length 536
5.755745 IP 10.1.1.1.49153 > 10.1.1.2.8080: Flags [.], seq 242273:242809, ack 1, win 65535, length 536
5.755745 IP 10.1.1.2.8080 > 10.1.1.1.49153: Flags [.], ack 242809, win 65535, length 0
5.756670 IP 10.1.1.1.49153 > 10.1.1.2.8080: Flags [.], seq 242809:243345, ack 1, win 65535, length 536
5.765812 IP 10.1.1.1.49153 > 10.1.1.2.8080: Flags [.], seq 243881:244417, ack 1, win 65535, length 536
5.765812 IP 10.1.1.2.8080 > 10.1.1.1.49153: Flags [.], ack 243345, win 65535, length 0
5.766737 IP 10.1.1.1.49153 > 10.1.1.2.8080: Flags [.], seq 244417:244953, ack 1, win 65535, length 536
5.766737 IP 10.1.1.2.8080 > 10.1.1.1.49153: Flags [.], ack 243345, win 65535, length 0
5.767662 IP 10.1.1.1.49153 > 10.1.1.2.8080: Flags [.], seq 244953:245489, ack 1, win 65535, length 536
5.767662 IP 10.1.1.2.8080 > 10.1.1.1.49153: Flags [.], ack 243345, win 65535, length 0
5.768587 IP 10.1.1.1.49153 > 10.1.1.2.8080: Flags [.], seq 245489:246025, ack 1, win 65535, length 536
5.768587 IP 10.1.1.2.8080 > 10.1.1.1.49153: Flags [.], ack 243345, win 65535, length 0
5.776804 IP 10.1.1.1.49153 > 10.1.1.2.8080: Flags [.], seq 246025:246561, ack 1, win 65535, length 536
5.776804 IP 10.1.1.2.8080 > 10.1.1.1.49153: Flags [.], ack 243345, win 65535, length 0
5.779579 IP 10.1.1.1.49153 > 10.1.1.2.8080: Flags [.], seq 243345:243881, ack 1, win 65535, length 536
5.779579 IP 10.1.1.2.8080 > 10.1.1.1.49153: Flags [.], ack 246561, win 65535, length 0
5.787796 IP 10.1.1.1.49153 > 10.1.1.2.8080: Flags [.], seq 246561:247097, ack 1, win 65535, length 536
5.790571 IP 10.1.1.1.49153 > 10.1.1.2.8080: Flags [.], seq 247097:247633, ack 1, win 65535, length 536
5.790571 IP 10.1.1.2.8080 > 10.1.1.1.49153: Flags [.], ack 247633, win 65535, length 0
5.791496 IP 10.1.1.1.49153 > 10.1.1.2.8080: Flags [.], seq 247633:248169, ack 1, win 65535, length 536
5.801563 IP 10.1.1.1.49153 > 10.1.1.2.8080: Flags [.], seq 248169:248705, ack 1, win 65535, length 536
5.801563 IP 10.1.1.2.8080 > 10.1.1.1.49153: Flags [.], ack 248705, win 65535, length 0
5.802488 IP 10.1.1.1.49153 > 10.1.1.2.8080: Flags [.], seq 248705:249241, ack 1, win 65535, length 536
5.812555 IP 10.1.1.1.49153 > 10.1.1.2.8080: Flags [.], seq 249241:249777, ack 1, win 65535, length 536
5.812555 IP 10.1.1.2.8080 > 10.1.1.1.49153: Flags [.], ack 249777, win 65535, length 0
5.813480 IP 10.1.1.1.49153 > 10.1.1.2.8080: Flags [.], seq 249777:250313, ack 1, win 65535, length 536
5.823547 IP 10.1.1.1.49153 > 10.1.1.2.8080: Flags [.], seq 250313:250849, ack 1, win 65535, length 536
5.823547 IP 10.1.1.2.8080 > 10.1.1.1.49153: Flags [.], ack 250849, win 65535, length 0
5.824472 IP 10.1.1.1.49153 > 10.1.1.2.8080: Flags [.], seq 250849:251385, ack 1, win 65535, length 536
5.825396 IP 10.1.1.1.49153 > 10.1.1.2.8080: Flags [.], seq 251385:251921, ack 1, win 65535, length 536
5.825396 IP 10.1.1.2.8080 > 10.1.1.1.49153: Flags [.], ack 251921, win 65535, length 0
5.834539 IP 10.1.1.1.49153 > 10.1.1.2.8080: Flags [.], seq 251921:252457, ack 1, win 65535, length 536
5.836388 IP 10.1.1.1.49153 > 10.1.1.2.8080: Flags [.], seq 252993:253529, ack 1, win 65535, length 536
5.836388 IP 10.1.1.2.8080 > 10.1.1.1.49153: Flags [.], ack 252457, win 65535, length 0
5.837313 IP 10.1.1.1.49153 > 10.1.1.2.8080: Flags [.], seq 253529:254065, ack 1, win 65535, length 536
5.837313 IP 10.1.1.2.8080 > 10.1.1.1.49153: Flags [.], ack 252457, win 65535, length 0
5.847380 IP 10.1.1.1.49153 > 10.1.1.2.8080: Flags [.], seq 254065:254601, ack 1, win 65535, length 536
5.847380 IP 10.1.1.2.8080 > 10.1.1.1.49153: Flags [.], ack 252457, win 65535, length 0
6.047380 IP 10.1.1.1.49153 > 10.1.1.2.8080: Flags [.], seq 252457:252993, ack 1, win 65535, length 536
6.047380 IP 10.1.1.2.8080 > 10.1.1.1.49153: Flags [.], ack 254601, win 65535, length 0
6.058372 IP 10.1.1.1.49153 > 10.1.1.2.8080: Flags [.], seq 254601:255137, ack 1, win 65535, length 536
6.059297 IP 10.1.1.1.49153 > 10.1.1.2.8080: Flags [.], seq 255137:255673, ack 1, win 65535, length 536
6.059297 IP 10.1.1.2.8080 > 10.1.1.1.49153: Flags [.], ack 255673, win 65535, length 0
6.070289 IP 10.1.1.1.49153 > 10.1.1.2.8080: Flags [.], seq 255673:256209, ack 1, win 65535, length 536
6.071214 IP 10.1.1.1.49153 > 10.1.1.2.8080: Flags [.], seq 256209:256745, ack 1, win 65535, length 536
6.071214 IP 10.1.1.2.8080 > 10.1.1.1.49153: Flags [.], ack 256745, win 65535, length 0
6.082206 IP 10.1.1.1.49153 > 10.1.1.2.8080: Flags [.], seq 256745:257281, ack 1, win 65535, length 536
6.083131 IP 10.1.1.1.49153 > 10.1.1.2.8080: Flags [.], seq 257281:257817, ack 1, win 65535, length 536
6.083131 IP 10.1.1.2.8080 > 10.1.1.1.49153: Flags [.], ack 257817, win 65535, length 0
6.094123 IP 10.1.1.1.49153 > 10.1.1.2.8080: Flags [.], seq 257817:258353, ack 1, win 65535, length 536
6.095048 IP 10.1.1.1.49153 > 10.1.1.2.8080: Flags [.], seq 258353:258889, ack 1, win 65535, length 536
6.095048 IP 10.1.1.2.8080 > 10.1.1.1.49153: Flags [.], ack 258889, win 65535, length 0
6.095972 IP 10.1.1.1.49153 > 10.1.1.2.8080: Flags [.], seq 258889:259425, ack 1, win 65535, length 536
6.106964 IP 10.1.1.1.49153 > 10.1.1.2.8080: Flags [.], seq 259961:260497, ack 1, win 65535, length 536
6.106964 IP 10.1.1.2.8080 > 10.1.1.1.49153: Flags [.], ack 259425, win 65535, length 0
6.117956 IP 10.1.1.1.49153 > 10.1.1.2.8080: Flags [.], seq 260497:261033, ack 1, win 65535, length 536
6.117956 IP 10.1.1.2.8080 > 10.1.1.1.49153: Flags [.], ack 259425, win 65535, length 0
6.317956 IP 10.1.1.1.49153 > 10.1.1.2.8080: Flags [.], seq 259425:259961, ack 1, win 65535, length 536
6.317956 IP 10.1.1.2.8080 > 10.1.1.1.49153: Flags [.], ack 261033, win 65535, length 0
6.328948 IP 10.1.1.1.49153 > 10.1.1.2.8080: Flags [.], seq 261033:261569, ack 1, win 65535, length 536
6.329873 IP 10.1.1.1.49153 > 10.1.1.2.8080: Flags [.], seq 261569:262105, ack 1, win 65535, length 536
6.329873 IP 10.1.1.2.8080 > 10.1.1.1.49153: Flags [.], ack 262105, win 65535, length 0
6.340865 IP 10.1.1.1.49153 > 10.1.1.2.8080: Flags [.], seq 262105:262641, ack 1, win 65535, length 536
6.341790 IP 10.1.1.1.49153 > 10.1.1.2.8080: Flags [.], seq 262641:263177, ack 1, win 65535, length 536
6.341790 IP 10.1.1.2.8080 > 10.1.1.1.49153: Flags [.], ack 263177, win 65535, length 0
6.352782 IP 10.1.1.1.49153 > 10.1.1.2.8080: Flags [.], seq 263177:263713, ack 1, win 65535, length 536
6.353707 IP 10.1.1.1.49153 > 10.1.1.2.8080: Flags [.], seq 263713:264249, ack 1, win 65535, length 536
6.353707 IP 10.1.1.2.8080 > 10.1.1.1.49153: Flags [.], ack 264249, win 65535, length 0
6.364699 IP 10.1.1.1.49153 > 10.1.1.2.8080: Flags [.], seq 264249:264785, ack 1, win 65535, length 536
6.365624 IP 10.1.1.1.49153 > 10.1.1.2.8080: Flags [.], seq 264785:265321, ack 1, win 65535, length 536
6.365624 IP 10.1.1.2.8080 > 10.1.1.1.49153: Flags [.], ack 265321, win 65535, length 0
6.366548 IP 10.1.1.1.49153 > 10.1.1.2.8080: Flags [.], seq 265321:265857, ack 1, win 65535, length 536
6.376616 IP 10.1.1.1.49153 > 10.1.1.2.8080: Flags [.], seq 265857:266393, ack 1, win 65535, length 536
6.376616 IP 10.1.1.2.8080 > 10.1.1.1.49153: Flags [.], ack 266393, win 65535, length 0
6.377540 IP 10.1.1.1.49153 > 10.1.1.2.8080: Flags [.], seq 266393:266929, ack 1, win 65535, length 536
6.577540 IP 10.1.1.2.8080 > 10.1.1.1.49153: Flags [.], ack 266929, win 65535, length 0
6.587608 IP 10.1.1.1.49153 > 10.1.1.2.8080: Flags [.], seq 266393:266929, ack 1, win 65535, length 536
6.587608 IP 10.1.1.2.8080 > 10.1.1.1.49153: Flags [.], ack 266929, win 65535, length 0
6.588532 IP 10.1.1.1.49153 > 10.1.1.2.8080: Flags [.], seq 266929:267465, ack 1, win 65535, length 536
6.589457 IP 10.1.1.1.49153 > 10.1.1.2.8080: Flags [.], seq 267465:268001, ack 1, win 65535, length 536
6.589457 IP 10.1.1.2.8080 > 10.1.1.1.49153: Flags [.], ack 268001, win 65535, length 0
6.600449 IP 10.1.1.1.49153 > 10.1.1.2.8080: Flags [.], seq 268001:268537, ack 1, win 65535, length 536
6.601374 IP 10.1.1.1.49153 > 10.1.1.2.8080: Flags [.], seq 268537:269073, ack 1, win 65535, length 536
6.601374 IP 10.1.1.2.8080 > 10.1.1.1.49153: Flags [.], ack 269073, win 65535, length 0
6.612366 IP 10.1.1.1.49153 > 10.1.1.2.8080: Flags [.], seq 269073:269609, ack 1, win 65535, length 536
6.613291 IP 10.1.1.1.49153 > 10.1.1.2.8080: Flags [.], seq 269609:270145, ack 1, win 65535, length 536
6.613291 IP 10.1.1.2.8080 > 10.1.1.1.49153: Flags [.], ack 270145, win 65535, length 0
6.624283 IP 10.1.1.1.49153 > 10.1.1.2.8080: Flags [.], seq 270145:270681, ack 1, win 65535, length 536
6.625208 IP 10.1.1.1.49153 > 10.1.1.2.8080: Flags [.], seq 270681:271217, ack 1, win 65535, length 536
6.625208 IP 10.1.1.2.8080 > 10.1.1.1.49153: Flags [.], ack 271217, win 65535, length 0
6.626132 IP 10.1.1.1.49153 > 10.1.1.2.8080: Flags [.], seq 271217:271753, ack 1, win 65535, length 536
6.636200 IP 10.1.1.1.49153 > 10.1.1.2.8080: Flags [.], seq 271753:272289, ack 1, win 65535, length 536
6.636200 IP 10.1.1.2.8080 > 10.1.1.1.49153: Flags [.], ack 272289, win 65535, length 0
6.637124 IP 10.1.1.1.49153 > 10.1.1.2.8080: Flags [.], seq 272289:272825, ack 1, win 65535, length 536
6.647192 IP 10.1.1.1.49153 > 10.1.1.2.8080: Flags [.], seq 272825:273361, ack 1, win 65535, length 536
6.647192 IP 10.1.1.2.8080 > 10.1.1.1.49153: Flags [.], ack 273361, win 65535, length 0
6.648116 IP 10.1.1.1.49153 > 10.1.1.2.8080: Flags [.], seq 273361:273897, ack 1, win 65535, length 536
6.659108 IP 10.1.1.1.49153 > 10.1.1.2.8080: Flags [.], seq 274433:274969, ack 1, win 65535, length 536
6.659108 IP 10.1.1.2.8080 > 10.1.1.1.49153: Flags [.], ack 273897, win 65535, length 0
6.660033 IP 10.1.1.1.49153 > 10.1.1.2.8080: Flags [.], seq 274969:275505, ack 1, win 65535, length 536
6.660033 IP 10.1.1.2.8080 > 10.1.1.1.49153: Flags [.], ack 273897, win 65535, length 0
6.670100 IP 10.1.1.1.49153 > 10.1.1.2.8080: Flags [.], seq 275505:276041, ack 1, win 65535, length 536
6.670100 IP 10.1.1.2.8080 > 10.1.1.1.49153: Flags [.], ack 273897, win 65535, length 0
6.870100 IP 10.1.1.1.49153 > 10.1.1.2.8080: Flags [.], seq 273897:274433, ack 1, win 65535, length 536
6.870100 IP 10.1.1.2.8080 > 10.1.1.1.49153: Flags [.], ack 276041, win 65535, length 0
6.881092 IP 10.1.1.1.49153 > 10.1.1.2.8080: Flags [.], seq 276041:276577, ack 1, win 65535, length 536
6.882017 IP 10.1.1.1.49153 > 10.1.1.2.8080: Flags [.], seq 276577:277113, ack 1, win 65535, length 536
6.882017 IP 10.1.1.2.8080 > 10.1.1.1.49153: Flags [.], ack 277113, win 65535, length 0
6.893009 IP 10.1.1.1.49153 > 10.1.1.2.8080: Flags [.], seq 277113:277649, ack 1, win 65535, length 536
6.893934 IP 10.1.1.1.49153 > 10.1.1.2.8080: Flags [.], seq 277649:278185, ack 1, win 65535, length 536
6.893934 IP 10.1.1.2.8080 > 10.1.1.1.49153: Flags [.], ack 278185, win 65535, length 0
6.904926 IP 10.1.1.1.49153 > 10.1.1.2.8080: Flags [.], seq 278185:278721, ack 1, win 65535, length 536
6.905851 IP 10.1.1.1.49153 > 10.1.1.2.8080: Flags [.], seq 278721:279257, ack 1, win 65535, length 536
6.905851 IP 10.1.1.2.8080 > 10.1.1.1.49153: Flags [.], ack 279257, win 65535, length 0
6.916843 IP 10.1.1.1.49153 > 10.1.1.2.8080: Flags [.], seq 279257:279793, ack 1, win 65535, length 536
6.917768 IP 10.1.1.1.49153 > 10.1.1.2.8080: Flags [.], seq 279793:280329, ack 1, win 65535, length 536
6.917768 IP 10.1.1.2.8080 > 10.1.1.1.49153: Flags [.], ack 280329, win 65535, length 0
6.928760 IP 10.1.1.1.49153 > 10.1.1.2.8080: Flags [.], seq 280865:281401, ack 1, win 65535, length 536
6.928760 IP 10.1.1.2.8080 > 10.1.1.1.49153: Flags [.], ack 280329, win 65535, length 0
6.929684 IP 10.1.1.1.49153 > 10.1.1.2.8080: Flags [.], seq 281401:281937, ack 1, win 65535, length 536
6.929684 IP 10.1.1.2.8080 > 10.1.1.1.49153: Flags [.], ack 280329, win 65535, length 0
7.128760 IP 10.1.1.1.49153 > 10.1.1.2.8080: Flags [.], seq 280329:280865, ack 1, win 65535, length 536
7.128760 IP 10.1.1.2.8080 > 10.1.1.1.49153: Flags [.], ack 281937, win 65535, length 0
7.139752 IP 10.1.1.1.49153 > 10.1.1.2.8080: Flags [.], seq 281937:282473, ack 1, win 65535, length 536
7.140676 IP 10.1.1.1.49153 > 10.1.1.2.8080: Flags [.], seq 282473:283009, ack 1, win 65535, length 536
7.140676 IP 10.1.1.2.8080 > 10.1.1.1.49153: Flags [.], ack 283009, win 65535, length 0
7.151668 IP 10.1.1.1.49153 > 10.1.1.2.8080: Flags [.], seq 283009:283545, ack 1, win 65535, length 536
7.152593 IP 10.1.1.1.49153 > 10.1.1.2.8080: Flags [.], seq 283545:284081, ack 1, win 65535, length 536
7.152593 IP 10.1.1.2.8080 > 10.1.1.1.49153: Flags [.], ack 284081, win 65535, length 0
7.164510 IP 10.1.1.1.49153 > 10.1.1.2.8080: Flags [.], seq 284617:285153, ack 1, win 65535, length 536
7.164510 IP 10.1.1.2.8080 > 10.1.1.1.49153: Flags [.], ack 284081, win 65535, length 0
7.363585 IP 10.1.1.1.49153 > 10.1.1.2.8080: Flags [.], seq 284081:284617, ack 1, win 65535, length 536
7.363585 IP 10.1.1.2.8080 > 10.1.1.1.49153: Flags [.], ack 285153, win 65535, length 0
7.374577 IP 10.1.1.1.49153 > 10.1.1.2.8080: Flags [.], seq 285153:285689, ack 1, win 65535, length 536
7.574577 IP 10.1.1.2.8080 > 10.1.1.1.49153: Flags [.], ack 285689, win 65535, length 0
7.585569 IP 10.1.1.1.49153 > 10.1.1.2.8080: Flags [.], seq 286225:286761, ack 1, win 65535, length 536
7.585569 IP 10.1.1.2.8080 > 10.1.1.1.49153: Flags [.], ack 285689, win 65535, length 0
7.785569 IP 10.1.1.1.49153 > 10.1.1.2.8080: Flags [.], seq 285689:286225, ack 1, win 65535, length 536
7.785569 IP 10.1.1.2.8080 > 10.1.1.1.49153: Flags [.], ack 286761, win 65535, length 0
7.797486 IP 10.1.1.1.49153 > 10.1.1.2.8080: Flags [.], seq 287297:287833, ack 1, win 65535, length 536
7.797486 IP 10.1.1.2.8080 > 10.1.1.1.49153: Flags [.], ack 286761, win 65535, length 0
8.196561 IP 10.1.1.1.49153 > 10.1.1.2.8080: Flags [.], seq 286761:287297, ack 1, win 65535, length 536
8.196561 IP 10.1.1.2.8080 > 10.1.1.1.49153: Flags [.], ack 287833, win 65535, length 0
8.207553 IP 10.1.1.1.49153 > 10.1.1.2.8080: Flags [.], seq 287833:288369, ack 1, win 65535, length 536
8.208478 IP 10.1.1.1.49153 > 10.1.1.2.8080: Flags [.], seq 288369:288905, ack 1, win 65535, length 536
8.208478 IP 10.1.1.2.8080 > 10.1.1.1.49153: Flags [.], ack 288905, win 65535, length 0
8.219470 IP 10.1.1.1.49153 > 10.1.1.2.8080: Flags [.], seq 288905:289441, ack 1, win 65535, length 536
8.220395 IP 10.1.1.1.49153 > 10.1.1.2.8080: Flags [.], seq 289441:289977, ack 1, win 65535, length 536
8.220395 IP 10.1.1.2.8080 > 10.1.1.1.49153: Flags [.], ack 289977, win 65535, length 0
8.231387 IP 10.1.1.1.49153 > 10.1.1.2.8080: Flags [.], seq 289977:290513, ack 1, win 65535, length 536
8.232312 IP 10.1.1.1.49153 > 10.1.1.2.8080: Flags [.], seq 290513:291049, ack 1, win 65535, length 536
8.232312 IP 10.1.1.2.8080 > 10.1.1.1.49153: Flags [.], ack 291049, win 65535, length 0
8.243304 IP 10.1.1.1.49153 > 10.1.1.2.8080: Flags [.], seq 291049:291585, ack 1, win 65535, length 536
8.244228 IP 10.1.1.1.49153 > 10.1.1.2.8080: Flags [.], seq 291585:292121, ack 1, win 65535, length 536
8.244228 IP 10.1.1.2.8080 > 10.1.1.1.49153: Flags [.], ack 292121, win 65535, length 0
8.245153 IP 10.1.1.1.49153 > 10.1.1.2.8080: Flags [.], seq 292121:292657, ack 1, win 65535, length 536
8.255220 IP 10.1.1.1.49153 > 10.1.1.2.8080: Flags [.], seq 292657:293193, ack 1, win 65535, length 536
8.255220 IP 10.1.1.2.8080 > 10.1.1.1.49153: Flags [.], ack 293193, win 65535, length 0
8.256145 IP 10.1.1.1.49153 > 10.1.1.2.8080: Flags [.], seq 293193:293729, ack 1, win 65535, length 536
8.266212 IP 10.1.1.1.49153 > 10.1.1.2.8080: Flags [.], seq 293729:294265, ack 1, win 65535, length 536
8.266212 IP 10.1.1.2.8080 > 10.1.1.1.49153: Flags [.], ack 294265, win 65535, length 0
8.277204 IP 10.1.1.1.49153 > 10.1.1.2.8080: Flags [.], seq 294801:295337, ack 1, win 65535, length 536
8.277204 IP 10.1.1.2.8080 > 10.1.1.1.49153: Flags [.], ack 294265, win 65535, length 0
8.278129 IP 10.1.1.1.49153 > 10.1.1.2.8080: Flags [.], seq 295337:295873, ack 1, win 65535, length 536
8.278129 IP 10.1.1.2.8080 > 10.1.1.1.49153: Flags [.], ack 294265, win 65535, length 0
8.279054 IP 10.1.1.1.49153 > 10.1.1.2.8080: Flags [.], seq 295873:296409, ack 1, win 65535, length 536
8.279054 IP 10.1.1.2.8080 > 10.1.1.1.49153: Flags [.], ack 294265, win 65535, length 0
8.290046 IP 10.1.1.1.49153 > 10.1.1.2.8080: Flags [.], seq 294265:294801, ack 1, win 65535, length 536
8.290046 IP 10.1.1.2.8080 > 10.1.1.1.49153: Flags [.], ack 296409, win 65535, length 0
8.301038 IP 10.1.1.1.49153 > 10.1.1.2.8080: Flags [.], seq 296409:296945, ack 1, win 65535, length 536
8.301963 IP 10.1.1.1.49153 > 10.1.1.2.8080: Flags [.], seq 296945:297481, ack 1, win 65535, length 536
8.301963 IP 10.1.1.2.8080 > 10.1.1.1.49153: Flags [.], ack 297481, win 65535, length 0
8.312955 IP 10.1.1.1.49153 > 10.1.1.2.8080: Flags [.], seq 297481:298017, ack 1, win 65535, length 536
8.313880 IP 10.1.1.1.49153 > 10.1.1.2.8080: Flags [.], seq 298017:298553, ack 1, win 65535, length 536
8.313880 IP 10.1.1.2.8080 > 10.1.1.1.49153: Flags [.], ack 298553, win 65535, length 0
8.324872 IP 10.1.1.1.49153 > 10.1.1.2.8080: Flags [.], seq 298553:299089, ack 1, win 65535, length 536
8.325796 IP 10.1.1.1.49153 > 10.1.1.2.8080: Flags [.], seq 299089:299625, ack 1, win 65535, length 536
8.325796 IP 10.1.1.2.8080 > 10.1.1.1.49153: Flags [.], ack 299625, win 65535, length 0
8.326721 IP 10.1.1.1.49153 > 10.1.1.2.8080: Flags [.], seq 299625:300161, ack 1, win 65535, length 536
8.336788 IP 10.1.1.1.49153 > 10.1.1.2.8080: Flags [.], seq 300161:300697, ack 1, win 65535, length 536
8.336788 IP 10.1.1.2.8080 > 10.1.1.1.49153: Flags [.], ack 300697, win 65535, length 0
8.337713 IP 10.1.1.1.49153 > 10.1.1.2.8080: Flags [.], seq 300697:301233, ack 1, win 65535, length 536
8.347780 IP 10.1.1.1.49153 > 10.1.1.2.8080: Flags [.], seq 301233:301769, ack 1, win 65535, length 536
8.347780 IP 10.1.1.2.8080 > 10.1.1.1.49153: Flags [.], ack 301769, win 65535, length 0
8.359697 IP 10.1.1.1.49153 > 10.1.1.2.8080: Flags [.], seq 302841:303377, ack 1, win 65535, length 536
8.359697 IP 10.1.1.2.8080 > 10.1.1.1.49153: Flags [.], ack 301769, win 65535, length 0
8.360622 IP 10.1.1.1.49153 > 10.1.1.2.8080: Flags [.], seq 303377:303913, ack 1, win 65535, length 536
8.360622 IP 10.1.1.2.8080 > 10.1.1.1.49153: Flags [.], ack 301769, win 65535, length 0
8.558772 IP 10.1.1.1.49153 > 10.1.1.2.8080: Flags [.], seq 301769:302305, ack 1, win 65535, length 536
8.558772 IP 10.1.1.2.8080 > 10.1.1.1.49153: Flags [.], ack 302305, win 65535, length 0
8.569764 IP 10.1.1.1.49153 > 10.1.1.2.8080: Flags [.], seq 302305:302841, ack 1, win 65535, length 536
8.569764 IP 10.1.1.2.8080 > 10.1.1.1.49153: Flags [.], ack 303913, win 65535, length 0
8.570689 IP 10.1.1.1.49153 > 10.1.1.2.8080: Flags [.], seq 302841:303377, ack 1, win 65535, length 536
8.570689 IP 10.1.1.2.8080 > 10.1.1.1.49153: Flags [.], ack 303913, win 65535, length 0
8.580756 IP 10.1.1.1.49153 > 10.1.1.2.8080: Flags [.], seq 303913:304449, ack 1, win 65535, length 536
8.581681 IP 10.1.1.1.49153 > 10.1.1.2.8080: Flags [.], seq 304449:304985, ack 1, win 65535, length 536
8.581681 IP 10.1.1.2.8080 > 10.1.1.1.49153: Flags [.], ack 304985, win 65535, length 0
8.592673 IP 10.1.1.1.49153 > 10.1.1.2.8080: Flags [.], seq 304985:305521, ack 1, win 65535, length 536
8.593598 IP 10.1.1.1.49153 > 10.1.1.2.8080: Flags [.], seq 305521:306057, ack 1, win 65535, length 536
8.593598 IP 10.1.1.2.8080 > 10.1.1.1.49153: Flags [.], ack 306057, win 65535, length 0
8.604590 IP 10.1.1.1.49153 > 10.1.1.2.8080: Flags [.], seq 306057:306593, ack 1, win 65535, length 536
8.605515 IP 10.1.1.1.49153 > 10.1.1.2.8080: Flags [.], seq 306593:307129, ack 1, win 65535, length 536
8.605515 IP 10.1.1.2.8080 > 10.1.1.1.49153: Flags [.], ack 307129, win 65535, length 0
8.606440 IP 10.1.1.1.49153 > 10.1.1.2.8080: Flags [.], seq 307129:307665, ack 1, win 65535, length 536
8.616507 IP 10.1.1.1.49153 > 10.1.1.2.8080: Flags [.], seq 307665:308201, ack 1, win 65535, length 536
8.616507 IP 10.1.1.2.8080 > 10.1.1.1.49153: Flags [.], ack 308201, win 65535, length 0
8.627499 IP 10.1.1.1.49153 > 10.1.1.2.8080: Flags [.], seq 308737:309273, ack 1, win 65535, length 536
8.627499 IP 10.1.1.2.8080 > 10.1.1.1.49153: Flags [.], ack 308201, win 65535, length 0
8.628424 IP 10.1.1.1.49153 > 10.1.1.2.8080: Flags [.], seq 309273:309809, ack 1, win 65535, length 536
8.628424 IP 10.1.1.2.8080 > 10.1.1.1.49153: Flags [.], ack 308201, win 65535, length 0
9.227499 IP 10.1.1.1.49153 > 10.1.1.2.8080: Flags [.], seq 308201:308737, ack 1, win 65535, length 536
9.227499 IP 10.1.1.2.8080 > 10.1.1.1.49153: Flags [.], ack 309809, win 65535, length 0
9.238491 IP 10.1.1.1.49153 > 10.1.1.2.8080: Flags [.], seq 309809:310345, ack 1, win 65535, length 536
9.239416 IP 10.1.1.1.49153 > 10.1.1.2.8080: Flags [.], seq 310345:310881, ack 1, win 65535, length 536
9.239416 IP 10.1.1.2.8080 > 10.1.1.1.49153: Flags [.], ack 310881, win 65535, length 0
9.250408 IP 10.1.1.1.49153 > 10.1.1.2.8080: Flags [.], seq 310881:311417, ack 1, win 65535, length 536
9.251332 IP 10.1.1.1.49153 > 10.1.1.2.8080: Flags [.], seq 311417:311953, ack 1, win 65535, length 536
9.251332 IP 10.1.1.2.8080 > 10.1.1.1.49153: Flags [.], ack 311953, win 65535, length 0
9.262324 IP 10.1.1.1.49153 > 10.1.1.2.8080: Flags [.], seq 311953:312489, ack 1, win 65535, length 536
9.263249 IP 10.1.1.1.49153 > 10.1.1.2.8080: Flags [.], seq 312489:313025, ack 1, win 65535, length 536
9.263249 IP 10.1.1.2.8080 > 10.1.1.1.49153: Flags [.], ack 313025, win 65535, length 0
9.274241 IP 10.1.1.1.49153 > 10.1.1.2.8080: Flags [.], seq 313025:313561, ack 1, win 65535, length 536
9.275166 IP 10.1.1.1.49153 > 10.1.1.2.8080: Flags [.], seq 313561:314097, ack 1, win 65535, length 536
9.275166 IP 10.1.1.2.8080 > 10.1.1.1.49153: Flags [.], ack 314097, win 65535, length 0
9.286158 IP 10.1.1.1.49153 > 10.1.1.2.8080: Flags [.], seq 314633:315169, ack 1, win 65535, length 536
9.286158 IP 10.1.1.2.8080 > 10.1.1.1.49153: Flags [.], ack 314097, win 65535, length 0
9.287083 IP 10.1.1.1.49153 > 10.1.1.2.8080: Flags [.], seq 315169:315705, ack 1, win 65535, length 536
9.287083 IP 10.1.1.2.8080 > 10.1.1.1.49153: Flags [.], ack 314097, win 65535, length 0
9.486158 IP 10.1.1.1.49153 > 10.1.1.2.8080: Flags [.], seq 314097:314633, ack 1, win 65535, length 536
9.486158 IP 10.1.1.2.8080 > 10.1.1.1.49153: Flags [.], ack 315705, win 65535, length 0
9.497150 IP 10.1.1.1.49153 > 10.1.1.2.8080: Flags [.], seq 315705:316241, ack 1, win 65535, length 536
9.498075 IP 10.1.1.1.49153 > 10.1.1.2.8080: Flags [.], seq 316241:316777, ack 1, win 65535, length 536
9.498075 IP 10.1.1.2.8080 > 10.1.1.1.49153: Flags [.], ack 316777, win 65535, length 0
9.509067 IP 10.1.1.1.49153 > 10.1.1.2.8080: Flags [.], seq 316777:317313, ack 1, win 65535, length 536
9.509992 IP 10.1.1.1.49153 > 10.1.1.2.8080: Flags [.], seq 317313:317849, ack 1, win 65535, length 536
9.509992 IP 10.1.1.2.8080 > 10.1.1.1.49153: Flags [.], ack 317849, win 65535, length 0
9.520984 IP 10.1.1.1.49153 > 10.1.1.2.8080: Flags [.], seq 317849:318385, ack 1, win 65535, length 536
9.521908 IP 10.1.1.1.49153 > 10.1.1.2.8080: Flags [.], seq 318385:318921, ack 1, win 65535, length 536
9.521908 IP 10.1.1.2.8080 > 10.1.1.1.49153: Flags [.], ack 318921, win 65535, length 0
9.532900 IP 10.1.1.1.49153 > 10.1.1.2.8080: Flags [.], seq 318921:319457, ack 1, win 65535, length 536
9.534750 IP 10.1.1.1.49153 > 10.1.1.2.8080: Flags [.], seq 319993:320529, ack 1, win 65535, length 536
9.534750 IP 10.1.1.2.8080 > 10.1.1.1.49153: Flags [.], ack 319457, win 65535, length 0
9.545742 IP 10.1.1.1.49153 > 10.1.1.2.8080: Flags [.], seq 320529:321065, ack 1, win 65535, length 536
9.545742 IP 10.1.1.2.8080 > 10.1.1.1.49153: Flags [.], ack 319457, win 65535, length 0
9.745742 IP 10.1.1.1.49153 > 10.1.1.2.8080: Flags [.], seq 319457:319993, ack 1, win 65535, length 536
9.745742 IP 10.1.1.2.8080 > 10.1.1.1.49153: Flags [.], ack 321065, win 65535, length 0
9.756734 IP 10.1.1.1.49153 > 10.1.1.2.8080: Flags [.], seq 321065:321601, ack 1, win 65535, length 536
9.757659 IP 10.1.1.1.49153 > 10.1.1.2.8080: Flags [.], seq 321601:322137, ack 1, win 65535, length 536
9.757659 IP 10.1.1.2.8080 > 10.1.1.1.49153: Flags [.], ack 322137, win 65535, length 0
9.768651 IP 10.1.1.1.49153 > 10.1.1.2.8080: Flags [.], seq 322137:322673, ack 1, win 65535, length 536
9.769576 IP 10.1.1.1.49153 > 10.1.1.2.8080: Flags [.], seq 322673:323209, ack 1, win 65535, length 536
9.769576 IP 10.1.1.2.8080 > 10.1.1.1.49153: Flags [.], ack 323209, win 65535, length 0
9.780568 IP 10.1.1.1.49153 > 10.1.1.2.8080: Flags [.], seq 323209:323745, ack 1, win 65535, length 536
9.781492 IP 10.1.1.1.49153 > 10.1.1.2.8080: Flags [.], seq 323745:324281, ack 1, win 65535, length 536
9.781492 IP 10.1.1.2.8080 > 10.1.1.1.49153: Flags [.], ack 324281, win 65535, length 0
9.792484 IP 10.1.1.1.49153 > 10.1.1.2.8080: Flags [.], seq 324281:324817, ack 1, win 65535, length 536
9.793409 IP 10.1.1.1.49153 > 10.1.1.2.8080: Flags [.], seq 324817:325353, ack 1, win 65535, length 536
9.793409 IP 10.1.1.2.8080 > 10.1.1.1.49153: Flags [.], ack 325353, win 65535, length 0
9.794334 IP 10.1.1.1.49153 > 10.1.1.2.8080: Flags [.], seq 325353:325889, ack 1, win 65535, length 536
9.804401 IP 10.1.1.1.49153 > 10.1.1.2.8080: Flags [.], seq 325889:326425, ack 1, win 65535, length 536
9.804401 IP 10.1.1.2.8080 > 10.1.1.1.49153: Flags [.], ack 326425, win 65535, length 0
9.805326 IP 10.1.1.1.49153 > 10.1.1.2.8080: Flags [.], seq 326425:326961, ack 1, win 65535, length 536
9.815393 IP 10.1.1.1.49153 > 10.1.1.2.8080: Flags [.], seq 326961:327497, ack 1, win 65535, length 536
9.815393 IP 10.1.1.2.8080 > 10.1.1.1.49153: Flags [.], ack 327497, win 65535, length 0
9.816318 IP 10.1.1.1.49153 > 10.1.1.2.8080: Flags [.], seq 327497:328033, ack 1, win 65535, length 536
9.826385 IP 10.1.1.1.49153 > 10.1.1.2.8080: Flags [.], seq 328033:328569, ack 1, win 65535, length 536
9.826385 IP 10.1.1.2.8080 > 10.1.1.1.49153: Flags [.], ack 328569, win 65535, length 0
9.827310 IP 10.1.1.1.49153 > 10.1.1.2.8080: Flags [.], seq 328569:329105, ack 1, win 65535, length 536
9.828235 IP 10.1.1.1.49153 > 10.1.1.2.8080: Flags [.], seq 329105:329641, ack 1, win 65535, length 536
9.828235 IP 10.1.1.2.8080 > 10.1.1.1.49153: Flags [.], ack 329641, win 65535, length 0
9.837377 IP 10.1.1.1.49153 > 10.1.1.2.8080: Flags [.], seq 329641:330177, ack 1, win 65535, length 536
9.839227 IP 10.1.1.1.49153 > 10.1.1.2.8080: Flags [.], seq 330713:331249, ack 1, win 65535, length 536
9.839227 IP 10.1.1.2.8080 > 10.1.1.1.49153: Flags [.], ack 330177, win 65535, length 0
9.840152 IP 10.1.1.1.49153 > 10.1.1.2.8080: Flags [.], seq 331249:331785, ack 1, win 65535, length 536
9.840152 IP 10.1.1.2.8080 > 10.1.1.1.49153: Flags [.], ack 330177, win 65535, length 0
9.850219 IP 10.1.1.1.49153 > 10.1.1.2.8080: Flags [.], seq 331785:332321, ack 1, win 65535, length 536
9.850219 IP 10.1.1.2.8080 > 10.1.1.1.49153: Flags [.], ack 330177, win 65535, length 0
