1.000000 IP 10.1.1.1.49153 > 10.1.1.2.8080: Flags [S], seq 0, win 65535, length 0
1.010134 IP 10.1.1.2.8080 > 10.1.1.1.49153: Flags [S.], seq 0, ack 1, win 65535, length 0
1.010134 IP 10.1.1.1.49153 > 10.1.1.2.8080: Flags [.], ack 1, win 65535, length 0
1.010201 IP 10.1.1.1.49153 > 10.1.1.2.8080: Flags [.], seq 1:537, ack 1, win 65535, length 536
1.021193 IP 10.1.1.2.8080 > 10.1.1.1.49153: Flags [.], ack 537, win 65535, length 0
1.021193 IP 10.1.1.1.49153 > 10.1.1.2.8080: Flags [.], seq 537:1073, ack 1, win 65535, length 536
1.022118 IP 10.1.1.1.49153 > 10.1.1.2.8080: Flags [.], seq 1073:1609, ack 1, win 65535, length 536
1.033110 IP 10.1.1.2.8080 > 10.1.1.1.49153: Flags [.], ack 1609, win 65535, length 0
1.033110 IP 10.1.1.1.49153 > 10.1.1.2.8080: Flags [.], seq 1609:2145, ack 1, win 65535, length 536
1.034035 IP 10.1.1.1.49153 > 10.1.1.2.8080: Flags [.], seq 2145:2681, ack 1, win 65535, length 536
1.034960 IP 10.1.1.1.49153 > 10.1.1.2.8080: Flags [.], seq 2681:3217, ack 1, win 65535, length 536
1.045027 IP 10.1.1.2.8080 > 10.1.1.1.49153: Flags [.], ack 2681, win 65535, length 0
1.045027 IP 10.1.1.1.49153 > 10.1.1.2.8080: Flags [.], seq 3217:3753, ack 1, win 65535, length 536
1.045952 IP 10.1.1.1.49153 > 10.1.1.2.8080: Flags [.], seq 3753:4289, ack 1, win 65535, length 536
1.046876 IP 10.1.1.1.49153 > 10.1.1.2.8080: Flags [.], seq 4289:4825, ack 1, win 65535, length 536
1.056019 IP 10.1.1.2.8080 > 10.1.1.1.49153: Flags [.], ack 3753, win 65535, length 0
1.056019 IP 10.1.1.1.49153 > 10.1.1.2.8080: Flags [.], seq 4825:5361, ack 1, win 65535, length 536
1.056944 IP 10.1.1.1.49153 > 10.1.1.2.8080: Flags [.], seq 5361:5897, ack 1, win 65535, length 536
1.057868 IP 10.1.1.2.8080 > 10.1.1.1.49153: Flags [.], ack 4825, win 65535, length 0
1.057868 IP 10.1.1.1.49153 > 10.1.1.2.8080: Flags [.], seq 5897:6433, ack 1, win 65535, length 536
1.058793 IP 10.1.1.1.49153 > 10.1.1.2.8080: Flags [.], seq 6433:6969, ack 1, win 65535, length 536
1.059718 IP 10.1.1.1.49153 > 10.1.1.2.8080: Flags [.], seq 6969:7505, ack 1, win 65535, length 536
1.060643 IP 10.1.1.1.49153 > 10.1.1.2.8080: Flags [.], seq 7505:8041, ack 1, win 65535, length 536
1.067936 IP 10.1.1.2.8080 > 10.1.1.1.49153: Flags [.], ack 5897, win 65535, length 0
1.067936 IP 10.1.1.1.49153 > 10.1.1.2.8080: Flags [.], seq 8041:8577, ack 1, win 65535, length 536
1.068860 IP 10.1.1.1.49153 > 10.1.1.2.8080: Flags [.], seq 8577:9113, ack 1, win 65535, length 536
1.069785 IP 10.1.1.2.8080 > 10.1.1.1.49153: Flags [.], ack 6969, win 65535, length 0
1.069785 IP 10.1.1.1.49153 > 10.1.1.2.8080: Flags [.], seq 9113:9649, ack 1, win 65535, length 536
1.070710 IP 10.1.1.1.49153 > 10.1.1.2.8080: Flags [.], seq 9649:10185, ack 1, win 65535, length 536
1.071635 IP 10.1.1.2.8080 > 10.1.1.1.49153: Flags [.], ack 8041, win 65535, length 0
1.071635 IP 10.1.1.1.49153 > 10.1.1.2.8080: Flags [.], seq 10185:10721, ack 1, win 65535, length 536
1.072560 IP 10.1.1.1.49153 > 10.1.1.2.8080: Flags [.], seq 10721:11257, ack 1, win 65535, length 536
1.073484 IP 10.1.1.1.49153 > 10.1.1.2.8080: Flags [.], seq 11257:11793, ack 1, win 65535, length 536
1.074409 IP 10.1.1.1.49153 > 10.1.1.2.8080: Flags [.], seq 11793:12329, ack 1, win 65535, length 536
1.075334 IP 10.1.1.1.49153 > 10.1.1.2.8080: Flags [.], seq 12329:12865, ack 1, win 65535, length 536
1.079852 IP 10.1.1.2.8080 > 10.1.1.1.49153: Flags [.], ack 9113, win 65535, length 0
1.079852 IP 10.1.1.1.49153 > 10.1.1.2.8080: Flags [.], seq 12865:13401, ack 1, win 65535, length 536
1.080777 IP 10.1.1.1.49153 > 10.1.1.2.8080: Flags [.], seq 13401:13937, ack 1, win 65535, length 536
1.081702 IP 10.1.1.2.8080 > 10.1.1.1.49153: Flags [.], ack 10185, win 65535, length 0
1.081702 IP 10.1.1.1.49153 > 10.1.1.2.8080: Flags [.], seq 13937:14473, ack 1, win 65535, length 536
1.082627 IP 10.1.1.1.49153 > 10.1.1.2.8080: Flags [.], seq 14473:15009, ack 1, win 65535, length 536
1.083552 IP 10.1.1.2.8080 > 10.1.1.1.49153: Flags [.], ack 11257, win 65535, length 0
1.083552 IP 10.1.1.1.49153 > 10.1.1.2.8080: Flags [.], seq 15009:15545, ack 1, win 65535, length 536
1.084476 IP 10.1.1.1.49153 > 10.1.1.2.8080: Flags [.], seq 15545:16081, ack 1, win 65535, length 536
1.085401 IP 10.1.1.2.8080 > 10.1.1.1.49153: Flags [.], ack 12329, win 65535, length 0
1.085401 IP 10.1.1.1.49153 > 10.1.1.2.8080: Flags [.], seq 16081:16617, ack 1, win 65535, length 536
1.086326 IP 10.1.1.1.49153 > 10.1.1.2.8080: Flags [.], seq 16617:17153, ack 1, win 65535, length 536
1.087251 IP 10.1.1.1.49153 > 10.1.1.2.8080: Flags [.], seq 17153:17689, ack 1, win 65535, length 536
1.088176 IP 10.1.1.1.49153 > 10.1.1.2.8080: Flags [.], seq 17689:18225, ack 1, win 65535, length 536
1.089100 IP 10.1.1.1.49153 > 10.1.1.2.8080: Flags [.], seq 18225:18761, ack 1, win 65535, length 536
1.090025 IP 10.1.1.1.49153 > 10.1.1.2.8080: Flags [.], seq 18761:19297, ack 1, win 65535, length 536
1.090844 IP 10.1.1.2.8080 > 10.1.1.1.49153: Flags [.], ack 13401, win 65535, length 0
1.090950 IP 10.1.1.1.49153 > 10.1.1.2.8080: Flags [.], seq 19297:19833, ack 1, win 65535, length 536
1.091875 IP 10.1.1.1.49153 > 10.1.1.2.8080: Flags [.], seq 19833:20369, ack 1, win 65535, length 536
1.092694 IP 10.1.1.2.8080 > 10.1.1.1.49153: Flags [.], ack 14473, win 65535, length 0
1.092800 IP 10.1.1.1.49153 > 10.1.1.2.8080: Flags [.], seq 20369:20905, ack 1, win 65535, length 536
1.093724 IP 10.1.1.1.49153 > 10.1.1.2.8080: Flags [.], seq 20905:21441, ack 1, win 65535, length 536
1.094544 IP 10.1.1.2.8080 > 10.1.1.1.49153: Flags [.], ack 15545, win 65535, length 0
1.094649 IP 10.1.1.1.49153 > 10.1.1.2.8080: Flags [.], seq 21441:21977, ack 1, win 65535, length 536
1.095574 IP 10.1.1.1.49153 > 10.1.1.2.8080: Flags [.], seq 21977:22513, ack 1, win 65535, length 536
1.096393 IP 10.1.1.2.8080 > 10.1.1.1.49153: Flags [.], ack 16617, win 65535, length 0
1.096499 IP 10.1.1.1.49153 > 10.1.1.2.8080: Flags [.], seq 22513:23049, ack 1, win 65535, length 536
1.097424 IP 10.1.1.1.49153 > 10.1.1.2.8080: Flags [.], seq 23049:23585, ack 1, win 65535, length 536
1.098243 IP 10.1.1.2.8080 > 10.1.1.1.49153: Flags [.], ack 17689, win 65535, length 0
1.098348 IP 10.1.1.1.49153 > 10.1.1.2.8080: Flags [.], seq 23585:24121, ack 1, win 65535, length 536
1.099273 IP 10.1.1.1.49153 > 10.1.1.2.8080: Flags [.], seq 24121:24657, ack 1, win 65535, length 536
1.100092 IP 10.1.1.2.8080 > 10.1.1.1.49153: Flags [.], ack 18761, win 65535, length 0
1.100198 IP 10.1.1.1.49153 > 10.1.1.2.8080: Flags [.], seq 24657:25193, ack 1, win 65535, length 536
1.101123 IP 10.1.1.1.49153 > 10.1.1.2.8080: Flags [.], seq 25193:25729, ack 1, win 65535, length 536
1.101942 IP 10.1.1.2.8080 > 10.1.1.1.49153: Flags [.], ack 19833, win 65535, length 0
1.102048 IP 10.1.1.1.49153 > 10.1.1.2.8080: Flags [.], seq 25729:26265, ack 1, win 65535, length 536
1.102972 IP 10.1.1.1.49153 > 10.1.1.2.8080: Flags [.], seq 26265:26801, ack 1, win 65535, length 536
1.103792 IP 10.1.1.2.8080 > 10.1.1.1.49153: Flags [.], ack 20905, win 65535, length 0
1.103897 IP 10.1.1.1.49153 > 10.1.1.2.8080: Flags [.], seq 26801:27337, ack 1, win 65535, length 536
1.104822 IP 10.1.1.1.49153 > 10.1.1.2.8080: Flags [.], seq 27337:27873, ack 1, win 65535, length 536
1.105641 IP 10.1.1.2.8080 > 10.1.1.1.49153: Flags [.], ack 21977, win 65535, length 0
1.105747 IP 10.1.1.1.49153 > 10.1.1.2.8080: Flags [.], seq 27873:28409, ack 1, win 65535, length 536
1.106672 IP 10.1.1.1.49153 > 10.1.1.2.8080: Flags [.], seq 28409:28945, ack 1, win 65535, length 536
1.107491 IP 10.1.1.2.8080 > 10.1.1.1.49153: Flags [.], ack 23049, win 65535, length 0
1.107596 IP 10.1.1.1.49153 > 10.1.1.2.8080: Flags [.], seq 28945:29481, ack 1, win 65535, length 536
1.108521 IP 10.1.1.1.49153 > 10.1.1.2.8080: Flags [.], seq 29481:30017, ack 1, win 65535, length 536
1.109340 IP 10.1.1.2.8080 > 10.1.1.1.49153: Flags [.], ack 24121, win 65535, length 0
1.109446 IP 10.1.1.1.49153 > 10.1.1.2.8080: Flags [.], seq 30017:30553, ack 1, win 65535, length 536
1.110371 IP 10.1.1.1.49153 > 10.1.1.2.8080: Flags [.], seq 30553:31089, ack 1, win 65535, length 536
1.111190 IP 10.1.1.2.8080 > 10.1.1.1.49153: Flags [.], ack 25193, win 65535, length 0
1.111296 IP 10.1.1.1.49153 > 10.1.1.2.8080: Flags [.], seq 31089:31625, ack 1, win 65535, length 536
1.112220 IP 10.1.1.1.49153 > 10.1.1.2.8080: Flags [.], seq 31625:32161, ack 1, win 65535, length 536
1.113040 IP 10.1.1.2.8080 > 10.1.1.1.49153: Flags [.], ack 26265, win 65535, length 0
1.113145 IP 10.1.1.1.49153 > 10.1.1.2.8080: Flags [.], seq 32161:32697, ack 1, win 65535, length 536
1.114070 IP 10.1.1.1.49153 > 10.1.1.2.8080: Flags [.], seq 32697:33233, ack 1, win 65535, length 536
1.114889 IP 10.1.1.2.8080 > 10.1.1.1.49153: Flags [.], ack 27337, win 65535, length 0
1.114995 IP 10.1.1.1.49153 > 10.1.1.2.8080: Flags [.], seq 33769:34305, ack 1, win 65535, length 536
1.115920 IP 10.1.1.1.49153 > 10.1.1.2.8080: Flags [.], seq 34305:34841, ack 1, win 65535, length 536
1.116739 IP 10.1.1.2.8080 > 10.1.1.1.49153: Flags [.], ack 28409, win 65535, length 0
1.116844 IP 10.1.1.1.49153 > 10.1.1.2.8080: Flags [.], seq 35377:35913, ack 1, win 65535, length 536
1.117769 IP 10.1.1.1.49153 > 10.1.1.2.8080: Flags [.], seq 35913:36449, ack 1, win 65535, length 536
1.118588 IP 10.1.1.2.8080 > 10.1.1.1.49153: Flags [.], ack 29481, win 65535, length 0
1.118694 IP 10.1.1.1.49153 > 10.1.1.2.8080: Flags [.], seq 36985:37521, ack 1, win 65535, length 536
1.119619 IP 10.1.1.1.49153 > 10.1.1.2.8080: Flags [.], seq 37521:38057, ack 1, win 65535, length 536
1.120438 IP 10.1.1.2.8080 > 10.1.1.1.49153: Flags [.], ack 30553, win 65535, length 0
1.120544 IP 10.1.1.1.49153 > 10.1.1.2.8080: Flags [.], seq 38593:39129, ack 1, win 65535, length 536
1.121468 IP 10.1.1.1.49153 > 10.1.1.2.8080: Flags [.], seq 39129:39665, ack 1, win 65535, length 536
1.122288 IP 10.1.1.2.8080 > 10.1.1.1.49153: Flags [.], ack 31625, win 65535, length 0
1.122393 IP 10.1.1.1.49153 > 10.1.1.2.8080: Flags [.], seq 40201:40737, ack 1, win 65535, length 536
1.123318 IP 10.1.1.1.49153 > 10.1.1.2.8080: Flags [.], seq 40737:41273, ack 1, win 65535, length 536
1.124137 IP 10.1.1.2.8080 > 10.1.1.1.49153: Flags [.], ack 32697, win 65535, length 0
1.124243 IP 10.1.1.1.49153 > 10.1.1.2.8080: Flags [.], seq 41809:42345, ack 1, win 65535, length 536
1.125168 IP 10.1.1.1.49153 > 10.1.1.2.8080: Flags [.], seq 42345:42881, ack 1, win 65535, length 536
1.125987 IP 10.1.1.2.8080 > 10.1.1.1.49153: Flags [.], ack 33233, win 65535, length 0
1.126092 IP 10.1.1.1.49153 > 10.1.1.2.8080: Flags [.], seq 43417:43953, ack 1, win 65535, length 536
1.126912 IP 10.1.1.2.8080 > 10.1.1.1.49153: Flags [.], ack 33233, win 65535, length 0
1.127017 IP 10.1.1.1.49153 > 10.1.1.2.8080: Flags [.], seq 43953:44489, ack 1, win 65535, length 536
1.127836 IP 10.1.1.2.8080 > 10.1.1.1.49153: Flags [.], ack 33233, win 65535, length 0
1.127942 IP 10.1.1.1.49153 > 10.1.1.2.8080: Flags [.], seq 45025:45561, ack 1, win 65535, length 536
1.128761 IP 10.1.1.2.8080 > 10.1.1.1.49153: Flags [.], ack 33233, win 65535, length 0
1.128867 IP 10.1.1.1.49153 > 10.1.1.2.8080: Flags [.], seq 45561:46097, ack 1, win 65535, length 536
1.129686 IP 10.1.1.2.8080 > 10.1.1.1.49153: Flags [.], ack 33233, win 65535, length 0
1.129792 IP 10.1.1.1.49153 > 10.1.1.2.8080: Flags [.], seq 46633:47169, ack 1, win 65535, length 536
1.130611 IP 10.1.1.2.8080 > 10.1.1.1.49153: Flags [.], ack 33233, win 65535, length 0
1.130716 IP 10.1.1.1.49153 > 10.1.1.2.8080: Flags [.], seq 47169:47705, ack 1, win 65535, length 536
1.131536 IP 10.1.1.2.8080 > 10.1.1.1.49153: Flags [.], ack 33233, win 65535, length 0
1.131641 IP 10.1.1.1.49153 > 10.1.1.2.8080: Flags [.], seq 48241:48777, ack 1, win 65535, length 536
1.132460 IP 10.1.1.2.8080 > 10.1.1.1.49153: Flags [.], ack 33233, win 65535, length 0
1.132566 IP 10.1.1.1.49153 > 10.1.1.2.8080: Flags [.], seq 48777:49313, ack 1, win 65535, length 536
1.133385 IP 10.1.1.2.8080 > 10.1.1.1.49153: Flags [.], ack 33233, win 65535, length 0
1.133491 IP 10.1.1.1.49153 > 10.1.1.2.8080: Flags [.], seq 49849:50385, ack 1, win 65535, length 536
1.134310 IP 10.1.1.2.8080 > 10.1.1.1.49153: Flags [.], ack 33233, win 65535, length 0
1.134416 IP 10.1.1.1.49153 > 10.1.1.2.8080: Flags [.], seq 50385:50921, ack 1, win 65535, length 536
1.135235 IP 10.1.1.2.8080 > 10.1.1.1.49153: Flags [.], ack 33233, win 65535, length 0
1.135340 IP 10.1.1.1.49153 > 10.1.1.2.8080: Flags [.], seq 33233:33769, ack 1, win 65535, length 536
1.136160 IP 10.1.1.2.8080 > 10.1.1.1.49153: Flags [.], ack 33233, win 65535, length 0
1.137084 IP 10.1.1.2.8080 > 10.1.1.1.49153: Flags [.], ack 33233, win 65535, length 0
1.138009 IP 10.1.1.2.8080 > 10.1.1.1.49153: Flags [.], ack 33233, win 65535, length 0
1.138934 IP 10.1.1.2.8080 > 10.1.1.1.49153: Flags [.], ack 33233, win 65535, length 0
1.139859 IP 10.1.1.2.8080 > 10.1.1.1.49153: Flags [.], ack 33233, win 65535, length 0
1.140784 IP 10.1.1.2.8080 > 10.1.1.1.49153: Flags [.], ack 33233, win 65535, length 0
1.141708 IP 10.1.1.2.8080 > 10.1.1.1.49153: Flags [.], ack 33233, win 65535, length 0
1.142633 IP 10.1.1.2.8080 > 10.1.1.1.49153: Flags [.], ack 33233, win 65535, length 0
1.142633 IP 10.1.1.1.49153 > 10.1.1.2.8080: Flags [.], seq 50921:51457, ack 1, win 65535, length 536
1.143558 IP 10.1.1.2.8080 > 10.1.1.1.49153: Flags [.], ack 33233, win 65535, length 0
1.143558 IP 10.1.1.1.49153 > 10.1.1.2.8080: Flags [.], seq 51457:51993, ack 1, win 65535, length 536
1.144483 IP 10.1.1.2.8080 > 10.1.1.1.49153: Flags [.], ack 33233, win 65535, length 0
1.144483 IP 10.1.1.1.49153 > 10.1.1.2.8080: Flags [.], seq 51993:52529, ack 1, win 65535, length 536
1.145408 IP 10.1.1.2.8080 > 10.1.1.1.49153: Flags [.], ack 33233, win 65535, length 0
1.145408 IP 10.1.1.1.49153 > 10.1.1.2.8080: Flags [.], seq 52529:53065, ack 1, win 65535, length 536
1.146332 IP 10.1.1.2.8080 > 10.1.1.1.49153: Flags [.], ack 34841, win 65535, length 0
1.153625 IP 10.1.1.2.8080 > 10.1.1.1.49153: Flags [.], ack 34841, win 65535, length 0
1.154550 IP 10.1.1.2.8080 > 10.1.1.1.49153: Flags [.], ack 34841, win 65535, length 0
1.155475 IP 10.1.1.2.8080 > 10.1.1.1.49153: Flags [.], ack 34841, win 65535, length 0
1.155475 IP 10.1.1.1.49153 > 10.1.1.2.8080: Flags [.], seq 34841:35377, ack 1, win 65535, length 536
1.156400 IP 10.1.1.2.8080 > 10.1.1.1.49153: Flags [.], ack 34841, win 65535, length 0
1.166467 IP 10.1.1.2.8080 > 10.1.1.1.49153: Flags [.], ack 36449, win 65535, length 0
1.366467 IP 10.1.1.1.49153 > 10.1.1.2.8080: Flags [.], seq 36449:36985, ack 1, win 65535, length 536
1.377459 IP 10.1.1.2.8080 > 10.1.1.1.49153: Flags [.], ack 38057, win 65535, length 0
1.377459 IP 10.1.1.1.49153 > 10.1.1.2.8080: Flags [.], seq 38057:38593, ack 1, win 65535, length 536
1.378384 IP 10.1.1.1.49153 > 10.1.1.2.8080: Flags [.], seq 38593:39129, ack 1, win 65535, length 536
1.388451 IP 10.1.1.2.8080 > 10.1.1.1.49153: Flags [.], ack 39665, win 65535, length 0
1.388451 IP 10.1.1.1.49153 > 10.1.1.2.8080: Flags [.], seq 39665:40201, ack 1, win 65535, length 536
1.389376 IP 10.1.1.2.8080 > 10.1.1.1.49153: Flags [.], ack 39665, win 65535, length 0
1.389376 IP 10.1.1.1.49153 > 10.1.1.2.8080: Flags [.], seq 40201:40737, ack 1, win 65535, length 536
1.390300 IP 10.1.1.1.49153 > 10.1.1.2.8080: Flags [.], seq 40737:41273, ack 1, win 65535, length 536
1.399443 IP 10.1.1.2.8080 > 10.1.1.1.49153: Flags [.], ack 41273, win 65535, length 0
1.399443 IP 10.1.1.1.49153 > 10.1.1.2.8080: Flags [.], seq 41273:41809, ack 1, win 65535, length 536
1.400368 IP 10.1.1.2.8080 > 10.1.1.1.49153: Flags [.], ack 41273, win 65535, length 0
1.400368 IP 10.1.1.1.49153 > 10.1.1.2.8080: Flags [.], seq 41809:42345, ack 1, win 65535, length 536
1.401292 IP 10.1.1.2.8080 > 10.1.1.1.49153: Flags [.], ack 41273, win 65535, length 0
1.401292 IP 10.1.1.1.49153 > 10.1.1.2.8080: Flags [.], seq 42345:42881, ack 1, win 65535, length 536
1.402217 IP 10.1.1.1.49153 > 10.1.1.2.8080: Flags [.], seq 42881:43417, ack 1, win 65535, length 536
1.410435 IP 10.1.1.2.8080 > 10.1.1.1.49153: Flags [.], ack 42881, win 65535, length 0
1.410435 IP 10.1.1.1.49153 > 10.1.1.2.8080: Flags [.], seq 43417:43953, ack 1, win 65535, length 536
1.411360 IP 10.1.1.2.8080 > 10.1.1.1.49153: Flags [.], ack 42881, win 65535, length 0
1.411360 IP 10.1.1.1.49153 > 10.1.1.2.8080: Flags [.], seq 43953:44489, ack 1, win 65535, length 536
1.412284 IP 10.1.1.2.8080 > 10.1.1.1.49153: Flags [.], ack 42881, win 65535, length 0
1.412284 IP 10.1.1.1.49153 > 10.1.1.2.8080: Flags [.], seq 44489:45025, ack 1, win 65535, length 536
1.413209 IP 10.1.1.2.8080 > 10.1.1.1.49153: Flags [.], ack 44489, win 65535, length 0
1.413209 IP 10.1.1.1.49153 > 10.1.1.2.8080: Flags [.], seq 45025:45561, ack 1, win 65535, length 536
1.414134 IP 10.1.1.1.49153 > 10.1.1.2.8080: Flags [.], seq 45561:46097, ack 1, win 65535, length 536
1.415059 IP 10.1.1.1.49153 > 10.1.1.2.8080: Flags [.], seq 46097:46633, ack 1, win 65535, length 536
1.415984 IP 10.1.1.1.49153 > 10.1.1.2.8080: Flags [.], seq 46633:47169, ack 1, win 65535, length 536
1.416908 IP 10.1.1.1.49153 > 10.1.1.2.8080: Flags [.], seq 47169:47705, ack 1, win 65535, length 536
1.421427 IP 10.1.1.2.8080 > 10.1.1.1.49153: Flags [.], ack 44489, win 65535, length 0
1.422352 IP 10.1.1.2.8080 > 10.1.1.1.49153: Flags [.], ack 44489, win 65535, length 0
1.423276 IP 10.1.1.2.8080 > 10.1.1.1.49153: Flags [.], ack 46097, win 65535, length 0
1.423276 IP 10.1.1.1.49153 > 10.1.1.2.8080: Flags [.], seq 47705:48241, ack 1, win 65535, length 536
1.424201 IP 10.1.1.2.8080 > 10.1.1.1.49153: Flags [.], ack 46097, win 65535, length 0
1.424201 IP 10.1.1.1.49153 > 10.1.1.2.8080: Flags [.], seq 48241:48777, ack 1, win 65535, length 536
1.425126 IP 10.1.1.2.8080 > 10.1.1.1.49153: Flags [.], ack 46097, win 65535, length 0
1.425126 IP 10.1.1.1.49153 > 10.1.1.2.8080: Flags [.], seq 48777:49313, ack 1, win 65535, length 536
1.426051 IP 10.1.1.2.8080 > 10.1.1.1.49153: Flags [.], ack 47705, win 65535, length 0
1.426051 IP 10.1.1.1.49153 > 10.1.1.2.8080: Flags [.], seq 49313:49849, ack 1, win 65535, length 536
1.426976 IP 10.1.1.2.8080 > 10.1.1.1.49153: Flags [.], ack 47705, win 65535, length 0
1.426976 IP 10.1.1.1.49153 > 10.1.1.2.8080: Flags [.], seq 49849:50385, ack 1, win 65535, length 536
1.427900 IP 10.1.1.2.8080 > 10.1.1.1.49153: Flags [.], ack 47705, win 65535, length 0
1.427900 IP 10.1.1.1.49153 > 10.1.1.2.8080: Flags [.], seq 50385:50921, ack 1, win 65535, length 536
1.428825 IP 10.1.1.1.49153 > 10.1.1.2.8080: Flags [.], seq 50921:51457, ack 1, win 65535, length 536
1.429750 IP 10.1.1.1.49153 > 10.1.1.2.8080: Flags [.], seq 51457:51993, ack 1, win 65535, length 536
1.434268 IP 10.1.1.2.8080 > 10.1.1.1.49153: Flags [.], ack 49313, win 65535, length 0
1.434268 IP 10.1.1.1.49153 > 10.1.1.2.8080: Flags [.], seq 51993:52529, ack 1, win 65535, length 536
1.435193 IP 10.1.1.2.8080 > 10.1.1.1.49153: Flags [.], ack 49313, win 65535, length 0
1.435193 IP 10.1.1.1.49153 > 10.1.1.2.8080: Flags [.], seq 52529:53065, ack 1, win 65535, length 536
1.436118 IP 10.1.1.2.8080 > 10.1.1.1.49153: Flags [.], ack 49313, win 65535, length 0
1.436118 IP 10.1.1.1.49153 > 10.1.1.2.8080: Flags [.], seq 53065:53601, ack 1, win 65535, length 536
1.437043 IP 10.1.1.2.8080 > 10.1.1.1.49153: Flags [.], ack 53065, win 65535, length 0
1.437043 IP 10.1.1.1.49153 > 10.1.1.2.8080: Flags [.], seq 53601:54137, ack 1, win 65535, length 536
1.437968 IP 10.1.1.2.8080 > 10.1.1.1.49153: Flags [.], ack 53065, win 65535, length 0
1.437968 IP 10.1.1.1.49153 > 10.1.1.2.8080: Flags [.], seq 54137:54673, ack 1, win 65535, length 536
1.438892 IP 10.1.1.2.8080 > 10.1.1.1.49153: Flags [.], ack 53065, win 65535, length 0
1.438892 IP 10.1.1.1.49153 > 10.1.1.2.8080: Flags [.], seq 54673:55209, ack 1, win 65535, length 536
1.439817 IP 10.1.1.2.8080 > 10.1.1.1.49153: Flags [.], ack 53065, win 65535, length 0
1.439817 IP 10.1.1.1.49153 > 10.1.1.2.8080: Flags [.], seq 55209:55745, ack 1, win 65535, length 536
1.440742 IP 10.1.1.2.8080 > 10.1.1.1.49153: Flags [.], ack 53065, win 65535, length 0
1.440742 IP 10.1.1.1.49153 > 10.1.1.2.8080: Flags [.], seq 55745:56281, ack 1, win 65535, length 536
1.441667 IP 10.1.1.1.49153 > 10.1.1.2.8080: Flags [.], seq 56281:56817, ack 1, win 65535, length 536
1.442592 IP 10.1.1.1.49153 > 10.1.1.2.8080: Flags [.], seq 56817:57353, ack 1, win 65535, length 536
1.443516 IP 10.1.1.1.49153 > 10.1.1.2.8080: Flags [.], seq 57353:57889, ack 1, win 65535, length 536
1.444441 IP 10.1.1.1.49153 > 10.1.1.2.8080: Flags [.], seq 57889:58425, ack 1, win 65535, length 536
1.445260 IP 10.1.1.2.8080 > 10.1.1.1.49153: Flags [.], ack 53065, win 65535, length 0
1.445366 IP 10.1.1.1.49153 > 10.1.1.2.8080: Flags [.], seq 53065:53601, ack 1, win 65535, length 536
1.446185 IP 10.1.1.2.8080 > 10.1.1.1.49153: Flags [.], ack 53065, win 65535, length 0
1.446291 IP 10.1.1.1.49153 > 10.1.1.2.8080: Flags [.], seq 58425:58961, ack 1, win 65535, length 536
1.448035 IP 10.1.1.2.8080 > 10.1.1.1.49153: Flags [.], ack 54137, win 65535, length 0
1.449884 IP 10.1.1.2.8080 > 10.1.1.1.49153: Flags [.], ack 55209, win 65535, length 0
1.451734 IP 10.1.1.2.8080 > 10.1.1.1.49153: Flags [.], ack 56281, win 65535, length 0
1.453584 IP 10.1.1.2.8080 > 10.1.1.1.49153: Flags [.], ack 57353, win 65535, length 0
1.453584 IP 10.1.1.1.49153 > 10.1.1.2.8080: Flags [.], seq 58961:59497, ack 1, win 65535, length 536
1.454508 IP 10.1.1.1.49153 > 10.1.1.2.8080: Flags [.], seq 59497:60033, ack 1, win 65535, length 536
1.455433 IP 10.1.1.2.8080 > 10.1.1.1.49153: Flags [.], ack 58425, win 65535, length 0
1.455433 IP 10.1.1.1.49153 > 10.1.1.2.8080: Flags [.], seq 60033:60569, ack 1, win 65535, length 536
1.456358 IP 10.1.1.2.8080 > 10.1.1.1.49153: Flags [.], ack 58425, win 65535, length 0
1.456358 IP 10.1.1.1.49153 > 10.1.1.2.8080: Flags [.], seq 60569:61105, ack 1, win 65535, length 536
1.464576 IP 10.1.1.2.8080 > 10.1.1.1.49153: Flags [.], ack 59497, win 65535, length 0
1.464576 IP 10.1.1.1.49153 > 10.1.1.2.8080: Flags [.], seq 61105:61641, ack 1, win 65535, length 536
1.465500 IP 10.1.1.1.49153 > 10.1.1.2.8080: Flags [.], seq 61641:62177, ack 1, win 65535, length 536
1.466425 IP 10.1.1.2.8080 > 10.1.1.1.49153: Flags [.], ack 60569, win 65535, length 0
1.466425 IP 10.1.1.1.49153 > 10.1.1.2.8080: Flags [.], seq 62177:62713, ack 1, win 65535, length 536
1.467350 IP 10.1.1.1.49153 > 10.1.1.2.8080: Flags [.], seq 62713:63249, ack 1, win 65535, length 536
1.468275 IP 10.1.1.1.49153 > 10.1.1.2.8080: Flags [.], seq 63249:63785, ack 1, win 65535, length 536
1.475568 IP 10.1.1.2.8080 > 10.1.1.1.49153: Flags [.], ack 61641, win 65535, length 0
1.475568 IP 10.1.1.1.49153 > 10.1.1.2.8080: Flags [.], seq 63785:64321, ack 1, win 65535, length 536
1.476492 IP 10.1.1.1.49153 > 10.1.1.2.8080: Flags [.], seq 64321:64857, ack 1, win 65535, length 536
1.477417 IP 10.1.1.2.8080 > 10.1.1.1.49153: Flags [.], ack 62713, win 65535, length 0
1.477417 IP 10.1.1.1.49153 > 10.1.1.2.8080: Flags [.], seq 64857:65393, ack 1, win 65535, length 536
1.478342 IP 10.1.1.1.49153 > 10.1.1.2.8080: Flags [.], seq 65393:65929, ack 1, win 65535, length 536
1.479267 IP 10.1.1.2.8080 > 10.1.1.1.49153: Flags [.], ack 63785, win 65535, length 0
1.479267 IP 10.1.1.1.49153 > 10.1.1.2.8080: Flags [.], seq 65929:66465, ack 1, win 65535, length 536
1.480192 IP 10.1.1.1.49153 > 10.1.1.2.8080: Flags [.], seq 66465:67001, ack 1, win 65535, length 536
1.487484 IP 10.1.1.2.8080 > 10.1.1.1.49153: Flags [.], ack 64857, win 65535, length 0
1.487484 IP 10.1.1.1.49153 > 10.1.1.2.8080: Flags [.], seq 67001:67537, ack 1, win 65535, length 536
1.488409 IP 10.1.1.1.49153 > 10.1.1.2.8080: Flags [.], seq 67537:68073, ack 1, win 65535, length 536
1.489334 IP 10.1.1.2.8080 > 10.1.1.1.49153: Flags [.], ack 65929, win 65535, length 0
1.489334 IP 10.1.1.1.49153 > 10.1.1.2.8080: Flags [.], seq 68073:68609, ack 1, win 65535, length 536
1.490259 IP 10.1.1.1.49153 > 10.1.1.2.8080: Flags [.], seq 68609:69145, ack 1, win 65535, length 536
1.491184 IP 10.1.1.2.8080 > 10.1.1.1.49153: Flags [.], ack 67001, win 65535, length 0
1.491184 IP 10.1.1.1.49153 > 10.1.1.2.8080: Flags [.], seq 69145:69681, ack 1, win 65535, length 536
1.492108 IP 10.1.1.1.49153 > 10.1.1.2.8080: Flags [.], seq 69681:70217, ack 1, win 65535, length 536
1.493033 IP 10.1.1.1.49153 > 10.1.1.2.8080: Flags [.], seq 70217:70753, ack 1, win 65535, length 536
1.499401 IP 10.1.1.2.8080 > 10.1.1.1.49153: Flags [.], ack 68073, win 65535, length 0
1.499401 IP 10.1.1.1.49153 > 10.1.1.2.8080: Flags [.], seq 70753:71289, ack 1, win 65535, length 536
1.500326 IP 10.1.1.1.49153 > 10.1.1.2.8080: Flags [.], seq 71289:71825, ack 1, win 65535, length 536
1.501251 IP 10.1.1.2.8080 > 10.1.1.1.49153: Flags [.], ack 69145, win 65535, length 0
1.501251 IP 10.1.1.1.49153 > 10.1.1.2.8080: Flags [.], seq 71825:72361, ack 1, win 65535, length 536
1.502176 IP 10.1.1.1.49153 > 10.1.1.2.8080: Flags [.], seq 72361:72897, ack 1, win 65535, length 536
1.503100 IP 10.1.1.2.8080 > 10.1.1.1.49153: Flags [.], ack 70217, win 65535, length 0
1.503100 IP 10.1.1.1.49153 > 10.1.1.2.8080: Flags [.], seq 72897:73433, ack 1, win 65535, length 536
1.504025 IP 10.1.1.1.49153 > 10.1.1.2.8080: Flags [.], seq 73433:73969, ack 1, win 65535, length 536
1.510393 IP 10.1.1.2.8080 > 10.1.1.1.49153: Flags [.], ack 71289, win 65535, length 0
1.510393 IP 10.1.1.1.49153 > 10.1.1.2.8080: Flags [.], seq 73969:74505, ack 1, win 65535, length 536
1.511318 IP 10.1.1.1.49153 > 10.1.1.2.8080: Flags [.], seq 74505:75041, ack 1, win 65535, length 536
1.512243 IP 10.1.1.2.8080 > 10.1.1.1.49153: Flags [.], ack 72361, win 65535, length 0
1.512243 IP 10.1.1.1.49153 > 10.1.1.2.8080: Flags [.], seq 75041:75577, ack 1, win 65535, length 536
1.513168 IP 10.1.1.1.49153 > 10.1.1.2.8080: Flags [.], seq 75577:76113, ack 1, win 65535, length 536
1.514092 IP 10.1.1.2.8080 > 10.1.1.1.49153: Flags [.], ack 73433, win 65535, length 0
1.514092 IP 10.1.1.1.49153 > 10.1.1.2.8080: Flags [.], seq 76113:76649, ack 1, win 65535, length 536
1.515017 IP 10.1.1.1.49153 > 10.1.1.2.8080: Flags [.], seq 76649:77185, ack 1, win 65535, length 536
1.521385 IP 10.1.1.2.8080 > 10.1.1.1.49153: Flags [.], ack 74505, win 65535, length 0
1.521385 IP 10.1.1.1.49153 > 10.1.1.2.8080: Flags [.], seq 77185:77721, ack 1, win 65535, length 536
1.522310 IP 10.1.1.1.49153 > 10.1.1.2.8080: Flags [.], seq 77721:78257, ack 1, win 65535, length 536
1.523235 IP 10.1.1.2.8080 > 10.1.1.1.49153: Flags [.], ack 75577, win 65535, length 0
1.523235 IP 10.1.1.1.49153 > 10.1.1.2.8080: Flags [.], seq 78257:78793, ack 1, win 65535, length 536
1.524160 IP 10.1.1.1.49153 > 10.1.1.2.8080: Flags [.], seq 78793:79329, ack 1, win 65535, length 536
1.525084 IP 10.1.1.2.8080 > 10.1.1.1.49153: Flags [.], ack 76649, win 65535, length 0
1.525084 IP 10.1.1.1.49153 > 10.1.1.2.8080: Flags [.], seq 79329:79865, ack 1, win 65535, length 536
1.526009 IP 10.1.1.1.49153 > 10.1.1.2.8080: Flags [.], seq 79865:80401, ack 1, win 65535, length 536
1.526934 IP 10.1.1.1.49153 > 10.1.1.2.8080: Flags [.], seq 80401:80937, ack 1, win 65535, length 536
1.532377 IP 10.1.1.2.8080 > 10.1.1.1.49153: Flags [.], ack 77721, win 65535, length 0
1.532377 IP 10.1.1.1.49153 > 10.1.1.2.8080: Flags [.], seq 80937:81473, ack 1, win 65535, length 536
1.533302 IP 10.1.1.1.49153 > 10.1.1.2.8080: Flags [.], seq 81473:82009, ack 1, win 65535, length 536
1.534227 IP 10.1.1.2.8080 > 10.1.1.1.49153: Flags [.], ack 78793, win 65535, length 0
1.534227 IP 10.1.1.1.49153 > 10.1.1.2.8080: Flags [.], seq 82009:82545, ack 1, win 65535, length 536
1.535152 IP 10.1.1.1.49153 > 10.1.1.2.8080: Flags [.], seq 82545:83081, ack 1, win 65535, length 536
1.536076 IP 10.1.1.2.8080 > 10.1.1.1.49153: Flags [.], ack 79865, win 65535, length 0
1.536076 IP 10.1.1.1.49153 > 10.1.1.2.8080: Flags [.], seq 83081:83617, ack 1, win 65535, length 536
1.537001 IP 10.1.1.1.49153 > 10.1.1.2.8080: Flags [.], seq 83617:84153, ack 1, win 65535, length 536
1.537926 IP 10.1.1.2.8080 > 10.1.1.1.49153: Flags [.], ack 80937, win 65535, length 0
1.537926 IP 10.1.1.1.49153 > 10.1.1.2.8080: Flags [.], seq 84153:84689, ack 1, win 65535, length 536
1.538851 IP 10.1.1.1.49153 > 10.1.1.2.8080: Flags [.], seq 84689:85225, ack 1, win 65535, length 536
1.544294 IP 10.1.1.2.8080 > 10.1.1.1.49153: Flags [.], ack 82009, win 65535, length 0
1.544294 IP 10.1.1.1.49153 > 10.1.1.2.8080: Flags [.], seq 85225:85761, ack 1, win 65535, length 536
1.545219 IP 10.1.1.1.49153 > 10.1.1.2.8080: Flags [.], seq 85761:86297, ack 1, win 65535, length 536
1.546144 IP 10.1.1.2.8080 > 10.1.1.1.49153: Flags [.], ack 83081, win 65535, length 0
1.546144 IP 10.1.1.1.49153 > 10.1.1.2.8080: Flags [.], seq 86297:86833, ack 1, win 65535, length 536
1.547068 IP 10.1.1.1.49153 > 10.1.1.2.8080: Flags [.], seq 86833:87369, ack 1, win 65535, length 536
1.547993 IP 10.1.1.2.8080 > 10.1.1.1.49153: Flags [.], ack 84153, win 65535, length 0
1.547993 IP 10.1.1.1.49153 > 10.1.1.2.8080: Flags [.], seq 87369:87905, ack 1, win 65535, length 536
1.548918 IP 10.1.1.1.49153 > 10.1.1.2.8080: Flags [.], seq 87905:88441, ack 1, win 65535, length 536
1.549843 IP 10.1.1.2.8080 > 10.1.1.1.49153: Flags [.], ack 85225, win 65535, length 0
1.549843 IP 10.1.1.1.49153 > 10.1.1.2.8080: Flags [.], seq 88441:88977, ack 1, win 65535, length 536
1.550768 IP 10.1.1.1.49153 > 10.1.1.2.8080: Flags [.], seq 88977:89513, ack 1, win 65535, length 536
1.551692 IP 10.1.1.1.49153 > 10.1.1.2.8080: Flags [.], seq 89513:90049, ack 1, win 65535, length 536
1.556211 IP 10.1.1.2.8080 > 10.1.1.1.49153: Flags [.], ack 86297, win 65535, length 0
1.556211 IP 10.1.1.1.49153 > 10.1.1.2.8080: Flags [.], seq 90049:90585, ack 1, win 65535, length 536
1.557136 IP 10.1.1.1.49153 > 10.1.1.2.8080: Flags [.], seq 90585:91121, ack 1, win 65535, length 536
1.558060 IP 10.1.1.2.8080 > 10.1.1.1.49153: Flags [.], ack 87369, win 65535, length 0
1.558060 IP 10.1.1.1.49153 > 10.1.1.2.8080: Flags [.], seq 91121:91657, ack 1, win 65535, length 536
1.558985 IP 10.1.1.1.49153 > 10.1.1.2.8080: Flags [.], seq 91657:92193, ack 1, win 65535, length 536
1.559910 IP 10.1.1.2.8080 > 10.1.1.1.49153: Flags [.], ack 88441, win 65535, length 0
1.559910 IP 10.1.1.1.49153 > 10.1.1.2.8080: Flags [.], seq 92193:92729, ack 1, win 65535, length 536
1.560835 IP 10.1.1.1.49153 > 10.1.1.2.8080: Flags [.], seq 92729:93265, ack 1, win 65535, length 536
1.561760 IP 10.1.1.2.8080 > 10.1.1.1.49153: Flags [.], ack 89513, win 65535, length 0
1.561760 IP 10.1.1.1.49153 > 10.1.1.2.8080: Flags [.], seq 93265:93801, ack 1, win 65535, length 536
1.562684 IP 10.1.1.1.49153 > 10.1.1.2.8080: Flags [.], seq 93801:94337, ack 1, win 65535, length 536
1.567203 IP 10.1.1.2.8080 > 10.1.1.1.49153: Flags [.], ack 90585, win 65535, length 0
1.567203 IP 10.1.1.1.49153 > 10.1.1.2.8080: Flags [.], seq 94337:94873, ack 1, win 65535, length 536
1.568128 IP 10.1.1.1.49153 > 10.1.1.2.8080: Flags [.], seq 94873:95409, ack 1, win 65535, length 536
1.569052 IP 10.1.1.2.8080 > 10.1.1.1.49153: Flags [.], ack 91657, win 65535, length 0
1.569052 IP 10.1.1.1.49153 > 10.1.1.2.8080: Flags [.], seq 95409:95945, ack 1, win 65535, length 536
1.569977 IP 10.1.1.1.49153 > 10.1.1.2.8080: Flags [.], seq 95945:96481, ack 1, win 65535, length 536
1.570902 IP 10.1.1.2.8080 > 10.1.1.1.49153: Flags [.], ack 92729, win 65535, length 0
1.570902 IP 10.1.1.1.49153 > 10.1.1.2.8080: Flags [.], seq 96481:97017, ack 1, win 65535, length 536
1.571827 IP 10.1.1.1.49153 > 10.1.1.2.8080: Flags [.], seq 97017:97553, ack 1, win 65535, length 536
1.572752 IP 10.1.1.2.8080 > 10.1.1.1.49153: Flags [.], ack 93801, win 65535, length 0
1.572752 IP 10.1.1.1.49153 > 10.1.1.2.8080: Flags [.], seq 97553:98089, ack 1, win 65535, length 536
1.573676 IP 10.1.1.1.49153 > 10.1.1.2.8080: Flags [.], seq 98089:98625, ack 1, win 65535, length 536
1.574601 IP 10.1.1.1.49153 > 10.1.1.2.8080: Flags [.], seq 98625:99161, ack 1, win 65535, length 536
1.578195 IP 10.1.1.2.8080 > 10.1.1.1.49153: Flags [.], ack 94873, win 65535, length 0
1.578195 IP 10.1.1.1.49153 > 10.1.1.2.8080: Flags [.], seq 99161:99697, ack 1, win 65535, length 536
1.579120 IP 10.1.1.1.49153 > 10.1.1.2.8080: Flags [.], seq 99697:100233, ack 1, win 65535, length 536
1.580044 IP 10.1.1.2.8080 > 10.1.1.1.49153: Flags [.], ack 95945, win 65535, length 0
1.580044 IP 10.1.1.1.49153 > 10.1.1.2.8080: Flags [.], seq 100233:100769, ack 1, win 65535, length 536
1.580969 IP 10.1.1.1.49153 > 10.1.1.2.8080: Flags [.], seq 100769:101305, ack 1, win 65535, length 536
1.581894 IP 10.1.1.2.8080 > 10.1.1.1.49153: Flags [.], ack 97017, win 65535, length 0
1.581894 IP 10.1.1.1.49153 > 10.1.1.2.8080: Flags [.], seq 101305:101841, ack 1, win 65535, length 536
1.582819 IP 10.1.1.1.49153 > 10.1.1.2.8080: Flags [.], seq 101841:102377, ack 1, win 65535, length 536
1.583744 IP 10.1.1.2.8080 > 10.1.1.1.49153: Flags [.], ack 98089, win 65535, length 0
1.583744 IP 10.1.1.1.49153 > 10.1.1.2.8080: Flags [.], seq 102377:102913, ack 1, win 65535, length 536
1.584668 IP 10.1.1.1.49153 > 10.1.1.2.8080: Flags [.], seq 102913:103449, ack 1, win 65535, length 536
1.585593 IP 10.1.1.2.8080 > 10.1.1.1.49153: Flags [.], ack 99161, win 65535, length 0
1.585593 IP 10.1.1.1.49153 > 10.1.1.2.8080: Flags [.], seq 103449:103985, ack 1, win 65535, length 536
1.586518 IP 10.1.1.1.49153 > 10.1.1.2.8080: Flags [.], seq 103985:104521, ack 1, win 65535, length 536
1.590112 IP 10.1.1.2.8080 > 10.1.1.1.49153: Flags [.], ack 100233, win 65535, length 0
1.590112 IP 10.1.1.1.49153 > 10.1.1.2.8080: Flags [.], seq 104521:105057, ack 1, win 65535, length 536
1.591036 IP 10.1.1.1.49153 > 10.1.1.2.8080: Flags [.], seq 105057:105593, ack 1, win 65535, length 536
1.591961 IP 10.1.1.2.8080 > 10.1.1.1.49153: Flags [.], ack 101305, win 65535, length 0
1.591961 IP 10.1.1.1.49153 > 10.1.1.2.8080: Flags [.], seq 105593:106129, ack 1, win 65535, length 536
1.592886 IP 10.1.1.1.49153 > 10.1.1.2.8080: Flags [.], seq 106129:106665, ack 1, win 65535, length 536
1.593811 IP 10.1.1.2.8080 > 10.1.1.1.49153: Flags [.], ack 102377, win 65535, length 0
1.593811 IP 10.1.1.1.49153 > 10.1.1.2.8080: Flags [.], seq 106665:107201, ack 1, win 65535, length 536
1.594736 IP 10.1.1.1.49153 > 10.1.1.2.8080: Flags [.], seq 107201:107737, ack 1, win 65535, length 536
1.595660 IP 10.1.1.2.8080 > 10.1.1.1.49153: Flags [.], ack 103449, win 65535, length 0
1.595660 IP 10.1.1.1.49153 > 10.1.1.2.8080: Flags [.], seq 107737:108273, ack 1, win 65535, length 536
1.596585 IP 10.1.1.1.49153 > 10.1.1.2.8080: Flags [.], seq 108273:108809, ack 1, win 65535, length 536
1.597510 IP 10.1.1.2.8080 > 10.1.1.1.49153: Flags [.], ack 104521, win 65535, length 0
1.597510 IP 10.1.1.1.49153 > 10.1.1.2.8080: Flags [.], seq 108809:109345, ack 1, win 65535, length 536
1.598435 IP 10.1.1.1.49153 > 10.1.1.2.8080: Flags [.], seq 109345:109881, ack 1, win 65535, length 536
1.599360 IP 10.1.1.1.49153 > 10.1.1.2.8080: Flags [.], seq 109881:110417, ack 1, win 65535, length 536
1.602028 IP 10.1.1.2.8080 > 10.1.1.1.49153: Flags [.], ack 105593, win 65535, length 0
1.602028 IP 10.1.1.1.49153 > 10.1.1.2.8080: Flags [.], seq 110417:110953, ack 1, win 65535, length 536
1.602953 IP 10.1.1.1.49153 > 10.1.1.2.8080: Flags [.], seq 110953:111489, ack 1, win 65535, length 536
1.603878 IP 10.1.1.2.8080 > 10.1.1.1.49153: Flags [.], ack 106665, win 65535, length 0
1.603878 IP 10.1.1.1.49153 > 10.1.1.2.8080: Flags [.], seq 111489:112025, ack 1, win 65535, length 536
1.604803 IP 10.1.1.1.49153 > 10.1.1.2.8080: Flags [.], seq 112025:112561, ack 1, win 65535, length 536
1.605728 IP 10.1.1.2.8080 > 10.1.1.1.49153: Flags [.], ack 107737, win 65535, length 0
1.605728 IP 10.1.1.1.49153 > 10.1.1.2.8080: Flags [.], seq 112561:113097, ack 1, win 65535, length 536
1.606652 IP 10.1.1.1.49153 > 10.1.1.2.8080: Flags [.], seq 113097:113633, ack 1, win 65535, length 536
1.607577 IP 10.1.1.2.8080 > 10.1.1.1.49153: Flags [.], ack 108809, win 65535, length 0
1.607577 IP 10.1.1.1.49153 > 10.1.1.2.8080: Flags [.], seq 113633:114169, ack 1, win 65535, length 536
1.608502 IP 10.1.1.1.49153 > 10.1.1.2.8080: Flags [.], seq 114169:114705, ack 1, win 65535, length 536
1.609427 IP 10.1.1.2.8080 > 10.1.1.1.49153: Flags [.], ack 109881, win 65535, length 0
1.609427 IP 10.1.1.1.49153 > 10.1.1.2.8080: Flags [.], seq 114705:115241, ack 1, win 65535, length 536
1.610352 IP 10.1.1.1.49153 > 10.1.1.2.8080: Flags [.], seq 115241:115777, ack 1, win 65535, length 536
1.613020 IP 10.1.1.2.8080 > 10.1.1.1.49153: Flags [.], ack 110953, win 65535, length 0
1.613020 IP 10.1.1.1.49153 > 10.1.1.2.8080: Flags [.], seq 115777:116313, ack 1, win 65535, length 536
1.613945 IP 10.1.1.1.49153 > 10.1.1.2.8080: Flags [.], seq 116313:116849, ack 1, win 65535, length 536
1.614870 IP 10.1.1.2.8080 > 10.1.1.1.49153: Flags [.], ack 112025, win 65535, length 0
1.614870 IP 10.1.1.1.49153 > 10.1.1.2.8080: Flags [.], seq 116849:117385, ack 1, win 65535, length 536
1.615795 IP 10.1.1.1.49153 > 10.1.1.2.8080: Flags [.], seq 117385:117921, ack 1, win 65535, length 536
1.616720 IP 10.1.1.2.8080 > 10.1.1.1.49153: Flags [.], ack 113097, win 65535, length 0
1.616720 IP 10.1.1.1.49153 > 10.1.1.2.8080: Flags [.], seq 117921:118457, ack 1, win 65535, length 536
1.617644 IP 10.1.1.1.49153 > 10.1.1.2.8080: Flags [.], seq 118457:118993, ack 1, win 65535, length 536
1.618569 IP 10.1.1.2.8080 > 10.1.1.1.49153: Flags [.], ack 114169, win 65535, length 0
1.618569 IP 10.1.1.1.49153 > 10.1.1.2.8080: Flags [.], seq 118993:119529, ack 1, win 65535, length 536
1.619494 IP 10.1.1.1.49153 > 10.1.1.2.8080: Flags [.], seq 119529:120065, ack 1, win 65535, length 536
1.620419 IP 10.1.1.2.8080 > 10.1.1.1.49153: Flags [.], ack 115241, win 65535, length 0
1.620419 IP 10.1.1.1.49153 > 10.1.1.2.8080: Flags [.], seq 120065:120601, ack 1, win 65535, length 536
1.621344 IP 10.1.1.1.49153 > 10.1.1.2.8080: Flags [.], seq 120601:121137, ack 1, win 65535, length 536
1.624012 IP 10.1.1.2.8080 > 10.1.1.1.49153: Flags [.], ack 116313, win 65535, length 0
1.624012 IP 10.1.1.1.49153 > 10.1.1.2.8080: Flags [.], seq 121137:121673, ack 1, win 65535, length 536
1.624937 IP 10.1.1.1.49153 > 10.1.1.2.8080: Flags [.], seq 121673:122209, ack 1, win 65535, length 536
1.625862 IP 10.1.1.2.8080 > 10.1.1.1.49153: Flags [.], ack 117385, win 65535, length 0
1.625862 IP 10.1.1.1.49153 > 10.1.1.2.8080: Flags [.], seq 122209:122745, ack 1, win 65535, length 536
1.626787 IP 10.1.1.1.49153 > 10.1.1.2.8080: Flags [.], seq 122745:123281, ack 1, win 65535, length 536
1.627712 IP 10.1.1.2.8080 > 10.1.1.1.49153: Flags [.], ack 118457, win 65535, length 0
1.627712 IP 10.1.1.1.49153 > 10.1.1.2.8080: Flags [.], seq 123281:123817, ack 1, win 65535, length 536
1.628636 IP 10.1.1.1.49153 > 10.1.1.2.8080: Flags [.], seq 123817:124353, ack 1, win 65535, length 536
1.629561 IP 10.1.1.2.8080 > 10.1.1.1.49153: Flags [.], ack 119529, win 65535, length 0
1.629561 IP 10.1.1.1.49153 > 10.1.1.2.8080: Flags [.], seq 124353:124889, ack 1, win 65535, length 536
1.630486 IP 10.1.1.1.49153 > 10.1.1.2.8080: Flags [.], seq 124889:125425, ack 1, win 65535, length 536
1.631411 IP 10.1.1.2.8080 > 10.1.1.1.49153: Flags [.], ack 120601, win 65535, length 0
1.631411 IP 10.1.1.1.49153 > 10.1.1.2.8080: Flags [.], seq 125425:125961, ack 1, win 65535, length 536
1.632336 IP 10.1.1.1.49153 > 10.1.1.2.8080: Flags [.], seq 125961:126497, ack 1, win 65535, length 536
1.633260 IP 10.1.1.1.49153 > 10.1.1.2.8080: Flags [.], seq 126497:127033, ack 1, win 65535, length 536
1.635004 IP 10.1.1.2.8080 > 10.1.1.1.49153: Flags [.], ack 121673, win 65535, length 0
1.635004 IP 10.1.1.1.49153 > 10.1.1.2.8080: Flags [.], seq 127033:127569, ack 1, win 65535, length 536
1.635929 IP 10.1.1.1.49153 > 10.1.1.2.8080: Flags [.], seq 127569:128105, ack 1, win 65535, length 536
1.636854 IP 10.1.1.2.8080 > 10.1.1.1.49153: Flags [.], ack 122745, win 65535, length 0
1.636854 IP 10.1.1.1.49153 > 10.1.1.2.8080: Flags [.], seq 128105:128641, ack 1, win 65535, length 536
1.637779 IP 10.1.1.1.49153 > 10.1.1.2.8080: Flags [.], seq 128641:129177, ack 1, win 65535, length 536
1.638704 IP 10.1.1.2.8080 > 10.1.1.1.49153: Flags [.], ack 123817, win 65535, length 0
